BEGIN_YEARMONTH,BEGIN_DAY,BEGIN_TIME,END_YEARMONTH,END_DAY,END_TIME,EPISODE_ID,EVENT_ID,STATE,STATE_FIPS,YEAR,MONTH_NAME,EVENT_TYPE,CZ_TYPE,CZ_FIPS,CZ_NAME,WFO,BEGIN_DATE_TIME,CZ_TIMEZONE,END_DATE_TIME,INJURIES_DIRECT,INJURIES_INDIRECT,DEATHS_DIRECT,DEATHS_INDIRECT,DAMAGE_PROPERTY,DAMAGE_CROPS,SOURCE,MAGNITUDE,MAGNITUDE_TYPE,FLOOD_CAUSE,CATEGORY,TOR_F_SCALE,TOR_LENGTH,TOR_WIDTH,TOR_OTHER_WFO,TOR_OTHER_CZ_STATE,TOR_OTHER_CZ_FIPS,TOR_OTHER_CZ_NAME,BEGIN_RANGE,BEGIN_AZIMUTH,BEGIN_LOCATION,END_RANGE,END_AZIMUTH,END_LOCATION,BEGIN_LAT,BEGIN_LON,END_LAT,END_LON,EPISODE_NARRATIVE,EVENT_NARRATIVE,DATA_SOURCE
200506,6,1740,200506,6,1740,1200846,5481857,ARKANSAS,5,2005,June,Hail,C,27,COLUMBIA,SHV,06-JUN-05 17:40:00,CST,06-JUN-05 17:40:00,0,0,0,0,,,GENERAL PUBLIC,0.88,,,,,,,,,,,,,TAYLOR,,,TAYLOR,33.1,-93.46667,33.1,-93.46667,,,PDS
200511,15,1159,200511,15,1205,1201264,5479771,ARKANSAS,5,2005,November,Thunderstorm Wind,C,93,MISSISSIPPI,MEG,15-NOV-05 11:59:00,CST,15-NOV-05 12:05:00,0,0,0,0,1K,,GOVT OFFICIAL,50,EG,,,,,,,,,,,,JOINER,,,JOINER,35.5,-90.15,35.5,-90.15,,Several large tree limbs were blown down.,PDS
200511,15,1259,200511,15,1305,1201264,5479772,ARKANSAS,5,2005,November,Hail,C,35,CRITTENDEN,MEG,15-NOV-05 12:59:00,CST,15-NOV-05 13:05:00,0,0,0,0,.01K,,TRAINED SPOTTER,0.75,,,,,,,,,,,,,WEST MEMPHIS,,,WEST MEMPHIS,35.15,-90.18333,35.15,-90.18333,,,PDS
200508,24,1810,200508,24,1810,1200899,5481196,ARKANSAS,5,2005,August,Thunderstorm Wind,C,99,NEVADA,SHV,24-AUG-05 18:10:00,CST,24-AUG-05 18:10:00,0,0,0,0,,,LAW ENFORCEMENT,53,EG,,,,,,,,,,4,NW,BLUFF CITY,4,NW,BLUFF CITY,33.75,-93.18333,33.75,-93.18333,,Trees were downed blocking Hwy 24 just west of the Hwy 368 split 2 miles west of the community of Reader.,PDS
200508,27,1245,200508,27,1245,1200900,5481197,ARKANSAS,5,2005,August,Hail,C,99,NEVADA,SHV,27-AUG-05 12:45:00,CST,27-AUG-05 12:45:00,0,0,0,0,,,LAW ENFORCEMENT,0.88,,,,,,,,,,,,,ROSSTON,,,ROSSTON,33.58333,-93.28333,33.58333,-93.28333,,,PDS
200508,27,1415,200508,27,1415,1200902,5481199,ARKANSAS,5,2005,August,Thunderstorm Wind,C,91,MILLER,SHV,27-AUG-05 14:15:00,CST,27-AUG-05 14:15:00,0,0,0,0,30K,,LAW ENFORCEMENT,54,EG,,,,,,,,,,2,S,TEXARKANA,2,S,TEXARKANA,33.4,-94.05,33.4,-94.05,,Trees were downed on a house along Hwy 71. Powerlines were also downed.,PDS
200511,27,1530,200511,27,1530,1201394,5480512,ARKANSAS,5,2005,November,Hail,C,81,LITTLE RIVER,SHV,27-NOV-05 15:30:00,CST,27-NOV-05 15:30:00,0,0,0,0,,,LAW ENFORCEMENT,0.88,,,,,,,,,,,,,WINTHROP,,,WINTHROP,33.83333,-94.35,33.83333,-94.35,,,PDS
200511,27,1550,200511,27,1550,1201395,5480513,ARKANSAS,5,2005,November,Hail,C,61,HOWARD,SHV,27-NOV-05 15:50:00,CST,27-NOV-05 15:50:00,0,0,0,0,,,LAW ENFORCEMENT,1.00,,,,,,,,,,,2,E,DIERKS,2,E,DIERKS,34.11667,-93.98333,34.11667,-93.98333,,Hail occurred 6 miles north of Center Point.,PDS
200511,27,1600,200511,27,1600,1201396,5480514,ARKANSAS,5,2005,November,Thunderstorm Wind,C,61,HOWARD,SHV,27-NOV-05 16:00:00,CST,27-NOV-05 16:00:00,0,0,0,0,,,LAW ENFORCEMENT,54,EG,,,,,,,,,,,,DIERKS,,,DIERKS,34.11667,-94.01667,34.11667,-94.01667,,Trees were downed in town.,PDS
200511,27,1602,200511,27,1602,1201398,5480516,ARKANSAS,5,2005,November,Hail,C,81,LITTLE RIVER,SHV,27-NOV-05 16:02:00,CST,27-NOV-05 16:02:00,0,0,0,0,,,LAW ENFORCEMENT,0.88,,,,,,,,,,,,,FOREMAN,,,FOREMAN,33.71667,-94.4,33.71667,-94.4,,,PDS
200511,27,1630,200511,27,1630,1201399,5480517,ARKANSAS,5,2005,November,Hail,C,61,HOWARD,SHV,27-NOV-05 16:30:00,CST,27-NOV-05 16:30:00,0,0,0,0,,,LAW ENFORCEMENT,0.75,,,,,,,,,,,9,W,NASHVILLE,9,W,NASHVILLE,33.93333,-94,33.93333,-94,,,PDS
200510,31,1335,200510,31,1335,1200979,5481047,ARKANSAS,5,2005,October,Thunderstorm Wind,C,91,MILLER,SHV,31-OCT-05 13:35:00,CST,31-OCT-05 13:35:00,1,0,0,0,30K,,EMERGENCY MANAGER,55,EG,,,,,,,,,,,,TEXARKANA,,,TEXARKANA,33.43333,-94.05,33.43333,-94.05,,One injury was reported at Loop 245 and I-30 when a billboard sign was blown over onto a man.  A roof was also taken off a concrete building next to a truck stop in town.,PDS
200510,31,1322,200510,31,1322,1200982,5481050,ARKANSAS,5,2005,October,Thunderstorm Wind,C,91,MILLER,SHV,31-OCT-05 13:22:00,CST,31-OCT-05 13:22:00,0,0,0,0,,,EMERGENCY MANAGER,52,EG,,,,,,,,,,,,TEXARKANA,,,TEXARKANA,33.43333,-94.05,33.43333,-94.05,,Gust estimated by Emergency Manager.,PDS
200510,31,1327,200510,31,1327,1200983,5481051,ARKANSAS,5,2005,October,Thunderstorm Wind,C,91,MILLER,SHV,31-OCT-05 13:27:00,CST,31-OCT-05 13:27:00,0,0,0,0,,,STORM CHASER,54,EG,,,,,,,,,,2,N,TEXARKANA,2,N,TEXARKANA,33.46667,-94.05,33.46667,-94.05,,Estimated gust by storm chaser two miles north of the junction of I-30 with US Hwy 71 south of the Index bridge crossing the Red River.,PDS
200511,27,1750,200511,27,1750,1201415,5480580,ARKANSAS,5,2005,November,Hail,C,57,HEMPSTEAD,SHV,27-NOV-05 17:50:00,CST,27-NOV-05 17:50:00,0,0,0,0,,,LAW ENFORCEMENT,0.75,,,,,,,,,,,10,NW,WASHINGTON,10,NW,WASHINGTON,33.86667,-93.8,33.86667,-93.8,,Hail fell in Bingen.,PDS
200504,5,2038,200504,5,2038,1200753,5481467,ARKANSAS,5,2005,April,Lightning,C,133,SEVIER,SHV,05-APR-05 20:38:00,CST,05-APR-05 20:38:00,0,0,0,0,125K,,LAW ENFORCEMENT,,,,,,,,,,,,,,LOCKESBURG,,,LOCKESBURG,,,,,,Lightning struck a home in town resulting in a fire.  The house burned to the ground but there were no injuries.,PDS
200512,3,2356,200512,4,0,1201168,5482076,ARKANSAS,5,2005,December,Hail,C,17,CHICOT,JAN,03-DEC-05 23:56:00,CST,04-DEC-05 00:00:00,0,0,0,0,,,LAW ENFORCEMENT,1.00,,,,,,,,,,,1,S,DERMOTT,1,S,DERMOTT,33.5,-91.43333,33.5,-91.38333,,,PDS
200507,13,1417,200507,13,1417,1200859,5481870,ARKANSAS,5,2005,July,Thunderstorm Wind,C,139,UNION,SHV,13-JUL-05 14:17:00,CST,13-JUL-05 14:17:00,0,0,0,0,,,OFFICIAL NWS OBS.,50,MG,,,,,,,,,,8,W,EL DORADO,8,W,EL DORADO,33.2,-92.8,33.2,-92.8,,Gust measured by the El Dorado ASOS at the local airport.,PDS
200511,27,1650,200511,27,1650,1201401,5480519,ARKANSAS,5,2005,November,Thunderstorm Wind,C,61,HOWARD,SHV,27-NOV-05 16:50:00,CST,27-NOV-05 16:50:00,0,0,0,0,2K,,EMERGENCY MANAGER,55,EG,,,,,,,,,,8,W,NASHVILLE,8,W,NASHVILLE,33.93333,-93.98333,33.93333,-93.98333,,200ft of a tin roof was blown off a chicken house in Center Point.,PDS
200508,1,0,200508,31,2359,1200960,5480830,ARKANSAS,5,2005,August,Drought,Z,71,LAFAYETTE,SHV,01-AUG-05 00:00:00,CST,31-AUG-05 23:59:00,0,0,0,0,,,OFFICIAL NWS OBS.,,,,,,,,,,,,,,,,,,,,,,"The abnormally dry summer months of June...July and August resulted in extreme drought conditions across all of Southwest Arkansas.  The drought combined with the extreme heat resulted in burn bans for much of the region as well.  The drought took its toll on the agricultural and hyrdological community with some areas having to ration water.  The lack of rainfall through the period resulted in many crops being unusable which put a significant strain on the farming community.  Water conservation measures were also in place in some areas as pool stages on various lakes were well below normal.  Rainfall for the three month summer period was only 34 to 42 percent of normal which led to deficits through this same period of some 7 to 10 inches.  Excessive heat across the region only compounded the drought with several areas seeing record high temperatures through portions of the summer months.   In Texarkana, Arkansas, there were eight 100+ degree days and 5 of those occurred in August.  The warmest temperature recorded was 103 occurring on 8/23.  The summer of 2005 was the 12th warmest summer on record for Texarkana.  In El Dorado, Arkansas, there were 6 consecutive days of 100+ degree days in August.  The warmest temperature of 105 degrees was recorded on 8/21.  The summer of 2005 was tied for the 13th warmest on record and the 9th driest on record in El Dorado.   In Dequeen, Arkansas, there were 18 days of 100+ degree temperatures over the summer with 15 days of 100+ degree temperatures in August.  The warmest temperature recorded was 105 degrees which occurred on 8/23.  August 2005 tied for the 6th warmest August on record while Dequeen set the all time driest August on record according to cooperative observer records.  Dequeen also set the all time driest summer of record as well.",,PDS
200504,26,40,200504,26,40,1200700,5481119,ARKANSAS,5,2005,April,Hail,C,73,LAFAYETTE,SHV,26-APR-05 00:40:00,CST,26-APR-05 00:40:00,0,0,0,0,,,LAW ENFORCEMENT,1.00,,,,,,,,,,,,,STAMPS,,,STAMPS,33.36667,-93.5,33.36667,-93.5,,,PDS
200509,28,1810,200509,28,1810,1200964,5480943,ARKANSAS,5,2005,September,Hail,C,61,HOWARD,SHV,28-SEP-05 18:10:00,CST,28-SEP-05 18:10:00,0,0,0,0,,,EMERGENCY MANAGER,0.75,,,,,,,,,,,,,DIERKS,,,DIERKS,34.11667,-94.01667,34.11667,-94.01667,,,PDS
200509,28,1830,200509,28,1830,1200966,5480945,ARKANSAS,5,2005,September,Thunderstorm Wind,C,133,SEVIER,SHV,28-SEP-05 18:30:00,CST,28-SEP-05 18:30:00,0,0,0,0,,,LAW ENFORCEMENT,54,EG,,,,,,,,,,,,DE QUEEN,,,DE QUEEN,34.03333,-94.33333,34.03333,-94.33333,,Trees and power lines were downed in town.,PDS
200504,26,40,200504,26,40,1200702,5481121,ARKANSAS,5,2005,April,Hail,C,73,LAFAYETTE,SHV,26-APR-05 00:40:00,CST,26-APR-05 00:40:00,0,0,0,0,,,LAW ENFORCEMENT,1.00,,,,,,,,,,,,,STAMPS,,,STAMPS,33.36667,-93.5,33.35,-93.58333,,,PDS
200511,27,1710,200511,27,1710,1201404,5480569,ARKANSAS,5,2005,November,Thunderstorm Wind,C,81,LITTLE RIVER,SHV,27-NOV-05 17:10:00,CST,27-NOV-05 17:10:00,0,0,0,0,,,LAW ENFORCEMENT,54,EG,,,,,,,,,,2,NE,FOREMAN,2,NE,FOREMAN,33.73333,-94.38333,33.73333,-94.38333,,Trees were blown down across County Rd. 53.,PDS
200511,27,1715,200511,27,1715,1201405,5480570,ARKANSAS,5,2005,November,Hail,C,81,LITTLE RIVER,SHV,27-NOV-05 17:15:00,CST,27-NOV-05 17:15:00,0,0,0,0,,,LAW ENFORCEMENT,0.75,,,,,,,,,,,,,ASHDOWN,,,ASHDOWN,33.66667,-94.13333,33.66667,-94.13333,,,PDS
200508,1,0,200508,31,2359,1200960,5480831,ARKANSAS,5,2005,August,Drought,Z,59,LITTLE RIVER,SHV,01-AUG-05 00:00:00,CST,31-AUG-05 23:59:00,0,0,0,0,,,OFFICIAL NWS OBS.,,,,,,,,,,,,,,,,,,,,,,"The abnormally dry summer months of June...July and August resulted in extreme drought conditions across all of Southwest Arkansas.  The drought combined with the extreme heat resulted in burn bans for much of the region as well.  The drought took its toll on the agricultural and hyrdological community with some areas having to ration water.  The lack of rainfall through the period resulted in many crops being unusable which put a significant strain on the farming community.  Water conservation measures were also in place in some areas as pool stages on various lakes were well below normal.  Rainfall for the three month summer period was only 34 to 42 percent of normal which led to deficits through this same period of some 7 to 10 inches.  Excessive heat across the region only compounded the drought with several areas seeing record high temperatures through portions of the summer months.   In Texarkana, Arkansas, there were eight 100+ degree days and 5 of those occurred in August.  The warmest temperature recorded was 103 occurring on 8/23.  The summer of 2005 was the 12th warmest summer on record for Texarkana.  In El Dorado, Arkansas, there were 6 consecutive days of 100+ degree days in August.  The warmest temperature of 105 degrees was recorded on 8/21.  The summer of 2005 was tied for the 13th warmest on record and the 9th driest on record in El Dorado.   In Dequeen, Arkansas, there were 18 days of 100+ degree temperatures over the summer with 15 days of 100+ degree temperatures in August.  The warmest temperature recorded was 105 degrees which occurred on 8/23.  August 2005 tied for the 6th warmest August on record while Dequeen set the all time driest August on record according to cooperative observer records.  Dequeen also set the all time driest summer of record as well.",,PDS
200511,14,1850,200511,14,1850,1201360,5479891,ARKANSAS,5,2005,November,Lightning,C,131,SEBASTIAN,TSA,14-NOV-05 18:50:00,CST,14-NOV-05 18:50:00,1,0,0,0,,,EMERGENCY MANAGER,,,,,,,,,,,,,,FT SMITH,,,FT SMITH,,,,,,A woman who was struck and injured by lightning was taken to the hospital for treatment.,PDS
200511,5,2040,200511,5,2040,1202031,5485474,ARKANSAS,5,2005,November,Thunderstorm Wind,C,101,NEWTON,LZK,05-NOV-05 20:40:00,CST,05-NOV-05 20:40:00,0,0,0,0,,,GENERAL PUBLIC,50,EG,,,,,,,,,,,,COMPTON,,,COMPTON,36.08333,-93.3,36.08333,-93.3,,Thunderstorm winds downed some large tree limbs.,PDS
200511,5,2135,200511,5,2135,1202032,5485475,ARKANSAS,5,2005,November,Thunderstorm Wind,C,5,BAXTER,LZK,05-NOV-05 21:35:00,CST,05-NOV-05 21:35:00,0,0,0,0,,,LAW ENFORCEMENT,50,EG,,,,,,,,,,,,THREE BROTHERS,,,THREE BROTHERS,36.45,-92.46667,36.45,-92.46667,Thunderstorm winds downed a number of trees and large tree limbs.,,PDS
200511,5,2150,200511,5,2150,1202032,5485476,ARKANSAS,5,2005,November,Thunderstorm Wind,C,5,BAXTER,LZK,05-NOV-05 21:50:00,CST,05-NOV-05 21:50:00,0,0,0,0,,,TRAINED SPOTTER,50,EG,,,,,,,,,,8,NE,BIGFLAT,8,NE,BIGFLAT,36.08333,-92.3,36.08333,-92.3,Thunderstorm winds downed a number of trees and large tree limbs.,,PDS
200511,5,2250,200511,5,2250,1202033,5485477,ARKANSAS,5,2005,November,Thunderstorm Wind,C,105,PERRY,LZK,05-NOV-05 22:50:00,CST,05-NOV-05 22:50:00,0,0,0,0,,,LAW ENFORCEMENT,50,EG,,,,,,,,,,,,BIGELOW,,,BIGELOW,35,-92.63333,35,-92.63333,,Thunderstorm winds downed some trees and caused minor roof damage to a home in Bigelow.,PDS
200511,5,2308,200511,5,2308,1202034,5485478,ARKANSAS,5,2005,November,Hail,C,45,FAULKNER,LZK,05-NOV-05 23:08:00,CST,05-NOV-05 23:08:00,0,0,0,0,,,LAW ENFORCEMENT,0.75,,,,,,,,,,,,,CONWAY,,,CONWAY,35.08333,-92.45,35.08333,-92.45,,,PDS
200511,5,2355,200511,5,2355,1202035,5485479,ARKANSAS,5,2005,November,Thunderstorm Wind,C,85,LONOKE,LZK,05-NOV-05 23:55:00,CST,05-NOV-05 23:55:00,0,0,0,0,,,LAW ENFORCEMENT,50,EG,,,,,,,,,,,,WARD,,,WARD,35.03333,-91.96667,35.03333,-91.96667,,Large tree blown down.,PDS
200511,5,2340,200511,5,2340,1202036,5485480,ARKANSAS,5,2005,November,Thunderstorm Wind,C,145,WHITE,LZK,05-NOV-05 23:40:00,CST,05-NOV-05 23:40:00,0,0,0,0,,,LAW ENFORCEMENT,50,EG,,,,,,,,,,2,S,BEEBE,2,S,BEEBE,35.03333,-91.9,35.03333,-91.9,,Power lines knocked down.,PDS
200511,5,2235,200511,5,2235,1202037,5485481,ARKANSAS,5,2005,November,Thunderstorm Wind,C,135,SHARP,LZK,05-NOV-05 22:35:00,CST,05-NOV-05 22:35:00,0,0,0,0,,,GENERAL PUBLIC,50,EG,,,,,,,,,,,,CENTER,,,CENTER,36.15,-91.51667,36.15,-91.51667,,Trees down.,PDS
200512,1,0,200512,31,2359,1202770,5483246,ARKANSAS,5,2005,December,Drought,Z,20,FRANKLIN,TSA,01-DEC-05 00:00:00,CST,31-DEC-05 23:59:00,0,0,0,0,,,NEWSPAPER,,,,,,,,,,,,,,,,,,,,,,"The prolonged absence of significant rainfall through December resulted in the continuance of severe drought conditions (D2) across the region.  During the month, northwestern Arkansas received generally less than one half inch of precipitation.  The Ozark region of northwestern Arkansas averages about 3.2 inches of precipitation during December.  Annual precipitation for northwestern Arkansas in 2005 was only about 65 to 70 percent of the normal average annual precipitation.  Streamflow was well below normal for tributaries of the Arkansas River Basin.  A burn ban was issued for all of northwestern Arkansas early in the month.",,PDS
200511,27,1809,200511,27,1826,1202101,5484328,ARKANSAS,5,2005,November,Tornado,C,29,CONWAY,LZK,27-NOV-05 18:09:00,CST,27-NOV-05 18:26:00,8,0,1,0,,,NWS STORM SURVEY,,,,,F3,15,700,,,,,3,SE,MORRILTON,3,SE,MORRILTON,35.11667,-92.71667,35.26667,-92.55,,"A strong tornado was spawned in southern Conway County about 2.5 miles southeast of Morrilton. The tornado tracked northeast across Interstate 40 and overturned several vehicles. In one of the vehicles, a person was killed and seven people were injured roughly 1 mile west of Plumerville. In the same area, a lumber company was badly damaged. The tornado also destroyed a large barn that contained several bass boats and vehicles. Homes and businesses were heavily damaged or destroyed. A fire station, numerous barns, outbuildings and chicken houses were damaged. Mobile homes were overturned. There were hundreds of trees, power lines and power poles downed. The tornado dissipated 1 mile east of Springfield.",PDS
200508,21,1830,200508,21,1830,1200936,5482105,ARKANSAS,5,2005,August,Thunderstorm Wind,C,139,UNION,SHV,21-AUG-05 18:30:00,CST,21-AUG-05 18:30:00,0,0,0,0,20K,,STORM CHASER,55,EG,,,,,,,,,,,,EL DORADO,,,EL DORADO,33.2,-92.66667,33.2,-92.66667,,Two roofs were taken off buildings with damage to a third in the south part of town.,PDS
200508,15,1404,200508,15,1404,1200939,5482108,ARKANSAS,5,2005,August,Thunderstorm Wind,C,27,COLUMBIA,SHV,15-AUG-05 14:04:00,CST,15-AUG-05 14:04:00,0,0,0,0,,,LAW ENFORCEMENT,53,EG,,,,,,,,,,5,S,MAGNOLIA,5,S,MAGNOLIA,33.2,-93.23333,33.2,-93.23333,,Trees downed across a road.,PDS
200511,27,1815,200511,27,1820,1202102,5484329,ARKANSAS,5,2005,November,Tornado,C,5,BAXTER,LZK,27-NOV-05 18:15:00,CST,27-NOV-05 18:20:00,0,0,0,0,,,NWS STORM SURVEY,,,,,F1,3.7,100,,,,,3,ESE,BUFORD,3,ESE,BUFORD,36.23333,-92.4,36.28333,-92.35,,"A tornado was spawned in Baxter County about 2.5 miles east-southeast of Buford. The tornado tracked to the northeast, and caused mostly tree damage. A barn roof was also damaged, with an outbuilding destroyed. The tornado dissipated 4 miles south-southeast of Mountain Home.",PDS
200511,27,1840,200511,27,1842,1202103,5484330,ARKANSAS,5,2005,November,Tornado,C,49,FULTON,LZK,27-NOV-05 18:40:00,CST,27-NOV-05 18:42:00,0,0,0,0,,,NWS STORM SURVEY,,,,,F1,1.3,50,,,,,4,NNW,VIDETTE,4,NNW,VIDETTE,36.48333,-92.15,36.5,-92.11667,,"A tornado was spawned in northwestern Fulton County about 4 miles north-northwest of Vidette. The tornado tracked to the northeast, and caused mostly tree damage. There was also some damage to a house and two barns. The tornado continued into Howell County, Missouri.",PDS
200511,27,1859,200511,27,1908,1202104,5484331,ARKANSAS,5,2005,November,Tornado,C,45,FAULKNER,LZK,27-NOV-05 18:59:00,CST,27-NOV-05 19:08:00,0,0,0,0,,,NWS STORM SURVEY,,,,,F1,7.7,75,,,,,3,S,WOOSTER,3,S,WOOSTER,35.16667,-92.46667,35.25,-92.38333,,"A weak tornado was spawned in western Faulkner County about 2.8 miles south of Wooster. The tornado tracked to the northeast, and caused some roof damage at several homes and also damaged a few mobile homes. Some outbuildings were destroyed, as was a dugout at a junior high school in Greenbrier. Many trees were blown down as well. The tornado dissipated 1.7 miles north-northeast of Greenbrier.",PDS
200511,27,1911,200511,27,1916,1202105,5484332,ARKANSAS,5,2005,November,Tornado,C,45,FAULKNER,LZK,27-NOV-05 19:11:00,CST,27-NOV-05 19:16:00,0,0,0,0,,,NWS STORM SURVEY,,,,,F0,4,40,,,,,4,NE,GREENBRIER,4,NE,GREENBRIER,35.26667,-92.35,35.3,-92.3,,"A weak tornado was spawned in northwestern Faulkner County roughly 3.7 miles northeast of Greenbrier. The tornado tracked to the northeast, and caused some minor roof damage to a house and a barn. A couple of small outbuldings were destroyed. The tornado dissipated 2.5 miles east-southeast of Guy.",PDS
200511,27,1902,200511,27,1906,1202107,5484419,ARKANSAS,5,2005,November,Tornado,C,23,CLEBURNE,LZK,27-NOV-05 19:02:00,CST,27-NOV-05 19:06:00,0,0,0,0,,,NWS STORM SURVEY,,,,,F1,2.7,50,,,,,4,SW,HIGDEN,4,SW,HIGDEN,35.51667,-92.26667,35.55,-92.23333,,"A weak tornado was spawned in western Cleburne County about 4.3 miles southwest of Higden. The tornado tracked to the northeast, and caused some damage to the roof of a mobile home. Several trees were downed as well. The tornado dissipated 1.6 miles southwest of Higden.",PDS
200511,27,1947,200511,27,1949,1202108,5484420,ARKANSAS,5,2005,November,Tornado,C,23,CLEBURNE,LZK,27-NOV-05 19:47:00,CST,27-NOV-05 19:49:00,0,0,0,0,,,NWS STORM SURVEY,,,,,F0,1.2,25,,,,,3,ESE,PRIM,3,ESE,PRIM,35.68333,-92.06667,35.7,-92.06667,,"A weak tornado was spawned in northwestern Cleburne County roughly 3 miles east-southeast of Prim. The tornado tracked to the northeast, and heavily damaged a barn. Part of the roof of a chicken house was partially removed, with trees downed as well. The tornado dissipated 3.1 miles east of Prim.",PDS
200511,27,1855,200511,27,1900,1202109,5484421,ARKANSAS,5,2005,November,Tornado,C,141,VAN BUREN,LZK,27-NOV-05 18:55:00,CST,27-NOV-05 19:00:00,0,0,0,0,,,NWS STORM SURVEY,,,,,F1,3.7,50,,,,,6,SSW,SHIRLEY,6,SSW,SHIRLEY,35.56667,-92.35,35.61667,-92.31667,,A weak tornado was spawned in northeastern Van Buren County roughly 6 miles south-southwest of Shirley. The tornado snapped a few trees before dissipating 2.8 miles south of Shirley.,PDS
200511,27,2005,200511,27,2014,1202110,5484422,ARKANSAS,5,2005,November,Tornado,C,137,STONE,LZK,27-NOV-05 20:05:00,CST,27-NOV-05 20:14:00,0,0,0,0,,,NWS STORM SURVEY,,,,,F2,7,250,,,,,4,W,MARCELLA,4,W,MARCELLA,35.78333,-91.95,35.86667,-91.88333,,"A strong tornado was spawned in eastern Stone County roughly 3.6 miles west of Marcella. The tornado tracked to the northeast, and tore the porch off of a house and damaged the roof. A roof was removed from a barn with another barn roof damaged. Several homes had roof damage, and a shed was destroyed. Hundreds of trees were downed, with one tree on a flatbed truck. The tornado dissipated 2.7 miles northeast of St. James.",PDS
200511,27,1955,200511,27,2001,1202111,5484423,ARKANSAS,5,2005,November,Tornado,C,65,IZARD,LZK,27-NOV-05 19:55:00,CST,27-NOV-05 20:01:00,0,0,0,0,,,EMERGENCY MANAGER,,,,,F1,5.8,150,,,,,2,ENE,FRANKLIN,2,ENE,FRANKLIN,36.18333,-91.75,36.21667,-91.66667,,"A weak tornado touched down in Izard County, roughly 2.3 miles east-northeast of Franklin.  Winds were estimated at 100 mph.  Two mobile homes were overturned, as well as a travel trailer.  Several homes sustained roof damage.  A pontoon boat was overturned and another was destroyed at Horseshoe Bend.  Numerous trees were blown down or snapped off.  Some power lines and power poles were also knocked down.  The tornado moved northeast into Sharp County.",PDS
200511,27,2001,200511,27,2002,1202112,5484424,ARKANSAS,5,2005,November,Tornado,C,135,SHARP,LZK,27-NOV-05 20:01:00,CST,27-NOV-05 20:02:00,0,0,0,0,,,EMERGENCY MANAGER,,,,,F1,.4,100,,,,,2,WNW,BALLARD,2,WNW,BALLARD,36.23333,-91.68333,36.23333,-91.66667,,A weak tornado moved out of Izard County and passed across the extreme northwest corner of Sharp County northwest of the town of Ballard.  The only damage noted along the track of the tornado were numerous trees that were blown down.  The tornado continued moving to the northeast into Fulton County.,PDS
200511,27,1800,200511,27,1800,1201417,5480582,ARKANSAS,5,2005,November,Hail,C,91,MILLER,SHV,27-NOV-05 18:00:00,CST,27-NOV-05 18:00:00,0,0,0,0,,,LAW ENFORCEMENT,1.75,,,,,,,,,,,,,TEXARKANA,,,TEXARKANA,33.43333,-94.05,33.43333,-94.05,,,PDS
200511,27,1840,200511,27,1840,1201422,5480587,ARKANSAS,5,2005,November,Hail,C,91,MILLER,SHV,27-NOV-05 18:40:00,CST,27-NOV-05 18:40:00,0,0,0,0,,,LAW ENFORCEMENT,1.00,,,,,,,,,,,5,NW,GARLAND,5,NW,GARLAND,33.4,-93.78333,33.4,-93.78333,,,PDS
200511,27,1855,200511,27,1855,1201425,5480590,ARKANSAS,5,2005,November,Hail,C,57,HEMPSTEAD,SHV,27-NOV-05 18:55:00,CST,27-NOV-05 18:55:00,0,0,0,0,,,LAW ENFORCEMENT,1.00,,,,,,,,,,,6,SW,HOPE,6,SW,HOPE,33.6,-93.66667,33.6,-93.66667,,Hail fell in Springhill.,PDS
200505,24,2005,200505,24,2005,1200766,5481553,ARKANSAS,5,2005,May,Thunderstorm Wind,C,139,UNION,SHV,24-MAY-05 20:05:00,CST,24-MAY-05 20:05:00,0,0,0,0,,,LAW ENFORCEMENT,54,EG,,,,,,,,,,2,E,EL DORADO,2,E,EL DORADO,33.2,-92.63333,33.2,-92.63333,,Trees were downed east of town.,PDS
200508,27,1445,200508,27,1445,1200909,5481271,ARKANSAS,5,2005,August,Thunderstorm Wind,C,57,HEMPSTEAD,SHV,27-AUG-05 14:45:00,CST,27-AUG-05 14:45:00,0,0,0,0,,,EMERGENCY MANAGER,53,EG,,,,,,,,,,6,SW,OZAN,6,SW,OZAN,33.78333,-93.78333,33.78333,-93.78333,,Trees downed in the community of Yancy.,PDS
200508,27,1415,200508,27,1415,1200903,5481200,ARKANSAS,5,2005,August,Lightning,C,91,MILLER,SHV,27-AUG-05 14:15:00,CST,27-AUG-05 14:15:00,0,0,0,0,,,LAW ENFORCEMENT,,,,,,,,,,,,10,W,GARLAND,10,W,GARLAND,,,,,,Lightning started a woods fire in Genoa.,PDS
200508,27,1415,200508,27,1415,1200904,5481201,ARKANSAS,5,2005,August,Thunderstorm Wind,C,91,MILLER,SHV,27-AUG-05 14:15:00,CST,27-AUG-05 14:15:00,0,0,0,0,,,LAW ENFORCEMENT,54,EG,,,,,,,,,,,,FOUKE,,,FOUKE,33.26667,-93.88333,33.26667,-93.88333,,Trees downed.,PDS
200508,27,1415,200508,27,1415,1200905,5481202,ARKANSAS,5,2005,August,Thunderstorm Wind,C,91,MILLER,SHV,27-AUG-05 14:15:00,CST,27-AUG-05 14:15:00,0,0,0,0,,,LAW ENFORCEMENT,54,EG,,,,,,,,,,,,GARLAND,,,GARLAND,33.35,-93.71667,33.35,-93.71667,,Several trees downed in town and in Genoa.,PDS
200508,27,1430,200508,27,1430,1200906,5481203,ARKANSAS,5,2005,August,Thunderstorm Wind,C,61,HOWARD,SHV,27-AUG-05 14:30:00,CST,27-AUG-05 14:30:00,0,0,0,0,,,EMERGENCY MANAGER,60,EG,,,,,,,,,,3,E,TOLLETTE,3,E,TOLLETTE,33.81667,-93.85,33.81667,-93.85,,Several large trees blown down along Hwy 332 near the communtiy of Schooley.  Survey performed by the county Emergency Manager measured the downburst about 3/8 mile wide and 1/4 to 1/2 mile long.,PDS
200508,27,1435,200508,27,1435,1200907,5481204,ARKANSAS,5,2005,August,Thunderstorm Wind,C,61,HOWARD,SHV,27-AUG-05 14:35:00,CST,27-AUG-05 14:35:00,0,0,0,0,,,EMERGENCY MANAGER,55,EG,,,,,,,,,,4,S,TOLLETTE,4,S,TOLLETTE,33.76667,-93.9,33.76667,-93.9,,Several trees were downed near the community of Saratoga.,PDS
