BEGIN_YEARMONTH,BEGIN_DAY,BEGIN_TIME,END_YEARMONTH,END_DAY,END_TIME,EPISODE_ID,EVENT_ID,STATE,STATE_FIPS,YEAR,MONTH_NAME,EVENT_TYPE,CZ_TYPE,CZ_FIPS,CZ_NAME,WFO,BEGIN_DATE_TIME,CZ_TIMEZONE,END_DATE_TIME,INJURIES_DIRECT,INJURIES_INDIRECT,DEATHS_DIRECT,DEATHS_INDIRECT,DAMAGE_PROPERTY,DAMAGE_CROPS,SOURCE,MAGNITUDE,MAGNITUDE_TYPE,FLOOD_CAUSE,CATEGORY,TOR_F_SCALE,TOR_LENGTH,TOR_WIDTH,TOR_OTHER_WFO,TOR_OTHER_CZ_STATE,TOR_OTHER_CZ_FIPS,TOR_OTHER_CZ_NAME,BEGIN_RANGE,BEGIN_AZIMUTH,BEGIN_LOCATION,END_RANGE,END_AZIMUTH,END_LOCATION,BEGIN_LAT,BEGIN_LON,END_LAT,END_LON,EPISODE_NARRATIVE,EVENT_NARRATIVE,DATA_SOURCE
200501,13,227,200501,13,230,1182731,5433003,ARKANSAS,5,2005,January,Thunderstorm Wind,C,3,ASHLEY,JAN,13-JAN-05 02:27:00,CST,13-JAN-05 02:30:00,0,0,0,0,60K,,LAW ENFORCEMENT,65,EG,,,,,,,,,,,,CROSSETT,,,CROSSETT,33.13333,-91.96667,33.13333,-91.96667,,"Numerous trees were blown down, a few homes had shingles blown off their roof and a portion of the Sears building was damaged.",PDS
200502,21,155,200502,21,155,1184846,5437418,ARKANSAS,5,2005,February,Thunderstorm Wind,C,143,WASHINGTON,TSA,21-FEB-05 01:55:00,CST,21-FEB-05 01:55:00,0,0,0,0,1K,,GENERAL PUBLIC,61,EG,,,,,,,,,,1,SE,WINSLOW,1,SE,WINSLOW,35.78333,-94.11667,35.78333,-94.11667,,Thunderstorm winds estimated at 70 miles an hour blew down large tree limbs and peeled several shingles off the roof of a home.,PDS
200502,21,158,200502,21,158,1184846,5437419,ARKANSAS,5,2005,February,Hail,C,143,WASHINGTON,TSA,21-FEB-05 01:58:00,CST,21-FEB-05 01:58:00,0,0,0,0,,,GENERAL PUBLIC,1.00,,,,,,,,,,,1,SE,WINSLOW,1,SE,WINSLOW,35.78333,-94.11667,35.78333,-94.11667,,,PDS
200502,21,205,200502,21,205,1184846,5437420,ARKANSAS,5,2005,February,Thunderstorm Wind,C,33,CRAWFORD,TSA,21-FEB-05 02:05:00,CST,21-FEB-05 02:05:00,0,0,0,0,,,GENERAL PUBLIC,52,EG,,,,,,,,,,,,BIDVILLE,,,BIDVILLE,35.73333,-93.98333,35.73333,-93.98333,,Thunderstorm winds estimated at 60 miles an hour blew down large tree limbs.,PDS
200502,21,210,200502,21,210,1184846,5437421,ARKANSAS,5,2005,February,Hail,C,33,CRAWFORD,TSA,21-FEB-05 02:10:00,CST,21-FEB-05 02:10:00,0,0,0,0,,,GENERAL PUBLIC,1.00,,,,,,,,,,,,,BIDVILLE,,,BIDVILLE,35.73333,-93.98333,35.73333,-93.98333,,,PDS
200502,21,215,200502,21,215,1184846,5437422,ARKANSAS,5,2005,February,Hail,C,87,MADISON,TSA,21-FEB-05 02:15:00,CST,21-FEB-05 02:15:00,0,0,0,0,,,TRAINED SPOTTER,0.88,,,,,,,,,,,,,JAPTON,,,JAPTON,35.95,-93.8,35.95,-93.8,,,PDS
200502,21,229,200502,21,229,1184846,5437423,ARKANSAS,5,2005,February,Hail,C,47,FRANKLIN,TSA,21-FEB-05 02:29:00,CST,21-FEB-05 02:29:00,0,0,0,0,,,EMERGENCY MANAGER,0.88,,,,,,,,,,,,,JETHRO,,,JETHRO,35.6,-93.88333,35.6,-93.88333,,,PDS
200501,12,1920,200501,12,1920,1184608,5438622,ARKANSAS,5,2005,January,Thunderstorm Wind,C,71,JOHNSON,LZK,12-JAN-05 19:20:00,CST,12-JAN-05 19:20:00,0,0,0,0,,,LAW ENFORCEMENT,50,EG,,,,,,,,,,,,OZONE,,,OZONE,35.63333,-93.45,35.63333,-93.45,,Thunderstorm winds damaged the roof of a porch.,PDS
200502,2,30,200502,2,1100,1184847,5437427,ARKANSAS,5,2005,February,Heavy Snow,Z,10,WASHINGTON,TSA,02-FEB-05 00:30:00,CST,02-FEB-05 11:00:00,0,0,0,0,,,GENERAL PUBLIC,,,,,,,,,,,,,,,,,,,,,,An upper level system began moving northeast out of the southern Rockies during the day on February 1st.  Rain began in southeast Oklahoma during the day and transititioned to or mixed with snow during the evening.  Snow fell across much of northeast Oklahoma and Northwest Arkansas during the early morning hours on the 2nd.  Temperatures were generally near or 3-4 degrees above freezing which limited the snow accumulations.  Higher terrain in far Northwest Arkansas did receive heavy snow. 5.5 inches of snow was the greatest accumulation and was located at Forum in Madison County. This was closely followed by 5.0 inches of snow in Japton in Madison County and 5.0 inches near West Fork in Washington County.,,PDS
200502,23,310,200502,23,310,1184848,5437428,ARKANSAS,5,2005,February,Hail,C,33,CRAWFORD,TSA,23-FEB-05 03:10:00,CST,23-FEB-05 03:10:00,0,0,0,0,,,POST OFFICE,0.88,,,,,,,,,,,1,S,NATURAL DAM,1,S,NATURAL DAM,35.63333,-94.4,35.63333,-94.4,,,PDS
200501,12,2000,200501,12,2200,1184579,5438429,ARKANSAS,5,2005,January,Flash Flood,C,7,BENTON,TSA,12-JAN-05 20:00:00,CST,12-JAN-05 22:00:00,0,0,0,0,,,EMERGENCY MANAGER,,,,,,,,,,,,,,COUNTYWIDE,,,COUNTYWIDE,36.35,-94.21667,36.35,-94.21667,,Heavy rains caused numerous county roads to be impassable throughout Benton County.  Highway 264 near Highfill was also under water for a period of time.,PDS
200501,12,2000,200501,12,2230,1184579,5438430,ARKANSAS,5,2005,January,Flash Flood,C,47,FRANKLIN,TSA,12-JAN-05 20:00:00,CST,12-JAN-05 22:30:00,0,0,0,0,,,EMERGENCY MANAGER,,,,,,,,,,,,,,COUNTYWIDE,,,COUNTYWIDE,35.58333,-93.85,35.58333,-93.85,,Heavy rains caused flooding of numerous county roads across Franklin County.  Street flooding was also reported in Ozark.,PDS
200501,12,2010,200501,12,2300,1184579,5438431,ARKANSAS,5,2005,January,Flash Flood,C,87,MADISON,TSA,12-JAN-05 20:10:00,CST,12-JAN-05 23:00:00,0,0,0,0,,,DEPT OF HIGHWAYS,,,,,,,,,,,,,,COUNTYWIDE,,,COUNTYWIDE,36.03333,-94.7,36.03333,-94.7,,Heavy rains caused numerous county roads to be flooded across Madison County.,PDS
200502,2,30,200502,2,1100,1184847,5437426,ARKANSAS,5,2005,February,Heavy Snow,Z,11,MADISON,TSA,02-FEB-05 00:30:00,CST,02-FEB-05 11:00:00,0,0,0,0,,,GENERAL PUBLIC,,,,,,,,,,,,,,,,,,,,,,An upper level system began moving northeast out of the southern Rockies during the day on February 1st.  Rain began in southeast Oklahoma during the day and transititioned to or mixed with snow during the evening.  Snow fell across much of northeast Oklahoma and Northwest Arkansas during the early morning hours on the 2nd.  Temperatures were generally near or 3-4 degrees above freezing which limited the snow accumulations.  Higher terrain in far Northwest Arkansas did receive heavy snow. 5.5 inches of snow was the greatest accumulation and was located at Forum in Madison County. This was closely followed by 5.0 inches of snow in Japton in Madison County and 5.0 inches near West Fork in Washington County.,,PDS
200501,3,1340,200501,3,1340,1184607,5438621,ARKANSAS,5,2005,January,Flash Flood,C,89,MARION,LZK,03-JAN-05 13:40:00,CST,03-JAN-05 13:40:00,0,0,1,0,,,EMERGENCY MANAGER,,,,,,,,,,,,,,RUSH,,,RUSH,36.13333,-92.56667,36.13333,-92.56667,,"An elderly couple was returning to their home and found a low water crossing on Rush Creek flooded.  They decided not to try and cross in their truck.  They got out of the truck and attempted to cross the creek on foot at an old road bed that crossed the creek nearby.  The water was too swift and they were swept downstream.  The 88 year old man survived, but his 87 year old wife did not.",PDS
200501,12,2000,200501,12,2000,1184609,5438623,ARKANSAS,5,2005,January,Thunderstorm Wind,C,101,NEWTON,LZK,12-JAN-05 20:00:00,CST,12-JAN-05 20:00:00,0,0,0,0,,,LAW ENFORCEMENT,50,EG,,,,,,,,,,,,WESTERN GROVE,,,WESTERN GROVE,36.1,-92.95,36.1,-92.95,,Thunderstorm winds downed some trees.,PDS
200501,12,2015,200501,12,2015,1184610,5438624,ARKANSAS,5,2005,January,Thunderstorm Wind,C,9,BOONE,LZK,12-JAN-05 20:15:00,CST,12-JAN-05 20:15:00,0,0,0,0,,,GENERAL PUBLIC,50,EG,,,,,,,,,,,,EVERTON,,,EVERTON,36.15,-92.9,36.15,-92.9,,Few trees were blown down.,PDS
200501,6,500,200501,6,2000,1184591,5438500,ARKANSAS,5,2005,January,Flood,Z,19,CRAWFORD,TSA,06-JAN-05 05:00:00,CST,06-JAN-05 20:00:00,0,0,0,0,,,OFFICIAL NWS OBS.,,,,,,,,,,,,,,,,,,34.38333,-93.18333,34.38333,-93.18333,The Arkansas River near Van Buren rose above its flood stage of 22 feet at 5 am cst on January 6th.  The river crested at noon that same day before falling below its flood stage at 8 pm cst that evening.,,PDS
200501,4,324,200501,4,324,1184576,5438342,ARKANSAS,5,2005,January,Hail,C,7,BENTON,TSA,04-JAN-05 03:24:00,CST,04-JAN-05 03:24:00,0,0,0,0,,,LAW ENFORCEMENT,1.00,,,,,,,,,,,2,NW,BELLA VISTA,2,NW,BELLA VISTA,36.45,-94.26667,36.45,-94.26667,,,PDS
200501,4,600,200501,4,630,1184576,5438343,ARKANSAS,5,2005,January,Flash Flood,C,47,FRANKLIN,TSA,04-JAN-05 06:00:00,CST,04-JAN-05 06:30:00,0,0,0,0,,,GENERAL PUBLIC,,,,,,,,,,,,1,S,CASS,1,S,CASS,35.66667,-93.81667,35.66667,-93.81667,,Highway 23 was temporarily impassable due to high water.,PDS
200501,12,2300,200501,12,2300,1184617,5438665,ARKANSAS,5,2005,January,Thunderstorm Wind,C,29,CONWAY,LZK,12-JAN-05 23:00:00,CST,12-JAN-05 23:00:00,0,0,0,0,,,LAW ENFORCEMENT,50,EG,,,,,,,,,,,,MORRILTON,,,MORRILTON,35.15,-92.75,35.15,-92.75,,A number of trees and large limbs were knocked down throughout the city of Morrilton.,PDS
200501,13,10,200501,13,400,1184618,5438666,ARKANSAS,5,2005,January,Flash Flood,C,69,JEFFERSON,LZK,13-JAN-05 00:10:00,CST,13-JAN-05 04:00:00,0,0,0,0,,,TRAINED SPOTTER,,,,,,,,,,,,,,PINE BLUFF,,,PINE BLUFF,34.21667,-92.01667,34.21667,-92.01667,,Heavy rainfall caused street flooding in parts of Pine Bluff.  A number of streets were impassible due to the flood waters and several cars stalled trying to maneuver through the high water.,PDS
200503,22,1525,200503,22,1530,1185770,5440645,ARKANSAS,5,2005,March,Hail,C,37,CROSS,MEG,22-MAR-05 15:25:00,CST,22-MAR-05 15:30:00,0,0,0,0,.1K,,TRAINED SPOTTER,1.00,,,,,,,,,,,4,E,HICKORY RIDGE,4,E,HICKORY RIDGE,35.4,-90.93333,35.4,-90.93333,,,PDS
200503,22,1540,200503,22,1545,1185770,5440646,ARKANSAS,5,2005,March,Hail,C,111,POINSETT,MEG,22-MAR-05 15:40:00,CST,22-MAR-05 15:45:00,0,0,0,0,.01K,,TRAINED SPOTTER,0.75,,,,,,,,,,,,,WALDENBURG,,,WALDENBURG,35.56667,-90.93333,35.56667,-90.93333,,,PDS
200503,22,1540,200503,22,1545,1185770,5440647,ARKANSAS,5,2005,March,Thunderstorm Wind,C,111,POINSETT,MEG,22-MAR-05 15:40:00,CST,22-MAR-05 15:45:00,0,0,0,0,1K,,TRAINED SPOTTER,50,EG,,,,,,,,,,,,WALDENBURG,,,WALDENBURG,35.56667,-90.93333,35.56667,-90.93333,,Some large tree limbs were blown down.,PDS
200503,22,1557,200503,22,1605,1185770,5440648,ARKANSAS,5,2005,March,Hail,C,37,CROSS,MEG,22-MAR-05 15:57:00,CST,22-MAR-05 16:05:00,0,0,0,0,.1K,,TRAINED SPOTTER,1.00,,,,,,,,,,,8,W,WYNNE,8,W,WYNNE,35.23333,-90.95,35.23333,-90.95,,,PDS
200503,22,1600,200503,22,1605,1185770,5440649,ARKANSAS,5,2005,March,Hail,C,31,CRAIGHEAD,MEG,22-MAR-05 16:00:00,CST,22-MAR-05 16:05:00,0,0,0,0,.05K,,TRAINED SPOTTER,0.88,,,,,,,,,,,,,BROOKLAND,,,BROOKLAND,35.9,-90.58333,35.9,-90.58333,,,PDS
200503,22,1605,200503,22,1620,1185770,5440650,ARKANSAS,5,2005,March,Hail,C,37,CROSS,MEG,22-MAR-05 16:05:00,CST,22-MAR-05 16:20:00,0,0,0,0,.1K,,TRAINED SPOTTER,0.88,,,,,,,,,,,,,VANNDALE,,,VANNDALE,35.31667,-90.78333,35.31667,-90.78333,,,PDS
200503,22,1615,200503,22,1625,1185770,5440651,ARKANSAS,5,2005,March,Hail,C,31,CRAIGHEAD,MEG,22-MAR-05 16:15:00,CST,22-MAR-05 16:25:00,0,0,0,0,.12K,,TRAINED SPOTTER,1.00,,,,,,,,,,,,,JONESBORO,,,JONESBORO,35.83333,-90.7,35.83333,-90.7,,,PDS
200503,22,1629,200503,22,1635,1185770,5440652,ARKANSAS,5,2005,March,Hail,C,35,CRITTENDEN,MEG,22-MAR-05 16:29:00,CST,22-MAR-05 16:35:00,0,0,0,0,.15K,,TRAINED SPOTTER,1.00,,,,,,,,,,,6,N,EARLE,6,N,EARLE,35.35,-90.46667,35.35,-90.46667,,,PDS
200503,22,1630,200503,22,1635,1185770,5440653,ARKANSAS,5,2005,March,Hail,C,31,CRAIGHEAD,MEG,22-MAR-05 16:30:00,CST,22-MAR-05 16:35:00,0,0,0,0,.01K,,TRAINED SPOTTER,0.75,,,,,,,,,,,,,JONESBORO,,,JONESBORO,35.83333,-90.7,35.83333,-90.7,,,PDS
200503,22,1650,200503,22,1655,1185770,5440654,ARKANSAS,5,2005,March,Hail,C,111,POINSETT,MEG,22-MAR-05 16:50:00,CST,22-MAR-05 16:55:00,0,0,0,0,.01K,,TRAINED SPOTTER,0.75,,,,,,,,,,,,,MARKED TREE,,,MARKED TREE,35.53333,-90.41667,35.53333,-90.41667,,,PDS
200503,22,1738,200503,22,1745,1185770,5440655,ARKANSAS,5,2005,March,Tornado,C,93,MISSISSIPPI,MEG,22-MAR-05 17:38:00,CST,22-MAR-05 17:45:00,0,0,0,0,5K,,NWS STORM SURVEY,,,,,F0,8,75,,,,,,,MARIE,,,MARIE,35.61667,-90.08333,35.7,-89.96667,,The tornado touched down near Marie and moved northeast. The tornado moved mainly over open farm fields and produced only minor damage to a couple of residences.,PDS
200503,22,1747,200503,22,1755,1185770,5440656,ARKANSAS,5,2005,March,Hail,C,93,MISSISSIPPI,MEG,22-MAR-05 17:47:00,CST,22-MAR-05 17:55:00,0,0,0,0,.11K,,TRAINED SPOTTER,1.00,,,,,,,,,,,,,OSCEOLA,,,OSCEOLA,35.7,-89.96667,35.7,-89.96667,,,PDS
200501,12,2020,200501,12,2025,1184611,5438657,ARKANSAS,5,2005,January,Thunderstorm Wind,C,89,MARION,LZK,12-JAN-05 20:20:00,CST,12-JAN-05 20:25:00,0,0,0,0,,,LAW ENFORCEMENT,65,EG,,,,,,,,,,2,S,EROS,2,S,EROS,36.15,-92.85,36.21667,-92.81667,,"Thunderstorm winds damaged several structures and downed numerous trees near the town of Eros.  Altogether, 5 barns were destroyed and a large tree fell onto a mobile home.  Several other homes sustained roof damage and the back porch of one home was blown off.",PDS
200501,12,2040,200501,12,2040,1184612,5438658,ARKANSAS,5,2005,January,Thunderstorm Wind,C,5,BAXTER,LZK,12-JAN-05 20:40:00,CST,12-JAN-05 20:40:00,0,0,0,0,,,LAW ENFORCEMENT,50,EG,,,,,,,,,,,,MIDWAY,,,MIDWAY,36.38333,-92.46667,36.38333,-92.46667,,"Thunderstorm winds downed some large tree limbs, knocked down a large tree onto power lines and blew away a carport.",PDS
200501,12,2235,200501,12,2235,1184613,5438659,ARKANSAS,5,2005,January,Thunderstorm Wind,C,105,PERRY,LZK,12-JAN-05 22:35:00,CST,12-JAN-05 22:35:00,0,0,0,0,,,TRAINED SPOTTER,50,EG,,,,,,,,,,,,ADONA,,,ADONA,35.03333,-92.91667,35.03333,-92.91667,,Thunderstorm winds split open a large tree and uprooted another.,PDS
200501,12,2330,200501,12,2330,1184614,5438660,ARKANSAS,5,2005,January,Thunderstorm Wind,C,119,PULASKI,LZK,12-JAN-05 23:30:00,CST,12-JAN-05 23:30:00,0,0,0,0,,,LAW ENFORCEMENT,50,EG,,,,,,,,,,,,NORTH LITTLE ROCK,,,NORTH LITTLE ROCK,34.76667,-92.25,34.76667,-92.25,,Thunderstorm winds downed some power lines and damaged the roof of a building in downtown North Little Rock.,PDS
200501,6,500,200501,6,2000,1184591,5438501,ARKANSAS,5,2005,January,Flood,Z,29,SEBASTIAN,TSA,06-JAN-05 05:00:00,CST,06-JAN-05 20:00:00,0,0,0,0,,,OFFICIAL NWS OBS.,,,,,,,,,,,,,,,,,,35.31667,-92.71667,35.31667,-92.71667,The Arkansas River near Van Buren rose above its flood stage of 22 feet at 5 am cst on January 6th.  The river crested at noon that same day before falling below its flood stage at 8 pm cst that evening.,,PDS
200501,12,1839,200501,12,1839,1184579,5438426,ARKANSAS,5,2005,January,Thunderstorm Wind,C,143,WASHINGTON,TSA,12-JAN-05 18:39:00,CST,12-JAN-05 18:39:00,0,0,0,0,,,EMERGENCY MANAGER,61,EG,,,,,,,,,,,,GOSHEN,,,GOSHEN,36.1,-94,36.1,-94,,Thunderstorm winds estimated at 70 miles an hour blew a tree down across Highway 45.,PDS
200501,12,1800,200501,12,1805,1184579,5438427,ARKANSAS,5,2005,January,Thunderstorm Wind,C,7,BENTON,TSA,12-JAN-05 18:00:00,CST,12-JAN-05 18:05:00,1,0,0,0,250K,,NWS STORM SURVEY,70,EG,,,,,,,,,,,,CENTERTON,,,CENTERTON,36.35,-94.28333,36.36667,-94.21667,,"A microburst with winds estimated at 80 miles an hour struck the ground north of highway 102 near Centerton then spread quickly through the Turnbridge subdivision.  This storm damaged two dozen homes with three sustaining major damage.  A home located on the southwest corner of the subdivision lost a large part of its roof.  Flying debris injured one person in that home.  The debris from this home was blown northeast and east through the subdivision resulting in damage to a number of other homes.  In addition to the damage in the subdivision, a number of trees were snapped or uprooted from Centerton to Bentonville.",PDS
200501,12,1845,200501,12,1845,1184579,5438428,ARKANSAS,5,2005,January,Thunderstorm Wind,C,47,FRANKLIN,TSA,12-JAN-05 18:45:00,CST,12-JAN-05 18:45:00,0,0,0,0,,,EMERGENCY MANAGER,61,EG,,,,,,,,,,1,E,OZARK,1,E,OZARK,35.5,-93.81667,35.5,-93.81667,,Thunderstorm winds estimated at 70 miles an hour blew a tree down onto Highway 64 just east of Ozark.,PDS
200502,21,230,200502,21,230,1184846,5437424,ARKANSAS,5,2005,February,Hail,C,47,FRANKLIN,TSA,21-FEB-05 02:30:00,CST,21-FEB-05 02:30:00,0,0,0,0,,,EMERGENCY MANAGER,1.00,,,,,,,,,,,,,CASS,,,CASS,35.68333,-93.81667,35.68333,-93.81667,,,PDS
200502,21,245,200502,21,245,1184846,5437425,ARKANSAS,5,2005,February,Hail,C,47,FRANKLIN,TSA,21-FEB-05 02:45:00,CST,21-FEB-05 02:45:00,0,0,0,0,,,EMERGENCY MANAGER,1.00,,,,,,,,,,,3,ENE,OZARK,3,ENE,OZARK,35.51667,-93.78333,35.51667,-93.78333,,,PDS
200501,13,800,200501,13,2300,1184592,5438502,ARKANSAS,5,2005,January,Flood,Z,19,CRAWFORD,TSA,13-JAN-05 08:00:00,CST,13-JAN-05 23:00:00,0,0,0,0,,,OFFICIAL NWS OBS.,,,,,,,,,,,,,,,,,,34.38333,-93.18333,34.38333,-93.18333,The Arkansas River near Van Buren rose above its flood stage of 22 feet at 8 am cst.  The river crested at 22.60 feet at 5 pm that same day.  The river fell below its flood stage at 11 pm cst that evening.,,PDS
200501,13,800,200501,13,2300,1184592,5438503,ARKANSAS,5,2005,January,Flood,Z,29,SEBASTIAN,TSA,13-JAN-05 08:00:00,CST,13-JAN-05 23:00:00,0,0,0,0,,,OFFICIAL NWS OBS.,,,,,,,,,,,,,,,,,,35.31667,-92.71667,35.31667,-92.71667,The Arkansas River near Van Buren rose above its flood stage of 22 feet at 8 am cst.  The river crested at 22.60 feet at 5 pm that same day.  The river fell below its flood stage at 11 pm cst that evening.,,PDS
200501,3,1130,200501,3,1230,1184593,5438504,ARKANSAS,5,2005,January,Flash Flood,C,47,FRANKLIN,TSA,03-JAN-05 11:30:00,CST,03-JAN-05 12:30:00,0,0,0,0,,,EMERGENCY MANAGER,,,,,,,,,,,,,,SOUTH PORTION,,,SOUTH PORTION,35.58333,-93.85,35.58333,-93.85,,"Heavy rains caused street flooding in Alix.  In addition, several low water crossings were under water across the southern part of Franklin County.",PDS
200501,12,2015,200501,12,2300,1184579,5438488,ARKANSAS,5,2005,January,Flash Flood,C,15,CARROLL,TSA,12-JAN-05 20:15:00,CST,12-JAN-05 23:00:00,0,0,0,0,,,DEPT OF HIGHWAYS,,,,,,,,,,,,,,COUNTYWIDE,,,COUNTYWIDE,36.3,-93.55,36.3,-93.55,,"Heavy rains caused numerous county roads to be flooded across Carroll County.  In particular, county roads 705 and 710 were closed north of Metalton.",PDS
200501,12,2245,200501,13,145,1184615,5438661,ARKANSAS,5,2005,January,Flash Flood,C,5,BAXTER,LZK,12-JAN-05 22:45:00,CST,13-JAN-05 01:45:00,0,0,0,0,,,LAW ENFORCEMENT,,,,,,,,,,,,3,S,MOUNTAIN HOME,3,S,MOUNTAIN HOME,36.28333,-92.38333,36.28333,-92.38333,,Heavy rains produced flash flooding south of Mountain Home.  Several county roads were closed for a few hours due to high water.,PDS
200501,12,2245,200501,13,145,1184616,5438662,ARKANSAS,5,2005,January,Flash Flood,C,71,JOHNSON,LZK,12-JAN-05 22:45:00,CST,13-JAN-05 01:45:00,0,0,0,0,,,LAW ENFORCEMENT,,,,,,,,,,,,,,COUNTYWIDE,,,COUNTYWIDE,35.58333,-93.43333,35.58333,-93.43333,Heavy rainfall across north-central Arkansas resulted in flash flooding.  Numerous county roads and low water crossings flooded and were impassible for several hours across the area.,,PDS
200501,12,2245,200501,13,145,1184616,5438663,ARKANSAS,5,2005,January,Flash Flood,C,89,MARION,LZK,12-JAN-05 22:45:00,CST,13-JAN-05 01:45:00,0,0,0,0,,,LAW ENFORCEMENT,,,,,,,,,,,,,,COUNTYWIDE,,,COUNTYWIDE,36.25,-92.7,36.25,-92.7,Heavy rainfall across north-central Arkansas resulted in flash flooding.  Numerous county roads and low water crossings flooded and were impassible for several hours across the area.,,PDS
200501,12,2245,200501,13,145,1184616,5438664,ARKANSAS,5,2005,January,Flash Flood,C,101,NEWTON,LZK,12-JAN-05 22:45:00,CST,13-JAN-05 01:45:00,0,0,0,0,,,LAW ENFORCEMENT,,,,,,,,,,,,,,COUNTYWIDE,,,COUNTYWIDE,35.93333,-93.21667,35.93333,-93.21667,Heavy rainfall across north-central Arkansas resulted in flash flooding.  Numerous county roads and low water crossings flooded and were impassible for several hours across the area.,,PDS
200501,13,30,200501,13,230,1184619,5438667,ARKANSAS,5,2005,January,Flash Flood,C,13,CALHOUN,LZK,13-JAN-05 00:30:00,CST,13-JAN-05 02:30:00,0,0,0,0,,,LAW ENFORCEMENT,,,,,,,,,,,,,,COUNTYWIDE,,,COUNTYWIDE,33.51667,-92.55,33.51667,-92.55,"Heavy rainfall across parts of southern Arkansas produced flash flooding.  Rainfall amounts between one and two inches were common, with a few locations receiving almost three inches.  A number of county roads were flooded and impassible due to the resulting high water levels.",,PDS
200501,13,30,200501,13,230,1184619,5438668,ARKANSAS,5,2005,January,Flash Flood,C,25,CLEVELAND,LZK,13-JAN-05 00:30:00,CST,13-JAN-05 02:30:00,0,0,0,0,,,LAW ENFORCEMENT,,,,,,,,,,,,,,COUNTYWIDE,,,COUNTYWIDE,33.88333,-92.16667,33.88333,-92.16667,"Heavy rainfall across parts of southern Arkansas produced flash flooding.  Rainfall amounts between one and two inches were common, with a few locations receiving almost three inches.  A number of county roads were flooded and impassible due to the resulting high water levels.",,PDS
200501,13,30,200501,13,230,1184619,5438669,ARKANSAS,5,2005,January,Flash Flood,C,103,OUACHITA,LZK,13-JAN-05 00:30:00,CST,13-JAN-05 02:30:00,0,0,0,0,,,LAW ENFORCEMENT,,,,,,,,,,,,,,SOUTHEAST PORTION,,,SOUTHEAST PORTION,33.91667,-92.86667,33.91667,-92.86667,"Heavy rainfall across parts of southern Arkansas produced flash flooding.  Rainfall amounts between one and two inches were common, with a few locations receiving almost three inches.  A number of county roads were flooded and impassible due to the resulting high water levels.",,PDS
200501,13,30,200501,13,230,1184619,5438670,ARKANSAS,5,2005,January,Flash Flood,C,39,DALLAS,LZK,13-JAN-05 00:30:00,CST,13-JAN-05 02:30:00,0,0,0,0,,,OFFICIAL NWS OBS.,,,,,,,,,,,,,,SPARKMAN,,,SPARKMAN,33.91667,-92.85,33.91667,-92.85,"Heavy rainfall across parts of southern Arkansas produced flash flooding.  Rainfall amounts between one and two inches were common, with a few locations receiving almost three inches.  A number of county roads were flooded and impassible due to the resulting high water levels.",,PDS
200503,21,2145,200503,21,2145,1185867,5439966,ARKANSAS,5,2005,March,Hail,C,143,WASHINGTON,TSA,21-MAR-05 21:45:00,CST,21-MAR-05 21:45:00,0,0,0,0,,,FIRE DEPT/RESCUE SQUAD,0.75,,,,,,,,,,,4,SE,WEST FORK,4,SE,WEST FORK,35.9,-94.13333,35.9,-94.13333,,,PDS
200503,21,2310,200503,21,2310,1185867,5439967,ARKANSAS,5,2005,March,Hail,C,131,SEBASTIAN,TSA,21-MAR-05 23:10:00,CST,21-MAR-05 23:10:00,0,0,0,0,,,EMERGENCY MANAGER,0.75,,,,,,,,,,,1,S,FT CHAFFEE,1,S,FT CHAFFEE,35.2,-94.05,35.2,-94.05,,,PDS
200503,24,2131,200503,24,2131,1185869,5440706,ARKANSAS,5,2005,March,Hail,C,33,CRAWFORD,TSA,24-MAR-05 21:31:00,CST,24-MAR-05 21:31:00,0,0,0,0,,,STORM CHASER,0.75,,,,,,,,,,,3,NE,VAN BUREN,3,NE,VAN BUREN,35.46667,-94.31667,35.46667,-94.31667,,,PDS
200503,24,58,200503,24,58,1185869,5440707,ARKANSAS,5,2005,March,Hail,C,47,FRANKLIN,TSA,24-MAR-05 00:58:00,CST,24-MAR-05 00:58:00,0,0,0,0,,,EMERGENCY MANAGER,1.00,,,,,,,,,,,8,NW,OZARK,8,NW,OZARK,35.58333,-93.93333,35.58333,-93.93333,,,PDS
200503,24,113,200503,24,113,1185869,5440708,ARKANSAS,5,2005,March,Hail,C,33,CRAWFORD,TSA,24-MAR-05 01:13:00,CST,24-MAR-05 01:13:00,0,0,0,0,,,EMERGENCY MANAGER,0.88,,,,,,,,,,,,,RUDY,,,RUDY,35.53333,-94.28333,35.53333,-94.28333,,,PDS
200503,25,125,200503,25,125,1185869,5440709,ARKANSAS,5,2005,March,Hail,C,47,FRANKLIN,TSA,25-MAR-05 01:25:00,CST,25-MAR-05 01:25:00,0,0,0,0,,,GENERAL PUBLIC,0.75,,,,,,,,,,,8,N,OZARK,8,N,OZARK,35.61667,-93.83333,35.61667,-93.83333,,,PDS
200502,21,658,200502,21,705,1185341,5440948,ARKANSAS,5,2005,February,Hail,C,35,CRITTENDEN,MEG,21-FEB-05 06:58:00,CST,21-FEB-05 07:05:00,0,0,0,0,.01K,,TRAINED SPOTTER,0.75,,,,,,,,,,,2,E,WEST MEMPHIS,2,E,WEST MEMPHIS,35.15,-90.15,35.15,-90.15,,,PDS
200504,29,645,200504,29,645,1187623,5442518,ARKANSAS,5,2005,April,Hail,C,145,WHITE,LZK,29-APR-05 06:45:00,CST,29-APR-05 06:45:00,0,0,0,0,,,LAW ENFORCEMENT,0.88,,,,,,,,,,,,,SEARCY,,,SEARCY,35.25,-91.75,35.25,-91.75,,,PDS
200504,29,653,200504,29,653,1187624,5442519,ARKANSAS,5,2005,April,Hail,C,145,WHITE,LZK,29-APR-05 06:53:00,CST,29-APR-05 06:53:00,0,0,0,0,,,TRAINED SPOTTER,0.88,,,,,,,,,,,,,JUDSONIA,,,JUDSONIA,35.28333,-91.63333,35.28333,-91.63333,,,PDS
200504,29,740,200504,29,740,1187625,5442520,ARKANSAS,5,2005,April,Hail,C,45,FAULKNER,LZK,29-APR-05 07:40:00,CST,29-APR-05 07:40:00,0,0,0,0,,,TRAINED SPOTTER,1.00,,,,,,,,,,,1,S,MAYFLOWER,1,S,MAYFLOWER,34.93333,-92.43333,34.93333,-92.43333,Hail covered the ground at several locations in southern Faulkner County.,,PDS
200504,29,743,200504,29,743,1187625,5442521,ARKANSAS,5,2005,April,Hail,C,45,FAULKNER,LZK,29-APR-05 07:43:00,CST,29-APR-05 07:43:00,0,0,0,0,,,TRAINED SPOTTER,0.88,,,,,,,,,,,1,S,MAYFLOWER,1,S,MAYFLOWER,34.93333,-92.43333,34.93333,-92.43333,Hail covered the ground at several locations in southern Faulkner County.,,PDS
200504,29,750,200504,29,750,1187625,5442522,ARKANSAS,5,2005,April,Hail,C,45,FAULKNER,LZK,29-APR-05 07:50:00,CST,29-APR-05 07:50:00,0,0,0,0,,,GENERAL PUBLIC,1.00,,,,,,,,,,,,,CATO,,,CATO,34.93333,-92.26667,34.93333,-92.26667,Hail covered the ground at several locations in southern Faulkner County.,,PDS
200504,29,720,200504,29,720,1187626,5442523,ARKANSAS,5,2005,April,Hail,C,105,PERRY,LZK,29-APR-05 07:20:00,CST,29-APR-05 07:20:00,0,0,0,0,,,BROADCAST MEDIA,1.25,,,,,,,,,,,,,BIGELOW,,,BIGELOW,35,-92.63333,35,-92.63333,,,PDS
200504,29,725,200504,29,725,1187626,5442524,ARKANSAS,5,2005,April,Hail,C,105,PERRY,LZK,29-APR-05 07:25:00,CST,29-APR-05 07:25:00,0,0,0,0,,,GENERAL PUBLIC,1.00,,,,,,,,,,,1,S,PERRYVILLE,1,S,PERRYVILLE,34.98333,-92.8,34.98333,-92.8,,,PDS
200504,29,746,200504,29,746,1187627,5442525,ARKANSAS,5,2005,April,Hail,C,119,PULASKI,LZK,29-APR-05 07:46:00,CST,29-APR-05 07:46:00,0,0,0,0,,,TRAINED SPOTTER,1.00,,,,,,,,,,,3,NW,MORGAN,3,NW,MORGAN,34.91667,-92.4,34.91667,-92.4,,,PDS
200504,29,1020,200504,29,1020,1187634,5442540,ARKANSAS,5,2005,April,Hail,C,145,WHITE,LZK,29-APR-05 10:20:00,CST,29-APR-05 10:20:00,0,0,0,0,,,TRAINED SPOTTER,0.75,,,,,,,,,,,,,SEARCY,,,SEARCY,35.25,-91.75,35.25,-91.75,,,PDS
200504,29,1026,200504,29,1026,1187634,5442541,ARKANSAS,5,2005,April,Hail,C,145,WHITE,LZK,29-APR-05 10:26:00,CST,29-APR-05 10:26:00,0,0,0,0,,,TRAINED SPOTTER,1.00,,,,,,,,,,,,,SEARCY,,,SEARCY,35.25,-91.75,35.25,-91.75,,,PDS
200504,29,1030,200504,29,1030,1187634,5442542,ARKANSAS,5,2005,April,Hail,C,145,WHITE,LZK,29-APR-05 10:30:00,CST,29-APR-05 10:30:00,0,0,0,0,,,TRAINED SPOTTER,0.75,,,,,,,,,,,,,SEARCY,,,SEARCY,35.25,-91.75,35.25,-91.75,,,PDS
