BEGIN_YEARMONTH,BEGIN_DAY,BEGIN_TIME,END_YEARMONTH,END_DAY,END_TIME,EPISODE_ID,EVENT_ID,STATE,STATE_FIPS,YEAR,MONTH_NAME,EVENT_TYPE,CZ_TYPE,CZ_FIPS,CZ_NAME,WFO,BEGIN_DATE_TIME,CZ_TIMEZONE,END_DATE_TIME,INJURIES_DIRECT,INJURIES_INDIRECT,DEATHS_DIRECT,DEATHS_INDIRECT,DAMAGE_PROPERTY,DAMAGE_CROPS,SOURCE,MAGNITUDE,MAGNITUDE_TYPE,FLOOD_CAUSE,CATEGORY,TOR_F_SCALE,TOR_LENGTH,TOR_WIDTH,TOR_OTHER_WFO,TOR_OTHER_CZ_STATE,TOR_OTHER_CZ_FIPS,TOR_OTHER_CZ_NAME,BEGIN_RANGE,BEGIN_AZIMUTH,BEGIN_LOCATION,END_RANGE,END_AZIMUTH,END_LOCATION,BEGIN_LAT,BEGIN_LON,END_LAT,END_LON,EPISODE_NARRATIVE,EVENT_NARRATIVE,DATA_SOURCE
200011,9,1630,200011,9,1635,1104377,5160066,INDIANA,18,2000,November,Thunderstorm Wind,C,115,OHIO,ILN,09-NOV-00 16:30:00,EST,09-NOV-00 16:35:00,0,0,0,0,5K,,LAW ENFORCEMENT,50,E,,,,,,,,,,,,RISING SUN,,,RISING SUN,38.95,-84.86667,38.95,-84.86667,,Numerous trees knocked down by thunderstorm winds.,PDC
200011,9,1635,200011,9,1650,1104377,5160067,INDIANA,18,2000,November,Thunderstorm Wind,C,47,FRANKLIN,ILN,09-NOV-00 16:35:00,EST,09-NOV-00 16:50:00,0,0,0,0,5K,,LAW ENFORCEMENT,50,E,,,,,,,,,,,,COUNTYWIDE,,,COUNTYWIDE,39.4,-85,39.4,-85,,Trees knocked down by thunderstorm winds.,PDC
200011,9,1650,200011,9,1655,1104377,5160068,INDIANA,18,2000,November,Thunderstorm Wind,C,41,FAYETTE,ILN,09-NOV-00 16:50:00,EST,09-NOV-00 16:55:00,0,0,0,0,5K,,LAW ENFORCEMENT,50,E,,,,,,,,,,10,NW,CONNERSVILLE,10,NW,CONNERSVILLE,39.75,-85.26667,39.75,-85.26667,,Numerous trees and power lines knocked down.,PDC
200011,9,1725,200011,9,1730,1104377,5160069,INDIANA,18,2000,November,Thunderstorm Wind,C,161,UNION,ILN,09-NOV-00 17:25:00,EST,09-NOV-00 17:30:00,0,0,0,0,5K,,LAW ENFORCEMENT,50,E,,,,,,,,,,,,WITTS STATION,,,WITTS STATION,39.71667,-84.86667,39.71667,-84.86667,,Trees were knocked down by thunderstorm winds.,PDC
200012,16,1800,200012,16,2300,1105324,5166208,INDIANA,18,2000,December,Heavy Snow,Z,81,GIBSON,PAH,16-DEC-00 18:00:00,CST,16-DEC-00 23:00:00,0,0,0,0,,,GENERAL PUBLIC,,,,,,,,,,,,,,,,,,,,,,"A mix of very light rain and snow during the afternoon changed to a steady snow early in the evening. The snow accumulated anywhere from 2 to 3 inches across southwest Indiana. The snow ended around midnight. The snow was caused by a strong upper level disturbance that tracked southeast to the Missouri Bootheel, then east along the Tennessee/Kentucky border.",,PDC
200012,13,1000,200012,14,0,1104750,5160482,INDIANA,18,2000,December,Heavy Snow,Z,37,BOONE,IND,13-DEC-00 10:00:00,EST,14-DEC-00 00:00:00,0,0,0,0,,,LAW ENFORCEMENT,,,,,,,,,,,,,,,,,,,,,,A strong upper level system tracked along the Ohio River during the evening of December 13. Strong lift and deep moisture allowed for a widespread heavy snow event across Central Indiana. The accumulating snow began during the late morning of December 13 and continued through about midnight before the activity tapered off to flurries in the early morning hours of December 14. The snowfall was rather uniform with 6 to 7 inch totals common.,,PDC
200009,20,1605,200009,20,1625,1103178,5157092,INDIANA,18,2000,September,Thunderstorm Wind,C,161,UNION,ILN,20-SEP-00 16:05:00,EST,20-SEP-00 16:25:00,0,0,0,0,5K,,LAW ENFORCEMENT,50,E,,,,,,,,,,,,COUNTYWIDE,,,COUNTYWIDE,39.63333,-84.93333,39.63333,-84.93333,,Trees knocked down in several locations across the county.,PDC
200009,20,1540,200009,20,1615,1103178,5157093,INDIANA,18,2000,September,Thunderstorm Wind,C,41,FAYETTE,ILN,20-SEP-00 15:40:00,EST,20-SEP-00 16:15:00,0,0,0,0,5K,,LAW ENFORCEMENT,50,E,,,,,,,,,,,,COUNTYWIDE,,,COUNTYWIDE,39.65,-85.16667,39.65,-85.16667,,Trees knocked down across the county.,PDC
200009,20,1545,200009,20,1625,1103178,5157094,INDIANA,18,2000,September,Thunderstorm Wind,C,177,WAYNE,ILN,20-SEP-00 15:45:00,EST,20-SEP-00 16:25:00,0,0,0,0,5K,,LAW ENFORCEMENT,50,E,,,,,,,,,,,,COUNTYWIDE,,,COUNTYWIDE,39.86667,-85.01667,39.86667,-85.01667,,Trees downed across the county.,PDC
200009,20,1605,200009,20,1615,1103178,5157095,INDIANA,18,2000,September,Thunderstorm Wind,C,47,FRANKLIN,ILN,20-SEP-00 16:05:00,EST,20-SEP-00 16:15:00,0,0,0,0,5K,,LAW ENFORCEMENT,50,E,,,,,,,,,,,,LAUREL,,,LAUREL,39.5,-85.18333,39.5,-85.18333,,Trees were knocked down by thunderstorm winds.,PDC
200012,13,1000,200012,14,0,1104750,5160483,INDIANA,18,2000,December,Heavy Snow,Z,63,BROWN,IND,13-DEC-00 10:00:00,EST,14-DEC-00 00:00:00,0,0,0,0,,,LAW ENFORCEMENT,,,,,,,,,,,,,,,,,,,,,,A strong upper level system tracked along the Ohio River during the evening of December 13. Strong lift and deep moisture allowed for a widespread heavy snow event across Central Indiana. The accumulating snow began during the late morning of December 13 and continued through about midnight before the activity tapered off to flurries in the early morning hours of December 14. The snowfall was rather uniform with 6 to 7 inch totals common.,,PDC
200012,13,900,200012,13,2300,1104750,5160484,INDIANA,18,2000,December,Heavy Snow,Z,52,CLAY,IND,13-DEC-00 09:00:00,EST,13-DEC-00 23:00:00,0,0,0,0,,,LAW ENFORCEMENT,,,,,,,,,,,,,,,,,,,,,,A strong upper level system tracked along the Ohio River during the evening of December 13. Strong lift and deep moisture allowed for a widespread heavy snow event across Central Indiana. The accumulating snow began during the late morning of December 13 and continued through about midnight before the activity tapered off to flurries in the early morning hours of December 14. The snowfall was rather uniform with 6 to 7 inch totals common.,,PDC
200008,6,1700,200008,6,1730,1100838,5156010,INDIANA,18,2000,August,Lightning,C,127,PORTER,LOT,06-AUG-00 17:00:00,CST,06-AUG-00 17:30:00,0,0,0,0,,,EMERGENCY MANAGER,,,,,,,,,,,,,,COUNTYWIDE,,,COUNTYWIDE,,,,,"Severe Thunderstorms, which originally developed in central Illinois during early afternoon, continued moving eastward through far northwest Indiana. Porter county received widespread tree damage, downed power lines, and property damage to several homes. During the storm an individual at the Indiana Dunes State Park had to be rushed to a nearby hospital after being injured when a tree fell. Flash flooding occurred in the community of South Haven, and at one point over half of the county was without electrical power.  Throughout the county two homes were damaged by falling trees and three homes caught fire when struck by lightning.",,PDC
200012,11,2000,200012,12,600,1104831,5159156,INDIANA,18,2000,December,High Wind,Z,74,DEARBORN,ILN,11-DEC-00 20:00:00,EST,12-DEC-00 06:00:00,0,0,0,0,100K,,LAW ENFORCEMENT,56,M,,,,,,,,,,,,,,,,,,,,"A strong low pressure system pushed a sharp cold front through the region dropping temperatures by around 30 degrees.  Strong winds occurred with the front and continued for several hours after the frontal passage.  The highest measured wind gust was 66 mph in Franklin county. Numerous trees and power lines were knocked down across the region.  Also, a grain bin was blown over onto a road.",,PDC
200012,11,2000,200012,12,600,1104831,5159157,INDIANA,18,2000,December,High Wind,Z,58,FAYETTE,ILN,11-DEC-00 20:00:00,EST,12-DEC-00 06:00:00,0,0,0,0,,,LAW ENFORCEMENT,56,M,,,,,,,,,,,,,,,,,,,,"A strong low pressure system pushed a sharp cold front through the region dropping temperatures by around 30 degrees.  Strong winds occurred with the front and continued for several hours after the frontal passage.  The highest measured wind gust was 66 mph in Franklin county. Numerous trees and power lines were knocked down across the region.  Also, a grain bin was blown over onto a road.",,PDC
200010,22,100,200010,22,900,1103548,5174523,INDIANA,18,2000,October,Dense Fog,Z,87,WARRICK,PAH,22-OCT-00 01:00:00,CST,22-OCT-00 09:00:00,0,0,0,0,,,"AWOS,ASOS,MESONET,ETC",,,,,,,,,,,,,,,,,,,,,,"Widespread dense fog blanketed southwest Indiana during the early morning hours. Visibility was less than a quarter mile in many areas, including the official observations from Evansville Airport.",,PDC
200009,20,1836,200009,20,1836,1103120,5175213,INDIANA,18,2000,September,Thunderstorm Wind,C,61,HARRISON,LMK,20-SEP-00 18:36:00,EST,20-SEP-00 18:36:00,0,0,0,0,,,LAW ENFORCEMENT,60,E,,,,,,,,,,,,DOGWOOD,,,DOGWOOD,38.1,-86.08333,38.1,-86.08333,Trees and power lines were downed over much of South Central Indiana due to thunderstorm winds.,,PDC
200010,5,600,200010,5,1030,1103574,5174475,INDIANA,18,2000,October,Flood,C,13,BROWN,IND,05-OCT-00 06:00:00,EST,05-OCT-00 10:30:00,0,0,0,0,,,NEWSPAPER,,,,,,,,,,,,,,COUNTYWIDE,,,COUNTYWIDE,,,,,Heavy rain of 2 to 5 inches caused widespread flash flooding across parts of central Indiana with numerous roads water covered especially adjacent to small streams.,,PDC
200010,5,600,200010,5,1030,1103574,5174476,INDIANA,18,2000,October,Flash Flood,C,81,JOHNSON,IND,05-OCT-00 06:00:00,EST,05-OCT-00 10:30:00,0,0,0,0,,,NEWSPAPER,,,,,,,,,,,,,,COUNTYWIDE,,,COUNTYWIDE,,,,,Heavy rain of 2 to 5 inches caused widespread flash flooding across parts of central Indiana with numerous roads water covered especially adjacent to small streams.,,PDC
200008,9,737,200008,9,739,1099638,5176546,INDIANA,18,2000,August,Thunderstorm Wind,C,57,HAMILTON,IND,09-AUG-00 07:37:00,EST,09-AUG-00 07:39:00,0,0,0,0,,,EMERGENCY MANAGER,50,E,,,,,,,,,,,,NOBLESVILLE,,,NOBLESVILLE,40.05,-86.01667,40.05,-86.01667,A line of thunderstorms knocked down numerous trees across east central Indiana. 5 cars were heavily damaged and two roofs were blown off businesses in Muncie.,,PDC
200008,6,1810,200008,6,1810,1099672,5175694,INDIANA,18,2000,August,Thunderstorm Wind,C,149,STARKE,IWX,06-AUG-00 18:10:00,EST,06-AUG-00 18:10:00,0,0,0,0,0,,LAW ENFORCEMENT,,,,,,,,,,,,,,STARKE CO ARPT,,,STARKE CO ARPT,41.28333,-86.63333,41.28333,-86.63333,"Synoptic and mesoscale conditions for August 6th...A significant shortwave trough of low pressure combined with a mid level speed max of 60 knots and rapid prefrontal destabilization during the day of August 6th ahead of a strong cold front led to convective initiation across eastern Iowa by late morning.  Given favorable deep layer shear of 50 knots and extreme instability present from Northern Illinois into Northwest Ohio that afternoon... storms quickly organized into a bow echo squall line as they rapidly moved eastward at speeds of up to 50 knots.  As the bow echo matured... dramatic yet elevated rear inflow jet developed along the backside with isolated wind damage along and west of a Elkhart to Wabash line.  However, with time the rear inflow jet descended causing widespread wind damage across Whitley, Noble and Allen counties.",Trees down.,PDC
200010,5,600,200010,5,900,1103574,5175104,INDIANA,18,2000,October,Flash Flood,C,153,SULLIVAN,IND,05-OCT-00 06:00:00,EST,05-OCT-00 09:00:00,0,0,0,0,,,LAW ENFORCEMENT,,,,,,,,,,,,,,COUNTYWIDE,,,COUNTYWIDE,,,,,Heavy rain of 2 to 5 inches caused widespread flash flooding across parts of central Indiana with numerous roads water covered especially adjacent to small streams.,,PDC
200010,3,2230,200010,3,2230,1103001,5174778,INDIANA,18,2000,October,Thunderstorm Wind,C,39,ELKHART,IWX,03-OCT-00 22:30:00,EST,03-OCT-00 22:30:00,0,0,0,0,50K,,NEWSPAPER,,,,,,,,,,,,,,COUNTYWIDE,,,COUNTYWIDE,41.6,-85.88333,41.6,-85.88333,,Scattered trees were blown down across the county. A large tree fell onto a car in Goshen heavily damaging it. Another large tree was downed across C.R. 12 blocking both lanes of travel. Two Stone Lake residences suffered major structural damage to their homes when a 150 foot Oak tree was felled in the storm.  The first house had its roof smashed by a large limb while the second house had its entire back wall cave in when the rest of the tree fell onto it.,PDC
200010,5,600,200010,5,900,1103574,5175105,INDIANA,18,2000,October,Flash Flood,C,55,GREENE,IND,05-OCT-00 06:00:00,EST,05-OCT-00 09:00:00,0,0,0,0,,,LAW ENFORCEMENT,,,,,,,,,,,,,,COUNTYWIDE,,,COUNTYWIDE,,,,,Heavy rain of 2 to 5 inches caused widespread flash flooding across parts of central Indiana with numerous roads water covered especially adjacent to small streams.,,PDC
200010,5,600,200010,5,900,1103574,5175106,INDIANA,18,2000,October,Flood,C,145,SHELBY,IND,05-OCT-00 06:00:00,EST,05-OCT-00 09:00:00,0,0,0,0,,,NEWSPAPER,,,,,,,,,,,,,,COUNTYWIDE,,,COUNTYWIDE,,,,,Heavy rain of 2 to 5 inches caused widespread flash flooding across parts of central Indiana with numerous roads water covered especially adjacent to small streams.,,PDC
200010,5,600,200010,5,900,1103574,5175107,INDIANA,18,2000,October,Flood,C,31,DECATUR,IND,05-OCT-00 06:00:00,EST,05-OCT-00 09:00:00,0,0,0,0,,,NEWSPAPER,,,,,,,,,,,,,,COUNTYWIDE,,,COUNTYWIDE,,,,,Heavy rain of 2 to 5 inches caused widespread flash flooding across parts of central Indiana with numerous roads water covered especially adjacent to small streams.,,PDC
200008,23,730,200008,23,730,1099644,5176075,INDIANA,18,2000,August,Lightning,C,81,JOHNSON,IND,23-AUG-00 07:30:00,EST,23-AUG-00 07:30:00,0,0,0,0,60K,,NEWSPAPER,,,,,,,,,,,,,,GREENWOOD,,,GREENWOOD,,,,,A home was severly damaged after being struck by lightning.,,PDC
200008,2,1853,200008,2,1927,1099645,5176076,INDIANA,18,2000,August,Lightning,C,57,HAMILTON,IND,02-AUG-00 18:53:00,EST,02-AUG-00 19:27:00,0,0,0,0,81K,,NEWSPAPER,,,,,,,,,,,,,,CARMEL,,,CARMEL,,,,,3 separate homes in the Carmel area sustained lightning strikes and subsequent damage.,,PDC
200010,5,850,200010,5,1030,1103574,5175103,INDIANA,18,2000,October,Flash Flood,C,167,VIGO,IND,05-OCT-00 08:50:00,EST,05-OCT-00 10:30:00,0,0,0,0,,,LAW ENFORCEMENT,,,,,,,,,,,,,,COUNTYWIDE,,,COUNTYWIDE,,,,,Heavy rain of 2 to 5 inches caused widespread flash flooding across parts of central Indiana with numerous roads water covered especially adjacent to small streams.,,PDC
200010,22,100,200010,22,900,1103548,5174518,INDIANA,18,2000,October,Dense Fog,Z,81,GIBSON,PAH,22-OCT-00 01:00:00,CST,22-OCT-00 09:00:00,0,0,0,0,,,"AWOS,ASOS,MESONET,ETC",,,,,,,,,,,,,,,,,,,,,,"Widespread dense fog blanketed southwest Indiana during the early morning hours. Visibility was less than a quarter mile in many areas, including the official observations from Evansville Airport.",,PDC
200010,22,100,200010,22,900,1103548,5174519,INDIANA,18,2000,October,Dense Fog,Z,82,PIKE,PAH,22-OCT-00 01:00:00,CST,22-OCT-00 09:00:00,0,0,0,0,,,"AWOS,ASOS,MESONET,ETC",,,,,,,,,,,,,,,,,,,,,,"Widespread dense fog blanketed southwest Indiana during the early morning hours. Visibility was less than a quarter mile in many areas, including the official observations from Evansville Airport.",,PDC
200010,22,100,200010,22,900,1103548,5174520,INDIANA,18,2000,October,Dense Fog,Z,85,POSEY,PAH,22-OCT-00 01:00:00,CST,22-OCT-00 09:00:00,0,0,0,0,,,"AWOS,ASOS,MESONET,ETC",,,,,,,,,,,,,,,,,,,,,,"Widespread dense fog blanketed southwest Indiana during the early morning hours. Visibility was less than a quarter mile in many areas, including the official observations from Evansville Airport.",,PDC
200010,22,100,200010,22,900,1103548,5174521,INDIANA,18,2000,October,Dense Fog,Z,88,SPENCER,PAH,22-OCT-00 01:00:00,CST,22-OCT-00 09:00:00,0,0,0,0,,,"AWOS,ASOS,MESONET,ETC",,,,,,,,,,,,,,,,,,,,,,"Widespread dense fog blanketed southwest Indiana during the early morning hours. Visibility was less than a quarter mile in many areas, including the official observations from Evansville Airport.",,PDC
200010,22,100,200010,22,900,1103548,5174522,INDIANA,18,2000,October,Dense Fog,Z,86,VANDERBURGH,PAH,22-OCT-00 01:00:00,CST,22-OCT-00 09:00:00,0,0,0,0,,,"AWOS,ASOS,MESONET,ETC",,,,,,,,,,,,,,,,,,,,,,"Widespread dense fog blanketed southwest Indiana during the early morning hours. Visibility was less than a quarter mile in many areas, including the official observations from Evansville Airport.",,PDC
200008,23,330,200008,23,336,1099643,5175678,INDIANA,18,2000,August,Thunderstorm Wind,C,95,MADISON,IND,23-AUG-00 03:30:00,EST,23-AUG-00 03:36:00,0,0,0,0,50K,,EMERGENCY MANAGER,60,E,,,,,,,,,,,,ALEXANDRIA,,,ALEXANDRIA,40.26667,-85.66667,40.3,-85.63333,,A Microburst downed numerous trees some on cars and homes.,PDC
200008,6,1857,200008,6,1857,1099672,5175767,INDIANA,18,2000,August,Thunderstorm Wind,C,141,ST. JOSEPH,IWX,06-AUG-00 18:57:00,EST,06-AUG-00 18:57:00,0,0,0,0,0,,LAW ENFORCEMENT,,,,,,,,,,,,2,S,MISHAWAKA,2,S,MISHAWAKA,41.63333,-86.16667,41.63333,-86.16667,"Synoptic and mesoscale conditions for August 6th...A significant shortwave trough of low pressure combined with a mid level speed max of 60 knots and rapid prefrontal destabilization during the day of August 6th ahead of a strong cold front led to convective initiation across eastern Iowa by late morning.  Given favorable deep layer shear of 50 knots and extreme instability present from Northern Illinois into Northwest Ohio that afternoon... storms quickly organized into a bow echo squall line as they rapidly moved eastward at speeds of up to 50 knots.  As the bow echo matured... dramatic yet elevated rear inflow jet developed along the backside with isolated wind damage along and west of a Elkhart to Wabash line.  However, with time the rear inflow jet descended causing widespread wind damage across Whitley, Noble and Allen counties.",Trees down.,PDC
200008,6,1859,200008,6,1859,1099672,5175768,INDIANA,18,2000,August,Thunderstorm Wind,C,103,MIAMI,IWX,06-AUG-00 18:59:00,EST,06-AUG-00 18:59:00,0,0,0,0,0,,LAW ENFORCEMENT,,,,,,,,,,,,2,SW,MACY,2,SW,MACY,40.95,-86.16667,40.95,-86.16667,"Synoptic and mesoscale conditions for August 6th...A significant shortwave trough of low pressure combined with a mid level speed max of 60 knots and rapid prefrontal destabilization during the day of August 6th ahead of a strong cold front led to convective initiation across eastern Iowa by late morning.  Given favorable deep layer shear of 50 knots and extreme instability present from Northern Illinois into Northwest Ohio that afternoon... storms quickly organized into a bow echo squall line as they rapidly moved eastward at speeds of up to 50 knots.  As the bow echo matured... dramatic yet elevated rear inflow jet developed along the backside with isolated wind damage along and west of a Elkhart to Wabash line.  However, with time the rear inflow jet descended causing widespread wind damage across Whitley, Noble and Allen counties.",Large tree limbs down.,PDC
200012,13,1800,200012,14,100,1104751,5166037,INDIANA,18,2000,December,Ice Storm,Z,57,RUSH,IND,13-DEC-00 18:00:00,EST,14-DEC-00 01:00:00,0,0,0,0,,,LAW ENFORCEMENT,,,,,,,,,,,,,,,,,,,,,,A strong upper level system moved along the Ohio River during the evening of December 13. The system produced moderate to heavy snow across South Central Indiana during the morning and afternoon of December 13 before the precipitation changed over to freezing rain during the evening. Law enforcement reported significant ice amounts as much as 1/2 an inch on top of the snow across South Central Indiana.  Power outages were noted across many of these counties.,,PDC
200012,13,1200,200012,14,0,1104433,5162065,INDIANA,18,2000,December,Heavy Snow,Z,34,JAY,IWX,13-DEC-00 12:00:00,EST,14-DEC-00 00:00:00,0,0,0,0,0K,,TRAINED SPOTTER,,,,,,,,,,,,,,,,,,,,,,"...Synoptic and mesoscale conditions for December 13th...Another in a series of strong upper level disturbances coming out of the southern plains combined with an intensifing upper jet over southern Canada led to another bout of heavy snow across part of Indiana and Northwest Ohio on the 13th.  Although the surface low remained quite weak and the upper level system  moved rather quickly... moisture was able to quickly advect northward out of the lower Mississippi valley as the low level jet intensified in response to increasing upper level divergence associated with the strong upper level jet over southern Canada.  Snow developed around noon and quickly became heavy by mid afternoon and continued into late evening before tapering off.  Some notable storm total snowfall reports included 8 inches at Grissom AFB... 7.4 in Young America... 7 in Defiance, Huntington, Monroeville, Portland, Bluffton, and Montpelier, and 6 in Marion, Columbus Grove, Fort Wayne, Hartford City, Monticello, Van Wert, Wabash, Wauseon, and Columbia City.",,PDC
200012,13,800,200012,13,2200,1104750,5165689,INDIANA,18,2000,December,Heavy Snow,Z,51,VIGO,IND,13-DEC-00 08:00:00,EST,13-DEC-00 22:00:00,0,0,0,0,,,LAW ENFORCEMENT,,,,,,,,,,,,,,,,,,,,,,A strong upper level system tracked along the Ohio River during the evening of December 13. Strong lift and deep moisture allowed for a widespread heavy snow event across Central Indiana. The accumulating snow began during the late morning of December 13 and continued through about midnight before the activity tapered off to flurries in the early morning hours of December 14. The snowfall was rather uniform with 6 to 7 inch totals common.,,PDC
200012,13,900,200012,13,2300,1104750,5165690,INDIANA,18,2000,December,Heavy Snow,Z,28,WARREN,IND,13-DEC-00 09:00:00,EST,13-DEC-00 23:00:00,0,0,0,0,,,LAW ENFORCEMENT,,,,,,,,,,,,,,,,,,,,,,A strong upper level system tracked along the Ohio River during the evening of December 13. Strong lift and deep moisture allowed for a widespread heavy snow event across Central Indiana. The accumulating snow began during the late morning of December 13 and continued through about midnight before the activity tapered off to flurries in the early morning hours of December 14. The snowfall was rather uniform with 6 to 7 inch totals common.,,PDC
200012,13,900,200012,13,2300,1104750,5165571,INDIANA,18,2000,December,Heavy Snow,Z,35,FOUNTAIN,IND,13-DEC-00 09:00:00,EST,13-DEC-00 23:00:00,0,0,0,0,,,LAW ENFORCEMENT,,,,,,,,,,,,,,,,,,,,,,A strong upper level system tracked along the Ohio River during the evening of December 13. Strong lift and deep moisture allowed for a widespread heavy snow event across Central Indiana. The accumulating snow began during the late morning of December 13 and continued through about midnight before the activity tapered off to flurries in the early morning hours of December 14. The snowfall was rather uniform with 6 to 7 inch totals common.,,PDC
200012,13,900,200012,13,2300,1104750,5165572,INDIANA,18,2000,December,Heavy Snow,Z,61,GREENE,IND,13-DEC-00 09:00:00,EST,13-DEC-00 23:00:00,0,0,0,0,,,LAW ENFORCEMENT,,,,,,,,,,,,,,,,,,,,,,A strong upper level system tracked along the Ohio River during the evening of December 13. Strong lift and deep moisture allowed for a widespread heavy snow event across Central Indiana. The accumulating snow began during the late morning of December 13 and continued through about midnight before the activity tapered off to flurries in the early morning hours of December 14. The snowfall was rather uniform with 6 to 7 inch totals common.,,PDC
200012,12,1,200012,31,2359,1105328,5165885,INDIANA,18,2000,December,Extreme Cold/Wind Chill,Z,88,SPENCER,PAH,12-DEC-00 00:01:00,CST,31-DEC-00 23:59:00,0,0,0,0,,,"AWOS,ASOS,MESONET,ETC",,,,,,,,,,,,,,,,,,,,,,"An invasion of arctic air occurred on December 12. The arctic air became permanently entrenched over the region for the remainder of the month, resulting in the second coldest December on record at Evansville. The average monthly temperature of 23.6 degrees was 11.6 below normal. On the coldest day of the month, the 22nd, the high was 15 and the low was 2. Unusually high energy prices, combined with the record cold, caused homeless shelters to fill to capacity. The usual problems associated with frigid temperatures, such as frozen pipes and water main breaks, were common during the latter half of the month.",,PDC
200012,12,100,200012,12,1200,1104754,5166130,INDIANA,18,2000,December,Flood,Z,53,OWEN,IND,12-DEC-00 01:00:00,EST,12-DEC-00 12:00:00,0,0,0,0,,,OFFICIAL NWS OBS.,,,,,,,,,,,,,,,,,,,,,,,Minor flooding was reported along Mill Creek at Cataract. The creek crested at 10.81 feet (flood stage is 10 feet) on December 12 at 5 am.,PDC
200012,16,1900,200012,17,700,1104755,5166131,INDIANA,18,2000,December,Flood,Z,53,OWEN,IND,16-DEC-00 19:00:00,EST,17-DEC-00 07:00:00,0,0,0,0,,,OFFICIAL NWS OBS.,,,,,,,,,,,,,,,,,,,,,,,Minor flooding was reported along Mill Creek at Cataract. The creek crested at 10.84 feet (flood stage is 10 feet) on December 17 at 1 am. A few county roads were water covered and there was minor flooding of agricultural bottomland.,PDC
200012,13,1000,200012,14,0,1104750,5165687,INDIANA,18,2000,December,Heavy Snow,Z,38,TIPTON,IND,13-DEC-00 10:00:00,EST,14-DEC-00 00:00:00,0,0,0,0,,,LAW ENFORCEMENT,,,,,,,,,,,,,,,,,,,,,,A strong upper level system tracked along the Ohio River during the evening of December 13. Strong lift and deep moisture allowed for a widespread heavy snow event across Central Indiana. The accumulating snow began during the late morning of December 13 and continued through about midnight before the activity tapered off to flurries in the early morning hours of December 14. The snowfall was rather uniform with 6 to 7 inch totals common.,,PDC
200012,13,800,200012,13,2300,1104750,5165677,INDIANA,18,2000,December,Heavy Snow,Z,67,KNOX,IND,13-DEC-00 08:00:00,EST,13-DEC-00 23:00:00,0,0,0,0,,,LAW ENFORCEMENT,,,,,,,,,,,,,,,,,,,,,,A strong upper level system tracked along the Ohio River during the evening of December 13. Strong lift and deep moisture allowed for a widespread heavy snow event across Central Indiana. The accumulating snow began during the late morning of December 13 and continued through about midnight before the activity tapered off to flurries in the early morning hours of December 14. The snowfall was rather uniform with 6 to 7 inch totals common.,,PDC
200012,16,1800,200012,16,2300,1105324,5166325,INDIANA,18,2000,December,Heavy Snow,Z,85,POSEY,PAH,16-DEC-00 18:00:00,CST,16-DEC-00 23:00:00,0,0,0,0,,,GENERAL PUBLIC,,,,,,,,,,,,,,,,,,,,,,"A mix of very light rain and snow during the afternoon changed to a steady snow early in the evening. The snow accumulated anywhere from 2 to 3 inches across southwest Indiana. The snow ended around midnight. The snow was caused by a strong upper level disturbance that tracked southeast to the Missouri Bootheel, then east along the Tennessee/Kentucky border.",,PDC
