BEGIN_YEARMONTH,BEGIN_DAY,BEGIN_TIME,END_YEARMONTH,END_DAY,END_TIME,EPISODE_ID,EVENT_ID,STATE,STATE_FIPS,YEAR,MONTH_NAME,EVENT_TYPE,CZ_TYPE,CZ_FIPS,CZ_NAME,WFO,BEGIN_DATE_TIME,CZ_TIMEZONE,END_DATE_TIME,INJURIES_DIRECT,INJURIES_INDIRECT,DEATHS_DIRECT,DEATHS_INDIRECT,DAMAGE_PROPERTY,DAMAGE_CROPS,SOURCE,MAGNITUDE,MAGNITUDE_TYPE,FLOOD_CAUSE,CATEGORY,TOR_F_SCALE,TOR_LENGTH,TOR_WIDTH,TOR_OTHER_WFO,TOR_OTHER_CZ_STATE,TOR_OTHER_CZ_FIPS,TOR_OTHER_CZ_NAME,BEGIN_RANGE,BEGIN_AZIMUTH,BEGIN_LOCATION,END_RANGE,END_AZIMUTH,END_LOCATION,BEGIN_LAT,BEGIN_LON,END_LAT,END_LON,EPISODE_NARRATIVE,EVENT_NARRATIVE,DATA_SOURCE
200511,7,1400,200511,8,700,1201022,5481373,CALIFORNIA,6,2005,November,Heavy Snow,Z,85,MODOC COUNTY,MFR,07-NOV-05 14:00:00,PST,08-NOV-05 07:00:00,0,0,0,0,,,TRAINED SPOTTER,,,,,,,,,,,,,,,,,,,,,,"A Heavy Snow Warning was issued for California zone CAZ082 at 07/1205 PST, effective until 08/0600 PST.  The warning was cancelled at 08/0402 PST.  The warning verified for that zone, but it also verified in zone CAZ080/084/085, where only a snow advisory was in effect.",Spotter MO33 at 4360 feet recorded 13 inches of snow in 17 hours.  Also reported widespread power outages due to line breaks caused by heavy wet snow.  Power was out 23 hours at the spotter's house.,PDS
200510,17,1647,200510,17,2045,1199840,5479182,CALIFORNIA,6,2005,October,Flash Flood,C,29,KERN,HNX,17-OCT-05 16:47:00,PST,17-OCT-05 20:45:00,0,0,0,0,75K,,TRAINED SPOTTER,,,,,,,,,,,,,,FRAZIER PARK,,,FRAZIER PARK,34.81667,-118.95,34.81667,-118.95,Weak low pressure off the Southern California Coast entrained tropical moisture that resulted numerous rainfall report of 2.5 to 3 inches of rain in the Kern County Mountains around Frazier Park from the evening of the 17th into the morning of the 18th. Numerous locations around Kern County had flooding but especially hard-hit was the Frazier Park area with flooded homes leading to the evacuation of at least 20 people and mudslides along the northbound portions of Interstate Highway-5. Cuddy Creek through Frazier Park overflowed putting more than a foot of water and mud over the roadway at several locations with reports of the 4-foot deep water in the northern portions of the community.,,PDS
200511,27,35,200511,29,630,1201381,5480412,CALIFORNIA,6,2005,November,Winter Storm,Z,68,X SE SHASTA/X E TEHAMA/W PLUMAS T X SW,STO,27-NOV-05 00:35:00,PST,29-NOV-05 06:30:00,0,0,0,0,,,"AWOS,ASOS,MESONET,ETC",,,,,,,,,,,,,,,,,,,,,,"A cold winter storm with low snow levels.  In the Northern Sacramento Valley, snow fell down to near 1500 feet and left measurable amounts in the northern Redding metro area.",,PDS
200511,27,35,200511,29,630,1201381,5480413,CALIFORNIA,6,2005,November,Winter Storm,Z,69,W SIERRA T X W/C NEVADA/C PLACER/C EL DORADO/E AMADOR/NE CALAVERAS/C & NE TUOLUMNE/SW ALPINE,STO,27-NOV-05 00:35:00,PST,29-NOV-05 06:30:00,0,0,0,0,,,"AWOS,ASOS,MESONET,ETC",,,,,,,,,,,,,,,,,,,,,,"A cold winter storm with low snow levels.  In the Northern Sacramento Valley, snow fell down to near 1500 feet and left measurable amounts in the northern Redding metro area.",,PDS
200511,3,600,200511,4,530,1201382,5480414,CALIFORNIA,6,2005,November,Winter Storm,Z,68,X SE SHASTA/X E TEHAMA/W PLUMAS T X SW,STO,03-NOV-05 06:00:00,PST,04-NOV-05 05:30:00,0,0,0,0,,,"AWOS,ASOS,MESONET,ETC",,,,,,,,,,,,,,,,,,,,,,A weak winter storm.  The heaviest snowfall was above 7000 feet.,,PDS
200511,3,600,200511,4,530,1201382,5480415,CALIFORNIA,6,2005,November,Winter Storm,Z,69,W SIERRA T X W/C NEVADA/C PLACER/C EL DORADO/E AMADOR/NE CALAVERAS/C & NE TUOLUMNE/SW ALPINE,STO,03-NOV-05 06:00:00,PST,04-NOV-05 05:30:00,0,0,0,0,,,"AWOS,ASOS,MESONET,ETC",,,,,,,,,,,,,,,,,,,,,,A weak winter storm.  The heaviest snowfall was above 7000 feet.,,PDS
200510,17,1955,200510,17,2045,1199841,5479186,CALIFORNIA,6,2005,October,Flash Flood,C,29,KERN,HNX,17-OCT-05 19:55:00,PST,17-OCT-05 20:45:00,0,0,0,0,,,LAW ENFORCEMENT,,,,,,,,,,,,,,ROSAMOND,,,ROSAMOND,34.86667,-118.16667,34.95,-118.16667,"Heavy rainfall resulted in substantial water runoff onto the Southeast Kern Desert areas during the evening hours of the 17th. State Highway 14 was impacted by water and mud over the roadways as well as upstream, smaller roadways. Rainfall amounts reported in the Kern Desert included 2.37"" and 2.55"" around Rosamond, 1.83"" at Boron, and 1.16"" at Mojave.",,PDS
200511,7,1700,200511,8,1000,1201380,5480405,CALIFORNIA,6,2005,November,Winter Storm,Z,68,X SE SHASTA/X E TEHAMA/W PLUMAS T X SW,STO,07-NOV-05 17:00:00,PST,08-NOV-05 10:00:00,0,0,0,0,,,"AWOS,ASOS,MESONET,ETC",,,,,,,,,,,,,,,,,,,,,,A moderate winter storm.  Snow levels were 4000 to 5500 feet and snow amounts up to eighteen inches in the higher elevations.,,PDS
200511,7,1700,200511,8,1000,1201380,5480406,CALIFORNIA,6,2005,November,Winter Storm,Z,69,W SIERRA T X W/C NEVADA/C PLACER/C EL DORADO/E AMADOR/NE CALAVERAS/C & NE TUOLUMNE/SW ALPINE,STO,07-NOV-05 17:00:00,PST,08-NOV-05 10:00:00,0,0,0,0,,,"AWOS,ASOS,MESONET,ETC",,,,,,,,,,,,,,,,,,,,,,A moderate winter storm.  Snow levels were 4000 to 5500 feet and snow amounts up to eighteen inches in the higher elevations.,,PDS
200510,18,517,200510,18,930,1199842,5479188,CALIFORNIA,6,2005,October,Flash Flood,C,29,KERN,HNX,18-OCT-05 05:17:00,PST,18-OCT-05 09:30:00,0,0,0,0,,,LAW ENFORCEMENT,,,,,,,,,,,,1,N,CANTIL,1,N,CANTIL,35.31667,-117.96667,35.31667,-117.96667,"Heavy rainfall in the Kern County Mountains and Deserts led to flooding on the 17th and early on the 18th. On the Kern Desert Floor normally dry streams flash flooded affecting areas north of California City, including State Highway 14 near the intersection with Redrock-Randsburg Road.",,PDS
200510,24,2027,200510,24,2027,1199843,5479189,CALIFORNIA,6,2005,October,Lightning,C,19,FRESNO,HNX,24-OCT-05 20:27:00,PST,24-OCT-05 20:27:00,0,0,0,0,,,TRAINED SPOTTER,,,,,,,,,,,,,,(FAT) AIR TERMINAL,,,(FAT) AIR TERMINAL,,,,,,Local thunderstorm activity resulted in lightning in and around the Fresno Air Terminal during the evening of the 24th.,PDS
200510,17,1500,200510,18,100,1199844,5479190,CALIFORNIA,6,2005,October,Heavy Rain,C,29,KERN,HNX,17-OCT-05 15:00:00,PST,18-OCT-05 01:00:00,0,0,0,0,,,TRAINED SPOTTER,,,,,,,,,,,,15,N,TEHACHAPI,15,N,TEHACHAPI,,,,,"Numerous locations in Kern County reported locally heavy rain that not only led to the documented flash flooding but also minor flooding at other locations. The Cummings Valley in the Tehachapi Mountains experienced minor flooding by the late evening of the 17th as well as Taft on the Southern San Joaquin Valley Floor by 2305 hours PDT. Bear Valley Springs had 2.31"" and Tehachapi 1.25"" in the Tehachapi Mountains while the Piute Forest Service RAWS reported 2.31"" of rain for the event in the Southern Sierra Nevada.",,PDS
200510,18,419,200510,18,930,1199842,5479187,CALIFORNIA,6,2005,October,Flash Flood,C,29,KERN,HNX,18-OCT-05 04:19:00,PST,18-OCT-05 09:30:00,0,0,0,0,,,LAW ENFORCEMENT,,,,,,,,,,,,4,NNE,CALIF CITY AIRPORT,4,NNE,CALIF CITY AIRPORT,35.2,-117.98333,35.2,-117.98333,"Heavy rainfall in the Kern County Mountains and Deserts led to flooding on the 17th and early on the 18th. On the Kern Desert Floor normally dry streams flash flooded affecting areas north of California City, including State Highway 14 near the intersection with Redrock-Randsburg Road.",,PDS
200511,28,636,200511,28,1836,1201027,5481481,CALIFORNIA,6,2005,November,Heavy Snow,Z,82,SOUTH CENTRAL SISKIYOU COUNTY,MFR,28-NOV-05 06:36:00,PST,28-NOV-05 18:36:00,0,0,0,0,,,TRAINED SPOTTER,,,,,,,,,,,,,,,,,,,,,,"A Winter Storm Warning was issued for California zones CAZ080/082 at 28/0856 PST, effective until 28/2000 PST.  It expired at 28/2000 PST.  The above observation verified the warning in zone CAZ082.",Spotter SY44 3 SSE Mount Shasta at 3450 feet recorded 12 inches of snow in 12 hours.,PDS
200511,2,847,200511,2,847,1201004,5481210,CALIFORNIA,6,2005,November,High Wind,Z,73,MONO,REV,02-NOV-05 08:47:00,PST,02-NOV-05 08:47:00,0,0,0,0,,,"AWOS,ASOS,MESONET,ETC",54,MG,,,,,,,,,,,,,,,,,,,,,A 54 kt (62 mph) wind gust was reported at the Walker RAWS sensor.,PDS
200511,2,1347,200511,2,1347,1201005,5481211,CALIFORNIA,6,2005,November,High Wind,Z,73,MONO,REV,02-NOV-05 13:47:00,PST,02-NOV-05 13:47:00,0,0,0,0,,,"AWOS,ASOS,MESONET,ETC",60,MG,,,,,,,,,,,,,,,,,,,,,A 60 kt (69 mph) wind gust was reported at the Walker RAWS sensor.,PDS
200509,20,308,200509,20,2000,1198474,5475534,CALIFORNIA,6,2005,September,Wildfire,Z,94,TULARE CTY FOOTHILLS,HNX,20-SEP-05 03:08:00,PST,20-SEP-05 20:00:00,0,0,0,0,,,NEWSPAPER,,,,,,,,,,,,,,,,,,,,,,A lightning caused fire burned 300 acres northeast of Woodlake during the early morning hours of the 20th.,,PDS
200510,24,1915,200510,25,400,1199837,5479175,CALIFORNIA,6,2005,October,Lightning,C,19,FRESNO,HNX,24-OCT-05 19:15:00,PST,25-OCT-05 04:00:00,0,0,0,0,,,OFFICIAL NWS OBS.,,,,,,,,,,,,,,COUNTYWIDE,,,COUNTYWIDE,,,,,"An upper air disturbance moving inland over South-Central California developed evening thunderstorms on the 24th and brought widespread lightning over portions of Kings, Tulare, Fresno, Madera, and Mariposa Counties. While the South San Joaquin Valley lightning diminished just before 2200 PST, numerous lightning strikes were noted until just before dawn in the foothill and mountain locations of Mariposa, Madera, Fresno, and especially Tulare Counties. Brief, locally heavy thundershowers accompanied the lightning. Yosemite reported 0.41"" of rain in one such thundershower.",,PDS
200510,24,1930,200510,25,300,1199837,5479176,CALIFORNIA,6,2005,October,Lightning,C,39,MADERA,HNX,24-OCT-05 19:30:00,PST,25-OCT-05 03:00:00,0,0,0,0,,,OFFICIAL NWS OBS.,,,,,,,,,,,,,,COUNTYWIDE,,,COUNTYWIDE,,,,,"An upper air disturbance moving inland over South-Central California developed evening thunderstorms on the 24th and brought widespread lightning over portions of Kings, Tulare, Fresno, Madera, and Mariposa Counties. While the South San Joaquin Valley lightning diminished just before 2200 PST, numerous lightning strikes were noted until just before dawn in the foothill and mountain locations of Mariposa, Madera, Fresno, and especially Tulare Counties. Brief, locally heavy thundershowers accompanied the lightning. Yosemite reported 0.41"" of rain in one such thundershower.",,PDS
200510,24,1930,200510,25,300,1199837,5479177,CALIFORNIA,6,2005,October,Lightning,C,43,MARIPOSA,HNX,24-OCT-05 19:30:00,PST,25-OCT-05 03:00:00,0,0,0,0,,,OFFICIAL NWS OBS.,,,,,,,,,,,,,,COUNTYWIDE,,,COUNTYWIDE,,,,,"An upper air disturbance moving inland over South-Central California developed evening thunderstorms on the 24th and brought widespread lightning over portions of Kings, Tulare, Fresno, Madera, and Mariposa Counties. While the South San Joaquin Valley lightning diminished just before 2200 PST, numerous lightning strikes were noted until just before dawn in the foothill and mountain locations of Mariposa, Madera, Fresno, and especially Tulare Counties. Brief, locally heavy thundershowers accompanied the lightning. Yosemite reported 0.41"" of rain in one such thundershower.",,PDS
200510,3,1510,200510,3,2010,1199838,5479178,CALIFORNIA,6,2005,October,Strong Wind,Z,95,KERN CTY MTNS,HNX,03-OCT-05 15:10:00,PST,03-OCT-05 20:10:00,0,0,0,0,1K,,"AWOS,ASOS,MESONET,ETC",45.2,MG,,,,,,,,,,,,,,,,,,,,Gusty northwest wind swept over the Kern County Mountains and adjacent desert late on the 2nd and through the 3rd in the typically windy areas of Interior Central California. Wind speeds as high as 59 MPH were reported at Indian Wells Canyon and 52 MPH at nearby Jawbone Canyon during the period.,,PDS
200510,2,2010,200510,3,2241,1199838,5479179,CALIFORNIA,6,2005,October,Strong Wind,Z,98,INDIAN WELLS VLY,HNX,02-OCT-05 20:10:00,PST,03-OCT-05 22:41:00,0,0,0,0,1K,,"AWOS,ASOS,MESONET,ETC",51.3,MG,,,,,,,,,,,,,,,,,,,,Gusty northwest wind swept over the Kern County Mountains and adjacent desert late on the 2nd and through the 3rd in the typically windy areas of Interior Central California. Wind speeds as high as 59 MPH were reported at Indian Wells Canyon and 52 MPH at nearby Jawbone Canyon during the period.,,PDS
200512,28,1900,200512,28,2300,1202932,5489190,CALIFORNIA,6,2005,December,Dense Fog,Z,90,E CENTRAL S.J. VALLEY,HNX,28-DEC-05 19:00:00,PST,28-DEC-05 23:00:00,0,0,0,0,,,"AWOS,ASOS,MESONET,ETC",,,,,,,,,,,,,,,,,,,,,,A quick moving but relatively weak frontal system crossed the Southern Sierra Nevada early on the 28th bringing new snow amounts of 7 to 10 inches. With the additional moisture on the adjacent Central and Southern San Joaquin Valley floor from the frontal passage dense fog developed later that evening before dissipating by midnight.,,PDS
200512,28,2000,200512,28,2300,1202932,5489191,CALIFORNIA,6,2005,December,Dense Fog,Z,91,SW S.J. VALLEY,HNX,28-DEC-05 20:00:00,PST,28-DEC-05 23:00:00,0,0,0,0,,,"AWOS,ASOS,MESONET,ETC",,,,,,,,,,,,,,,,,,,,,,A quick moving but relatively weak frontal system crossed the Southern Sierra Nevada early on the 28th bringing new snow amounts of 7 to 10 inches. With the additional moisture on the adjacent Central and Southern San Joaquin Valley floor from the frontal passage dense fog developed later that evening before dissipating by midnight.,,PDS
200512,31,920,200512,31,1530,1202934,5489195,CALIFORNIA,6,2005,December,Debris Flow,Z,93,S SIERRA FOOTHILLS,HNX,31-DEC-05 09:20:00,PST,31-DEC-05 15:30:00,0,0,0,0,,,LAW ENFORCEMENT,,,,,,,,,,,,,,,,,,,,,,"Locally heavy rain contributed to numerous rock and mudslides in the lower elevations of the Southern Sierra Nevada and Tulare County foothills as well as the far western area of Merced County on the Coast Range at Pacheco Pass. California Highway Patrol reported that Highway 140 at Savages Trading Post had water and debris washed over the bridge along with a rockslide farther up the road below Yosemite National Park. In the Madera County area a mudslide occurred near Bass Lake, and in the Tulare County a large boulder blocked lanes of State Highway 190. Rainfall amounts included 0.40"" at Madera, 0.36"" at Merced, 0.35"" at Hanford, 0.24"" at Fresno, and only 0.11"" at Bakersfield.",,PDS
200512,31,1120,200512,31,1500,1202934,5489197,CALIFORNIA,6,2005,December,Debris Flow,Z,94,TULARE CTY FOOTHILLS,HNX,31-DEC-05 11:20:00,PST,31-DEC-05 15:00:00,0,0,0,0,,,LAW ENFORCEMENT,,,,,,,,,,,,,,,,,,,,,,"Locally heavy rain contributed to numerous rock and mudslides in the lower elevations of the Southern Sierra Nevada and Tulare County foothills as well as the far western area of Merced County on the Coast Range at Pacheco Pass. California Highway Patrol reported that Highway 140 at Savages Trading Post had water and debris washed over the bridge along with a rockslide farther up the road below Yosemite National Park. In the Madera County area a mudslide occurred near Bass Lake, and in the Tulare County a large boulder blocked lanes of State Highway 190. Rainfall amounts included 0.40"" at Madera, 0.36"" at Merced, 0.35"" at Hanford, 0.24"" at Fresno, and only 0.11"" at Bakersfield.",,PDS
200512,31,1150,200512,31,1700,1202934,5489198,CALIFORNIA,6,2005,December,Flood,Z,93,S SIERRA FOOTHILLS,HNX,31-DEC-05 11:50:00,PST,31-DEC-05 17:00:00,0,0,0,0,,,LAW ENFORCEMENT,,,,,,,,,,,,,,,,,,41.61667,-122.55,41.61667,-122.55,"Locally heavy rain contributed to numerous rock and mudslides in the lower elevations of the Southern Sierra Nevada and Tulare County foothills as well as the far western area of Merced County on the Coast Range at Pacheco Pass. California Highway Patrol reported that Highway 140 at Savages Trading Post had water and debris washed over the bridge along with a rockslide farther up the road below Yosemite National Park. In the Madera County area a mudslide occurred near Bass Lake, and in the Tulare County a large boulder blocked lanes of State Highway 190. Rainfall amounts included 0.40"" at Madera, 0.36"" at Merced, 0.35"" at Hanford, 0.24"" at Fresno, and only 0.11"" at Bakersfield.",,PDS
200512,24,1655,200512,25,800,1202930,5489186,CALIFORNIA,6,2005,December,Dense Fog,Z,92,SE S.J. VALLEY,HNX,24-DEC-05 16:55:00,PST,25-DEC-05 08:00:00,0,0,0,0,,,"AWOS,ASOS,MESONET,ETC",,,,,,,,,,,,,,,,,,,,,,Dense fog settled early into the Central and Southern San Joaquin Valley on Christmas Eve. A multiple vehicle accident occurred on Interstate-5 at the Kings-Kern County Line with visibilities lowered to 200 feet as a contributing factor.,,PDS
200512,25,2224,200512,25,2224,1202931,5489187,CALIFORNIA,6,2005,December,Debris Flow,Z,93,S SIERRA FOOTHILLS,HNX,25-DEC-05 22:24:00,PST,25-DEC-05 22:24:00,0,0,0,0,1K,,LAW ENFORCEMENT,,,,,,,,,,,,,,,,,,,,,,Locally heavy rain contributed to a small rockslide over Highway 140 at Bull Creek in Southwest Mariposa County. Subsequent convection resulted some lightning activity in the Central Valley including a strike near the Fresno Air Terminal early on the 26th.,,PDS
200512,26,556,200512,26,556,1202931,5489188,CALIFORNIA,6,2005,December,Lightning,C,19,FRESNO,HNX,26-DEC-05 05:56:00,PST,26-DEC-05 05:56:00,0,0,0,0,,,OFFICIAL NWS OBS.,,,,,,,,,,,,,,(FAT) AIR TERMINAL,,,(FAT) AIR TERMINAL,,,,,Locally heavy rain contributed to a small rockslide over Highway 140 at Bull Creek in Southwest Mariposa County. Subsequent convection resulted some lightning activity in the Central Valley including a strike near the Fresno Air Terminal early on the 26th.,,PDS
200512,28,0,200512,31,2359,1203191,5487890,CALIFORNIA,6,2005,December,Debris Flow,Z,4,UPPER TRINITY RIVER,EKA,28-DEC-05 00:00:00,PST,31-DEC-05 23:59:00,0,0,0,0,3.6M,,DEPT OF HIGHWAYS,,,,,,,,,,,,,,,,,,,,,,"A series of strong Pacific storm systems with a subtropical moisture tap began on December 18 and continued through the end of the month.   The first 10 days of this wet period conditioned the watersheds with flooding of concern beginning on December 28th. Total precipitation amounts for the series of systems ranged from 12 to 20 inches.While flooding was widespread throughout Humboldt, Del Norte, and Mendocino Counties, the major flood damages occurred in the Klamath River basin and the Russian River Basin.  On the Klamath River, two boat ramps were damaged, 15 structures were flooded, and the Klamath River Bridge over HWY 101 sustained 15 million dollars worth of damage.  On the Russian River,  hundreds of homes were flooded, major crop damage occurred, and widespread infrastructure damage occurred.  In Mendocino County, landslide damages are not separated from flood damages.A major impact of this series of systems was heavy rain induced landslides.  Cal Trans reported 25 million dollars worth of damage in Humboldt County alone as a result of road wash outs and mud slides, with additional damages of 17.3 and 3.6 million dollars reported by Cal Trans for Mendocino and Trinity Counties for similar causes.  The Hoopa Indians reported 8.5 million dollars worth of similar damage for roads on their lands, and Humboldt and Del Norte County reported 21.5 million dollars worth of land slide damage to county owned roads.Also associated with this series of systems were a storm surge coastal flooding event and a short lived but destructive wind event.    A wind gust of 64 mph was recorded at the Eureka WFO, and a gust of 97 mph was also reported from a research vessel at dock.  Combined damages from these two events were 4.9 million dollars. Damages from the wind event included downed power lines and trees falling ons structures.  Damages from the coastal flooding event occurred to shore side facilities in Del Norte, Mendocino, and Humboldt Counties.It should be noted that damages estimates are still being refined by all parties contacted for dollar estimates.",,PDS
200512,4,200,200512,7,800,1202926,5489172,CALIFORNIA,6,2005,December,Frost/Freeze,Z,89,W CENTRAL S.J. VALLEY,HNX,04-DEC-05 02:00:00,PST,07-DEC-05 08:00:00,0,0,0,0,,,"AWOS,ASOS,MESONET,ETC",,,,,,,,,,,,,,,,,,,,,,"Temperatures dropped into the mid 20s to around 30 degrees for the mornings of the 4th through the 7th. While the lowest minimum temperatures (in the mid 20s F.) occurred along the axis of the San Joaquin Valley, temperatures in the agricultural citrus belt were generally around 30F for the period. The coldest morning of the string was the 5th when temperatures generally ranged from 24F go 30F in rural areas in the valley. Local citrus growers were able to provide some protection from the early season cold...but protection was especially necessary at their colder grove locations.",,PDS
200512,4,200,200512,7,800,1202926,5489173,CALIFORNIA,6,2005,December,Frost/Freeze,Z,90,E CENTRAL S.J. VALLEY,HNX,04-DEC-05 02:00:00,PST,07-DEC-05 08:00:00,0,0,0,0,,,"AWOS,ASOS,MESONET,ETC",,,,,,,,,,,,,,,,,,,,,,"Temperatures dropped into the mid 20s to around 30 degrees for the mornings of the 4th through the 7th. While the lowest minimum temperatures (in the mid 20s F.) occurred along the axis of the San Joaquin Valley, temperatures in the agricultural citrus belt were generally around 30F for the period. The coldest morning of the string was the 5th when temperatures generally ranged from 24F go 30F in rural areas in the valley. Local citrus growers were able to provide some protection from the early season cold...but protection was especially necessary at their colder grove locations.",,PDS
200512,4,330,200512,7,800,1202926,5489175,CALIFORNIA,6,2005,December,Frost/Freeze,Z,92,SE S.J. VALLEY,HNX,04-DEC-05 03:30:00,PST,07-DEC-05 08:00:00,0,0,0,0,,,"AWOS,ASOS,MESONET,ETC",,,,,,,,,,,,,,,,,,,,,,"Temperatures dropped into the mid 20s to around 30 degrees for the mornings of the 4th through the 7th. While the lowest minimum temperatures (in the mid 20s F.) occurred along the axis of the San Joaquin Valley, temperatures in the agricultural citrus belt were generally around 30F for the period. The coldest morning of the string was the 5th when temperatures generally ranged from 24F go 30F in rural areas in the valley. Local citrus growers were able to provide some protection from the early season cold...but protection was especially necessary at their colder grove locations.",,PDS
200512,10,1953,200512,15,1000,1202927,5489176,CALIFORNIA,6,2005,December,Dense Fog,Z,89,W CENTRAL S.J. VALLEY,HNX,10-DEC-05 19:53:00,PST,15-DEC-05 10:00:00,0,0,0,0,,,"AWOS,ASOS,MESONET,ETC",,,,,,,,,,,,,,,,,,,,,,"Weak or flat pressure gradients across Central California for the period from the very early morning of the 9th through the morning of the 15th provided conditions for the first seasonal long-lived episode of late night and early morning dense fog for much of the Central and Southern San Joaquin Valley. While some high clouds due to the proximity of low pressure off the Southern California Coast kept the fog from becoming its most dense, cleared skies by the evening of the 12th provided for widespread dense fog for all of the Central and South San Joaquin Valley during the evening of the 12th through the morning hours on the 13th. Residual moisture maintained the occurrence of late night and early morning fog for the mornings of the 14th and 15th. The dense fog was a contributing factor to a double fatal plane crash in the vicinity of Visalia, Tulare County, late in the night of the 10th.  Numerous motor vehicle accidents had the dense fog as a contributing factor from Merced County south through the San Joaquin Valley to Kern County on the morning of the 10th, including a fatality near Riverdale in Southern Fresno County.",,PDS
200512,17,2100,200512,22,2300,1203162,5488430,CALIFORNIA,6,2005,December,Heavy Rain,C,67,SACRAMENTO,STO,17-DEC-05 21:00:00,PST,22-DEC-05 23:00:00,0,0,0,0,,,"AWOS,ASOS,MESONET,ETC",,,,,,,,,,,,,,COUNTYWIDE,,,COUNTYWIDE,,,,,"A series of powerful but warm winter storms brought heavy rainfall to Northern California during a five day period.  Five day rainfall totals in the Northern Mountains included: Girard 12.65"", Hillcrest 9.94"", Lakeshore 8.76"", and Shasta Dam 7.31"".  In the Northern Sierra Nevada Mountains, totals included: Bucks Lake 16.68"", La Porte 15.22"", Gold Lake 14.68"", Brush Creek 13.02"", and Blue Canyon 10.57"".  In the Sierra Nevada Foothills: Pike Lookout 12.04"", Cohasset 9.59"", Paradise 7.97"", and Grass Valley 6.27"".  In the Coastal Mountains: Soda Creek 9.81"", Whispering Pines 9.24"", Alder Springs 7.82"", and Upper Lake 5.92"".  In the Sacramento and Northern San Joaquin Valleys: Vacaville 6.35"", Redding 4.95"", Fairfield 4.67"", Oroville 4.65"", Lincoln 3.68"", Red Bluff 3.65"", Folsom 3.50"", Roseville 2.99"", Sacramento 2.89"", Stockton 2.11"", and Modesto 1.08"".",,PDS
200512,4,200,200512,7,800,1202926,5489174,CALIFORNIA,6,2005,December,Frost/Freeze,Z,91,SW S.J. VALLEY,HNX,04-DEC-05 02:00:00,PST,07-DEC-05 08:00:00,0,0,0,0,,,"AWOS,ASOS,MESONET,ETC",,,,,,,,,,,,,,,,,,,,,,"Temperatures dropped into the mid 20s to around 30 degrees for the mornings of the 4th through the 7th. While the lowest minimum temperatures (in the mid 20s F.) occurred along the axis of the San Joaquin Valley, temperatures in the agricultural citrus belt were generally around 30F for the period. The coldest morning of the string was the 5th when temperatures generally ranged from 24F go 30F in rural areas in the valley. Local citrus growers were able to provide some protection from the early season cold...but protection was especially necessary at their colder grove locations.",,PDS
