BEGIN_YEARMONTH,BEGIN_DAY,BEGIN_TIME,END_YEARMONTH,END_DAY,END_TIME,EPISODE_ID,EVENT_ID,STATE,STATE_FIPS,YEAR,MONTH_NAME,EVENT_TYPE,CZ_TYPE,CZ_FIPS,CZ_NAME,WFO,BEGIN_DATE_TIME,CZ_TIMEZONE,END_DATE_TIME,INJURIES_DIRECT,INJURIES_INDIRECT,DEATHS_DIRECT,DEATHS_INDIRECT,DAMAGE_PROPERTY,DAMAGE_CROPS,SOURCE,MAGNITUDE,MAGNITUDE_TYPE,FLOOD_CAUSE,CATEGORY,TOR_F_SCALE,TOR_LENGTH,TOR_WIDTH,TOR_OTHER_WFO,TOR_OTHER_CZ_STATE,TOR_OTHER_CZ_FIPS,TOR_OTHER_CZ_NAME,BEGIN_RANGE,BEGIN_AZIMUTH,BEGIN_LOCATION,END_RANGE,END_AZIMUTH,END_LOCATION,BEGIN_LAT,BEGIN_LON,END_LAT,END_LON,EPISODE_NARRATIVE,EVENT_NARRATIVE,DATA_SOURCE
200006,1,1,200006,1,225,1096054,5148542,CALIFORNIA,6,2000,June,Extreme Cold/Wind Chill,Z,81,CENTRAL SISKIYOU COUNTY,MFR,01-JUN-00 00:01:00,PST,01-JUN-00 02:25:00,0,0,0,0,,,OFFICIAL NWS OBS.,,,,,,,,,,,,,,,,,,,,,,"A Frost Warning was issued for CAZ080 (Western Siskiyou County) and CAZ081 (Central Siskiyou County) at 1015 PDT on 05/31/00 and cancelled at 0225 PDT on 06/01/00.  However, this cancellation may have been premature as lows in the middle 30s were reported in the warning area.  No frost was reported, but some probably did form.  The reported lows in the warning area are listed below:Location		Zone		LowHappy Camp		CAZ080		38Yreka			CAZ081		36",See below.,PDC
200006,1,1,200006,1,800,1096055,5148543,CALIFORNIA,6,2000,June,Extreme Cold/Wind Chill,Z,84,NORTHEAST SISKIYOU AND NORTHWEST MODOC COUNTIES,MFR,01-JUN-00 00:01:00,PST,01-JUN-00 08:00:00,0,0,0,0,,,OFFICIAL NWS OBS.,,,,,,,,,,,,,,,,,,,,,,A Freeze Warning was issued for Eastern Siskiyou County and most of Modoc County at 1015 PDT on 05/31/00.  Freezing temperatures were observed at a few locations.  The reported low temperatures and normals are listed below:Location		Zone		Normal Low		Reported Low		DepartureMt. Hebron		CAZ084			41			39		-2Tulelake		CAZ084			40			33		-7Adin			CAZ085			40			35		-5Alturas			CAZ085			38			28		-10Canby			CAZ085			36			28		-8,See below.,PDC
200006,13,330,200006,13,2130,1096820,5150172,CALIFORNIA,6,2000,June,High Wind,Z,63,MOUNTAINS SOUTHWEST SHASTA COUNTY TO NORTHERN LAKE COUNTY,STO,13-JUN-00 03:30:00,PST,13-JUN-00 21:30:00,0,0,0,0,,,"AWOS,ASOS,MESONET,ETC",45,E,,,,,,,,,,,,,,,,,,,,A strong ridge of high pressure building over the Central Valley area resulted in windy conditions throughout the day.  Sustained winds were 25-30 mph with local gusts to 45 mph.,,PDC
200007,22,1300,200007,31,2359,1097042,5151460,CALIFORNIA,6,2000,July,Wildfire,C,107,TULARE,HNX,22-JUL-00 13:00:00,PST,31-JUL-00 23:59:00,0,0,0,0,490K,,PARK/FOREST SERVICE,,,,,,,,,,,,17,ESE,JOHNSONDALE,17,ESE,JOHNSONDALE,,,,,,"The Manter Wildfire (possible arson cause) in the southernmost part of the Sequoia National Park just above the Kern County line in the Dome Land Wilderness Area burned from July 22nd and was contained on August 10th.  It burned 74,010 acres and 16 structures, including at least 7 homes in the Pine Creek area.  Its cost of containment was $11.2 Million and involved 978 personnel.",PDC
200007,31,1200,200007,31,2359,1097043,5151461,CALIFORNIA,6,2000,July,Wildfire,C,107,TULARE,HNX,31-JUL-00 12:00:00,PST,31-JUL-00 23:59:00,0,0,0,0,,,PARK/FOREST SERVICE,,,,,,,,,,,,7,NE,SPRINGVILLE,7,NE,SPRINGVILLE,,,,,,The Edison wildfire began on July 31st from an unknown cause and was contained the next day (August 1st) after burning 150 acres.  No structures were lost and the cost to contain was unreported.,PDC
200006,16,45,200006,16,45,1097199,5150663,CALIFORNIA,6,2000,June,High Surf,Z,1,REDWOOD COAST,EKA,16-JUN-00 00:45:00,PST,16-JUN-00 00:45:00,2,0,0,0,,,NEWSPAPER,,,,,,,,,,,,,,,,,,,,,,"A large wave broke on a 67 foot motor pleasure craft 20 miles west of Big Lagoon.  Two crew members suffered lacerations and bruises and were airlifted by the Coast Guard to a hospital.  The wave blew out windows, damaged the electrical system and damaged the steering system.  The wave was estimated to be 36 feet, twice the size of the 18 foot predominate waves.",,PDC
200006,15,1530,200006,16,1830,1096821,5150173,CALIFORNIA,6,2000,June,High Wind,Z,16,C & E GLENN/COLUSA T X W/N SUTTER/SW YUBA/BUTTE T X E,STO,15-JUN-00 15:30:00,PST,16-JUN-00 18:30:00,0,0,0,0,,,"AWOS,ASOS,MESONET,ETC",44,E,,,,,,,,,,,,,,,,,,,,Strong gusty winds developed across the Northern and Central Sacramento Valley and through the surrounding mountain passes.  Sustained winds were 25-35 mph with gusts to 45 mph.,,PDC
200006,4,1620,200006,4,1620,1096812,5151286,CALIFORNIA,6,2000,June,Rip Current,C,59,ORANGE,SGX,04-JUN-00 16:20:00,PST,04-JUN-00 16:20:00,0,0,1,0,,,NEWSPAPER,,,,,,,,,,,,,,NEWPORT BEACH,,,NEWPORT BEACH,,,,,"A family of five waded out into the surf and were caught in a rip current. Four were rescued, the father drowned. His body was washed ashore five days later, six miles north up the coast.",,PDC
200006,24,900,200006,24,1600,1096813,5151287,CALIFORNIA,6,2000,June,Heat,Z,62,C SAN DIEGO,SGX,24-JUN-00 09:00:00,PST,24-JUN-00 16:00:00,0,0,1,0,,,NEWSPAPER,,,,,,,,,,,,,,,,,,,,,,One of three men traveling on foot through an isolated section of the Anza-Borrego Desert State Park was overcome by the excessive heat. His companions placed him in the shade of a tree while they went for help. Temperatures ranged between 110 and 120 degree.,,PDC
200006,1,1330,200006,1,1330,1096810,5151284,CALIFORNIA,6,2000,June,Rip Current,C,73,SAN DIEGO,SGX,01-JUN-00 13:30:00,PST,01-JUN-00 13:30:00,0,0,1,0,,,NEWSPAPER,,,,,,,,,,,,3,N,LA JOLLA,3,N,LA JOLLA,,,,,A father and daughter were caught in a rip current near the entrance to Torrey Pines State Park. The daughter was rescued but the father was not.,,PDC
200006,4,1344,200006,5,700,1096811,5151285,CALIFORNIA,6,2000,June,Wildfire,C,73,SAN DIEGO,SGX,04-JUN-00 13:44:00,PST,05-JUN-00 07:00:00,0,0,0,0,,,NEWSPAPER,,,,,,,,,,,,1,E,POWAY,1,E,POWAY,,,,,A brush fire grew rapidily to 2000 acres due to the hot dry weather conditions.,,PDC
200005,21,800,200005,23,2300,1096819,5151360,CALIFORNIA,6,2000,May,Heat,Z,15,NORTHERN SACRAMENTO VALLEY,STO,21-MAY-00 08:00:00,PST,23-MAY-00 23:00:00,0,0,0,0,,,"AWOS,ASOS,MESONET,ETC",,,,,,,,,,,,,,,,,,,,,,"Daily maximum temperatures across the area reached record levels for three consecutive days and most official reporting sites were fifteen to twenty degrees above normal readings.  Sacramento, Stockton, Redding, Red Bluff, and Vallejo (Solano Co.) each tied or broke records on one or more days.  The normal maximum temperature for Sacramento for this period is 82 degrees, yet temperatures reached 100, 103, and 99 degrees...all new daily records.  The temperature in Vallejo reached 98 degrees on the 23rd, which was the highest temperature ever reached in May for the city.",,PDC
200005,21,800,200005,23,2300,1096819,5151361,CALIFORNIA,6,2000,May,Heat,Z,18,CARQUINEZ STRAIT AND DELTA,STO,21-MAY-00 08:00:00,PST,23-MAY-00 23:00:00,0,0,0,0,,,"AWOS,ASOS,MESONET,ETC",,,,,,,,,,,,,,,,,,,,,,"Daily maximum temperatures across the area reached record levels for three consecutive days and most official reporting sites were fifteen to twenty degrees above normal readings.  Sacramento, Stockton, Redding, Red Bluff, and Vallejo (Solano Co.) each tied or broke records on one or more days.  The normal maximum temperature for Sacramento for this period is 82 degrees, yet temperatures reached 100, 103, and 99 degrees...all new daily records.  The temperature in Vallejo reached 98 degrees on the 23rd, which was the highest temperature ever reached in May for the city.",,PDC
200006,25,1830,200006,25,1830,1096814,5151288,CALIFORNIA,6,2000,June,Funnel Cloud,C,73,SAN DIEGO,SGX,25-JUN-00 18:30:00,PST,25-JUN-00 18:30:00,0,0,0,0,,,OTHER FEDERAL AGENCY,,,,,,,,,,,,12,W,OCEAN BEACH,12,W,OCEAN BEACH,,,,,,,PDC
200006,21,1245,200006,21,1250,1096817,5151291,CALIFORNIA,6,2000,June,Hail,C,73,SAN DIEGO,SGX,21-JUN-00 12:45:00,PST,21-JUN-00 12:50:00,0,0,0,0,,,BROADCAST MEDIA,1.00,,,,,,,,,,,,,RINCON,,,RINCON,33.28333,-116.95,33.28333,-116.95,"A slow moving thunderstorm dropped hail to a depth of several inches and an inch of rain over Palomar Mountain. The area had been severely burned during a wild fire the previous Fall. Mud, ash, and other debris quickly was swept across a 200 foot section of Highway 76 to a depth of 18 inches. Three vehicles were trapped, and it took about two hours for CALTRANS to clear the mud and debris.",,PDC
200006,21,1245,200006,21,1300,1096817,5151292,CALIFORNIA,6,2000,June,Flash Flood,C,73,SAN DIEGO,SGX,21-JUN-00 12:45:00,PST,21-JUN-00 13:00:00,0,0,0,0,6K,,DEPT OF HIGHWAYS,,,,,,,,,,,,,,RINCON,,,RINCON,,,,,"A slow moving thunderstorm dropped hail to a depth of several inches and an inch of rain over Palomar Mountain. The area had been severely burned during a wild fire the previous Fall. Mud, ash, and other debris quickly was swept across a 200 foot section of Highway 76 to a depth of 18 inches. Three vehicles were trapped, and it took about two hours for CALTRANS to clear the mud and debris.",,PDC
200005,15,1201,200005,15,1204,1096818,5151293,CALIFORNIA,6,2000,May,Funnel Cloud,C,103,TEHAMA,STO,15-MAY-00 12:01:00,PST,15-MAY-00 12:04:00,0,0,0,0,,,OFFICIAL NWS OBS.,,,,,,,,,,,,,,RED BLUFF MUNI ARPT,,,RED BLUFF MUNI ARPT,,,,,,A funnel cloud developed 10 miles west of Red Bluff.  It dissipated after 2-3 minutes.,PDC
200005,15,2210,200005,16,300,1096818,5151294,CALIFORNIA,6,2000,May,Flood,Z,19,NORTHERN SAN JOAQUIN VALLEY,STO,15-MAY-00 22:10:00,PST,16-MAY-00 03:00:00,0,0,0,0,,,OFFICIAL NWS OBS.,,,,,,,,,,,,,,,,,,,,,,,"Thunderstorms moving across the area produced locally heavy rain and small hail.  This resulted in urban flooding in Modesto (Stanislaus Co.), power outages to 2500 homes, several minor traffic accidents, and damage to early varieties of cherry, grape, and strawberry crops.",PDC
200007,31,2100,200007,31,2100,1097273,5151608,CALIFORNIA,6,2000,July,High Surf,Z,41,X SE LOS ANGELES,LOX,31-JUL-00 21:00:00,PST,31-JUL-00 21:00:00,0,0,0,0,,,NEWSPAPER,,,,,,,,,,,,,,,,,,,,,,,"The combination of locally heavy surf and abnormally high tides resulted in damage to two homes in the Malibu area. The powerful waves destroyed the decks of two homes, including one house owned by the musician Sting.",PDC
200005,15,1620,200005,15,1720,1096818,5151295,CALIFORNIA,6,2000,May,Heavy Rain,C,67,SACRAMENTO,STO,15-MAY-00 16:20:00,PST,15-MAY-00 17:20:00,0,0,0,0,,,"AWOS,ASOS,MESONET,ETC",,,,,,,,,,,,,,COUNTYWIDE,,,COUNTYWIDE,,,,,,"Thunderstorms moving across the area produced locally heavy rain.  One hour rainfall amounts included 1.13 inches reported south of Elk Grove, 0.79 inches in Florin, and 0.68 inches in Sacramento.",PDC
200005,21,800,200005,23,2300,1096819,5151296,CALIFORNIA,6,2000,May,Heat,Z,16,CENTRAL SACRAMENTO VALLEY,STO,21-MAY-00 08:00:00,PST,23-MAY-00 23:00:00,0,0,0,0,,,"AWOS,ASOS,MESONET,ETC",,,,,,,,,,,,,,,,,,,,,,"Daily maximum temperatures across the area reached record levels for three consecutive days and most official reporting sites were fifteen to twenty degrees above normal readings.  Sacramento, Stockton, Redding, Red Bluff, and Vallejo (Solano Co.) each tied or broke records on one or more days.  The normal maximum temperature for Sacramento for this period is 82 degrees, yet temperatures reached 100, 103, and 99 degrees...all new daily records.  The temperature in Vallejo reached 98 degrees on the 23rd, which was the highest temperature ever reached in May for the city.",,PDC
200006,10,1434,200006,11,800,1096059,5148197,CALIFORNIA,6,2000,June,Extreme Cold/Wind Chill,Z,84,NORTHEAST SISKIYOU AND NORTHWEST MODOC COUNTIES,MFR,10-JUN-00 14:34:00,PST,11-JUN-00 08:00:00,0,0,0,0,,,OFFICIAL NWS OBS.,,,,,,,,,,,,,,,,,,,,,,"A Frost Warning was issued for the zone listed above at the time listed above.  Reported low temperatures were cold enough to support frost formation, but no frost was reported.  Station			Zone			Low TemperatureMt. Hebron		CAZ084				31Tulelake		CAZ084				33Adin			CAZ085				38Alturas			CAZ085				31Canby			CAZ085				33",See below.,PDC
200006,10,1434,200006,11,800,1096059,5148198,CALIFORNIA,6,2000,June,Extreme Cold/Wind Chill,Z,85,MODOC COUNTY,MFR,10-JUN-00 14:34:00,PST,11-JUN-00 08:00:00,0,0,0,0,,,OFFICIAL NWS OBS.,,,,,,,,,,,,,,,,,,,,,,"A Frost Warning was issued for the zone listed above at the time listed above.  Reported low temperatures were cold enough to support frost formation, but no frost was reported.  Station			Zone			Low TemperatureMt. Hebron		CAZ084				31Tulelake		CAZ084				33Adin			CAZ085				38Alturas			CAZ085				31Canby			CAZ085				33",See below.,PDC
200006,8,800,200006,8,1500,1096063,5148209,CALIFORNIA,6,2000,June,Heavy Rain,C,19,FRESNO,HNX,08-JUN-00 08:00:00,PST,08-JUN-00 15:00:00,0,0,0,0,,200K,"AWOS,ASOS,MESONET,ETC",,,,,,,,,,,,,,FRESNO,,,FRESNO,,,,,"An unseasonable rain again caused problems for hay and fruit growers in the Central and Southern San Joaquin Valley growing areas.  Amounts varied from 1/3 to 2/3rds of an inch in Kings, Tulare, Fresno, and Madera Counties.  Fresno had 0.56 inches of rain that broke a 46-year old record of 0.14 inch for June 8th.  Locally heavy rain in Visalia caused some urban flooding problems.  Gusty wind also occurred in the Kern County Mountains and Deserts:  gusts to 51 knots were reported in Tehachapi Pass; with gusts to 40 knots at Mojave and Inyokern.",,PDC
200006,1,1,200006,1,225,1096054,5148541,CALIFORNIA,6,2000,June,Extreme Cold/Wind Chill,Z,80,WESTERN SISKIYOU COUNTY,MFR,01-JUN-00 00:01:00,PST,01-JUN-00 02:25:00,0,0,0,0,,,OFFICIAL NWS OBS.,,,,,,,,,,,,,,,,,,,,,,"A Frost Warning was issued for CAZ080 (Western Siskiyou County) and CAZ081 (Central Siskiyou County) at 1015 PDT on 05/31/00 and cancelled at 0225 PDT on 06/01/00.  However, this cancellation may have been premature as lows in the middle 30s were reported in the warning area.  No frost was reported, but some probably did form.  The reported lows in the warning area are listed below:Location		Zone		LowHappy Camp		CAZ080		38Yreka			CAZ081		36",See below.,PDC
200006,8,1030,200006,8,1900,1096063,5148206,CALIFORNIA,6,2000,June,High Wind,Z,99,SE KERN CTY DESERT,HNX,08-JUN-00 10:30:00,PST,08-JUN-00 19:00:00,0,0,0,0,,,"AWOS,ASOS,MESONET,ETC",,,,,,,,,,,,,,,,,,,,,,"An unseasonable rain again caused problems for hay and fruit growers in the Central and Southern San Joaquin Valley growing areas.  Amounts varied from 1/3 to 2/3rds of an inch in Kings, Tulare, Fresno, and Madera Counties.  Fresno had 0.56 inches of rain that broke a 46-year old record of 0.14 inch for June 8th.  Locally heavy rain in Visalia caused some urban flooding problems.  Gusty wind also occurred in the Kern County Mountains and Deserts:  gusts to 51 knots were reported in Tehachapi Pass; with gusts to 40 knots at Mojave and Inyokern.",,PDC
200006,8,1030,200006,8,1900,1096063,5148207,CALIFORNIA,6,2000,June,High Wind,Z,98,INDIAN WELLS VLY,HNX,08-JUN-00 10:30:00,PST,08-JUN-00 19:00:00,0,0,0,0,,,"AWOS,ASOS,MESONET,ETC",,,,,,,,,,,,,,,,,,,,,,"An unseasonable rain again caused problems for hay and fruit growers in the Central and Southern San Joaquin Valley growing areas.  Amounts varied from 1/3 to 2/3rds of an inch in Kings, Tulare, Fresno, and Madera Counties.  Fresno had 0.56 inches of rain that broke a 46-year old record of 0.14 inch for June 8th.  Locally heavy rain in Visalia caused some urban flooding problems.  Gusty wind also occurred in the Kern County Mountains and Deserts:  gusts to 51 knots were reported in Tehachapi Pass; with gusts to 40 knots at Mojave and Inyokern.",,PDC
200006,8,800,200006,8,1500,1096063,5148208,CALIFORNIA,6,2000,June,Heavy Rain,C,31,KINGS,HNX,08-JUN-00 08:00:00,PST,08-JUN-00 15:00:00,0,0,0,0,,100K,"AWOS,ASOS,MESONET,ETC",,,,,,,,,,,,,,HANFORD,,,HANFORD,,,,,"An unseasonable rain again caused problems for hay and fruit growers in the Central and Southern San Joaquin Valley growing areas.  Amounts varied from 1/3 to 2/3rds of an inch in Kings, Tulare, Fresno, and Madera Counties.  Fresno had 0.56 inches of rain that broke a 46-year old record of 0.14 inch for June 8th.  Locally heavy rain in Visalia caused some urban flooding problems.  Gusty wind also occurred in the Kern County Mountains and Deserts:  gusts to 51 knots were reported in Tehachapi Pass; with gusts to 40 knots at Mojave and Inyokern.",,PDC
200007,14,1315,200007,14,1315,1098661,5153895,CALIFORNIA,6,2000,July,Funnel Cloud,C,71,SAN BERNARDINO,SGX,14-JUL-00 13:15:00,PST,14-JUL-00 13:15:00,0,0,0,0,,,TRAINED SPOTTER,,,,,,,,,,,,,,PHELAN,,,PHELAN,,,,,,,PDC
200007,20,1530,200007,21,1700,1098662,5153896,CALIFORNIA,6,2000,July,Wildfire,C,73,SAN DIEGO,SGX,20-JUL-00 15:30:00,PST,21-JUL-00 17:00:00,0,0,1,0,,,BROADCAST MEDIA,,,,,,,,,,,,,,LIVE OAK SPGS,,,LIVE OAK SPGS,,,,,"Erratic winds pushed a brush fire close to State Route 94 and threatened four homes before fire fighters beat it back. Near the origin of the blaze, a burned body was found. It was estimated that it had been a middle-aged male",,PDC
200007,23,1300,200007,23,1500,1098663,5153897,CALIFORNIA,6,2000,July,Heat,Z,43,X W SAN DIEGO,SGX,23-JUL-00 13:00:00,PST,23-JUL-00 15:00:00,1,0,0,0,,,BROADCAST MEDIA,,,,,,,,,,,,,,,,,,,,,,Heat exhaustion was blamed for a young man losing consciousness after running along the beach.,,PDC
200007,22,1150,200007,23,1700,1098664,5153898,CALIFORNIA,6,2000,July,Wildfire,C,73,SAN DIEGO,SGX,22-JUL-00 11:50:00,PST,23-JUL-00 17:00:00,0,0,0,0,,,NEWSPAPER,,,,,,,,,,,,,,ALPINE,,,ALPINE,,,,,A wild fire  scorched 300 acres in a remote area of the Cleveland National Forest.,,PDC
200007,22,1640,200007,23,500,1098665,5153899,CALIFORNIA,6,2000,July,Wildfire,C,65,RIVERSIDE,SGX,22-JUL-00 16:40:00,PST,23-JUL-00 05:00:00,0,0,0,0,,,NEWSPAPER,,,,,,,,,,,,,,TEMECULA,,,TEMECULA,,,,,A wildfire threatened several homes and burned 180 acres before being contained.,,PDC
200007,29,1241,200007,31,2359,1098666,5153900,CALIFORNIA,6,2000,July,Wildfire,C,65,RIVERSIDE,SGX,29-JUL-00 12:41:00,PST,31-JUL-00 23:59:00,3,0,0,0,,,NEWSPAPER,,,,,,,,,,,,7,E,TEMECULA,7,E,TEMECULA,,,,,"A brush fire, fanned by erratic winds, quickly grew to over 3800 acres and was still out of control as July ended. Over 1,100 fire fighters, 74 fire engines, 4 helicopters, and eight air tankers were battling to keep flames away from structures.",,PDC
200007,31,800,200007,31,2359,1098666,5153901,CALIFORNIA,6,2000,July,Wildfire,C,73,SAN DIEGO,SGX,31-JUL-00 08:00:00,PST,31-JUL-00 23:59:00,0,0,0,0,,,NEWSPAPER,,,,,,,,,,,,5,N,PALA,5,N,PALA,,,,,"A brush fire, fanned by erratic winds, quickly grew to over 3800 acres and was still out of control as July ended. Over 1,100 fire fighters, 74 fire engines, 4 helicopters, and eight air tankers were battling to keep flames away from structures.",,PDC
200007,27,1330,200007,28,800,1098667,5153902,CALIFORNIA,6,2000,July,Wildfire,C,73,SAN DIEGO,SGX,27-JUL-00 13:30:00,PST,28-JUL-00 08:00:00,0,0,0,0,,,NEWSPAPER,,,,,,,,,,,,10,NW,CAMPO,10,NW,CAMPO,,,,,About 500 acres were burned in the wilderness area near Morena Reservoir.,,PDC
200005,21,800,200005,23,2300,1096819,5151362,CALIFORNIA,6,2000,May,Heat,Z,19,NORTHERN SAN JOAQUIN VALLEY,STO,21-MAY-00 08:00:00,PST,23-MAY-00 23:00:00,0,0,0,0,,,"AWOS,ASOS,MESONET,ETC",,,,,,,,,,,,,,,,,,,,,,"Daily maximum temperatures across the area reached record levels for three consecutive days and most official reporting sites were fifteen to twenty degrees above normal readings.  Sacramento, Stockton, Redding, Red Bluff, and Vallejo (Solano Co.) each tied or broke records on one or more days.  The normal maximum temperature for Sacramento for this period is 82 degrees, yet temperatures reached 100, 103, and 99 degrees...all new daily records.  The temperature in Vallejo reached 98 degrees on the 23rd, which was the highest temperature ever reached in May for the city.",,PDC
200005,21,800,200005,23,2300,1096819,5151363,CALIFORNIA,6,2000,May,Heat,Z,17,SOUTHERN SACRAMENTO VALLEY,STO,21-MAY-00 08:00:00,PST,23-MAY-00 23:00:00,0,0,0,0,,,"AWOS,ASOS,MESONET,ETC",,,,,,,,,,,,,,,,,,,,,,"Daily maximum temperatures across the area reached record levels for three consecutive days and most official reporting sites were fifteen to twenty degrees above normal readings.  Sacramento, Stockton, Redding, Red Bluff, and Vallejo (Solano Co.) each tied or broke records on one or more days.  The normal maximum temperature for Sacramento for this period is 82 degrees, yet temperatures reached 100, 103, and 99 degrees...all new daily records.  The temperature in Vallejo reached 98 degrees on the 23rd, which was the highest temperature ever reached in May for the city.",,PDC
200006,13,330,200006,13,2130,1096820,5151364,CALIFORNIA,6,2000,June,High Wind,Z,64,CLEAR LAKE/SOUTHERN LAKE COUNTY,STO,13-JUN-00 03:30:00,PST,13-JUN-00 21:30:00,0,0,0,0,,,"AWOS,ASOS,MESONET,ETC",45,E,,,,,,,,,,,,,,,,,,,,A strong ridge of high pressure building over the Central Valley area resulted in windy conditions throughout the day.  Sustained winds were 25-30 mph with local gusts to 45 mph.,,PDC
200006,22,2215,200006,22,2305,1097060,5150879,CALIFORNIA,6,2000,June,Flash Flood,C,71,SAN BERNARDINO,VEF,22-JUN-00 22:15:00,PST,22-JUN-00 23:05:00,0,0,0,0,5K,,LAW ENFORCEMENT,,,,,,,,,,,,,,NEEDLES,,,NEEDLES,,,,,,"A slow moving thunderstorm dumped over an inch of rain in Needles, CA causing roads throughout much of the town to become flooded. The Sheriff's office reported that many roadways were covered with debis. Power was also knocked out to much of the town for the majority of the night.",PDC
200006,13,300,200006,15,2300,1096822,5150179,CALIFORNIA,6,2000,June,Heat,Z,16,CENTRAL SACRAMENTO VALLEY,STO,13-JUN-00 03:00:00,PST,15-JUN-00 23:00:00,0,0,1,0,,,"AWOS,ASOS,MESONET,ETC",,,,,,,,,,,,,,,,,,,,,,"Very hot weather persisted across Interior Northern California for three days, resulting in record and near record temperatures at most reporting sites.  Sixteen people were treated for heat stroke in Sacramento and Solano counties and one, a 16-year-old male in West Sacramento, died.  A heavily used portion of I-80 between Sacramento and San Francisco was closed for several hours to repair three lanes in which the asphalt had buckled due to the sustained heat.   Power outages were suffered by more than 100,000 customers during the event.Maximum temperatures were fifteen to twenty degrees above normal throughout the valley and foothills, but what made the weather especially difficult to handle was that the minimum temperatures were also ten to twenty degrees above normal for the period.  The hottest day across the area was the 14th,  with maximum temperatures of 105 degrees at Modesto, 107 at Stockton and Sacramento, and 109 at Redding and Red Bluff.  The maximum temperatures on the 8th...less than a week earlier...were 73 degrees at Modesto and Stockton, 71 at Sacramento, 72 at Redding, and 70 degrees at Red Bluff. Redding tied or set three daily temperature records in a 36 hour period by tying the high minimum of 81 degrees on the 14th, setting a new high maximum of 109 degrees on the 14th, and setting a new high minimum of 80 degrees on the 15th.  Sacramento set a daily high minimum temperature record by dropping only to 68 degrees on the 13th.  Other sites setting daily high temperature records...all on the 14th...were Nevada City (Nevada Co.) at 99 degrees, Vacaville (Solano Co.) at 110, and Fairfield (Solano Co.) at 109.",,PDC
200006,15,1530,200006,16,1830,1096821,5150174,CALIFORNIA,6,2000,June,High Wind,Z,64,LAKE T N & X SW/W YOLO/X SW COLUSA/E NAPA/X NW SOLANO,STO,15-JUN-00 15:30:00,PST,16-JUN-00 18:30:00,0,0,0,0,,,"AWOS,ASOS,MESONET,ETC",44,E,,,,,,,,,,,,,,,,,,,,Strong gusty winds developed across the Northern and Central Sacramento Valley and through the surrounding mountain passes.  Sustained winds were 25-35 mph with gusts to 45 mph.,,PDC
200006,15,1530,200006,16,1830,1096821,5150175,CALIFORNIA,6,2000,June,High Wind,Z,14,NE & EC SHASTA,STO,15-JUN-00 15:30:00,PST,16-JUN-00 18:30:00,0,0,0,0,,,"AWOS,ASOS,MESONET,ETC",44,E,,,,,,,,,,,,,,,,,,,,Strong gusty winds developed across the Northern and Central Sacramento Valley and through the surrounding mountain passes.  Sustained winds were 25-35 mph with gusts to 45 mph.,,PDC
200006,15,1530,200006,16,1830,1096821,5150176,CALIFORNIA,6,2000,June,High Wind,Z,13,NW & NC SHASTA,STO,15-JUN-00 15:30:00,PST,16-JUN-00 18:30:00,0,0,0,0,,,"AWOS,ASOS,MESONET,ETC",44,E,,,,,,,,,,,,,,,,,,,,Strong gusty winds developed across the Northern and Central Sacramento Valley and through the surrounding mountain passes.  Sustained winds were 25-35 mph with gusts to 45 mph.,,PDC
200006,15,1530,200006,16,1830,1096821,5150177,CALIFORNIA,6,2000,June,High Wind,Z,15,P SC SHASTA/C TEHAMA,STO,15-JUN-00 15:30:00,PST,16-JUN-00 18:30:00,0,0,0,0,,,"AWOS,ASOS,MESONET,ETC",44,E,,,,,,,,,,,,,,,,,,,,Strong gusty winds developed across the Northern and Central Sacramento Valley and through the surrounding mountain passes.  Sustained winds were 25-35 mph with gusts to 45 mph.,,PDC
200006,15,1530,200006,16,1830,1096821,5150178,CALIFORNIA,6,2000,June,High Wind,Z,63,SW SHASTA/W TEHAMA/W GLENN/X NW COLUSA/N LAKE,STO,15-JUN-00 15:30:00,PST,16-JUN-00 18:30:00,0,0,0,0,,,"AWOS,ASOS,MESONET,ETC",44,E,,,,,,,,,,,,,,,,,,,,Strong gusty winds developed across the Northern and Central Sacramento Valley and through the surrounding mountain passes.  Sustained winds were 25-35 mph with gusts to 45 mph.,,PDC
200006,14,1200,200006,14,1700,1097073,5152902,CALIFORNIA,6,2000,June,Heat,Z,7,ALAMEDA / CONTRA COSTA,MTR,14-JUN-00 12:00:00,PST,14-JUN-00 17:00:00,15,0,3,0,,,"AWOS,ASOS,MESONET,ETC",,,,,,,,,,,,,,,,,,,,,,"This unusual early summer record breaking heat wave was responsible for 10 deaths in the Bay Area and a large number of heat related injuries. Temperature record of 103 degrees in San Francisco tied the all time record high temperature. Other record highs for the day were Livermore had 107 degrees, Oakland 106 degrees, Santa Rosa 108 degrees High temperature caused over loading of power resources and rolling blackouts were implemented to keep the power system from exceeding capacity so many people lost power for a period during the heat.",,PDC
