BEGIN_YEARMONTH,BEGIN_DAY,BEGIN_TIME,END_YEARMONTH,END_DAY,END_TIME,EPISODE_ID,EVENT_ID,STATE,STATE_FIPS,YEAR,MONTH_NAME,EVENT_TYPE,CZ_TYPE,CZ_FIPS,CZ_NAME,WFO,BEGIN_DATE_TIME,CZ_TIMEZONE,END_DATE_TIME,INJURIES_DIRECT,INJURIES_INDIRECT,DEATHS_DIRECT,DEATHS_INDIRECT,DAMAGE_PROPERTY,DAMAGE_CROPS,SOURCE,MAGNITUDE,MAGNITUDE_TYPE,FLOOD_CAUSE,CATEGORY,TOR_F_SCALE,TOR_LENGTH,TOR_WIDTH,TOR_OTHER_WFO,TOR_OTHER_CZ_STATE,TOR_OTHER_CZ_FIPS,TOR_OTHER_CZ_NAME,BEGIN_RANGE,BEGIN_AZIMUTH,BEGIN_LOCATION,END_RANGE,END_AZIMUTH,END_LOCATION,BEGIN_LAT,BEGIN_LON,END_LAT,END_LON,EPISODE_NARRATIVE,EVENT_NARRATIVE,DATA_SOURCE
200508,15,1505,200508,15,1505,1194318,5464847,CALIFORNIA,6,2005,August,Hail,C,71,SAN BERNARDINO,VEF,15-AUG-05 15:05:00,PST,15-AUG-05 15:05:00,0,0,0,0,,,TRAINED SPOTTER,1.00,,,,,,,,,,,,,HINKLEY,,,HINKLEY,34.93333,-117.2,34.93333,-117.2,,,PDS
200508,15,1512,200508,15,1600,1194319,5464848,CALIFORNIA,6,2005,August,Flash Flood,C,71,SAN BERNARDINO,VEF,15-AUG-05 15:12:00,PST,15-AUG-05 16:00:00,0,0,0,0,,,LAW ENFORCEMENT,,,,,,,,,,,,,,BARSTOW,,,BARSTOW,34.88333,-117.03333,34.88333,-117.03333,,"One to two feet of water and debris crossing roadways, and up to one foot of water in businesses.",PDS
200507,10,1200,200507,20,1800,1193697,5461754,CALIFORNIA,6,2005,July,Heat,Z,56,P W RIVERSIDE,SGX,10-JUL-05 12:00:00,PST,20-JUL-05 18:00:00,0,0,0,0,,,NEWSPAPER,,,,,,,,,,,,,,,,,,,,,,"Record heat resulted in near record power consumption and one death. High temperatures soared to 121 at Thermal, 120 at Palm Springs, 120 at Borrego Springs, and 116 at Hesperia. Temperatures in the Coachella Valley hit 110 degrees or greater on 9 consecutive days. No relief was found in the mountains either as high temperatures there reached into the mid and upper 90s, even above 7,000 ft. Big Bear Lake tied their all-time record high of 94 on the 18th while Idyllwild hit a high of 98. Daytime temperatures in the inland valleys hit 100 or higher on most days, and things didn't get much better after sunset. A slew of record high minimums were broken as night time temperatures ranged from the low 70s in the valleys to the upper 80s in the deserts. On the 13th, the low temperature in Indio only dropped to 90 degrees. One teen died from heat exposure when he and his father went looking for help after their dune-buggy broke down in Anza-Borrego Desert State Park.",,PDS
200508,1,1238,200508,1,1239,1194290,5464767,CALIFORNIA,6,2005,August,Hail,C,71,SAN BERNARDINO,VEF,01-AUG-05 12:38:00,PST,01-AUG-05 12:39:00,0,0,0,0,,,TRAINED SPOTTER,0.75,,,,,,,,,,,,,YUCCA VLY,,,YUCCA VLY,34.11667,-116.45,34.11667,-116.45,,,PDS
200508,14,1742,200508,14,1842,1194311,5464779,CALIFORNIA,6,2005,August,Flash Flood,C,71,SAN BERNARDINO,VEF,14-AUG-05 17:42:00,PST,14-AUG-05 18:42:00,0,0,0,0,,,AMATEUR RADIO,,,,,,,,,,,,10,W,NEEDLES,10,W,NEEDLES,34.83333,-114.78333,34.83333,-114.78333,,U.S. Highway 95 closed at Interstate 40 interchange.,PDS
200508,9,1054,200508,9,1415,1194297,5464774,CALIFORNIA,6,2005,August,Flash Flood,C,71,SAN BERNARDINO,VEF,09-AUG-05 10:54:00,PST,09-AUG-05 14:15:00,0,0,0,0,,,LAW ENFORCEMENT,,,,,,,,,,,,,,KLINEFELTER,,,KLINEFELTER,34.9,-114.75,35.21667,-114.75,,U.S. Highway 95 closed from Interstate 40 to the Nevada state line.,PDS
200508,9,1520,200508,9,1730,1194299,5464776,CALIFORNIA,6,2005,August,Flash Flood,C,71,SAN BERNARDINO,VEF,09-AUG-05 15:20:00,PST,09-AUG-05 17:30:00,0,0,0,0,,,TRAINED SPOTTER,,,,,,,,,,,,,,YUCCA VLY,,,YUCCA VLY,34.11667,-116.45,34.11667,-116.45,,"Several roads impassable, including Highway 62. 13 people rescued from vehicles.",PDS
200507,23,1423,200507,23,1735,1195977,5466634,CALIFORNIA,6,2005,July,Flash Flood,C,29,KERN,HNX,23-JUL-05 14:23:00,PST,23-JUL-05 17:35:00,0,0,0,0,,,LAW ENFORCEMENT,,,,,,,,,,,,1,W,CANTIL,1,W,CANTIL,35.3,-117.98333,35.3,-117.98333,"Monsoonal moisture swept northwestward into the south half of California early in the morning of the 23rd and lingered through the 24th. On the 23rd the deserts and mountain areas of Kern County received locally heavy rain from thundershowers that resulted in numerous areas of desert stream flows. Radar estimates indicated 1-hour precipitation amounts of 2-3 inches and storm totals in excess of 4 inches. At Big Pine 0.68"" of rain occurred in 15 minutes with a storm total of 1.16.""  Flooding was reported along Highway 14 near Redrock-Randsburg Road by 1423 PST. Subsequent flooding was reported along Redrock-Randsburg Road to Garlock by 1625 PST. Additional flooding occurred west of Mojave on Willow Springs Road.",,PDS
200507,24,1355,200507,24,1415,1193688,5461278,CALIFORNIA,6,2005,July,Flash Flood,C,65,RIVERSIDE,SGX,24-JUL-05 13:55:00,PST,24-JUL-05 14:15:00,0,0,0,0,,,STORM CHASER,,,,,,,,,,,,,,HEMET,,,HEMET,33.73333,-116.96667,33.73333,-116.96667,"Thunderstorms fired for the second straight day along the Elsinore Convergence Zone, only this time with less severity. These thunderstorms produced heavy rain, pea size hail, and isolated wind damage. Flooding problems were reported in Hemet and surrounding areas.",Flooding from a thunderstorm observed near the intersection of highways 74 and 79 in Hemet. Pea size hail accompanied this storm.,PDS
200507,29,1500,200507,29,1500,1193690,5461507,CALIFORNIA,6,2005,July,Hail,C,73,SAN DIEGO,SGX,29-JUL-05 15:00:00,PST,29-JUL-05 15:00:00,0,0,0,0,,,TRAINED SPOTTER,0.75,,,,,,,,,,,2,ENE,RANCHITA,2,ENE,RANCHITA,33.23333,-116.5,33.21667,-116.53333,,Two reports of 3/4 hail were received as a severe thunderstorm moved over Ranchita. Hail fell from Ranchita to just northeast of Montezuma Valley Rd.,PDS
200507,29,1500,200507,29,1500,1193690,5461508,CALIFORNIA,6,2005,July,Thunderstorm Wind,C,73,SAN DIEGO,SGX,29-JUL-05 15:00:00,PST,29-JUL-05 15:00:00,0,0,0,0,5K,,TRAINED SPOTTER,52,EG,,,,,,,,,,2,E,RANCHITA,2,E,RANCHITA,33.21667,-116.5,33.21667,-116.53333,,The same thunderstorm that dropped 3/4 inch hail also produced estimated wind gusts over 60 mph in the town of Ranchita as well as near Montezuma Valley Rd. Doppler radar indicated a mesocyclone with this storm.,PDS
200507,29,1500,200507,29,1542,1193690,5461509,CALIFORNIA,6,2005,July,Flash Flood,C,73,SAN DIEGO,SGX,29-JUL-05 15:00:00,PST,29-JUL-05 15:42:00,0,0,0,0,5K,,STORM CHASER,,,,,,,,,,,,2,E,RANCHITA,2,E,RANCHITA,33.21667,-116.5,33.21667,-116.5,,Flash flooding between 1 and 2 feet deep and hail was reported at Montezuma Valley Rd.,PDS
200507,29,1515,200507,29,1515,1193690,5461510,CALIFORNIA,6,2005,July,Hail,C,73,SAN DIEGO,SGX,29-JUL-05 15:15:00,PST,29-JUL-05 15:15:00,0,0,0,0,,,TRAINED SPOTTER,0.75,,,,,,,,,,,3,E,BOULEVARD,3,E,BOULEVARD,32.66667,-116.21667,32.66667,-116.21667,,A thunderstorm between Boulevard and Jacumba dropped 3/4 inch hail on interstate 8.,PDS
200507,29,1420,200507,29,1430,1193690,5461511,CALIFORNIA,6,2005,July,Heavy Rain,C,73,SAN DIEGO,SGX,29-JUL-05 14:20:00,PST,29-JUL-05 14:30:00,0,0,0,0,,,"AWOS,ASOS,MESONET,ETC",0.50,,,,,,,,,,,,,RANCHITA,,,RANCHITA,,,,,,Flood Control reported 0.50 inches of rain in 10 minutes in a gage located at San Felipe Creek.,PDS
200507,30,1310,200507,30,1310,1193056,5458425,CALIFORNIA,6,2005,July,Hail,C,71,SAN BERNARDINO,VEF,30-JUL-05 13:10:00,PST,30-JUL-05 13:10:00,0,0,0,0,,,DEPT OF HIGHWAYS,1.00,,,,,,,,,,,20,E,BARSTOW,20,E,BARSTOW,34.88333,-116.68333,34.88333,-116.68333,,One inch hail on Interstate 40 at mile marker 23.  Reported by Caltrans.,PDS
200507,30,1435,200507,30,1435,1193057,5458426,CALIFORNIA,6,2005,July,Thunderstorm Wind,C,71,SAN BERNARDINO,VEF,30-JUL-05 14:35:00,PST,30-JUL-05 14:35:00,0,0,0,0,,,PARK/FOREST SERVICE,52,EG,,,,,,,,,,,,BAKER,,,BAKER,35.26667,-116.08333,35.26667,-116.08333,,Also dust storm with visibility down to 50 feet.,PDS
200507,30,1426,200507,30,1500,1193691,5461516,CALIFORNIA,6,2005,July,Flash Flood,C,71,SAN BERNARDINO,SGX,30-JUL-05 14:26:00,PST,30-JUL-05 15:00:00,0,0,0,0,10K,,LAW ENFORCEMENT,,,,,,,,,,,,11,ESE,LUCERNE VLY,11,ESE,LUCERNE VLY,34.38333,-116.76667,34.38333,-116.76667,"An approaching mid-level trough, combined with steep lapse rates, surface dewpoints in the low to mid 70s, and precipitable water values of around 2 inches helped trigger severe thunderstorms across the mountains and deserts during the afternoon and evening hours of the 30th. The strongest storms formed over the San Bernardino Mountains where numerous reports of hail and flooding were received. This day marked the 11th straight day of thunderstorms in the San Diego CWA.",Heavy rain from thunderstorms sent water raging across highway 247 at Santa Fe Rd.,PDS
200507,30,1326,200507,30,1400,1193691,5461517,CALIFORNIA,6,2005,July,Flash Flood,C,71,SAN BERNARDINO,SGX,30-JUL-05 13:26:00,PST,30-JUL-05 14:00:00,0,0,0,0,10K,,LAW ENFORCEMENT,,,,,,,,,,,,4,S,BIG BEAR LAKE,4,S,BIG BEAR LAKE,34.2,-116.9,34.2,-116.9,"An approaching mid-level trough, combined with steep lapse rates, surface dewpoints in the low to mid 70s, and precipitable water values of around 2 inches helped trigger severe thunderstorms across the mountains and deserts during the afternoon and evening hours of the 30th. The strongest storms formed over the San Bernardino Mountains where numerous reports of hail and flooding were received. This day marked the 11th straight day of thunderstorms in the San Diego CWA.",Flooding across highway 38 at Jenks Lake Rd. stopped traffic and left rocks on the road.,PDS
200507,31,1031,200507,31,1044,1193693,5461740,CALIFORNIA,6,2005,July,Heavy Rain,C,73,SAN DIEGO,SGX,31-JUL-05 10:31:00,PST,31-JUL-05 10:44:00,0,0,0,0,,,"AWOS,ASOS,MESONET,ETC",0.52,,,,,,,,,,,8,S,PINE VLY,8,S,PINE VLY,,,,,,The Morena Reservoir alert gage recorded 0.52 inches of rain in 13 minutes during a thunderstorm.,PDS
200507,31,1105,200507,31,1135,1193693,5461741,CALIFORNIA,6,2005,July,Flash Flood,C,65,RIVERSIDE,SGX,31-JUL-05 11:05:00,PST,31-JUL-05 11:35:00,0,0,0,0,,,DEPT OF HIGHWAYS,,,,,,,,,,,,1,NW,ANZA,1,NW,ANZA,33.56667,-116.7,33.56667,-116.7,,Flash flooding was reported at Mitchell Rd and Bonita Vista Rd.,PDS
200507,31,1045,200507,31,1107,1193693,5461742,CALIFORNIA,6,2005,July,Heavy Rain,C,71,SAN BERNARDINO,SGX,31-JUL-05 10:45:00,PST,31-JUL-05 11:07:00,0,0,0,0,,,"AWOS,ASOS,MESONET,ETC",0.75,,,,,,,,,,,2,S,FOREST FALLS,2,S,FOREST FALLS,,,,,,The Yucaipa Ridge alert gage recorded 0.75 inches of rain in 22 minutes during a thunderstorm.,PDS
200506,1,0,200506,30,2359,1193314,5462025,CALIFORNIA,6,2005,June,Heavy Rain,C,43,MARIPOSA,HNX,01-JUN-05 00:00:00,PST,30-JUN-05 23:59:00,0,0,0,0,,,OFFICIAL NWS OBS.,,,,,,,,,,,,,,COUNTYWIDE,,,COUNTYWIDE,,,,,"The 2004-2005 cool season in Interior Central California was one of the better rain accumulation years recently. Rain periods with snow at the higher elevations started in mid-October and continued consistently through mid-May. This water year was in stark contrast to the averaged below normal rainfall from the past 6 years. Generally the Central and South San Joaquin Valley ended with 140% of rainfall normals while the higher elevation snowpack for the Southern Sierra Nevada finished at 185% of normal and the Kern River Basin on the Southern end of the S.Sierra Nevada at 154% of normal. From October through May every month had above normal rain/snow amounts with the exception of just below normal precipitation for November and April. October, December, and May had significantly large amounts of rain/snow. Furthermore, the mountain snowpack was marked by its staying power as cool weather persisted into June and reservoirs were able to hold more water for a longer period of time than ever seen before. Campgrounds at the higher elevations of the Southern Sierra Nevada in Yosemite National Park did not open for the summer of 2005 due to the large and late snowpack.",,PDS
200507,23,1310,200507,23,1325,1193684,5460708,CALIFORNIA,6,2005,July,Heavy Rain,C,65,RIVERSIDE,SGX,23-JUL-05 13:10:00,PST,23-JUL-05 13:25:00,0,0,0,0,,,TRAINED SPOTTER,1,,,,,,,,,,,,,HEMET,,,HEMET,,,,,"A severe thunderstorm rapidly developed just before 2:00 PM northeast of Hemet along the Elsinore Convergence Zone. This storm produced a tornado, damaging straight line winds to 70 mph, dime to nickel size hail, and flash flooding. The storm traveled southwestward along the Elsinore Convergence Zone before dissipating near interstate 15 in Murrieta. The majority of the reported damage consisted of downed trees and flooded roads and property.",Two separate reports were received from Hemet indicating 1.00 inch of rainfall in 15 minutes.,PDS
200507,24,1213,200507,24,1323,1193685,5461274,CALIFORNIA,6,2005,July,Flash Flood,C,71,SAN BERNARDINO,SGX,24-JUL-05 12:13:00,PST,24-JUL-05 13:23:00,0,0,0,0,20K,,FIRE DEPT/RESCUE SQUAD,,,,,,,,,,,,13,ESE,LUCERNE VLY,13,ESE,LUCERNE VLY,34.38333,-116.73333,34.43333,-116.9,,One motorist had to be rescued along highway 247 at mile marker 29 when a flash flood swept over the road. Flash flooding occurred from mile markers 32 to 22 and pushed several vehicles off of the roadway.,PDS
200507,24,1318,200507,24,1330,1193686,5461275,CALIFORNIA,6,2005,July,Flash Flood,C,71,SAN BERNARDINO,SGX,24-JUL-05 13:18:00,PST,24-JUL-05 13:30:00,0,0,0,0,20K,,TRAINED SPOTTER,,,,,,,,,,,,,,FOREST FALLS,,,FOREST FALLS,34.08333,-116.91667,34.08333,-116.91667,,The town of Forest Falls was cut off from highway 38 when 3 mudslides came down across Valley of the Falls Dr. Each mudslide was about 3 to 4 feet deep.,PDS
200507,24,1330,200507,24,1345,1193687,5461276,CALIFORNIA,6,2005,July,Flash Flood,C,71,SAN BERNARDINO,SGX,24-JUL-05 13:30:00,PST,24-JUL-05 13:45:00,0,0,0,0,5K,,AMATEUR RADIO,,,,,,,,,,,,,,PHELAN,,,PHELAN,34.41667,-117.56667,34.41667,-117.56667,,Between 8 and 12 inches of water and mud reported rushing over Balde Mesa Rd.,PDS
200507,24,1445,200507,24,1445,1193688,5461277,CALIFORNIA,6,2005,July,Thunderstorm Wind,C,65,RIVERSIDE,SGX,24-JUL-05 14:45:00,PST,24-JUL-05 14:45:00,0,0,0,0,1K,,GENERAL PUBLIC,50,EG,,,,,,,,,,3,SW,SUN CITY,3,SW,SUN CITY,33.66667,-117.23333,33.66667,-117.23333,"Thunderstorms fired for the second straight day along the Elsinore Convergence Zone, only this time with less severity. These thunderstorms produced heavy rain, pea size hail, and isolated wind damage. Flooding problems were reported in Hemet and surrounding areas.",A fence was blown over in Canyon Lake.,PDS
200507,30,1200,200507,30,1230,1193691,5461514,CALIFORNIA,6,2005,July,Flash Flood,C,65,RIVERSIDE,SGX,30-JUL-05 12:00:00,PST,30-JUL-05 12:30:00,0,0,0,0,5K,,TRAINED SPOTTER,,,,,,,,,,,,,,IDYLLWILD,,,IDYLLWILD,33.75,-116.71667,33.75,-116.71667,"An approaching mid-level trough, combined with steep lapse rates, surface dewpoints in the low to mid 70s, and precipitable water values of around 2 inches helped trigger severe thunderstorms across the mountains and deserts during the afternoon and evening hours of the 30th. The strongest storms formed over the San Bernardino Mountains where numerous reports of hail and flooding were received. This day marked the 11th straight day of thunderstorms in the San Diego CWA.",A flash flood in the Fern Valley area left boulders scattered across the road.,PDS
200507,30,1215,200507,30,1245,1193691,5461515,CALIFORNIA,6,2005,July,Flash Flood,C,65,RIVERSIDE,SGX,30-JUL-05 12:15:00,PST,30-JUL-05 12:45:00,0,0,0,0,30K,,FIRE DEPT/RESCUE SQUAD,,,,,,,,,,,,,,BANNING,,,BANNING,33.93333,-116.88333,33.93333,-116.88333,"An approaching mid-level trough, combined with steep lapse rates, surface dewpoints in the low to mid 70s, and precipitable water values of around 2 inches helped trigger severe thunderstorms across the mountains and deserts during the afternoon and evening hours of the 30th. The strongest storms formed over the San Bernardino Mountains where numerous reports of hail and flooding were received. This day marked the 11th straight day of thunderstorms in the San Diego CWA.",Thunderstorms produced very heavy rainfall in the Banning Pass and flooded some hangers at the Banning Airport.,PDS
200507,23,1325,200507,23,1325,1193684,5460705,CALIFORNIA,6,2005,July,Hail,C,65,RIVERSIDE,SGX,23-JUL-05 13:25:00,PST,23-JUL-05 13:25:00,0,0,0,0,,,TRAINED SPOTTER,0.75,,,,,,,,,,,,,SAN JACINTO,,,SAN JACINTO,33.78333,-116.95,33.78333,-116.95,"A severe thunderstorm rapidly developed just before 2:00 PM northeast of Hemet along the Elsinore Convergence Zone. This storm produced a tornado, damaging straight line winds to 70 mph, dime to nickel size hail, and flash flooding. The storm traveled southwestward along the Elsinore Convergence Zone before dissipating near interstate 15 in Murrieta. The majority of the reported damage consisted of downed trees and flooded roads and property.",Hail ranging in size from 1/4 to 3/4 inch in diameter was reported in San Jacinto.,PDS
200507,31,1154,200507,31,1254,1193693,5461743,CALIFORNIA,6,2005,July,Flash Flood,C,73,SAN DIEGO,SGX,31-JUL-05 11:54:00,PST,31-JUL-05 12:54:00,0,0,0,0,20K,,DEPT OF HIGHWAYS,,,,,,,,,,,,6,W,RANCHITA,6,W,RANCHITA,33.21667,-116.63333,33.21667,-116.63333,,Flash flooding and mud flows reported on San Felipe Rd at Montezuma Valley Rd in the old Matiguay burn area.,PDS
200507,23,1400,200507,23,1405,1193684,5460706,CALIFORNIA,6,2005,July,Thunderstorm Wind,C,65,RIVERSIDE,SGX,23-JUL-05 14:00:00,PST,23-JUL-05 14:05:00,0,0,0,0,15K,,FIRE DEPT/RESCUE SQUAD,61,EG,,,,,,,,,,,,HEMET,,,HEMET,33.73333,-116.96667,33.73333,-116.96667,"A severe thunderstorm rapidly developed just before 2:00 PM northeast of Hemet along the Elsinore Convergence Zone. This storm produced a tornado, damaging straight line winds to 70 mph, dime to nickel size hail, and flash flooding. The storm traveled southwestward along the Elsinore Convergence Zone before dissipating near interstate 15 in Murrieta. The majority of the reported damage consisted of downed trees and flooded roads and property.",The fire department estimated a thunderstorm wind gust between 60 and 70 mph and trees down in Hemet.,PDS
200507,23,1255,200507,23,1325,1193684,5460707,CALIFORNIA,6,2005,July,Heavy Rain,C,65,RIVERSIDE,SGX,23-JUL-05 12:55:00,PST,23-JUL-05 13:25:00,0,0,0,0,,,TRAINED SPOTTER,1.5,,,,,,,,,,,,,SAN JACINTO,,,SAN JACINTO,,,,,"A severe thunderstorm rapidly developed just before 2:00 PM northeast of Hemet along the Elsinore Convergence Zone. This storm produced a tornado, damaging straight line winds to 70 mph, dime to nickel size hail, and flash flooding. The storm traveled southwestward along the Elsinore Convergence Zone before dissipating near interstate 15 in Murrieta. The majority of the reported damage consisted of downed trees and flooded roads and property.",A trained spotter measured 1.50 inches of rain from a thunderstorm in 30 minutes.,PDS
200507,24,1526,200507,24,1535,1193688,5461279,CALIFORNIA,6,2005,July,Flash Flood,C,65,RIVERSIDE,SGX,24-JUL-05 15:26:00,PST,24-JUL-05 15:35:00,0,0,0,0,5K,,AMATEUR RADIO,,,,,,,,,,,,,,HEMET,,,HEMET,33.73333,-116.96667,33.73333,-116.96667,"Thunderstorms fired for the second straight day along the Elsinore Convergence Zone, only this time with less severity. These thunderstorms produced heavy rain, pea size hail, and isolated wind damage. Flooding problems were reported in Hemet and surrounding areas.",Flash Flooding was reported in Hemet at Sanford St. and Florida St.,PDS
200507,24,1608,200507,24,1648,1193689,5461280,CALIFORNIA,6,2005,July,Heavy Rain,C,73,SAN DIEGO,SGX,24-JUL-05 16:08:00,PST,24-JUL-05 16:48:00,0,0,0,0,,,"AWOS,ASOS,MESONET,ETC",2.3,,,,,,,,,,,7,ENE,PINE VLY,7,ENE,PINE VLY,,,,,"With strong afternoon thunderstorms in rural areas for days, one thunderstorm finally drifted over the Mount Laguna alert gage and provided the NWS with critical ground truth regarding Doppler Radar indicated heavy rainfall rates. Few reports of flooding were ever received as many of the thunderstorms remained over rural areas of the mountains and deserts.",The Mount Laguna alert gage recorded 2.30 inches of rain in 40 minutes from a nearly stationary thunderstorm.,PDS
200507,31,1215,200507,31,1300,1193693,5461744,CALIFORNIA,6,2005,July,Flash Flood,C,71,SAN BERNARDINO,SGX,31-JUL-05 12:15:00,PST,31-JUL-05 13:00:00,0,0,0,0,,,DEPT OF HIGHWAYS,,,,,,,,,,,,,,BIG BEAR CITY,,,BIG BEAR CITY,34.26667,-116.85,34.26667,-116.85,,Flash flooding reported along highway 38 at Mountain View.,PDS
200507,31,1222,200507,31,1222,1193693,5461745,CALIFORNIA,6,2005,July,Lightning,C,73,SAN DIEGO,SGX,31-JUL-05 12:22:00,PST,31-JUL-05 12:22:00,0,0,0,0,,,FIRE DEPT/RESCUE SQUAD,,,,,,,,,,,,,,RAMONA,,,RAMONA,,,,,,Lightning ignited 3 fires on Orosco Ridge in the Ramona area. The fires burned 20 acres.,PDS
200507,23,230,200507,23,345,1193694,5461746,CALIFORNIA,6,2005,July,Heavy Rain,C,73,SAN DIEGO,SGX,23-JUL-05 02:30:00,PST,23-JUL-05 03:45:00,0,0,0,0,,,OFFICIAL NWS OBS.,0.75,,,,,,,,,,,,,VISTA,,,VISTA,,,,,,"Many residents in San Diego County awoke during the early morning hours of the 23rd to the sound of heavy rain and thunder as tropical moisture associated with the remnants of former hurricane Emily brought widespread thunderstorms from the desert to the coast. The Cooperative Observer in Vista measured 0.75 inches of rain and reported that lightning had sparked some fires. A nearby trained spotter measured 0.70 inches in 30 minutes. Considerable debris cloudiness would limit thunderstorm activity in San Diego County that afternoon, however much stronger heating and instability to the north triggered severe thunderstorms in Riverside County.",PDS
200507,23,100,200507,23,600,1193694,5461747,CALIFORNIA,6,2005,July,Lightning,C,73,SAN DIEGO,SGX,23-JUL-05 01:00:00,PST,23-JUL-05 06:00:00,0,0,0,0,10K,,NEWSPAPER,,,,,,,,,,,,,,JULIAN,,,JULIAN,,,,,,Lightning sparked about 15 fires across the county and burned 150 acres.,PDS
200507,31,1205,200507,31,1235,1193059,5458428,CALIFORNIA,6,2005,July,Flash Flood,C,71,SAN BERNARDINO,VEF,31-JUL-05 12:05:00,PST,31-JUL-05 12:35:00,0,0,0,0,,,PARK/FOREST SERVICE,,,,,,,,,,,,,,CIMA,,,CIMA,35.23333,-115.5,35.23333,-115.5,,Some roads impassable in the Mojave National Preserve.,PDS
200507,31,1320,200507,31,1420,1193060,5458429,CALIFORNIA,6,2005,July,Flash Flood,C,71,SAN BERNARDINO,VEF,31-JUL-05 13:20:00,PST,31-JUL-05 14:20:00,0,0,0,0,,,TRAINED SPOTTER,,,,,,,,,,,,4,W,YUCCA VLY,4,W,YUCCA VLY,34.11667,-116.51667,34.11667,-116.51667,,"Water, mud, and rocks across Highway 62 between Yucca Valley and Morongo Valley.",PDS
200507,24,1224,200507,24,1321,1193695,5461748,CALIFORNIA,6,2005,July,Flash Flood,C,71,SAN BERNARDINO,SGX,24-JUL-05 12:24:00,PST,24-JUL-05 13:21:00,0,0,0,0,,,AMATEUR RADIO,,,,,,,,,,,,,,APPLE VLY,,,APPLE VLY,34.51667,-117.2,34.53333,-117.3,,"Flooding problems were reported on roads and washes in the Victorville area. One fire station in Victorville measured 5.58 inches of rain from sporadic thunderstorms during a 12 hour period. Roads near highway 18 in Apple Valley became rivers after thunderstorms dropped heavy rain in a short amount of time. Debris left in the wake of flash flooding consisted of chunks of pavement, rocks, and mud.",PDS
200507,24,1306,200507,24,1342,1193696,5461749,CALIFORNIA,6,2005,July,Heavy Rain,C,73,SAN DIEGO,SGX,24-JUL-05 13:06:00,PST,24-JUL-05 13:42:00,0,0,0,0,,,TRAINED SPOTTER,0.72,,,,,,,,,,,,,JULIAN,,,JULIAN,,,,,,A 36 minute rainfall total of 0.72 inches was measured just north of Lake Cuyamaca.,PDS
200507,30,1223,200507,30,1223,1193691,5461519,CALIFORNIA,6,2005,July,Hail,C,71,SAN BERNARDINO,SGX,30-JUL-05 12:23:00,PST,30-JUL-05 12:23:00,0,0,0,0,,,TRAINED SPOTTER,0.75,,,,,,,,,,,,,BIG BEAR CITY,,,BIG BEAR CITY,34.26667,-116.85,34.26667,-116.85,"An approaching mid-level trough, combined with steep lapse rates, surface dewpoints in the low to mid 70s, and precipitable water values of around 2 inches helped trigger severe thunderstorms across the mountains and deserts during the afternoon and evening hours of the 30th. The strongest storms formed over the San Bernardino Mountains where numerous reports of hail and flooding were received. This day marked the 11th straight day of thunderstorms in the San Diego CWA.",A trained spotter in Big Bear City observed 3/4 inch hail and measured 1.06 inches of rain in 30 minutes during a thunderstorm. Heavy rain and hail also resulted flash flooding.,PDS
200507,5,1300,200507,9,1700,1193692,5461520,CALIFORNIA,6,2005,July,Wildfire,Z,42,W/S ORANGE,SGX,05-JUL-05 13:00:00,PST,09-JUL-05 17:00:00,8,0,0,0,,,FIRE DEPT/RESCUE SQUAD,,,,,,,,,,,,,,,,,,,,,,,"A fire in Yorba Linda burned 1,078 acres. There were 8 firefighters injured while fighting the fire.",PDS
200507,22,1328,200507,22,1400,1193683,5460700,CALIFORNIA,6,2005,July,Flash Flood,C,71,SAN BERNARDINO,SGX,22-JUL-05 13:28:00,PST,22-JUL-05 14:00:00,0,0,0,0,,,AMATEUR RADIO,,,,,,,,,,,,,,BIG BEAR CITY,,,BIG BEAR CITY,34.26667,-116.85,34.26667,-116.85,,Flash flooding and pea size hail from a thunderstorm was reported along highway 18 near eagle point.,PDS
200507,22,1108,200507,22,1500,1193683,5460701,CALIFORNIA,6,2005,July,Lightning,C,71,SAN BERNARDINO,SGX,22-JUL-05 11:08:00,PST,22-JUL-05 15:00:00,0,0,0,0,,,NEWSPAPER,,,,,,,,,,,,4,SW,BIG BEAR LAKE,4,SW,BIG BEAR LAKE,,,,,,"Lightning sparked a 30-acre brush fire east of Manzanita Flats in Bear Creek. About 200 firefighters, four air tankers, five helicopters, and 13 fire engines were used to fight the fire.",PDS
200507,23,1321,200507,23,1321,1193684,5460704,CALIFORNIA,6,2005,July,Hail,C,65,RIVERSIDE,SGX,23-JUL-05 13:21:00,PST,23-JUL-05 13:21:00,0,0,0,0,,,TRAINED SPOTTER,0.75,,,,,,,,,,,,,HEMET,,,HEMET,33.73333,-116.96667,33.73333,-116.96667,"A severe thunderstorm rapidly developed just before 2:00 PM northeast of Hemet along the Elsinore Convergence Zone. This storm produced a tornado, damaging straight line winds to 70 mph, dime to nickel size hail, and flash flooding. The storm traveled southwestward along the Elsinore Convergence Zone before dissipating near interstate 15 in Murrieta. The majority of the reported damage consisted of downed trees and flooded roads and property.",A trained spotter reported hail slightly larger than dime size in Hemet.,PDS
