BEGIN_YEARMONTH,BEGIN_DAY,BEGIN_TIME,END_YEARMONTH,END_DAY,END_TIME,EPISODE_ID,EVENT_ID,STATE,STATE_FIPS,YEAR,MONTH_NAME,EVENT_TYPE,CZ_TYPE,CZ_FIPS,CZ_NAME,WFO,BEGIN_DATE_TIME,CZ_TIMEZONE,END_DATE_TIME,INJURIES_DIRECT,INJURIES_INDIRECT,DEATHS_DIRECT,DEATHS_INDIRECT,DAMAGE_PROPERTY,DAMAGE_CROPS,SOURCE,MAGNITUDE,MAGNITUDE_TYPE,FLOOD_CAUSE,CATEGORY,TOR_F_SCALE,TOR_LENGTH,TOR_WIDTH,TOR_OTHER_WFO,TOR_OTHER_CZ_STATE,TOR_OTHER_CZ_FIPS,TOR_OTHER_CZ_NAME,BEGIN_RANGE,BEGIN_AZIMUTH,BEGIN_LOCATION,END_RANGE,END_AZIMUTH,END_LOCATION,BEGIN_LAT,BEGIN_LON,END_LAT,END_LON,EPISODE_NARRATIVE,EVENT_NARRATIVE,DATA_SOURCE
200002,13,2130,200002,14,400,1091749,5134640,CALIFORNIA,6,2000,February,Flash Flood,C,85,SANTA CLARA,MTR,13-FEB-00 21:30:00,PST,14-FEB-00 04:00:00,0,0,0,0,,,"AWOS,ASOS,MESONET,ETC",,,,,,,,,,,,,,COYOTE,,,COYOTE,,,,,"Widespread rain with twenty four hour accumulations of more than 5 inches occured over the area on Feb 13 into February 14th. Urban and small stream  flooding occured in nost counties of the area. Many roads including Hwy 1 and Hwy 116 were closed. Hwy 129 was closed by a mudslide in Santa Cruz County. 29 people were evacuated in Pescadero due to high waters.  . A number of houses in Daly City had to be abandoned and eventually distroyed due to mudslides which were a result of the consecutive years of above average rain. Winds of more than 50 mph were recorded in Marin county and a number of trees were downed knocking out power to as many as 42,000 residents throughout the bay area. A tree blew down into one residence causing in excess of $250,000 damage. there were no deaths and only minor injuries.the russian river in sonoma county reached near flood stage but, damage was confined to low lying areas near the river such as some trailers and camping areas near forestville. Numerous traffic accidents and flight delays at SFO occurred during the storm.",,PDC
200002,28,1405,200002,29,445,1091671,5134959,CALIFORNIA,6,2000,February,Heavy Snow,Z,82,SOUTH CENTRAL SISKIYOU COUNTY,MFR,28-FEB-00 14:05:00,PST,29-FEB-00 04:45:00,0,0,0,0,,,OFFICIAL NWS OBS.,,,,,,,,,,,,,,,,,,,,,,"A Heavy Snow Warning was issued for Northern California zones CAZ081 (Central Siskiyou County) and CAZ082 (South Central Siskiyou County) above 3500 feet at 1405 PST on 02/28/00 and cancelled at 0445 PST on 02/29/00.  Unfortunately, no verifying observations were received, this was probably partially due to the high elevation of the snow level.",See below,PDC
200003,5,1810,200003,6,130,1092629,5136030,CALIFORNIA,6,2000,March,Winter Storm,Z,58,SAN DIEGO COUNTY MOUNTAINS,SGX,05-MAR-00 18:10:00,PST,06-MAR-00 01:30:00,13,0,3,0,50K,,NEWSPAPER,,,,,,,,,,,,,,,,,,,,,,"A winter storm started out on the evening of Saturday, March 4 with heavy wet snow at the higher elevations and heavy rain and flooding at the lower elevations. Sustained 40 knot winds overnight caused heavy surf and several boats to lose their anchorage. On Sunday, March 5, strong winds continued to cause damage to trees and power lines. Participants in outdoor athletic events Sunday morning, March 5, developed hypothermia. Later outdoor events were cancelled. As reinforcing cold air arrived Sunday night, the snow level lowered dramatically, trapping at least 30 people in the wilderness areas of the San Diego Mountains, closing highways and freeways with seven inches of snow in the passes. Three people died and another thirteen were hospitalized for hypothermia. At the 6500 foot level, seventeen inches snow fell in less than 24 hours. Blizzard conditions were reported throughout the Southwest California Mountains.",,PDC
200003,7,1045,200003,7,1055,1092634,5136122,CALIFORNIA,6,2000,March,Waterspout,C,59,ORANGE,SGX,07-MAR-00 10:45:00,PST,07-MAR-00 10:55:00,0,0,0,0,,,FIRE DEPT/RESCUE SQUAD,,,,,,,,,,,,10,W,SAN CLEMENTE,10,W,SAN CLEMENTE,,,,,,,PDC
200003,8,700,200003,8,1400,1092635,5136123,CALIFORNIA,6,2000,March,Flood,C,65,RIVERSIDE,SGX,08-MAR-00 07:00:00,PST,08-MAR-00 14:00:00,4,0,2,0,60K,,NEWSPAPER,,,,,,,,,,,,,,ELSINORE,,,ELSINORE,,,,,"Heavy rains most of the morning, flooded roads across Orange County and Western Riverside County. The deaths and injuries resulted from a traffic accident during an afternoon downpour.",,PDC
200003,8,500,200003,8,1100,1092635,5136124,CALIFORNIA,6,2000,March,Flood,C,59,ORANGE,SGX,08-MAR-00 05:00:00,PST,08-MAR-00 11:00:00,0,0,0,0,,,NEWSPAPER,,,,,,,,,,,,,,COUNTYWIDE,,,COUNTYWIDE,,,,,"Heavy rains most of the morning, flooded roads across Orange County and Western Riverside County. The deaths and injuries resulted from a traffic accident during an afternoon downpour.",,PDC
200002,20,1600,200002,21,945,1091694,5134993,CALIFORNIA,6,2000,February,Winter Storm,Z,97,TULARE CTY MTNS,HNX,20-FEB-00 16:00:00,PST,21-FEB-00 09:45:00,0,0,0,0,,,PARK/FOREST SERVICE,,,,,,,,,,,,,,,,,,,,,,"Lodgepole received 8 inches of new snow in 12 hours; Mammoth had 12 inches overnight. In addition, gusty wind caused a loss of power to about 8500 customers in the Southern Sierra Nevada between Mariposa and Madera Counties.",,PDC
200003,5,630,200003,5,930,1092629,5136031,CALIFORNIA,6,2000,March,High Wind,Z,42,ORANGE COUNTY COASTAL PLAIN,SGX,05-MAR-00 06:30:00,PST,05-MAR-00 09:30:00,15,0,0,0,125K,,NEWSPAPER,45,E,,,,,,,,,,,,,,,,,,,,"A winter storm started out on the evening of Saturday, March 4 with heavy wet snow at the higher elevations and heavy rain and flooding at the lower elevations. Sustained 40 knot winds overnight caused heavy surf and several boats to lose their anchorage. On Sunday, March 5, strong winds continued to cause damage to trees and power lines. Participants in outdoor athletic events Sunday morning, March 5, developed hypothermia. Later outdoor events were cancelled. As reinforcing cold air arrived Sunday night, the snow level lowered dramatically, trapping at least 30 people in the wilderness areas of the San Diego Mountains, closing highways and freeways with seven inches of snow in the passes. Three people died and another thirteen were hospitalized for hypothermia. At the 6500 foot level, seventeen inches snow fell in less than 24 hours. Blizzard conditions were reported throughout the Southwest California Mountains.",,PDC
200003,5,902,200003,5,902,1092629,5136032,CALIFORNIA,6,2000,March,High Wind,Z,43,SAN DIEGO COUNTY COASTS,SGX,05-MAR-00 09:02:00,PST,05-MAR-00 09:02:00,0,0,0,0,30K,20K,TRAINED SPOTTER,52,M,,,,,,,,,,,,,,,,,,,,"A winter storm started out on the evening of Saturday, March 4 with heavy wet snow at the higher elevations and heavy rain and flooding at the lower elevations. Sustained 40 knot winds overnight caused heavy surf and several boats to lose their anchorage. On Sunday, March 5, strong winds continued to cause damage to trees and power lines. Participants in outdoor athletic events Sunday morning, March 5, developed hypothermia. Later outdoor events were cancelled. As reinforcing cold air arrived Sunday night, the snow level lowered dramatically, trapping at least 30 people in the wilderness areas of the San Diego Mountains, closing highways and freeways with seven inches of snow in the passes. Three people died and another thirteen were hospitalized for hypothermia. At the 6500 foot level, seventeen inches snow fell in less than 24 hours. Blizzard conditions were reported throughout the Southwest California Mountains.",,PDC
200002,27,800,200002,27,2359,1091701,5135009,CALIFORNIA,6,2000,February,Flood,C,43,MARIPOSA,HNX,27-FEB-00 08:00:00,PST,27-FEB-00 23:59:00,0,0,0,0,,,LAW ENFORCEMENT,,,,,,,,,,,,,,MARIPOSA,,,MARIPOSA,,,,,"Minor flooding and ponding problems were reported with serveral secondary roads closed to heavy rain (and snow at the higher elevations).  Several secondary roads were closed by the Mariposa Sheriff as area streams ran bankfull. Significant precipitation occurred along the Southern Sierra Nevada including the foothill areas from Mariposa through Tulare County. On the San Joaquin Valley floor ..especially around the city of Fresno.. the steady rain continued with 1.87"" of rain in a 24-hour period setting a new record for the date by eclipsing the old one of 1.03"" in 1904.",,PDC
200002,28,1405,200002,29,445,1091671,5134958,CALIFORNIA,6,2000,February,Heavy Snow,Z,81,CENTRAL SISKIYOU COUNTY,MFR,28-FEB-00 14:05:00,PST,29-FEB-00 04:45:00,0,0,0,0,,,OFFICIAL NWS OBS.,,,,,,,,,,,,,,,,,,,,,,"A Heavy Snow Warning was issued for Northern California zones CAZ081 (Central Siskiyou County) and CAZ082 (South Central Siskiyou County) above 3500 feet at 1405 PST on 02/28/00 and cancelled at 0445 PST on 02/29/00.  Unfortunately, no verifying observations were received, this was probably partially due to the high elevation of the snow level.",See below,PDC
200003,3,1830,200003,3,1830,1092628,5136026,CALIFORNIA,6,2000,March,Lightning,C,65,RIVERSIDE,SGX,03-MAR-00 18:30:00,PST,03-MAR-00 18:30:00,3,0,0,0,,10K,NEWSPAPER,,,,,,,,,,,,,,NORCO,,,NORCO,,,,,"A thunderstorm moved east across Orange County and the Inland Empire. Lightning struck a boat docked in Newport Beach, but the resulting fire was quickly extinquished. Several power transformers were also struck as the thunderstorm moved inland, resulting in power outages to 6300 customers in Orange County. In Riverside County, lightning struck a 50 foot pine tree just as a car was passing by. Three occupants felt the electricity course through their bodies and the heat from the lightning strike.",,PDC
200002,29,400,200002,29,2000,1091703,5135115,CALIFORNIA,6,2000,February,Heavy Snow,Z,97,TULARE CTY MTNS,HNX,29-FEB-00 04:00:00,PST,29-FEB-00 20:00:00,0,0,0,0,,,PARK/FOREST SERVICE,,,,,,,,,,,,,,,,,,,,,,Tuolumne Meadows and Mammoth Mountain both reported an additional 6 inches of new snow.,,PDC
200002,13,0,200002,13,2359,1091704,5135116,CALIFORNIA,6,2000,February,Heavy Rain,Z,90,E CENTRAL SJ VALLEY,HNX,13-FEB-00 00:00:00,PST,13-FEB-00 23:59:00,0,0,0,0,,,OFFICIAL NWS OBS.,,,,,,,,,,,,,,,,,,,,,,"The San Joaquin Valley floor received 2/3rds of an inch of rain during the rain episode resulting in its typical flooded streets. Fresno reached 5.59"" of water-year rain by the afternoon of the 13th ... 87% of normal for the date...and ended with 1.08"" for the 24-hour period.  This broke the old rain record for-the-date of 0.80"" set in 1936. Fresno's 4-day rainfall total ending on the 13th was 2.08"".",,PDC
200002,11,2000,200002,12,735,1091689,5134983,CALIFORNIA,6,2000,February,Winter Storm,Z,96,S SIERRA MTNS,HNX,11-FEB-00 20:00:00,PST,12-FEB-00 07:35:00,0,0,0,0,,,PARK/FOREST SERVICE,,,,,,,,,,,,,,,,,,,,,,"Reported snow amounts as precipitation again spread over Interior Central California (and thereby continued relatively consistent through the end of the month) were: Tuolumne Meadows 11 inches new snow, Lodgepole 14 inches, and Mammoth Mountain 38 inches.",,PDC
200002,11,2000,200002,12,735,1091689,5134984,CALIFORNIA,6,2000,February,Winter Storm,Z,97,TULARE CTY MTNS,HNX,11-FEB-00 20:00:00,PST,12-FEB-00 07:35:00,0,0,0,0,,,PARK/FOREST SERVICE,,,,,,,,,,,,,,,,,,,,,,"Reported snow amounts as precipitation again spread over Interior Central California (and thereby continued relatively consistent through the end of the month) were: Tuolumne Meadows 11 inches new snow, Lodgepole 14 inches, and Mammoth Mountain 38 inches.",,PDC
200002,13,900,200002,14,2359,1091690,5134985,CALIFORNIA,6,2000,February,Winter Storm,Z,96,S SIERRA MTNS,HNX,13-FEB-00 09:00:00,PST,14-FEB-00 23:59:00,0,0,0,0,,,PARK/FOREST SERVICE,,,,,,,,,,,,,,,,,,,,,,Tuolumne Meadows had 24 inches of new snow and Mammoth Mountain reported 40 inches additional snow through the 14th.,,PDC
200002,13,900,200002,14,2359,1091690,5134986,CALIFORNIA,6,2000,February,Winter Storm,Z,97,TULARE CTY MTNS,HNX,13-FEB-00 09:00:00,PST,14-FEB-00 23:59:00,0,0,0,0,,,PARK/FOREST SERVICE,,,,,,,,,,,,,,,,,,,,,,Tuolumne Meadows had 24 inches of new snow and Mammoth Mountain reported 40 inches additional snow through the 14th.,,PDC
200002,22,1600,200002,24,200,1091698,5135001,CALIFORNIA,6,2000,February,Winter Storm,Z,96,S SIERRA MTNS,HNX,22-FEB-00 16:00:00,PST,24-FEB-00 02:00:00,0,0,0,0,,,TRAINED SPOTTER,,,,,,,,,,,,,,,,,,,,,,"Reports of heavy snow in the high country as noted by the following:  Fish Camp 24 inches; Tuolumne Meadows 9""; Lodgepole 13""; Frazier Park 6""; Bear Valley 6""; and, Mammoth  Mountain 36"". Yosemite Valley received 1.30"" of rain from late on the 22nd through just early on the 23rd to start the event. Heavy snow was also reported in the Tehachapi Mountains the afternoon of the 23rd with snow restricting travel on Interstate-5, especially during the evening of the 23rd, and closing Tehachapi-Willow Springs Road. A high number vehicle accidents occurred on Kern County's San Joaquin Valley roads along with local flooding due to the steady rain during the afternoon of the 23rd. Edward AFB in the Kern Desert received 0.47"" of rain; Frazier Park in the mountains got 0.71"".",,PDC
200002,22,1600,200002,24,200,1091698,5135002,CALIFORNIA,6,2000,February,Winter Storm,Z,97,TULARE CTY MTNS,HNX,22-FEB-00 16:00:00,PST,24-FEB-00 02:00:00,0,0,0,0,,,TRAINED SPOTTER,,,,,,,,,,,,,,,,,,,,,,"Reports of heavy snow in the high country as noted by the following:  Fish Camp 24 inches; Tuolumne Meadows 9""; Lodgepole 13""; Frazier Park 6""; Bear Valley 6""; and, Mammoth  Mountain 36"". Yosemite Valley received 1.30"" of rain from late on the 22nd through just early on the 23rd to start the event. Heavy snow was also reported in the Tehachapi Mountains the afternoon of the 23rd with snow restricting travel on Interstate-5, especially during the evening of the 23rd, and closing Tehachapi-Willow Springs Road. A high number vehicle accidents occurred on Kern County's San Joaquin Valley roads along with local flooding due to the steady rain during the afternoon of the 23rd. Edward AFB in the Kern Desert received 0.47"" of rain; Frazier Park in the mountains got 0.71"".",,PDC
200002,20,1600,200002,21,945,1091694,5134992,CALIFORNIA,6,2000,February,Winter Storm,Z,96,S SIERRA MTNS,HNX,20-FEB-00 16:00:00,PST,21-FEB-00 09:45:00,0,0,0,0,25K,,PARK/FOREST SERVICE,,,,,,,,,,,,,,,,,,,,,,"Lodgepole received 8 inches of new snow in 12 hours; Mammoth had 12 inches overnight. In addition, gusty wind caused a loss of power to about 8500 customers in the Southern Sierra Nevada between Mariposa and Madera Counties.",,PDC
200002,14,1015,200002,14,1015,1091907,5135260,CALIFORNIA,6,2000,February,High Wind,Z,72,E NEVADA/E PLACER/E EL DORADO/NE ALPINE,REV,14-FEB-00 10:15:00,PST,14-FEB-00 10:15:00,0,0,0,0,0,,"AWOS,ASOS,MESONET,ETC",74,M,,,,,,,,,,,,,,,,,,,,,Tahoe Valley airport recorded a wind gust of 74 knots.,PDC
200002,14,1200,200002,15,600,1091908,5135261,CALIFORNIA,6,2000,February,Heavy Snow,Z,72,GREATER LAKE TAHOE AREA,REV,14-FEB-00 12:00:00,PST,15-FEB-00 06:00:00,0,0,0,0,0,,GENERAL PUBLIC,,,,,,,,,,,,,,,,,,,,,,,Sierra ski resorts reported storm totals ranging from 48-60 inches.,PDC
200002,22,915,200002,22,2115,1091909,5135262,CALIFORNIA,6,2000,February,Heavy Snow,Z,72,E NEVADA/E PLACER/E EL DORADO/NE ALPINE,REV,22-FEB-00 09:15:00,PST,22-FEB-00 21:15:00,0,0,0,0,0,,DEPT OF HIGHWAYS,,,,,,,,,,,,,,,,,,,,,,,California Department of Transportation reported 15 inches of new snow in a 12 hour period on top of Donner Summit.,PDC
200002,1,1,200002,29,2359,1091686,5135446,CALIFORNIA,6,2000,February,Heavy Rain,Z,90,E CENTRAL SJ VALLEY,HNX,01-FEB-00 00:01:00,PST,29-FEB-00 23:59:00,0,0,0,0,,,"AWOS,ASOS,MESONET,ETC",,,,,,,,,,,,,,,,,,,,,,"As indicated in the December 1999 report, Interior Central California had the 3rd driest start of its water year on record based on Fresno records. With the rain from mid-to-late January, rain again returned on February 9th to Central California and remained through the end of February onto March 8th.  The amount of rain that occurred in Fresno during the 52-day period from January 15th through March 8th, exceeded the yearly rainfall (10.60"") for only the 2nd time in history (having occurred previously in a benchmark water year of 1969). The key to this water-year recovery was the record-setting rainfall for February where Fresno received 6.11"" eclipsing the old 28-day February record of 5.97"" set in 1962.  This unusual recovery from near-drought to normal water-year rain/snow brought sufficient water supplies for the upcoming, typical summer drought.",,PDC
200002,3,1130,200002,3,1800,1091687,5135447,CALIFORNIA,6,2000,February,High Wind,Z,91,SW SJ VALLEY,HNX,03-FEB-00 11:30:00,PST,03-FEB-00 18:00:00,4,0,1,0,100K,,"AWOS,ASOS,MESONET,ETC",,,,,,,,,,,,,,,,,,,,,,Infrequent gusty wind occurred on this date in Central California.  Tehachapi and Frazier Park in the Kern County Mountains reported gusts of 45 knots. Bakersfield had gusts to 36 knots and Lemoore had sustained wind at 21 knots on the South San Joaquin Valley floor. Over 4500 power company customers in the South San Joaquin Valley lost power due to downed trees from Bakersfield to Taft along with several weather-related vehicle accidents ... including one with a fatality due to areas of blowing dust 5 mi SE of Shafter that lowered visiblity to near zero at 1220 PST.,,PDC
200002,3,1130,200002,3,1800,1091687,5135448,CALIFORNIA,6,2000,February,High Wind,Z,92,SE SJ VALLEY,HNX,03-FEB-00 11:30:00,PST,03-FEB-00 18:00:00,0,0,0,0,,,"AWOS,ASOS,MESONET,ETC",,,,,,,,,,,,,,,,,,,,,,Infrequent gusty wind occurred on this date in Central California.  Tehachapi and Frazier Park in the Kern County Mountains reported gusts of 45 knots. Bakersfield had gusts to 36 knots and Lemoore had sustained wind at 21 knots on the South San Joaquin Valley floor. Over 4500 power company customers in the South San Joaquin Valley lost power due to downed trees from Bakersfield to Taft along with several weather-related vehicle accidents ... including one with a fatality due to areas of blowing dust 5 mi SE of Shafter that lowered visiblity to near zero at 1220 PST.,,PDC
200003,19,1510,200003,20,400,1092591,5135600,CALIFORNIA,6,2000,March,High Wind,Z,5,SONOMA / MARIN,MTR,19-MAR-00 15:10:00,PST,20-MAR-00 04:00:00,0,0,0,0,,,"AWOS,ASOS,MESONET,ETC",72,M,,,,,,,,,,,,,,,,,,,,,,PDC
200003,19,1510,200003,20,400,1092591,5135601,CALIFORNIA,6,2000,March,High Wind,Z,6,SAN FRANCISCO,MTR,19-MAR-00 15:10:00,PST,20-MAR-00 04:00:00,0,0,0,0,,,OTHER FEDERAL AGENCY,40,E,,,,,,,,,,,,,,,,,,,,,,PDC
200003,19,1510,200003,20,400,1092591,5135602,CALIFORNIA,6,2000,March,High Wind,Z,75,SAN MATEO,MTR,19-MAR-00 15:10:00,PST,20-MAR-00 04:00:00,0,0,0,0,.25M,,"AWOS,ASOS,MESONET,ETC",71,M,,,,,,,,,,,,,,,,,,,,,,PDC
200002,20,2200,200002,21,400,1091695,5134994,CALIFORNIA,6,2000,February,Blizzard,Z,95,KERN CTY MTNS,HNX,20-FEB-00 22:00:00,PST,21-FEB-00 04:00:00,0,0,0,0,20K,,TRAINED SPOTTER,,,,,,,,,,,,,,,,,,,,,,A 70-knot gust of wind as 12:30 AM on the 21st damaged a glider and felled a 3-foot diameter tree at Mountain Valley Airport. Subsequent reports of roof damage from high wind was also received from the California City area in the Kern County Desert.  These wind reports were in conjunction with snowfall reported overnight in the Kern County Mountains at and above the 4000 foot elevation. Frazier Park received 5 inches of new snow with 2.19 inches of precipitation total.  There were several road closures in and leading out of the Tehachapi Valley due to snow accumulations. Winter Storm type conditons began as early as 5 PM and ended by 945 AM on the 21st.,,PDC
200002,10,1600,200002,11,1000,1091194,5134779,CALIFORNIA,6,2000,February,Heavy Snow,Z,4,UPPER TRINITY RIVER,EKA,10-FEB-00 16:00:00,PST,11-FEB-00 10:00:00,0,0,0,0,,,TRAINED SPOTTER,,,,,,,,,,,,,,,,,,,,,,,Nine inches of snow fell at the 2500 foot level near Coffee Creek.,PDC
200002,25,2000,200002,26,1600,1091197,5134785,CALIFORNIA,6,2000,February,Heavy Snow,Z,4,UPPER TRINITY RIVER,EKA,25-FEB-00 20:00:00,PST,26-FEB-00 16:00:00,0,0,0,0,,,TRAINED SPOTTER,,,,,,,,,,,,,,,,,,,,,,12 inches of snow fell in Northeast Trinity County at both Coffee Creek and Scott Mountain.,,PDC
200003,7,2200,200003,8,1000,1091955,5135372,CALIFORNIA,6,2000,March,Heavy Snow,Z,54,N LOS ANGELES T X N,LOX,07-MAR-00 22:00:00,PST,08-MAR-00 10:00:00,0,0,0,0,,,BROADCAST MEDIA,,,,,,,,,,,,,,,,,,,,,,"Another Pacific storm brought more snow to the mountains of Southern California. Snowfall totals ranged from 8 to 16 inches across the mountains. The snow forced the closure of Route 2, near Big Tujunga, for several hours.",,PDC
200002,3,1130,200002,3,1800,1091687,5135449,CALIFORNIA,6,2000,February,High Wind,Z,95,KERN CTY MTNS,HNX,03-FEB-00 11:30:00,PST,03-FEB-00 18:00:00,0,0,0,0,,,TRAINED SPOTTER,,,,,,,,,,,,,,,,,,,,,,Infrequent gusty wind occurred on this date in Central California.  Tehachapi and Frazier Park in the Kern County Mountains reported gusts of 45 knots. Bakersfield had gusts to 36 knots and Lemoore had sustained wind at 21 knots on the South San Joaquin Valley floor. Over 4500 power company customers in the South San Joaquin Valley lost power due to downed trees from Bakersfield to Taft along with several weather-related vehicle accidents ... including one with a fatality due to areas of blowing dust 5 mi SE of Shafter that lowered visiblity to near zero at 1220 PST.,,PDC
200002,8,737,200002,8,1000,1091688,5135450,CALIFORNIA,6,2000,February,Dense Fog,Z,89,W CENTRAL SJ VALLEY,HNX,08-FEB-00 07:37:00,PST,08-FEB-00 10:00:00,0,0,0,0,,,"AWOS,ASOS,MESONET,ETC",,,,,,,,,,,,,,,,,,,,,,"Visibilities dropped to less than 1/4 mile in dense fog with representative reports for surrounding areas at Merced, Madera, Fresno, Visalia, and Hanford.",,PDC
200002,20,1505,200002,20,2100,1091696,5134998,CALIFORNIA,6,2000,February,High Wind,Z,90,E CENTRAL SJ VALLEY,HNX,20-FEB-00 15:05:00,PST,20-FEB-00 21:00:00,0,0,0,0,100K,,DEPT OF HIGHWAYS,,,,,,,,,,,,,,,,,,,,,,Bakersfield/Meadows Field reported winds sustained at 32 knots and gusting to 43 knots at 1556 PST. California Highway Patrol closed some South San Joaquin Valley roads due to visibilities less than 50 feet in blowing dust.  Ohter locations with gusty wind included; Fresno G35 Kts at 1922L; Merced G31 Kts at 1925L; Madera G31 Kts at 1527L; Hanford G31 Kts at 1854L; and Visalia G35 Kts at 1915L.  CALTRANS reported trees down along Highway 198; and subsequent power outages occurred. Over 6000 customers lost power in the Fresno Area along with numerous reports of trees being blown down .. including some commercial fruit trees.,,PDC
200002,20,1505,200002,20,2100,1091696,5134999,CALIFORNIA,6,2000,February,High Wind,Z,89,W CENTRAL SJ VALLEY,HNX,20-FEB-00 15:05:00,PST,20-FEB-00 21:00:00,0,0,0,0,,,DEPT OF HIGHWAYS,,,,,,,,,,,,,,,,,,,,,,Bakersfield/Meadows Field reported winds sustained at 32 knots and gusting to 43 knots at 1556 PST. California Highway Patrol closed some South San Joaquin Valley roads due to visibilities less than 50 feet in blowing dust.  Ohter locations with gusty wind included; Fresno G35 Kts at 1922L; Merced G31 Kts at 1925L; Madera G31 Kts at 1527L; Hanford G31 Kts at 1854L; and Visalia G35 Kts at 1915L.  CALTRANS reported trees down along Highway 198; and subsequent power outages occurred. Over 6000 customers lost power in the Fresno Area along with numerous reports of trees being blown down .. including some commercial fruit trees.,,PDC
200002,21,50,200002,21,1200,1091697,5135000,CALIFORNIA,6,2000,February,Flood,C,29,KERN,HNX,21-FEB-00 00:50:00,PST,21-FEB-00 12:00:00,0,0,0,0,,,DEPT OF HIGHWAYS,,,,,,,,,,,,2,SE,TEHACHAPI,2,SE,TEHACHAPI,,,,,,Local road flooding with debris deposited on the roadway occurred in the Tehachapi Valley along Highline Road.,PDC
200002,14,830,200002,14,1400,1091195,5134780,CALIFORNIA,6,2000,February,Flood,Z,76,MENDOCINO INTERIOR,EKA,14-FEB-00 08:30:00,PST,14-FEB-00 14:00:00,0,0,0,0,,,EMERGENCY MANAGER,,,,,,,,,,,,,,,,,,,,,,Flooding of the Russian and Navarro Rivers closed nearby highways.,,PDC
200002,14,600,200002,14,1600,1091195,5134781,CALIFORNIA,6,2000,February,Flood,Z,2,MENDOCINO COAST,EKA,14-FEB-00 06:00:00,PST,14-FEB-00 16:00:00,0,0,0,0,,,EMERGENCY MANAGER,,,,,,,,,,,,,,,,,,,,,,Flooding of the Russian and Navarro Rivers closed nearby highways.,,PDC
200002,13,2230,200002,14,1000,1091196,5134782,CALIFORNIA,6,2000,February,High Wind,Z,1,REDWOOD COAST,EKA,13-FEB-00 22:30:00,PST,14-FEB-00 10:00:00,0,0,0,0,,,TRAINED SPOTTER,52,E,,,,,,,,,,,,,,,,,,,,"Strong winds and heavy rains caused numerous power outages, downed trees and light damage to fences and windows.  An oak tree in Ukiah blew down on a mobile home, killing the occupant.  The estimated 52 knot winds were in Myers Flat and the measured 57 knot wind was 9 miles north of Redway.",,PDC
200002,13,2230,200002,14,1000,1091196,5134783,CALIFORNIA,6,2000,February,High Wind,Z,3,NORTH COAST INTERIOR,EKA,13-FEB-00 22:30:00,PST,14-FEB-00 10:00:00,0,0,0,0,,,TRAINED SPOTTER,57,M,,,,,,,,,,,,,,,,,,,,"Strong winds and heavy rains caused numerous power outages, downed trees and light damage to fences and windows.  An oak tree in Ukiah blew down on a mobile home, killing the occupant.  The estimated 52 knot winds were in Myers Flat and the measured 57 knot wind was 9 miles north of Redway.",,PDC
200002,13,2230,200002,14,1000,1091196,5134784,CALIFORNIA,6,2000,February,High Wind,Z,76,MENDOCINO INTERIOR,EKA,13-FEB-00 22:30:00,PST,14-FEB-00 10:00:00,0,0,1,0,,,NEWSPAPER,50,E,,,,,,,,,,,,,,,,,,,,"Strong winds and heavy rains caused numerous power outages, downed trees and light damage to fences and windows.  An oak tree in Ukiah blew down on a mobile home, killing the occupant.  The estimated 52 knot winds were in Myers Flat and the measured 57 knot wind was 9 miles north of Redway.",,PDC
200002,14,800,200002,14,800,1091902,5135255,CALIFORNIA,6,2000,February,High Wind,Z,71,LASSEN/EASTERN PLUMAS/EASTERN SIERRA,REV,14-FEB-00 08:00:00,PST,14-FEB-00 08:00:00,0,0,0,0,0,,TRAINED SPOTTER,52,M,,,,,,,,,,,,,,,,,,,,,Spotter report of winds gusting to 60 mph in Pittville.,PDC
