BEGIN_YEARMONTH,BEGIN_DAY,BEGIN_TIME,END_YEARMONTH,END_DAY,END_TIME,EPISODE_ID,EVENT_ID,STATE,STATE_FIPS,YEAR,MONTH_NAME,EVENT_TYPE,CZ_TYPE,CZ_FIPS,CZ_NAME,WFO,BEGIN_DATE_TIME,CZ_TIMEZONE,END_DATE_TIME,INJURIES_DIRECT,INJURIES_INDIRECT,DEATHS_DIRECT,DEATHS_INDIRECT,DAMAGE_PROPERTY,DAMAGE_CROPS,SOURCE,MAGNITUDE,MAGNITUDE_TYPE,FLOOD_CAUSE,CATEGORY,TOR_F_SCALE,TOR_LENGTH,TOR_WIDTH,TOR_OTHER_WFO,TOR_OTHER_CZ_STATE,TOR_OTHER_CZ_FIPS,TOR_OTHER_CZ_NAME,BEGIN_RANGE,BEGIN_AZIMUTH,BEGIN_LOCATION,END_RANGE,END_AZIMUTH,END_LOCATION,BEGIN_LAT,BEGIN_LON,END_LAT,END_LON,EPISODE_NARRATIVE,EVENT_NARRATIVE,DATA_SOURCE
200501,26,1530,200501,26,1630,1184572,5438328,CALIFORNIA,6,2005,January,Lightning,C,19,FRESNO,HNX,26-JAN-05 15:30:00,PST,26-JAN-05 16:30:00,0,0,0,0,,,OFFICIAL NWS OBS.,,,,,,,,,,,,,,FRESNO,,,FRESNO,,,,,Thunderstorm activity on the 26th and 28th resulted in lightning strikes in and around the city of Fresno. Small hail accompanying the convective activity swept through the city of Fresno during the mid-afternoon of the 28th.,,PDS
200501,9,2100,200501,9,2130,1184756,5438137,CALIFORNIA,6,2005,January,Flood,Z,43,SAN DIEGO COUNTY COASTS,SGX,09-JAN-05 21:00:00,PST,09-JAN-05 21:30:00,0,0,0,0,80K,,NWS EMPLOYEE(OFF DUTY),,,,,,,,,,,,,,,,,,37.56667,-119.86667,37.56667,-119.86667,"Pacific Street in Oceanside washed out into the ocean after the San Luis Rey River flooded the crossing. The road was unable to handle the volume of water flowing under it, and caused the river to dam up behind the road. In addition, the road was partially weakened by high surf and high tides that had occurred during the previous days. Eventually, the river burst through the crossing and sent drainage pipes and chunks of asphalt onto the beach and into the ocean. The river was flowing about 150 feet wide as it entered the ocean. The San Luis Rey continued to flow at high volumes off and on for many weeks and caused further erosion and damage to Pacific Street.",,PDS
200501,9,2015,200501,9,2015,1184757,5438138,CALIFORNIA,6,2005,January,Flash Flood,C,65,RIVERSIDE,SGX,09-JAN-05 20:15:00,PST,09-JAN-05 20:15:00,0,0,0,0,20K,,TRAINED SPOTTER,,,,,,,,,,,,,,CORONA,,,CORONA,33.86667,-117.58333,33.86667,-117.58333,Several cars were stranded when Bedford Canyon flooded. The west side of Corona Airport was submerged under flood waters as well.,,PDS
200501,9,2100,200501,9,2130,1184758,5438139,CALIFORNIA,6,2005,January,Flash Flood,C,65,RIVERSIDE,SGX,09-JAN-05 21:00:00,PST,09-JAN-05 21:30:00,0,0,0,0,40K,,NEWSPAPER,,,,,,,,,,,,,,COACHELLA,,,COACHELLA,33.68333,-116.18333,33.68333,-116.18333,Numerous roads in the Coachella Valley were flooded and 3 swift water rescues had to be performed that night.,,PDS
200501,3,400,200501,4,900,1184726,5437995,CALIFORNIA,6,2005,January,Winter Storm,Z,56,RIVERSIDE COUNTY MOUNTAINS,SGX,03-JAN-05 04:00:00,PST,04-JAN-05 09:00:00,0,0,0,0,,,TRAINED SPOTTER,,,,,,,,,,,,,,,,,,,,,,"A cold storm brought heavy snow and strong winds to the local mountains. Snow fell as low as the 3000 ft level near places like Hesperia, the Cajon Pass, Descanso, Campo, and Warner Springs. Up to a foot of snow was reported at some higher elevations of the San Bernardino and Riverside County mountains, and up to 10 inches was reported in the San Diego County mountains. The temperature dropped to 9 degrees at Big Bear Lake by the morning of the 4th, and the lake completely froze over by the end of the storm.",,PDS
200501,3,400,200501,4,900,1184726,5437996,CALIFORNIA,6,2005,January,Winter Storm,Z,58,SAN DIEGO COUNTY MOUNTAINS,SGX,03-JAN-05 04:00:00,PST,04-JAN-05 09:00:00,0,0,0,0,,,TRAINED SPOTTER,,,,,,,,,,,,,,,,,,,,,,"A cold storm brought heavy snow and strong winds to the local mountains. Snow fell as low as the 3000 ft level near places like Hesperia, the Cajon Pass, Descanso, Campo, and Warner Springs. Up to a foot of snow was reported at some higher elevations of the San Bernardino and Riverside County mountains, and up to 10 inches was reported in the San Diego County mountains. The temperature dropped to 9 degrees at Big Bear Lake by the morning of the 4th, and the lake completely froze over by the end of the storm.",,PDS
200501,7,1200,200501,7,1600,1184563,5438246,CALIFORNIA,6,2005,January,Strong Wind,Z,92,SE S.J. VALLEY,HNX,07-JAN-05 12:00:00,PST,07-JAN-05 16:00:00,0,0,0,0,50K,,NEWSPAPER,65,EG,,,,,,,,,,,,,,,,,,,,,Power poles were downed in the Arvin Area due to strong wind that had gusts to 75 MPH.,PDS
200501,9,1106,200501,9,1106,1184759,5438140,CALIFORNIA,6,2005,January,Funnel Cloud,C,65,RIVERSIDE,SGX,09-JAN-05 11:06:00,PST,09-JAN-05 11:06:00,0,0,0,0,,,TRAINED SPOTTER,,,,,,,,,,,,1,W,MIRA LOMA,1,W,MIRA LOMA,,,,,,,PDS
200501,11,1100,200501,11,1300,1184760,5438141,CALIFORNIA,6,2005,January,Strong Wind,Z,61,C RIVERSIDE,SGX,11-JAN-05 11:00:00,PST,11-JAN-05 13:00:00,0,0,0,0,20K,,BROADCAST MEDIA,27,MG,,,,,,,,,,,,,,,,,,,,Strong winds blew down trees and power lines in the Palm Springs area.,,PDS
200501,10,2101,200501,10,2102,1184761,5438142,CALIFORNIA,6,2005,January,Debris Flow,Z,55,P SW SAN BERNARDINO,SGX,10-JAN-05 21:01:00,PST,10-JAN-05 21:02:00,0,0,0,0,25K,,DEPT OF HIGHWAYS,,,,,,,,,,,,,,,,,,,,,,Heavy rain sent very large rocks crashing onto Highway 38 about 9 miles southeast of Running Springs.,,PDS
200501,10,30,200501,10,35,1184762,5438143,CALIFORNIA,6,2005,January,Flash Flood,C,71,SAN BERNARDINO,SGX,10-JAN-05 00:30:00,PST,10-JAN-05 00:35:00,0,0,0,0,5K,,DEPT OF HIGHWAYS,,,,,,,,,,,,,,LAKE ARROWHEAD,,,LAKE ARROWHEAD,34.25,-117.18333,34.25,-117.18333,Roads were flooded at Lake Arrowhead.,,PDS
200501,9,1100,200501,11,1100,1184763,5438144,CALIFORNIA,6,2005,January,Flood,Z,48,SAN BERNARDINO COUNTY VALLEY/THE INLAND EMPIRE,SGX,09-JAN-05 11:00:00,PST,11-JAN-05 11:00:00,1,0,0,0,3M,,NEWSPAPER,,,,,,,,,,,,,,,,,,,,,,"Flooding along the Santa Ana River destroyed a barn, tractors, livestock, a house, bridges, 3 golf courses, and a sewer line. An estimated 2 to 3 million gallons of untreated sewage spilled into the river. One man had to be rescued after he fell in the river. The man was hospitalized for hypothermia and pelvic injuries.",,PDS
200501,9,1030,200501,9,1230,1184764,5438145,CALIFORNIA,6,2005,January,Flood,Z,42,W/S ORANGE,SGX,09-JAN-05 10:30:00,PST,09-JAN-05 12:30:00,0,0,0,0,75K,,NEWSPAPER,,,,,,,,,,,,,,,,,,,,,,Several homes and vehicles flooded near Placentia.,,PDS
200501,9,812,200501,10,900,1184566,5438310,CALIFORNIA,6,2005,January,Flood,Z,95,KERN CTY MTNS,HNX,09-JAN-05 08:12:00,PST,10-JAN-05 09:00:00,0,0,0,0,,,EMERGENCY MANAGER,,,,,,,,,,,,,,,,,,38.35,-121.95,38.35,-121.95,"Snow continued to accumulate at the higher elevations of the Southern Sierra Nevada, Tulare County Mountains, and the Kern Mountains from the 7th into the 11th: 18 inches of new snow at Tuolumne Meadows in the Southern Sierra Nevada and 19"" of new snow at Wet Meadows in the Tulare County Mountains in 24 hours from the 7th to the 8th. A fatality occurred near Kernville as a hiker succumbed to hypothermia. The series of storms systems continuing through the 11th brought impressive snow totals in the Southern Sierra Nevada and Tulare Mountains: 108"" at Ostrander Lake, West Woodchuck Meadow, and Pascoes; 103"" in at Upper Burnt Corral; 152"" at Farewell Gap; and 123"" at Wet Meadow.  In the Kern Mountains additional new snow of 8"" accumulated in Tehachapi Valley. Stream flooding with some secondary road flooding occurred in the Kern County Mountains west of Frazier Park (near Lockwood Valley) on the 9th and early on the 10th. The precipitation totals during this time period combined with above normal precipitation for October and December brought the seasonal snowpack in the Sierra to 101% of the yearly normal or 245% of the mid-January normal.",,PDS
200501,3,1200,200501,3,1200,1184725,5437993,CALIFORNIA,6,2005,January,Debris Flow,Z,58,SAN DIEGO T X W,SGX,03-JAN-05 12:00:00,PST,03-JAN-05 12:00:00,0,0,0,0,25K,,NEWSPAPER,,,,,,,,,,,,,,,,,,,,,,,A landslide precipitated by heavy rain deposited large boulders on Lake Wohlford Road and caused moderate damage to the pavement.,PDS
200501,3,400,200501,4,900,1184726,5437994,CALIFORNIA,6,2005,January,Winter Storm,Z,55,SAN BERNARDINO COUNTY MOUNTAINS,SGX,03-JAN-05 04:00:00,PST,04-JAN-05 09:00:00,0,0,0,0,,,TRAINED SPOTTER,,,,,,,,,,,,,,,,,,,,,,"A cold storm brought heavy snow and strong winds to the local mountains. Snow fell as low as the 3000 ft level near places like Hesperia, the Cajon Pass, Descanso, Campo, and Warner Springs. Up to a foot of snow was reported at some higher elevations of the San Bernardino and Riverside County mountains, and up to 10 inches was reported in the San Diego County mountains. The temperature dropped to 9 degrees at Big Bear Lake by the morning of the 4th, and the lake completely froze over by the end of the storm.",,PDS
200501,7,600,200501,7,1430,1184567,5438312,CALIFORNIA,6,2005,January,Strong Wind,Z,89,W CENTRAL S.J. VALLEY,HNX,07-JAN-05 06:00:00,PST,07-JAN-05 14:30:00,0,0,0,0,10K,,"AWOS,ASOS,MESONET,ETC",36,MG,,,,,,,,,,,,,,,,,,,,"Strong southeast pre-frontal winds buffeted Central California on the 7th. A truck-trailer was overturned from the high wind with areas of zero visibility and numerous power poles downed near Arvin in the South San Joaquin Valley on the7th. Wind speeds were commonly up to 45 MPH throughout the Central and South San Joaquin Valley with higher wind gusts in the far South and Southwest areas of the Valley. Even in the foothill areas of the Southern Sierra Nevada and Tulare County Mountains wind gusts up to 56 MPH were observed. Trees were commonly downed taking power lines with them from Merced and Mariposa Counties south through Kern County. Property damage was high due to large trees falling in the Merced, Fresno-Clovis, and Visalia areas. Agriculture suffered loss through numerous deciduous trees being uprooted.",,PDS
200501,28,1425,200501,28,1511,1184572,5438329,CALIFORNIA,6,2005,January,Lightning,C,19,FRESNO,HNX,28-JAN-05 14:25:00,PST,28-JAN-05 15:11:00,0,0,0,0,,,OFFICIAL NWS OBS.,,,,,,,,,,,,8,SW,(FAT) AIR TERMINAL,8,SW,(FAT) AIR TERMINAL,,,,,Thunderstorm activity on the 26th and 28th resulted in lightning strikes in and around the city of Fresno. Small hail accompanying the convective activity swept through the city of Fresno during the mid-afternoon of the 28th.,,PDS
200501,28,400,200501,29,400,1184573,5438330,CALIFORNIA,6,2005,January,Winter Weather,Z,96,S SIERRA MTNS,HNX,28-JAN-05 04:00:00,PST,29-JAN-05 04:00:00,0,0,0,0,,,PARK/FOREST SERVICE,,,,,,,,,,,,,,,,,,,,,,"Another weather system brought significant snow the higher elevations of Central California: 9"" new snow at Tuolumne Meadows overnight of the 8th; 7"" at Lodgepole in Tulare County; and 5"" at Frazier Park in Kern County.",,PDS
200501,28,400,200501,29,400,1184573,5438331,CALIFORNIA,6,2005,January,Winter Weather,Z,97,TULARE CTY MTNS,HNX,28-JAN-05 04:00:00,PST,29-JAN-05 04:00:00,0,0,0,0,,,PARK/FOREST SERVICE,,,,,,,,,,,,,,,,,,,,,,"Another weather system brought significant snow the higher elevations of Central California: 9"" new snow at Tuolumne Meadows overnight of the 8th; 7"" at Lodgepole in Tulare County; and 5"" at Frazier Park in Kern County.",,PDS
200501,28,1800,200501,29,400,1184573,5438332,CALIFORNIA,6,2005,January,Winter Weather,Z,95,KERN CTY MTNS,HNX,28-JAN-05 18:00:00,PST,29-JAN-05 04:00:00,0,0,0,0,,,TRAINED SPOTTER,,,,,,,,,,,,,,,,,,,,,,"Another weather system brought significant snow the higher elevations of Central California: 9"" new snow at Tuolumne Meadows overnight of the 8th; 7"" at Lodgepole in Tulare County; and 5"" at Frazier Park in Kern County.",,PDS
200502,19,1009,200502,19,1200,1185446,5441762,CALIFORNIA,6,2005,February,Flash Flood,C,59,ORANGE,SGX,19-FEB-05 10:09:00,PST,19-FEB-05 12:00:00,0,0,0,0,15K,,LAW ENFORCEMENT,,,,,,,,,,,,,,IRVINE,,,IRVINE,33.68333,-117.81667,33.68333,-117.81667,The canyon between the 405 Freeway and the 73 was extremely flooded by runoff from heavy rain.,,PDS
200502,19,1015,200502,19,1015,1185447,5441763,CALIFORNIA,6,2005,February,Thunderstorm Wind,C,59,ORANGE,SGX,19-FEB-05 10:15:00,PST,19-FEB-05 10:15:00,0,0,0,0,40K,,FIRE DEPT/RESCUE SQUAD,70,EG,,,,,,,,,,2,NNE,LAGUNA HILLS,2,NNE,LAGUNA HILLS,33.61667,-117.71667,33.61667,-117.71667,,"Strong thunderstorm winds blew down fences, trees, and damaged the roof of a mobile home.",PDS
200502,18,0,200502,18,2359,1185329,5442292,CALIFORNIA,6,2005,February,Heavy Rain,C,107,TULARE,HNX,18-FEB-05 00:00:00,PST,18-FEB-05 23:59:00,0,0,0,0,,,NEWSPAPER,,,,,,,,,,,,,,VISALIA,,,VISALIA,,,,,"A thunderstorm passed over Avenal late in the afternoon of the 18th with 1/2"" hail and very heavy rain reported. The city of Visalia had over 30 intersections between Tulare and Walnut Avenues around Central Street flooded due to persistent and locally heavy rain. Rainfall accumulations around Visalia for the 36-hour period ending late on the 18th were in excess of 1"".",,PDS
200502,15,109,200502,15,2356,1185315,5442190,CALIFORNIA,6,2005,February,Heavy Rain,C,19,FRESNO,HNX,15-FEB-05 01:09:00,PST,15-FEB-05 23:56:00,0,0,0,0,,,OFFICIAL NWS OBS.,,,,,,,,,,,,,,(FAT) AIR TERMINAL,,,(FAT) AIR TERMINAL,,,,,"The period from the 15th into the 22nd of the month marked a period of unsettled weather for Interior Central California. Rain occurred during this time period with some locally heavy rain showers or thundershowers. On the 15th Central California was particularly hard hit with much above normal daily rain amounts as Merced received 1.24"" during the 24-hour period, Madera 1.16"", and Fresno 0.92"". In the South San Joaquin Valley Bakersfield received 0.82"" on the 18th (a daily record), a contribution by an early evening thundershower. Resultant ponded and flowing water in the South San Joaquin Valley from the 15th to the 22nd caused major damage to area roads...including Wheeler Ridge Road 2.5 miles northeast of Mettler in the South Valley. Numerous reports of small stream and urban flooding occurred throughout Interior Central California during the wet period and specifically included localized flooding on the 15th in West Fresno City and Dos Palos in Fresno County and on Highway 41 north of Fresno in Madera County, and local road flooding around Bakersfield on the 18th.",,PDS
200502,21,1505,200502,21,1515,1185322,5442279,CALIFORNIA,6,2005,February,Hail,C,19,FRESNO,HNX,21-FEB-05 15:05:00,PST,21-FEB-05 15:15:00,0,0,0,0,,,TRAINED SPOTTER,0.75,,,,,,,,,,,3,N,KERMAN,3,N,KERMAN,36.76667,-120.06667,36.76667,-120.06667,Numerous reports of 3/4-inch hail in Fresno and Madera Counties between 1505 and 1715 PST on the 21st along with widespread thunderstorm activity in the Central and South San Joaquin Valley. Lightning struck within the city limits of Madera (West 4th Street between Hilton and Schnoor Avenues) during the afternoon thunderstorm.,,PDS
200502,21,1535,200502,21,1550,1185322,5442280,CALIFORNIA,6,2005,February,Hail,C,39,MADERA,HNX,21-FEB-05 15:35:00,PST,21-FEB-05 15:50:00,0,0,0,0,,,TRAINED SPOTTER,0.75,,,,,,,,,,,5,SW,MADERA,5,SW,MADERA,36.91667,-120.13333,36.91667,-120.13333,Numerous reports of 3/4-inch hail in Fresno and Madera Counties between 1505 and 1715 PST on the 21st along with widespread thunderstorm activity in the Central and South San Joaquin Valley. Lightning struck within the city limits of Madera (West 4th Street between Hilton and Schnoor Avenues) during the afternoon thunderstorm.,,PDS
200502,22,1500,200502,22,1500,1185458,5441777,CALIFORNIA,6,2005,February,Funnel Cloud,C,71,SAN BERNARDINO,SGX,22-FEB-05 15:00:00,PST,22-FEB-05 15:00:00,0,0,0,0,,,TRAINED SPOTTER,,,,,,,,,,,,15,N,VICTORVILLE,15,N,VICTORVILLE,,,,,,,PDS
200502,22,330,200502,22,430,1185459,5441778,CALIFORNIA,6,2005,February,Flash Flood,C,73,SAN DIEGO,SGX,22-FEB-05 03:30:00,PST,22-FEB-05 04:30:00,0,0,0,0,75K,,NEWSPAPER,,,,,,,,,,,,,,SAN DIEGO,,,SAN DIEGO,32.75,-117.1,32.75,-117.1,The first floor of a two story apartment building in City Heights completely flooded. Ten people had to be rescued from the second floor.,,PDS
200502,22,1745,200502,22,1845,1185460,5441779,CALIFORNIA,6,2005,February,Flash Flood,C,73,SAN DIEGO,SGX,22-FEB-05 17:45:00,PST,22-FEB-05 18:45:00,0,0,0,0,30K,,NEWSPAPER,,,,,,,,,,,,,,EL CAJON,,,EL CAJON,32.78333,-116.96667,32.78333,-116.96667,Several homes flooded.,,PDS
200502,21,1711,200502,21,1715,1185322,5442281,CALIFORNIA,6,2005,February,Hail,C,39,MADERA,HNX,21-FEB-05 17:11:00,PST,21-FEB-05 17:15:00,0,0,0,0,,,TRAINED SPOTTER,0.75,,,,,,,,,,,15,NE,MADERA,15,NE,MADERA,37.11667,-119.86667,37.11667,-119.86667,Numerous reports of 3/4-inch hail in Fresno and Madera Counties between 1505 and 1715 PST on the 21st along with widespread thunderstorm activity in the Central and South San Joaquin Valley. Lightning struck within the city limits of Madera (West 4th Street between Hilton and Schnoor Avenues) during the afternoon thunderstorm.,,PDS
200502,21,1540,200502,21,1540,1185322,5442282,CALIFORNIA,6,2005,February,Lightning,C,39,MADERA,HNX,21-FEB-05 15:40:00,PST,21-FEB-05 15:40:00,0,0,0,0,,,NEWSPAPER,,,,,,,,,,,,,,MADERA,,,MADERA,,,,,Numerous reports of 3/4-inch hail in Fresno and Madera Counties between 1505 and 1715 PST on the 21st along with widespread thunderstorm activity in the Central and South San Joaquin Valley. Lightning struck within the city limits of Madera (West 4th Street between Hilton and Schnoor Avenues) during the afternoon thunderstorm.,,PDS
200502,22,1935,200502,22,2000,1185323,5442283,CALIFORNIA,6,2005,February,Hail,C,31,KINGS,HNX,22-FEB-05 19:35:00,PST,22-FEB-05 20:00:00,0,0,0,0,,,TRAINED SPOTTER,1.00,,,,,,,,,,,8,E,KETTLEMAN CITY,8,E,KETTLEMAN CITY,36,-119.81667,36,-119.81667,,"Trained spotter reported 3/4 to 1"" hail.",PDS
200502,23,1417,200502,23,1417,1185324,5442284,CALIFORNIA,6,2005,February,Lightning,C,29,KERN,HNX,23-FEB-05 14:17:00,PST,23-FEB-05 14:17:00,0,0,0,0,,,OFFICIAL NWS OBS.,,,,,,,,,,,,5,E,(BFL)MEADOWS FIELD AP,5,E,(BFL)MEADOWS FIELD AP,,,,,,"Thunderstorm in the vicinity of Meadows Field, Kern County Airport.",PDS
200502,22,1800,200502,22,1830,1185461,5441780,CALIFORNIA,6,2005,February,Flash Flood,C,59,ORANGE,SGX,22-FEB-05 18:00:00,PST,22-FEB-05 18:30:00,0,0,0,0,30K,,DEPT OF HIGHWAYS,,,,,,,,,,,,2,N,YORBA LINDA,2,N,YORBA LINDA,33.91667,-117.81667,33.91667,-117.81667,A large mudslide blocked Carbon Canyon Road about 2 miles east of the entrance to Carbon Canyon Regional Park.,,PDS
200502,19,1026,200502,19,1042,1185462,5441781,CALIFORNIA,6,2005,February,Flash Flood,C,65,RIVERSIDE,SGX,19-FEB-05 10:26:00,PST,19-FEB-05 10:42:00,0,0,0,0,5K,,LAW ENFORCEMENT,,,,,,,,,,,,4,SE,CORONA,4,SE,CORONA,33.83333,-117.53333,33.83333,-117.53333,Vehicles reported stuck in a flash flood on Cajalco Road at Temescal Road.,,PDS
200502,2,555,200502,2,1000,1185313,5442184,CALIFORNIA,6,2005,February,Dense Fog,Z,89,W CENTRAL S.J. VALLEY,HNX,02-FEB-05 05:55:00,PST,02-FEB-05 10:00:00,0,0,0,0,,,OFFICIAL NWS OBS.,,,,,,,,,,,,,,,,,,,,,,Numerous aviation sites with less than 1/4 mile visibility plus satellite data confirms widespread nature of dense fog on the morning of the 2nd.,,PDS
200502,2,555,200502,2,1000,1185313,5442185,CALIFORNIA,6,2005,February,Dense Fog,Z,91,SW S.J. VALLEY,HNX,02-FEB-05 05:55:00,PST,02-FEB-05 10:00:00,0,0,0,0,,,"AWOS,ASOS,MESONET,ETC",,,,,,,,,,,,,,,,,,,,,,Numerous aviation sites with less than 1/4 mile visibility plus satellite data confirms widespread nature of dense fog on the morning of the 2nd.,,PDS
200502,2,315,200502,2,1000,1185313,5442186,CALIFORNIA,6,2005,February,Dense Fog,Z,92,SE S.J. VALLEY,HNX,02-FEB-05 03:15:00,PST,02-FEB-05 10:00:00,0,0,0,0,,,"AWOS,ASOS,MESONET,ETC",,,,,,,,,,,,,,,,,,,,,,Numerous aviation sites with less than 1/4 mile visibility plus satellite data confirms widespread nature of dense fog on the morning of the 2nd.,,PDS
200502,3,300,200502,3,800,1185314,5442187,CALIFORNIA,6,2005,February,Dense Fog,Z,89,W CENTRAL S.J. VALLEY,HNX,03-FEB-05 03:00:00,PST,03-FEB-05 08:00:00,0,0,0,0,,,LAW ENFORCEMENT,,,,,,,,,,,,,,,,,,,,,,"Widespread dense fog developed primarily in the Central San Joaquin Valley on the morning of the 3rd but extended well into the Southwest S.J.Valley. During the first half of the month, other than the mornings of the 2nd and 3rd, patchy fog plagued the Central and South Valley due to the moist conditions from much above normal rainfall through the winter.",,PDS
200502,3,300,200502,3,800,1185314,5442188,CALIFORNIA,6,2005,February,Dense Fog,Z,90,E CENTRAL S.J. VALLEY,HNX,03-FEB-05 03:00:00,PST,03-FEB-05 08:00:00,0,0,0,0,,,"AWOS,ASOS,MESONET,ETC",,,,,,,,,,,,,,,,,,,,,,"Widespread dense fog developed primarily in the Central San Joaquin Valley on the morning of the 3rd but extended well into the Southwest S.J.Valley. During the first half of the month, other than the mornings of the 2nd and 3rd, patchy fog plagued the Central and South Valley due to the moist conditions from much above normal rainfall through the winter.",,PDS
200502,3,200,200502,3,800,1185314,5442189,CALIFORNIA,6,2005,February,Dense Fog,Z,91,SW S.J. VALLEY,HNX,03-FEB-05 02:00:00,PST,03-FEB-05 08:00:00,0,0,0,0,,,"AWOS,ASOS,MESONET,ETC",,,,,,,,,,,,,,,,,,,,,,"Widespread dense fog developed primarily in the Central San Joaquin Valley on the morning of the 3rd but extended well into the Southwest S.J.Valley. During the first half of the month, other than the mornings of the 2nd and 3rd, patchy fog plagued the Central and South Valley due to the moist conditions from much above normal rainfall through the winter.",,PDS
200502,24,1702,200502,24,1725,1185325,5442285,CALIFORNIA,6,2005,February,Hail,C,29,KERN,HNX,24-FEB-05 17:02:00,PST,24-FEB-05 17:25:00,0,0,0,0,,,TRAINED SPOTTER,1.00,,,,,,,,,,,5,SW,TEHACHAPI,5,SW,TEHACHAPI,35.08333,-118.5,35.08333,-118.5,,"Hail varying from 3/4 to 1"" was reported at Alpine Forest southwest of Tehachapi in the Kern County Mountains.",PDS
200502,23,1700,200502,23,1720,1185326,5442286,CALIFORNIA,6,2005,February,Heavy Rain,C,29,KERN,HNX,23-FEB-05 17:00:00,PST,23-FEB-05 17:20:00,0,0,0,0,,,LAW ENFORCEMENT,,,,,,,,,,,,,,WELDON,,,WELDON,,,,,"Continued shower activity brought locally heavy rain to the Kern County Mountains just east of Lake Isabella where 0.75"" of rain fell in a 20 minute time period late in the afternoon of the 23rd. A 4"" accumulation of small hail at State Highway 178 and Sierra Way was also received in the Lake Isabella area. Heavy rain in Mariposa County resulted in a rockslide near Savage's Trading Post on Highway 140.",,PDS
200502,23,1703,200502,23,1703,1185326,5442287,CALIFORNIA,6,2005,February,Debris Flow,Z,93,S SIERRA FOOTHILLS,HNX,23-FEB-05 17:03:00,PST,23-FEB-05 17:03:00,0,0,0,0,,,LAW ENFORCEMENT,,,,,,,,,,,,,,,,,,,,,,"Continued shower activity brought locally heavy rain to the Kern County Mountains just east of Lake Isabella where 0.75"" of rain fell in a 20 minute time period late in the afternoon of the 23rd. A 4"" accumulation of small hail at State Highway 178 and Sierra Way was also received in the Lake Isabella area. Heavy rain in Mariposa County resulted in a rockslide near Savage's Trading Post on Highway 140.",,PDS
200502,21,1710,200502,21,1715,1185328,5442290,CALIFORNIA,6,2005,February,Funnel Cloud,C,29,KERN,HNX,21-FEB-05 17:10:00,PST,21-FEB-05 17:15:00,0,0,0,0,,,LAW ENFORCEMENT,,,,,,,,,,,,4,NW,CALIF CITY AIRPORT,4,NW,CALIF CITY AIRPORT,,,,,,The general public reported a funnel cloud northwest of the California City Airport in the Kern County Desert in the late afternoon of the 21st.,PDS
200502,18,1700,200502,18,1730,1185329,5442291,CALIFORNIA,6,2005,February,Heavy Rain,C,31,KINGS,HNX,18-FEB-05 17:00:00,PST,18-FEB-05 17:30:00,0,0,0,0,,,NEWSPAPER,,,,,,,,,,,,,,AVENAL,,,AVENAL,,,,,"A thunderstorm passed over Avenal late in the afternoon of the 18th with 1/2"" hail and very heavy rain reported. The city of Visalia had over 30 intersections between Tulare and Walnut Avenues around Central Street flooded due to persistent and locally heavy rain. Rainfall accumulations around Visalia for the 36-hour period ending late on the 18th were in excess of 1"".",,PDS
200502,19,1450,200502,19,1500,1185445,5441761,CALIFORNIA,6,2005,February,Debris Flow,Z,42,W/S ORANGE,SGX,19-FEB-05 14:50:00,PST,19-FEB-05 15:00:00,0,0,0,0,2M,,NEWSPAPER,,,,,,,,,,,,,,,,,,,,,,,One house began sliding down a hill in Laguna Beach after a landslide left part of the house dangling in the air. Two other homes were also in danger of sliding down the hill.,PDS
200502,19,1048,200502,19,1300,1185448,5441764,CALIFORNIA,6,2005,February,Flash Flood,C,59,ORANGE,SGX,19-FEB-05 10:48:00,PST,19-FEB-05 13:00:00,0,0,0,0,60K,,LAW ENFORCEMENT,,,,,,,,,,,,1,N,LAGUNA BEACH,1,N,LAGUNA BEACH,33.53333,-117.76667,33.53333,-117.76667,,Several vehicles were nearly submerged up to their roofs in flood waters on Laguna Canyon Road.,PDS
200502,19,652,200502,19,652,1185449,5441765,CALIFORNIA,6,2005,February,Hail,C,59,ORANGE,SGX,19-FEB-05 06:52:00,PST,19-FEB-05 06:52:00,0,0,0,0,,,TRAINED SPOTTER,0.75,,,,,,,,,,,,,ANAHEIM,,,ANAHEIM,33.83333,-117.91667,33.83333,-117.91667,,,PDS
200502,22,1700,200502,22,1800,1185450,5441766,CALIFORNIA,6,2005,February,Flash Flood,C,65,RIVERSIDE,SGX,22-FEB-05 17:00:00,PST,22-FEB-05 18:00:00,0,0,0,0,10K,,TRAINED SPOTTER,,,,,,,,,,,,,,LAKE ELSINORE,,,LAKE ELSINORE,33.7,-117.3,33.7,-117.3,,Flash Flooding was reported along Grand and Highway 74 in Lake Elsinore.,PDS
