BEGIN_YEARMONTH,BEGIN_DAY,BEGIN_TIME,END_YEARMONTH,END_DAY,END_TIME,EPISODE_ID,EVENT_ID,STATE,STATE_FIPS,YEAR,MONTH_NAME,EVENT_TYPE,CZ_TYPE,CZ_FIPS,CZ_NAME,WFO,BEGIN_DATE_TIME,CZ_TIMEZONE,END_DATE_TIME,INJURIES_DIRECT,INJURIES_INDIRECT,DEATHS_DIRECT,DEATHS_INDIRECT,DAMAGE_PROPERTY,DAMAGE_CROPS,SOURCE,MAGNITUDE,MAGNITUDE_TYPE,FLOOD_CAUSE,CATEGORY,TOR_F_SCALE,TOR_LENGTH,TOR_WIDTH,TOR_OTHER_WFO,TOR_OTHER_CZ_STATE,TOR_OTHER_CZ_FIPS,TOR_OTHER_CZ_NAME,BEGIN_RANGE,BEGIN_AZIMUTH,BEGIN_LOCATION,END_RANGE,END_AZIMUTH,END_LOCATION,BEGIN_LAT,BEGIN_LON,END_LAT,END_LON,EPISODE_NARRATIVE,EVENT_NARRATIVE,DATA_SOURCE
200406,6,1245,200406,6,1245,1172052,5402760,MISSISSIPPI,28,2004,June,Thunderstorm Wind,C,49,HINDS,JAN,06-JUN-04 12:45:00,CST,06-JUN-04 12:45:00,0,0,0,0,2K,,UTILITY COMPANY,53,EG,,,,,,,,,,,,CLINTON,,,CLINTON,32.33333,-90.33333,32.33333,-90.33333,,A couple of power lines were blown down.,PDS
200406,27,1150,200406,27,1150,1172063,5402964,MISSISSIPPI,28,2004,June,Thunderstorm Wind,C,1,ADAMS,JAN,27-JUN-04 11:50:00,CST,27-JUN-04 11:50:00,0,0,0,0,,,LAW ENFORCEMENT,50,EG,,,,,,,,,,,,NATCHEZ,,,NATCHEZ,31.56667,-91.4,31.56667,-91.4,,A few trees were blown down.,PDS
200406,2,535,200406,2,600,1172049,5402651,MISSISSIPPI,28,2004,June,Flash Flood,C,11,BOLIVAR,JAN,02-JUN-04 05:35:00,CST,02-JUN-04 06:00:00,0,0,0,0,,,EMERGENCY MANAGER,,,,,,,,,,,,,,CLEVELAND,,,CLEVELAND,,,,,,Brief heavy rain caused a few streets to flood.,PDS
200406,28,1745,200406,28,1930,1172066,5403247,MISSISSIPPI,28,2004,June,Flash Flood,C,77,LAWRENCE,JAN,28-JUN-04 17:45:00,CST,28-JUN-04 19:30:00,0,0,0,0,10K,,EMERGENCY MANAGER,,,,,,,,,,,,,,MONTICELLO,,,MONTICELLO,,,,,,Heavy rains caused several roads around Monticello to flood. A few roads were closed as one to two feet of water covered sections of the road. A few cars were stranded as a parking lot flooded.,PDS
200406,1,500,200406,1,630,1172047,5402546,MISSISSIPPI,28,2004,June,Flash Flood,C,73,LAMAR,JAN,01-JUN-04 05:00:00,CST,01-JUN-04 06:30:00,0,0,0,0,35K,,EMERGENCY MANAGER,,,,,,,,,,,,4,N,PURVIS,4,N,PURVIS,,,,,,"Three to four inches of rain fell across northwest portions of Lamar county early Tuesday morning. A few homes were flooded, along with numerous streets, as creeks quickly rose out of their banks.",PDS
200406,21,1932,200406,21,1945,1172059,5402856,MISSISSIPPI,28,2004,June,Thunderstorm Wind,C,133,SUNFLOWER,JAN,21-JUN-04 19:32:00,CST,21-JUN-04 19:45:00,0,0,0,0,50K,,EMERGENCY MANAGER,70,EG,,,,,,,,,,1,SW,INVERNESS,1,SW,INVERNESS,33.33333,-90.61667,33.35,-90.58333,,Numerous trees were blown down east of Inverness. Two homes had large trees fall on them and a shed was destroyed. Several power lines were also blown down.,PDS
200406,21,1930,200406,21,1935,1172059,5402857,MISSISSIPPI,28,2004,June,Thunderstorm Wind,C,53,HUMPHREYS,JAN,21-JUN-04 19:30:00,CST,21-JUN-04 19:35:00,0,0,0,0,1K,,LAW ENFORCEMENT,58,EG,,,,,,,,,,,,ISOLA,,,ISOLA,33.26667,-90.6,33.26667,-90.6,,One power line was blown down.,PDS
200406,29,1850,200406,29,2000,1172067,5403249,MISSISSIPPI,28,2004,June,Flash Flood,C,79,LEAKE,JAN,29-JUN-04 18:50:00,CST,29-JUN-04 20:00:00,0,0,0,0,,,LAW ENFORCEMENT,,,,,,,,,,,,,,WALNUT GROVE,,,WALNUT GROVE,,,,,,"Three to six inches of rain fell in a short time across Walnut Grove and the southern portion of Leake county. This heavy rain flooded nine streets around town and caused eight business to have several inches of water in them. In addition, four county roads had sections of the road bed or culverts washed out.",PDS
200406,29,1930,200406,29,2010,1172067,5403250,MISSISSIPPI,28,2004,June,Flash Flood,C,89,MADISON,JAN,29-JUN-04 19:30:00,CST,29-JUN-04 20:10:00,0,0,0,0,,,LAW ENFORCEMENT,,,,,,,,,,,,2,W,CANTON,2,W,CANTON,,,,,,"Heavy rains caused a portion of highway 22, near Virlillia Road, to flood.",PDS
200406,30,1715,200406,30,1800,1172068,5403251,MISSISSIPPI,28,2004,June,Flash Flood,C,19,CHOCTAW,JAN,30-JUN-04 17:15:00,CST,30-JUN-04 18:00:00,0,0,0,0,10K,,LAW ENFORCEMENT,,,,,,,,,,,,5,S,ACKERMAN,5,S,ACKERMAN,,,,,,Several county roads were flooded and a few culverts were washed out.,PDS
200406,21,1625,200406,21,1625,1172059,5402864,MISSISSIPPI,28,2004,June,Thunderstorm Wind,C,37,FRANKLIN,JAN,21-JUN-04 16:25:00,CST,21-JUN-04 16:25:00,0,0,0,0,1K,,UTILITY COMPANY,50,EG,,,,,,,,,,3,E,BUDE,3,E,BUDE,31.46667,-90.8,31.46667,-90.8,,A few power lines were blown down.,PDS
200406,19,1520,200406,19,1520,1172058,5402852,MISSISSIPPI,28,2004,June,Thunderstorm Wind,C,121,RANKIN,JAN,19-JUN-04 15:20:00,CST,19-JUN-04 15:20:00,1,0,0,0,15K,,LAW ENFORCEMENT,42,MG,,,,,,,,,,,,PEARL,,,PEARL,32.28333,-90.11667,32.28333,-90.11667,,Forty-eight mph winds downed three trees in Pearl. One tree fell on a mobile home and crushed it. One person was in the home and was injured.,PDS
200406,21,2027,200406,21,2027,1172059,5402853,MISSISSIPPI,28,2004,June,Hail,C,163,YAZOO,JAN,21-JUN-04 20:27:00,CST,21-JUN-04 20:27:00,0,0,0,0,,,LAW ENFORCEMENT,0.88,,,,,,,,,,,6,S,YAZOO CITY,6,S,YAZOO CITY,32.76667,-90.41667,32.76667,-90.41667,,,PDS
200406,21,2000,200406,21,2005,1172059,5402854,MISSISSIPPI,28,2004,June,Hail,C,75,LAUDERDALE,JAN,21-JUN-04 20:00:00,CST,21-JUN-04 20:05:00,0,0,0,0,,,LAW ENFORCEMENT,0.88,,,,,,,,,,,,,MERIDIAN,,,MERIDIAN,32.36667,-88.71667,32.36667,-88.71667,,Nickel to dime sized hail covered the ground.,PDS
200406,21,2000,200406,21,2005,1172059,5402855,MISSISSIPPI,28,2004,June,Thunderstorm Wind,C,75,LAUDERDALE,JAN,21-JUN-04 20:00:00,CST,21-JUN-04 20:05:00,0,0,0,0,,,LAW ENFORCEMENT,50,EG,,,,,,,,,,,,MERIDIAN,,,MERIDIAN,32.36667,-88.71667,32.36667,-88.71667,,A couple of trees were blown down.,PDS
200405,1,1449,200405,1,1453,1170170,5397072,MISSISSIPPI,28,2004,May,Tornado,C,31,COVINGTON,JAN,01-MAY-04 14:49:00,CST,01-MAY-04 14:53:00,0,0,0,0,10K,,NWS STORM SURVEY,,,,,F1,3,200,,,,,9,WSW,COLLINS,9,WSW,COLLINS,31.63333,-89.55,31.65,-89.53333,,"This is the continuation of the Jefferson Davis county tornado that moved just to the north of the Terrell community and into Covington county. This tornado stayed on the ground for 3 more miles, downing numerous trees, before dissipating 6 miles west southwest of Collins.",PDS
200405,1,1500,200405,1,1500,1170170,5397073,MISSISSIPPI,28,2004,May,Hail,C,65,JEFFERSON DAVIS,JAN,01-MAY-04 15:00:00,CST,01-MAY-04 15:00:00,0,0,0,0,,,LAW ENFORCEMENT,0.75,,,,,,,,,,,8,N,PRENTISS,8,N,PRENTISS,31.48333,-90.18333,31.48333,-90.18333,,,PDS
200405,31,35,200405,31,40,1170178,5396988,MISSISSIPPI,28,2004,May,Thunderstorm Wind,C,51,HOLMES,JAN,31-MAY-04 00:35:00,CST,31-MAY-04 00:40:00,0,0,0,0,10K,,LAW ENFORCEMENT,60,EG,,,,,,,,,,8,W,LEXINGTON,8,W,LEXINGTON,33.11667,-90.9,33.11667,-90.86667,,A few power lines and telephone poles were blown down along with numerous trees and large limbs.,PDS
200405,31,45,200405,31,45,1170178,5396989,MISSISSIPPI,28,2004,May,Thunderstorm Wind,C,15,CARROLL,JAN,31-MAY-04 00:45:00,CST,31-MAY-04 00:45:00,0,0,0,0,,,LAW ENFORCEMENT,50,EG,,,,,,,,,,10,S,CARROLLTON,10,S,CARROLLTON,33.56667,-89.91667,33.56667,-89.91667,,Several large limbs were blown down.,PDS
200405,18,1614,200405,18,1700,1170174,5396710,MISSISSIPPI,28,2004,May,Flash Flood,C,49,HINDS,JAN,18-MAY-04 16:14:00,CST,18-MAY-04 17:00:00,0,0,0,0,,,LAW ENFORCEMENT,,,,,,,,,,,,,,JACKSON,,,JACKSON,,,,,,"Brief heavy rains caused portions of Terry, Granville and McDowell roads to flood.",PDS
200405,18,1545,200405,18,1545,1170175,5396711,MISSISSIPPI,28,2004,May,Lightning,C,49,HINDS,JAN,18-MAY-04 15:45:00,CST,18-MAY-04 15:45:00,0,0,1,0,,,NEWSPAPER,,,,,,,,,,,,,,BROWNSVILLE,,,BROWNSVILLE,,,,,,"Tuesday afternoon, two men were fishing on Trotter Lake in northern Hinds county. A thunderstorm developed near the lake and one of the men was struck by a fatal lighting strike.",PDS
200405,30,2210,200405,30,2217,1170178,5396716,MISSISSIPPI,28,2004,May,Thunderstorm Wind,C,43,GRENADA,JAN,30-MAY-04 22:10:00,CST,30-MAY-04 22:17:00,0,0,0,0,5K,,EMERGENCY MANAGER,53,EG,,,,,,,,,,,,GRENADA,,,GRENADA,32.58333,-89.46667,32.58333,-89.46667,,Several trees were blown down in Eastern Heights subdivision.,PDS
200405,30,2230,200405,31,100,1170178,5396717,MISSISSIPPI,28,2004,May,Flash Flood,C,43,GRENADA,JAN,30-MAY-04 22:30:00,CST,31-MAY-04 01:00:00,0,0,0,0,,,EMERGENCY MANAGER,,,,,,,,,,,,,,GRENADA,,,GRENADA,,,,,,A few streets were flooded in the southern part of town.,PDS
200405,13,1645,200405,13,1700,1170177,5396714,MISSISSIPPI,28,2004,May,Thunderstorm Wind,C,149,WARREN,JAN,13-MAY-04 16:45:00,CST,13-MAY-04 17:00:00,0,0,0,0,4K,,EMERGENCY MANAGER,40,EG,,,,,,,,,,,,VICKSBURG,,,VICKSBURG,32.35,-90.88333,32.35,-90.88333,,Forty to forty-five mph winds blew across Warren county downing a dozen trees in the city of Vicksburg and a few dozen more across the county. Very wet ground conditions played a large role in why the trees were blown down by non severe thunderstorm winds.,PDS
200405,30,2100,200405,30,2115,1170178,5396715,MISSISSIPPI,28,2004,May,Thunderstorm Wind,C,11,BOLIVAR,JAN,30-MAY-04 21:00:00,CST,30-MAY-04 21:15:00,0,0,0,0,2K,,EMERGENCY MANAGER,53,EG,,,,,,,,,,,,MOUND BAYOU,,,MOUND BAYOU,33.05,-89.58333,33.05,-89.58333,,Several trees were blown down from Mound Bayou to Cleveland. Crews had to cut a few trees and move them from area roads.,PDS
200405,29,1839,200405,29,1843,1170176,5396712,MISSISSIPPI,28,2004,May,Tornado,C,83,LEFLORE,JAN,29-MAY-04 18:39:00,CST,29-MAY-04 18:43:00,0,0,0,0,,,LAW ENFORCEMENT,,,,,F0,2,50,,,,,3,N,SCHLATER,3,N,SCHLATER,33.7,-90.35,33.7,-90.26667,,"This weak tornado touched down in an open field, spotters watched it as it slowly moved north northeast. No damage occurred.",PDS
200405,29,1852,200405,29,1854,1170176,5396713,MISSISSIPPI,28,2004,May,Funnel Cloud,C,83,LEFLORE,JAN,29-MAY-04 18:52:00,CST,29-MAY-04 18:54:00,0,0,0,0,,,LAW ENFORCEMENT,,,,,,,,,,,,3,S,MINTER CITY,3,S,MINTER CITY,,,,,,,PDS
200405,30,2225,200405,30,2230,1169013,5395824,MISSISSIPPI,28,2004,May,Thunderstorm Wind,C,13,CALHOUN,MEG,30-MAY-04 22:25:00,CST,30-MAY-04 22:30:00,0,0,0,0,5K,,LAW ENFORCEMENT,50,EG,,,,,,,,,,,,CALHOUN CITY,,,CALHOUN CITY,33.85,-89.31667,33.85,-89.31667,,Several trees were knocked down.,PDS
200405,30,2230,200405,30,2235,1169013,5395825,MISSISSIPPI,28,2004,May,Thunderstorm Wind,C,145,UNION,MEG,30-MAY-04 22:30:00,CST,30-MAY-04 22:35:00,0,0,0,0,5K,,TRAINED SPOTTER,50,EG,,,,,,,,,,1,N,MYRTLE,1,N,MYRTLE,34.58333,-89.11667,34.58333,-89.11667,,Some trees were blown down.,PDS
200405,30,2233,200405,30,2245,1169013,5395826,MISSISSIPPI,28,2004,May,Thunderstorm Wind,C,81,LEE,MEG,30-MAY-04 22:33:00,CST,30-MAY-04 22:45:00,0,0,0,0,5K,,AMATEUR RADIO,50,EG,,,,,,,,,,5,SW,BALDWYN,5,SW,BALDWYN,34.45,-88.7,34.5,-88.63333,,Several trees were knocked down.,PDS
200405,30,2240,200405,30,2245,1169013,5395827,MISSISSIPPI,28,2004,May,Thunderstorm Wind,C,115,PONTOTOC,MEG,30-MAY-04 22:40:00,CST,30-MAY-04 22:45:00,0,0,0,0,5K,,BROADCAST MEDIA,55,EG,,,,,,,,,,,,THAXTON,,,THAXTON,34.31667,-89.16667,34.31667,-89.16667,,A few trees were blown down.,PDS
200405,30,2120,200405,30,2125,1169013,5395828,MISSISSIPPI,28,2004,May,Thunderstorm Wind,C,93,MARSHALL,MEG,30-MAY-04 21:20:00,CST,30-MAY-04 21:25:00,0,0,0,0,20K,,LAW ENFORCEMENT,55,EG,,,,,,,,,,,,HOLLY SPGS,,,HOLLY SPGS,34.76667,-89.45,34.76667,-89.45,,Numerous trees and power lines were knocked down.,PDS
200405,30,2105,200405,30,2110,1169013,5395829,MISSISSIPPI,28,2004,May,Thunderstorm Wind,C,137,TATE,MEG,30-MAY-04 21:05:00,CST,30-MAY-04 21:10:00,0,0,0,0,5K,,LAW ENFORCEMENT,50,EG,,,,,,,,,,6,W,SENATOBIA,6,W,SENATOBIA,34.61667,-90.05,34.61667,-90.05,,Several trees were blown down with some of the trees falling on a house.,PDS
200405,30,2220,200405,30,2225,1169013,5395830,MISSISSIPPI,28,2004,May,Thunderstorm Wind,C,3,ALCORN,MEG,30-MAY-04 22:20:00,CST,30-MAY-04 22:25:00,0,0,0,0,15K,,EMERGENCY MANAGER,55,EG,,,,,,,,,,,,CORINTH,,,CORINTH,34.93333,-88.51667,34.93333,-88.51667,,One building had its roof blown off. Several trees and power lines were knocked down.,PDS
200405,11,1145,200405,11,1147,1170171,5397177,MISSISSIPPI,28,2004,May,Hail,C,73,LAMAR,JAN,11-MAY-04 11:45:00,CST,11-MAY-04 11:47:00,0,0,0,0,,,EMERGENCY MANAGER,1.00,,,,,,,,,,,,,HATTIESBURG,,,HATTIESBURG,31.31667,-89.31667,31.31667,-89.31667,,,PDS
200405,11,1145,200405,11,1147,1170171,5397178,MISSISSIPPI,28,2004,May,Hail,C,35,FORREST,JAN,11-MAY-04 11:45:00,CST,11-MAY-04 11:47:00,0,0,0,0,,,EMERGENCY MANAGER,1.00,,,,,,,,,,,,,HATTIESBURG,,,HATTIESBURG,31.31667,-89.31667,31.31667,-89.31667,,,PDS
200405,11,1430,200405,11,1430,1170171,5397179,MISSISSIPPI,28,2004,May,Thunderstorm Wind,C,29,COPIAH,JAN,11-MAY-04 14:30:00,CST,11-MAY-04 14:30:00,0,0,0,0,,,EMERGENCY MANAGER,50,EG,,,,,,,,,,5,N,DENTVILLE,5,N,DENTVILLE,32.01667,-90.56667,32.01667,-90.56667,,A couple of trees were blown down.,PDS
200405,14,1535,200405,14,1610,1170172,5397180,MISSISSIPPI,28,2004,May,Flash Flood,C,63,JEFFERSON,JAN,14-MAY-04 15:35:00,CST,14-MAY-04 16:10:00,0,0,0,0,,,EMERGENCY MANAGER,,,,,,,,,,,,2,W,FAYETTE,2,W,FAYETTE,,,,,,Brief heavy rain caused a few streets to flood along US Highway 61 and on Coonbox Road.,PDS
200405,14,1711,200405,14,1750,1170172,5397181,MISSISSIPPI,28,2004,May,Flash Flood,C,1,ADAMS,JAN,14-MAY-04 17:11:00,CST,14-MAY-04 17:50:00,0,0,0,0,,,EMERGENCY MANAGER,,,,,,,,,,,,,,NATCHEZ,,,NATCHEZ,,,,,,Heavy rains caused portions of Airport Road and Cardinal Drive to flood.,PDS
200405,14,1825,200405,14,1930,1170172,5397182,MISSISSIPPI,28,2004,May,Flash Flood,C,37,FRANKLIN,JAN,14-MAY-04 18:25:00,CST,14-MAY-04 19:30:00,0,0,0,0,,,LAW ENFORCEMENT,,,,,,,,,,,,,,MEADVILLE,,,MEADVILLE,33.43333,-89.58333,33.43333,-89.58333,,Several streets were flooded in the City.,PDS
200405,14,1900,200405,14,2000,1170172,5396700,MISSISSIPPI,28,2004,May,Flash Flood,C,63,JEFFERSON,JAN,14-MAY-04 19:00:00,CST,14-MAY-04 20:00:00,0,0,0,0,,,TRAINED SPOTTER,,,,,,,,,,,,,,HARRISTON,,,HARRISTON,,,,,,A portion of highway 553 north was flooded.,PDS
200405,14,1939,200405,14,2100,1170172,5396701,MISSISSIPPI,28,2004,May,Flash Flood,C,49,HINDS,JAN,14-MAY-04 19:39:00,CST,14-MAY-04 21:00:00,0,0,0,0,1K,,NWS EMPLOYEE(OFF DUTY),,,,,,,,,,,,8,SSW,RAYMOND,8,SSW,RAYMOND,,,,,,A few drainage ditches and creeks were out of their banks as a portion of Dry Grove road was under 5 to 6 inches of water.,PDS
200405,31,1315,200405,31,1315,1169940,5397669,MISSISSIPPI,28,2004,May,Hail,C,47,HARRISON,LIX,31-MAY-04 13:15:00,CST,31-MAY-04 13:15:00,0,0,0,0,,,LAW ENFORCEMENT,0.75,,,,,,,,,,,15,N,GULFPORT,15,N,GULFPORT,30.6,-89.08333,30.6,-89.08333,,,PDS
200405,31,1335,200405,31,1335,1169941,5397670,MISSISSIPPI,28,2004,May,Thunderstorm Wind,C,45,HANCOCK,LIX,31-MAY-04 13:35:00,CST,31-MAY-04 13:35:00,0,0,0,0,,,LAW ENFORCEMENT,50,EG,,,,,,,,,,5,N,KILN,5,N,KILN,30.48333,-89.43333,30.48333,-89.43333,,Thunderstorm wind gusts blew down powerlines.,PDS
200405,1,1446,200405,1,1446,1169944,5397673,MISSISSIPPI,28,2004,May,Thunderstorm Wind,C,113,PIKE,LIX,01-MAY-04 14:46:00,CST,01-MAY-04 14:46:00,0,0,0,0,10K,,LAW ENFORCEMENT,50,EG,,,,,,,,,,2,SE,MC COMB,2,SE,MC COMB,31.23333,-90.45,31.23333,-90.45,,"Several trees were blown down, and the roof of mobile home and nearby building received wind damge.",PDS
200405,1,1455,200405,1,1455,1169944,5397674,MISSISSIPPI,28,2004,May,Hail,C,113,PIKE,LIX,01-MAY-04 14:55:00,CST,01-MAY-04 14:55:00,0,0,0,0,,,LAW ENFORCEMENT,0.75,,,,,,,,,,,5,SE,MC COMB,5,SE,MC COMB,31.2,-90.4,31.2,-90.4,,,PDS
200405,1,1503,200405,1,1508,1169944,5397675,MISSISSIPPI,28,2004,May,Tornado,C,147,WALTHALL,LIX,01-MAY-04 15:03:00,CST,01-MAY-04 15:08:00,0,0,0,0,50K,,LAW ENFORCEMENT,,,,,F1,3,40,,,,,3,NNW,ENON,3,NNW,ENON,31.33333,-90.25,31.36667,-90.2,,"A tornado touched down along an intermittent path in extreme northern Walthall County. Numerous trees were downed or their main trunks snapped. Several buildings and mobile homes were damaged by wind or fallen trees. The tornado continued to move northeast in Lawrence County in southern Mississippi. See additonal information in Storm Data entries from the National Weather Service - Jackson, Mississippi.",PDS
200407,31,1455,200407,31,1455,1176079,5412916,MISSISSIPPI,28,2004,July,Funnel Cloud,C,47,HARRISON,LIX,31-JUL-04 14:55:00,CST,31-JUL-04 14:55:00,0,0,0,0,,,LAW ENFORCEMENT,,,,,,,,,,,,10,N,PASS CHRISTIAN,10,N,PASS CHRISTIAN,,,,,,A funnel cloud was observed north of Interstate 10 in western Harrison County.,PDS
200407,5,1535,200407,5,1535,1175406,5411846,MISSISSIPPI,28,2004,July,Thunderstorm Wind,C,85,LINCOLN,JAN,05-JUL-04 15:35:00,CST,05-JUL-04 15:35:00,0,0,0,0,.1K,,LAW ENFORCEMENT,39,EG,,,,,,,,,,7,S,BROOKHAVEN,7,S,BROOKHAVEN,31.48333,-90.45,31.48333,-90.45,,A few trees were blown down.,PDS
200407,5,1750,200407,5,1750,1175406,5411847,MISSISSIPPI,28,2004,July,Thunderstorm Wind,C,121,RANKIN,JAN,05-JUL-04 17:50:00,CST,05-JUL-04 17:50:00,0,0,0,0,1K,,EMERGENCY MANAGER,39,MG,,,,,,,,,,,,BRANDON,,,BRANDON,32.26667,-89.98333,32.26667,-89.98333,,A large limb crashed through a roof and a small exit sign was blown over on Interstate 20.,PDS
200407,5,1805,200407,5,1805,1175406,5411848,MISSISSIPPI,28,2004,July,Thunderstorm Wind,C,163,YAZOO,JAN,05-JUL-04 18:05:00,CST,05-JUL-04 18:05:00,0,0,0,0,.1K,,LAW ENFORCEMENT,39,EG,,,,,,,,,,6,S,YAZOO CITY,6,S,YAZOO CITY,32.76667,-90.41667,32.76667,-90.41667,,A few trees were blown down.,PDS
200407,5,1845,200407,5,1845,1175406,5411849,MISSISSIPPI,28,2004,July,Thunderstorm Wind,C,89,MADISON,JAN,05-JUL-04 18:45:00,CST,05-JUL-04 18:45:00,0,0,0,0,.1K,,LAW ENFORCEMENT,52,EG,,,,,,,,,,,,CANTON,,,CANTON,32.61667,-90.03333,32.61667,-90.03333,,A few trees were blown down.,PDS
200407,6,1710,200407,6,1710,1175407,5411850,MISSISSIPPI,28,2004,July,Thunderstorm Wind,C,85,LINCOLN,JAN,06-JUL-04 17:10:00,CST,06-JUL-04 17:10:00,0,0,0,0,1K,,EMERGENCY MANAGER,43,EG,,,,,,,,,,8,NW,BROOKHAVEN,8,NW,BROOKHAVEN,31.66667,-90.55,31.66667,-90.55,,Two trees downed power lines on Jackson-Liberty Drive.,PDS
200407,6,1710,200407,6,1730,1175407,5411851,MISSISSIPPI,28,2004,July,Flash Flood,C,85,LINCOLN,JAN,06-JUL-04 17:10:00,CST,06-JUL-04 17:30:00,0,0,0,0,,,EMERGENCY MANAGER,,,,,,,,,,,,8,NW,BROOKHAVEN,8,NW,BROOKHAVEN,,,,,,Heavy rains caused a portion of Jackson-Liberty Road to flood.,PDS
200407,6,1340,200407,6,1440,1175407,5411852,MISSISSIPPI,28,2004,July,Flash Flood,C,35,FORREST,JAN,06-JUL-04 13:40:00,CST,06-JUL-04 14:40:00,0,0,0,0,,,EMERGENCY MANAGER,,,,,,,,,,,,7,N,HATTIESBURG,7,N,HATTIESBURG,,,,,,Several roads were flooded in the northern part of the county.,PDS
200407,7,1425,200407,7,1425,1175408,5411853,MISSISSIPPI,28,2004,July,Thunderstorm Wind,C,105,OKTIBBEHA,JAN,07-JUL-04 14:25:00,CST,07-JUL-04 14:25:00,0,0,0,0,,,EMERGENCY MANAGER,54,EG,,,,,,,,,,5,W,STARKVILLE,5,W,STARKVILLE,33.46667,-88.91667,33.46667,-88.91667,,A couple of trees were blown down on US Highway 82. Crews had to remove the debris from the road.,PDS
200407,8,1630,200407,8,1635,1175409,5411854,MISSISSIPPI,28,2004,July,Thunderstorm Wind,C,123,SCOTT,JAN,08-JUL-04 16:30:00,CST,08-JUL-04 16:35:00,0,0,0,0,,,LAW ENFORCEMENT,55,EG,,,,,,,,,,,,HARPERVILLE,,,HARPERVILLE,32.48333,-89.48333,32.48333,-89.48333,,Several trees were blown down.,PDS
200407,16,1145,200407,16,1150,1175411,5410458,MISSISSIPPI,28,2004,July,Thunderstorm Wind,C,73,LAMAR,JAN,16-JUL-04 11:45:00,CST,16-JUL-04 11:50:00,0,0,0,0,8K,,EMERGENCY MANAGER,60,EG,,,,,,,,,,,,LUMBERTON,,,LUMBERTON,31,-89.45,31,-89.45,,Numerous trees and power lines were blown down across the southern part of the county.,PDS
200407,15,1746,200407,15,1755,1175410,5410449,MISSISSIPPI,28,2004,July,Thunderstorm Wind,C,67,JONES,JAN,15-JUL-04 17:46:00,CST,15-JUL-04 17:55:00,0,0,0,0,2K,,EMERGENCY MANAGER,55,EG,,,,,,,,,,,,TUCKERS CROSSING,,,TUCKERS CROSSING,32.55,-90.23333,32.55,-90.23333,,Numerous trees were blown down in the central portion of the county.,PDS
200407,15,1630,200407,15,1640,1175410,5410450,MISSISSIPPI,28,2004,July,Thunderstorm Wind,C,99,NESHOBA,JAN,15-JUL-04 16:30:00,CST,15-JUL-04 16:40:00,0,0,0,0,4K,,EMERGENCY MANAGER,60,EG,,,,,,,,,,14,SSW,PHILADELPHIA,14,SSW,PHILADELPHIA,32.55,-90.31667,32.55,-90.31667,,Several power lines were blown down and trees uprooted. Three trees fell across two county roads.,PDS
200407,16,1030,200407,16,1130,1175411,5410451,MISSISSIPPI,28,2004,July,Flash Flood,C,43,GRENADA,JAN,16-JUL-04 10:30:00,CST,16-JUL-04 11:30:00,0,0,0,0,,,EMERGENCY MANAGER,,,,,,,,,,,,,,GRENADA,,,GRENADA,,,,,,Several roads were flooded.,PDS
200407,16,1020,200407,16,1025,1175411,5410452,MISSISSIPPI,28,2004,July,Thunderstorm Wind,C,99,NESHOBA,JAN,16-JUL-04 10:20:00,CST,16-JUL-04 10:25:00,0,0,0,0,1K,,EMERGENCY MANAGER,60,EG,,,,,,,,,,4,N,PHILADELPHIA,4,N,PHILADELPHIA,32.81667,-89.11667,32.81667,-89.11667,,Several large trees were uprooted along with pines trees snapped and limbs twisted off.,PDS
200407,16,1020,200407,16,1020,1175411,5410453,MISSISSIPPI,28,2004,July,Thunderstorm Wind,C,31,COVINGTON,JAN,16-JUL-04 10:20:00,CST,16-JUL-04 10:20:00,0,0,0,0,,,EMERGENCY MANAGER,53,EG,,,,,,,,,,,,COLLINS,,,COLLINS,31.63333,-89.55,31.63333,-89.55,,Several trees were blown down along highway 588.,PDS
200407,16,1040,200407,16,1120,1175411,5410454,MISSISSIPPI,28,2004,July,Thunderstorm Wind,C,97,MONTGOMERY,JAN,16-JUL-04 10:40:00,CST,16-JUL-04 11:20:00,0,0,0,0,8K,,UTILITY COMPANY,55,EG,,,,,,,,,,,,COUNTYWIDE,,,COUNTYWIDE,33.48333,-89.61667,33.48333,-89.61667,,Numerous trees and power lines were blown down across the county.,PDS
200407,16,1100,200407,16,1100,1175411,5410455,MISSISSIPPI,28,2004,July,Thunderstorm Wind,C,67,JONES,JAN,16-JUL-04 11:00:00,CST,16-JUL-04 11:00:00,0,0,0,0,5K,,UTILITY COMPANY,55,EG,,,,,,,,,,10,S,ELLISVILLE,10,S,ELLISVILLE,31.45,-89.2,31.45,-89.2,,Several trees and power lines were blown down.,PDS
200407,16,1140,200407,16,1140,1175411,5410456,MISSISSIPPI,28,2004,July,Thunderstorm Wind,C,23,CLARKE,JAN,16-JUL-04 11:40:00,CST,16-JUL-04 11:40:00,0,0,0,0,5K,,LAW ENFORCEMENT,60,EG,,,,,,,,,,,,ENTERPRISE,,,ENTERPRISE,32.18333,-88.81667,32.18333,-88.81667,,Numerous trees were blown down across highway 11 near the community of Stafford Springs.,PDS
200407,16,1140,200407,16,1140,1175411,5410457,MISSISSIPPI,28,2004,July,Thunderstorm Wind,C,155,WEBSTER,JAN,16-JUL-04 11:40:00,CST,16-JUL-04 11:40:00,0,0,0,0,,,LAW ENFORCEMENT,50,EG,,,,,,,,,,,,EUPORA,,,EUPORA,33.53333,-89.28333,33.53333,-89.28333,,Three trees were blown down.,PDS
200407,6,1355,200407,6,1357,1176144,5414140,MISSISSIPPI,28,2004,July,Thunderstorm Wind,C,41,GREENE,MOB,06-JUL-04 13:55:00,CST,06-JUL-04 13:57:00,0,0,0,0,8K,,GENERAL PUBLIC,50,EG,,,,,,,,,,,,SAND HILL,,,SAND HILL,31.35,-88.76667,31.35,-88.76667,,High winds from a thunderstorm blew down several trees and power lines near Sand Hill.  Dime size hail was also reported along with the high winds.,PDS
200407,8,1250,200407,8,1252,1176146,5414142,MISSISSIPPI,28,2004,July,Hail,C,131,STONE,MOB,08-JUL-04 12:50:00,CST,08-JUL-04 12:52:00,0,0,0,0,,,EMERGENCY MANAGER,0.88,,,,,,,,,,,,,RAMSEY SPGS,,,RAMSEY SPGS,30.76667,-88.91667,30.76667,-88.91667,,,PDS
200407,4,1205,200407,4,1210,1176751,5415107,MISSISSIPPI,28,2004,July,Thunderstorm Wind,C,33,DE SOTO,MEG,04-JUL-04 12:05:00,CST,04-JUL-04 12:10:00,0,0,1,0,10K,,LAW ENFORCEMENT,50,EG,,,,,,,,,,,,EUDORA,,,EUDORA,34.83333,-90.15,34.83333,-90.15,,Several trees were knocked down. One tree fell on a car killing the driver.,PDS
200407,4,1215,200407,4,1225,1176751,5415108,MISSISSIPPI,28,2004,July,Thunderstorm Wind,C,33,DE SOTO,MEG,04-JUL-04 12:15:00,CST,04-JUL-04 12:25:00,0,0,0,0,10K,,TRAINED SPOTTER,50,EG,,,,,,,,,,,,OLIVE BRANCH,,,OLIVE BRANCH,34.96667,-89.81667,34.96667,-89.81667,,An apartment building was damaged.,PDS
200408,22,1640,200408,22,1650,1176832,5414777,MISSISSIPPI,28,2004,August,Thunderstorm Wind,C,99,NESHOBA,JAN,22-AUG-04 16:40:00,CST,22-AUG-04 16:50:00,0,0,0,0,15K,,EMERGENCY MANAGER,60,EG,,,,,,,,,,3,W,DIXON,3,W,DIXON,32.66667,-89.26667,32.61667,-89.2,,Numerous trees were blown down across the southwest portion of the county. One large tree fell on a mobile home as well as some structural damage to a barn and chicken house.,PDS
200408,27,1803,200408,27,1803,1176833,5414778,MISSISSIPPI,28,2004,August,Hail,C,121,RANKIN,JAN,27-AUG-04 18:03:00,CST,27-AUG-04 18:03:00,0,0,0,0,,,EMERGENCY MANAGER,0.75,,,,,,,,,,,2,NNE,BRANDON,2,NNE,BRANDON,32.3,-89.96667,32.3,-89.96667,,,PDS
200407,3,1625,200407,3,1630,1176748,5414938,MISSISSIPPI,28,2004,July,Thunderstorm Wind,C,81,LEE,MEG,03-JUL-04 16:25:00,CST,03-JUL-04 16:30:00,0,0,0,0,5K,,TRAINED SPOTTER,50,EG,,,,,,,,,,,,TUPELO,,,TUPELO,34.26667,-88.71667,34.26667,-88.71667,,Several trees were blown down.,PDS
200407,3,1750,200407,3,1755,1176748,5414939,MISSISSIPPI,28,2004,July,Thunderstorm Wind,C,57,ITAWAMBA,MEG,03-JUL-04 17:50:00,CST,03-JUL-04 17:55:00,0,0,0,0,5K,,TRAINED SPOTTER,50,EG,,,,,,,,,,,,FULTON,,,FULTON,34.26667,-88.41667,34.26667,-88.41667,,Some trees were knocked down.,PDS
200407,3,2030,200407,3,2130,1176748,5414940,MISSISSIPPI,28,2004,July,Flash Flood,C,57,ITAWAMBA,MEG,03-JUL-04 20:30:00,CST,03-JUL-04 21:30:00,0,0,0,0,1K,,LAW ENFORCEMENT,,,,,,,,,,,,15,N,TREMONT,15,N,TREMONT,,,,,,Sections of Bull Mountain Creek were flooded sending some water over Highway 29.,PDS
200407,4,1310,200407,4,1315,1176751,5415109,MISSISSIPPI,28,2004,July,Thunderstorm Wind,C,3,ALCORN,MEG,04-JUL-04 13:10:00,CST,04-JUL-04 13:15:00,0,0,0,0,25K,,NWS STORM SURVEY,55,EG,,,,,,,,,,1,N,KOSSUTH,1,N,KOSSUTH,34.88333,-88.63333,34.88333,-88.63333,,A house was badly damaged when a large oak tree was blown on top of it.,PDS
200408,5,1610,200408,5,1610,1176829,5414771,MISSISSIPPI,28,2004,August,Thunderstorm Wind,C,127,SIMPSON,JAN,05-AUG-04 16:10:00,CST,05-AUG-04 16:10:00,0,0,0,0,5K,,UTILITY COMPANY,58,EG,,,,,,,,,,10,SW,PINOLA,10,SW,PINOLA,31.76667,-90.08333,31.76667,-90.08333,,Trees and power lines were blown down just east of the Pearl River near David Sherman Road.,PDS
200408,5,1619,200408,5,1619,1176829,5414772,MISSISSIPPI,28,2004,August,Thunderstorm Wind,C,1,ADAMS,JAN,05-AUG-04 16:19:00,CST,05-AUG-04 16:19:00,0,0,0,0,3K,,EMERGENCY MANAGER,58,EG,,,,,,,,,,5,N,NATCHEZ,5,N,NATCHEZ,31.63333,-91.4,31.63333,-91.4,,A few trees and power lines were blown down.,PDS
