BEGIN_YEARMONTH,BEGIN_DAY,BEGIN_TIME,END_YEARMONTH,END_DAY,END_TIME,EPISODE_ID,EVENT_ID,STATE,STATE_FIPS,YEAR,MONTH_NAME,EVENT_TYPE,CZ_TYPE,CZ_FIPS,CZ_NAME,WFO,BEGIN_DATE_TIME,CZ_TIMEZONE,END_DATE_TIME,INJURIES_DIRECT,INJURIES_INDIRECT,DEATHS_DIRECT,DEATHS_INDIRECT,DAMAGE_PROPERTY,DAMAGE_CROPS,SOURCE,MAGNITUDE,MAGNITUDE_TYPE,FLOOD_CAUSE,CATEGORY,TOR_F_SCALE,TOR_LENGTH,TOR_WIDTH,TOR_OTHER_WFO,TOR_OTHER_CZ_STATE,TOR_OTHER_CZ_FIPS,TOR_OTHER_CZ_NAME,BEGIN_RANGE,BEGIN_AZIMUTH,BEGIN_LOCATION,END_RANGE,END_AZIMUTH,END_LOCATION,BEGIN_LAT,BEGIN_LON,END_LAT,END_LON,EPISODE_NARRATIVE,EVENT_NARRATIVE,DATA_SOURCE
200411,24,227,200411,24,245,1181702,5425478,MISSISSIPPI,28,2004,November,Tornado,C,159,WINSTON,JAN,24-NOV-04 02:27:00,CST,24-NOV-04 02:45:00,2,0,1,0,2.5M,,NWS STORM SURVEY,,,,,F3,12,600,,,,,6,SE,NOXAPATER,6,SE,NOXAPATER,32.93333,-88.98333,33,-88.83333,,"This strong tornado moved into Winston county from Neshoba county and tracked northeast for 12 miles before moving into Noxubee county. Just inside the Winston county line four large chicken houses were destroyed. As the tornado tracked northeast across State Route 393 and 397, a few hundred trees were uprooted and snapped. Several homes sustained minor roof damage. One home was totally destroyed on McBrayer Road. Pieces of the home was blown and scattered across a field for 1/4 mile. Here three vehicles were moved with two of them landing on top of tree debris and the other thrown into a ditch. This home was where the two injuries and one fatality occurred. The tornado was at its widest point here and as it tracked northeast hundreds of trees were blown down. The tornado moved into Noxubee county 2 miles southeast of Ferns Springs. The total path length across northern Neshoba, southeast Winston and western Noxubee county was 21 miles.",PDS
200411,24,245,200411,24,251,1181702,5425479,MISSISSIPPI,28,2004,November,Tornado,C,103,NOXUBEE,JAN,24-NOV-04 02:45:00,CST,24-NOV-04 02:51:00,0,0,0,0,100K,,NWS STORM SURVEY,,,,,F1,8,400,,,,,8,SW,MASHULAVILLE,8,SW,MASHULAVILLE,33,-88.85,33.05,-88.71667,,"This tornado moved into Noxubee county from Winston county and tracked northeast for 8 miles before dissipating 3 miles southeast of Mashulaville. This tornado mainly moved across heavily forested areas of Noxubee county and downed several hundred trees. As it crossed some county roads a few homes sustained minor roof damage and a few sheds were blown over. The total path length across northern Neshoba, southeast Winston and western Noxubee county was 21 miles.",PDS
200411,24,230,200411,24,230,1181702,5425480,MISSISSIPPI,28,2004,November,Thunderstorm Wind,C,99,NESHOBA,JAN,24-NOV-04 02:30:00,CST,24-NOV-04 02:30:00,0,0,0,0,10K,,EMERGENCY MANAGER,60,EG,,,,,,,,,,3,NE,SPRING CREEK,3,NE,SPRING CREEK,32.86667,-89,32.86667,-89,,A porch to a mobile home was blown off.,PDS
200411,24,242,200411,24,244,1181702,5425483,MISSISSIPPI,28,2004,November,Thunderstorm Wind,C,31,COVINGTON,JAN,24-NOV-04 02:42:00,CST,24-NOV-04 02:44:00,0,0,0,0,1K,,LAW ENFORCEMENT,55,EG,,,,,,,,,,5,ESE,WILLIAMSBURG,5,ESE,WILLIAMSBURG,31.58333,-89.53333,31.58333,-89.53333,,A few trees were blown down.,PDS
200410,19,1950,200410,19,1950,1180868,5425076,MISSISSIPPI,28,2004,October,Hail,C,19,CHOCTAW,JAN,19-OCT-04 19:50:00,CST,19-OCT-04 19:50:00,0,0,0,0,,,GENERAL PUBLIC,0.88,,,,,,,,,,,,,WEIR,,,WEIR,33.26667,-89.28333,33.26667,-89.28333,,,PDS
200410,20,2305,200410,20,2308,1180869,5425077,MISSISSIPPI,28,2004,October,Hail,C,87,LOWNDES,JAN,20-OCT-04 23:05:00,CST,20-OCT-04 23:08:00,0,0,0,0,,,LAW ENFORCEMENT,0.88,,,,,,,,,,,3,S,CALEDONIA,3,S,CALEDONIA,33.63333,-88.33333,33.61667,-88.33333,,,PDS
200410,20,2350,200410,20,2350,1180869,5425078,MISSISSIPPI,28,2004,October,Hail,C,87,LOWNDES,JAN,20-OCT-04 23:50:00,CST,20-OCT-04 23:50:00,0,0,0,0,,,PARK/FOREST SERVICE,0.88,,,,,,,,,,,3,S,NEW HOPE,3,S,NEW HOPE,33.41667,-88.31667,33.41667,-88.31667,,Nickel sized hail fell at Lake Lowndes State Park.,PDS
200409,16,0,200409,16,1600,1179490,5420738,MISSISSIPPI,28,2004,September,Hurricane (Typhoon),Z,58,CLARKE,JAN,16-SEP-04 00:00:00,CST,16-SEP-04 16:00:00,0,0,0,0,93.75K,31.3K,OFFICIAL NWS OBS.,,,,,,,,,,,,,,,,,,,,,,"Hurricane Ivan made landfall at 2:02 AM, September 16, near Gulf Shores, Alabama as a upper Category 3 hurricane. The western side of Ivan effected a large portion of Eastern Mississippi as the center moved north through Alabama. Thousands of trees were blown down across Eastern Mississippi during the event as well as hundreds of power lines. The strong wind itself did not cause much structural damage, however the fallen trees did. These downed trees accounted for several hundred homes, mobile homes and businesses to be damaged or destroyed. Most locations across Eastern Mississippi reported sustained winds between 30 and 40 mph with Tropical Storm force gusts between 48 and 54 mph. The strongest reported winds occurred in Newton, Lauderdale and Oktibbeha counties. A Mississippi mesonet site, in Newton, reported maximum sustained winds of 42 mph and peak gust of 54 mph. At Key Field in Meridian, maximum sustained winds were reported at 43 mph with a peak gust of 61 mph. The highest sustained and peak wind occurred at the Mississippi State Climate Lab in Starkville. This site reported maximum sustained winds of 52 mph and a peak gust of 64 mph.Overall, rainfall totals were held in check as Ivan steadily moved north. The heaviest rains were confined to far Eastern Mississippi where 3 to 4 inches fell over a 15 hour period. Due to the duration of the rain no flooding was reported.Across Eastern Mississippi, Hurricane Ivan was responsible for one fatality. This fatality occurred in Brooksville when a tree fell on a man. Damage from Ivan was estimated at $200 Million.",,PDS
200408,24,2000,200408,24,2005,1179627,5422110,MISSISSIPPI,28,2004,August,Thunderstorm Wind,C,93,MARSHALL,MEG,24-AUG-04 20:00:00,CST,24-AUG-04 20:05:00,1,0,0,0,10K,,GENERAL PUBLIC,60,EG,,,,,,,,,,,,WAITES,,,WAITES,34.7,-89.36667,34.7,-89.36667,,A trucker was blown off of Highway 78. The driver suffered minor injuries.,PDS
200411,23,2340,200411,24,7,1181702,5425216,MISSISSIPPI,28,2004,November,Thunderstorm Wind,C,49,HINDS,JAN,23-NOV-04 23:40:00,CST,24-NOV-04 00:07:00,0,0,0,0,5K,,NWS STORM SURVEY,57,EG,,,,,,,,,,6,NW,UTICA,6,NW,UTICA,32.18333,-90.68333,32.26667,-90.45,,Sporatic trees and large limbs were blown down from 6 miles northwest of Utica to 1 mile west of Raymond. This swath of sporatic tree damage was associated with the rear flank downdraft of a super cell thunderstorm that tracked east northeast across Central Hinds county.,PDS
200411,23,2340,200411,24,4,1181702,5425217,MISSISSIPPI,28,2004,November,Tornado,C,63,JEFFERSON,JAN,23-NOV-04 23:40:00,CST,24-NOV-04 00:04:00,0,0,0,0,300K,,NWS STORM SURVEY,,,,,F3,18,600,,,,,8,W,FAYETTE,8,W,FAYETTE,31.71667,-91.2,31.85,-90.93333,,"This tornado touched down just west of the Natchez Trace, 8 miles west of Fayette and tracked northeast for 18 miles across Jefferson county. Between the Natchez Trace and highway 553 the tornado was in its early stages and produced F0 damage by downing several trees. Between highway 553 and US Highway 61 this tornado began to intensify and downed or snapped hundreds of trees. One mobile home and two sheds sustained minor damage as they were located on the northern edge of the circulation.  As it approached US Highway 61, it moved through an open field and was at its widest point, 600 yards. Here a string of seven power poles were snapped and a large tractor shed was destroyed. The frame of the shed was made of large I-beams. These beams were snapped from their base as the shed was blown away. In the area around US Highway 61 four homes sustained major roof damage. On the east side of the highway one of these homes lost almost the entire roof and had every window blown out. For a three mile stretch between US Highway 61 and highway 552 the tornado was at its strongest and produced F3 damage. Every tree in the forest, along this stretch, was uprooted or snapped. The tornado began to weaken after passing across highway 552 and dissipated just on the other side of the Claiborne county line.",PDS
200410,18,530,200410,18,530,1180866,5425034,MISSISSIPPI,28,2004,October,Thunderstorm Wind,C,61,JASPER,JAN,18-OCT-04 05:30:00,CST,18-OCT-04 05:30:00,0,0,0,0,3K,,EMERGENCY MANAGER,57,EG,,,,,,,,,,6,E,BAY SPGS,6,E,BAY SPGS,31.96667,-89.2,31.96667,-89.2,,Fifteen to twenty trees were blown down along with one power line.,PDS
200410,18,1840,200410,18,1843,1180866,5425035,MISSISSIPPI,28,2004,October,Tornado,C,25,CLAY,JAN,18-OCT-04 18:40:00,CST,18-OCT-04 18:43:00,0,0,0,0,1K,,STORM CHASER,,,,,F0,1,75,,,,,6,NE,WEST PT,6,NE,WEST PT,33.66667,-88.58333,33.66667,-88.56667,,"Storm chasers captured this weak tornado on video as it moved east across northern Clay county, six miles northeast of West Point.",PDS
200410,8,1220,200410,8,1500,1180871,5425083,MISSISSIPPI,28,2004,October,Flash Flood,C,73,LAMAR,JAN,08-OCT-04 12:20:00,CST,08-OCT-04 15:00:00,0,0,0,0,50K,,EMERGENCY MANAGER,,,,,,,,,,,,6,NNE,BAXTERVILLE,6,NNE,BAXTERVILLE,,,,,,"At 1:20 PM CDT, the dam at York's Lake failed as the owners tried to do a controlled break on the structure with a back hoe. The structure failed and four to six feet of water covered a portion of RL Anderson Road. This water was dispersed into Five Spice Creek then into Grantham Creek and eventually into Lower Little Creek. Due to the relatively small size of York's Lake, the wave of water was dispersed rather quickly and only caused minor flooding on a few rural roads in the area.",PDS
200411,24,4,200411,24,5,1181702,5425218,MISSISSIPPI,28,2004,November,Tornado,C,21,CLAIBORNE,JAN,24-NOV-04 00:04:00,CST,24-NOV-04 00:05:00,0,0,0,0,1K,,NWS STORM SURVEY,,,,,F0,.5,100,,,,,2,WSW,TILLMAN,2,WSW,TILLMAN,31.83333,-90.96667,31.85,-90.95,,"This weak tornado entered Claiborne county from Jefferson county and dissipated 1/2 mile into the county. This was the very end of the 18 mile path of the Jefferson county tornado. While briefly in Claiborne county, a few trees were damaged before the tornado dissipated.",PDS
200411,23,2335,200411,23,2340,1181702,5425219,MISSISSIPPI,28,2004,November,Hail,C,63,JEFFERSON,JAN,23-NOV-04 23:35:00,CST,23-NOV-04 23:40:00,0,0,0,0,,,NWS STORM SURVEY,0.75,,,,,,,,,,,,,CHURCH HILL,,,CHURCH HILL,31.71667,-91.25,31.76667,-91.31667,,,PDS
200411,24,253,200411,24,253,1181702,5425484,MISSISSIPPI,28,2004,November,Thunderstorm Wind,C,31,COVINGTON,JAN,24-NOV-04 02:53:00,CST,24-NOV-04 02:53:00,0,0,0,0,1K,,LAW ENFORCEMENT,55,EG,,,,,,,,,,1,N,SEMINARY,1,N,SEMINARY,31.56667,-89.5,31.56667,-89.5,,A few trees and large limbs were blown down.,PDS
200411,24,300,200411,24,300,1181702,5425485,MISSISSIPPI,28,2004,November,Thunderstorm Wind,C,31,COVINGTON,JAN,24-NOV-04 03:00:00,CST,24-NOV-04 03:00:00,0,0,0,0,1K,,LAW ENFORCEMENT,55,EG,,,,,,,,,,9,E,COLLINS,9,E,COLLINS,31.63333,-89.4,31.63333,-89.4,,A few trees and large limbs were blown down.,PDS
200410,2,1550,200410,2,1553,1180865,5425033,MISSISSIPPI,28,2004,October,Thunderstorm Wind,C,87,LOWNDES,JAN,02-OCT-04 15:50:00,CST,02-OCT-04 15:53:00,1,0,0,0,10K,,EMERGENCY MANAGER,60,EG,,,,,,,,,,,,CALEDONIA,,,CALEDONIA,33.68333,-88.33333,33.68333,-88.33333,,"One person was injured as debris from a downed wooden fence was blown through a window. In addition, several trees were blown down in the area with a few blown down across a road.",PDS
200411,23,2310,200411,23,2310,1181702,5425150,MISSISSIPPI,28,2004,November,Hail,C,21,CLAIBORNE,JAN,23-NOV-04 23:10:00,CST,23-NOV-04 23:10:00,0,0,0,0,,,AMATEUR RADIO,0.75,,,,,,,,,,,,,PORT GIBSON,,,PORT GIBSON,31.96667,-91,31.96667,-91,,,PDS
200411,23,2315,200411,23,2315,1181702,5425151,MISSISSIPPI,28,2004,November,Hail,C,149,WARREN,JAN,23-NOV-04 23:15:00,CST,23-NOV-04 23:15:00,0,0,0,0,,,AMATEUR RADIO,0.75,,,,,,,,,,,,,VICKSBURG,,,VICKSBURG,32.35,-90.88333,32.35,-90.88333,,,PDS
200411,23,2324,200411,23,2324,1181702,5425152,MISSISSIPPI,28,2004,November,Hail,C,1,ADAMS,JAN,23-NOV-04 23:24:00,CST,23-NOV-04 23:24:00,0,0,0,0,,,EMERGENCY MANAGER,0.75,,,,,,,,,,,3,N,NATCHEZ,3,N,NATCHEZ,31.61667,-91.4,31.61667,-91.4,,,PDS
200411,23,2331,200411,23,2333,1181702,5425153,MISSISSIPPI,28,2004,November,Tornado,C,149,WARREN,JAN,23-NOV-04 23:31:00,CST,23-NOV-04 23:33:00,0,0,0,0,1K,,NWS STORM SURVEY,,,,,F0,1,75,,,,,8,SE,VICKSBURG,8,SE,VICKSBURG,32.26667,-90.78333,32.26667,-90.78333,,This weak tornado touched down about 2 miles south of China Grove Road on highway 27. It moved east for 1 mile and downed a few large trees and snapped several branches off a dozen more trees.,PDS
200411,23,2332,200411,23,2332,1181702,5425154,MISSISSIPPI,28,2004,November,Thunderstorm Wind,C,149,WARREN,JAN,23-NOV-04 23:32:00,CST,23-NOV-04 23:32:00,0,0,0,0,1K,,NWS STORM SURVEY,63,EG,,,,,,,,,,9,SE,VICKSBURG,9,SE,VICKSBURG,32.25,-90.76667,32.25,-90.76667,,A few large trees were blown down 1 mile south of a F0 tornado track. This damage occurred 3 miles south of China Grove Road on highway 27. This damage was caused by the rear flank down draft of a super cell thunderstorm.,PDS
200410,19,820,200410,19,825,1180868,5425037,MISSISSIPPI,28,2004,October,Thunderstorm Wind,C,151,WASHINGTON,JAN,19-OCT-04 08:20:00,CST,19-OCT-04 08:25:00,0,0,0,0,3K,,NEWSPAPER,53,EG,,,,,,,,,,,,GREENVILLE,,,GREENVILLE,33.4,-91.05,33.4,-91.05,,Two  trees and two power lines were blown down near the Washington County Courthouse.,PDS
200408,11,1358,200408,11,1403,1179623,5422047,MISSISSIPPI,28,2004,August,Hail,C,141,TISHOMINGO,MEG,11-AUG-04 13:58:00,CST,11-AUG-04 14:03:00,0,0,0,0,.1K,,GENERAL PUBLIC,1.00,,,,,,,,,,,4,E,IUKA,4,E,IUKA,34.83333,-88.1,34.83333,-88.1,,,PDS
200408,19,2045,200408,19,2045,1179625,5422049,MISSISSIPPI,28,2004,August,Strong Wind,Z,10,COAHOMA,MEG,19-AUG-04 20:45:00,CST,19-AUG-04 20:45:00,0,0,0,0,10K,,EMERGENCY MANAGER,35,EG,,,,,,,,,,,,,,,,,,,,,Trees and power lines were blown down in association with a gust front.,PDS
200411,23,2350,200411,23,2355,1181702,5425220,MISSISSIPPI,28,2004,November,Hail,C,63,JEFFERSON,JAN,23-NOV-04 23:50:00,CST,23-NOV-04 23:55:00,0,0,0,0,,,NWS STORM SURVEY,0.75,,,,,,,,,,,1,S,LORMAN,1,S,LORMAN,31.8,-91.05,31.81667,-91.01667,,,PDS
200411,23,2355,200411,23,2355,1181702,5425221,MISSISSIPPI,28,2004,November,Thunderstorm Wind,C,1,ADAMS,JAN,23-NOV-04 23:55:00,CST,23-NOV-04 23:55:00,0,0,0,0,,,AMATEUR RADIO,51,EG,,,,,,,,,,,,NATCHEZ,,,NATCHEZ,31.56667,-91.4,31.56667,-91.4,,,PDS
200411,23,2356,200411,23,2356,1181702,5425222,MISSISSIPPI,28,2004,November,Hail,C,49,HINDS,JAN,23-NOV-04 23:56:00,CST,23-NOV-04 23:56:00,0,0,0,0,,,AMATEUR RADIO,0.75,,,,,,,,,,,5,W,RAYMOND,5,W,RAYMOND,32.26667,-90.51667,32.26667,-90.51667,,,PDS
200411,24,6,200411,24,8,1181702,5425223,MISSISSIPPI,28,2004,November,Thunderstorm Wind,C,1,ADAMS,JAN,24-NOV-04 00:06:00,CST,24-NOV-04 00:08:00,0,0,0,0,5K,,AMATEUR RADIO,62,EG,,,,,,,,,,,,WASHINGTON,,,WASHINGTON,31.58333,-91.3,31.58333,-91.3,,Several power lines and large trees were blown down.,PDS
200411,24,18,200411,24,20,1181702,5425224,MISSISSIPPI,28,2004,November,Thunderstorm Wind,C,49,HINDS,JAN,24-NOV-04 00:18:00,CST,24-NOV-04 00:20:00,0,0,0,0,15K,,EMERGENCY MANAGER,68,EG,,,,,,,,,,,,CLINTON,,,CLINTON,32.33333,-90.33333,32.33333,-90.33333,,Numerous trees and power lines blown down.,PDS
200411,24,33,200411,24,33,1181702,5425225,MISSISSIPPI,28,2004,November,Tornado,C,29,COPIAH,JAN,24-NOV-04 00:33:00,CST,24-NOV-04 00:33:00,0,0,0,0,1K,,NWS STORM SURVEY,,,,,F0,.5,30,,,,,5,ENE,CARPENTER,5,ENE,CARPENTER,32.06667,-90.6,32.06667,-90.6,,"This weak tornado touched down along Chapman Road on the Copiah, Hinds county line. A few trees were damaged along the road before the tornado moved northeast into an open field.",PDS
200411,24,33,200411,24,34,1181702,5425226,MISSISSIPPI,28,2004,November,Tornado,C,49,HINDS,JAN,24-NOV-04 00:33:00,CST,24-NOV-04 00:34:00,0,0,0,0,1K,,NWS STORM SURVEY,,,,,F0,.5,30,,,,,4,S,UTICA,4,S,UTICA,32.06667,-90.61667,32.06667,-90.61667,,"This weak tornado touched down along Chapman Road on the Copiah, Hinds county line. A few trees were damaged along the road before the tornado moved northeast into an open field.",PDS
200409,12,1620,200409,12,1620,1179489,5420737,MISSISSIPPI,28,2004,September,Thunderstorm Wind,C,103,NOXUBEE,JAN,12-SEP-04 16:20:00,CST,12-SEP-04 16:20:00,0,0,0,0,.1K,,LAW ENFORCEMENT,43,EG,,,,,,,,,,2,S,MACON,2,S,MACON,33.08333,-88.4,33.08333,-88.4,,Two trees were blown down.,PDS
200409,16,0,200409,16,1600,1179490,5420745,MISSISSIPPI,28,2004,September,Hurricane (Typhoon),Z,73,LAMAR,JAN,16-SEP-04 00:00:00,CST,16-SEP-04 16:00:00,0,0,0,0,93.75K,31.3K,OFFICIAL NWS OBS.,,,,,,,,,,,,,,,,,,,,,,"Hurricane Ivan made landfall at 2:02 AM, September 16, near Gulf Shores, Alabama as a upper Category 3 hurricane. The western side of Ivan effected a large portion of Eastern Mississippi as the center moved north through Alabama. Thousands of trees were blown down across Eastern Mississippi during the event as well as hundreds of power lines. The strong wind itself did not cause much structural damage, however the fallen trees did. These downed trees accounted for several hundred homes, mobile homes and businesses to be damaged or destroyed. Most locations across Eastern Mississippi reported sustained winds between 30 and 40 mph with Tropical Storm force gusts between 48 and 54 mph. The strongest reported winds occurred in Newton, Lauderdale and Oktibbeha counties. A Mississippi mesonet site, in Newton, reported maximum sustained winds of 42 mph and peak gust of 54 mph. At Key Field in Meridian, maximum sustained winds were reported at 43 mph with a peak gust of 61 mph. The highest sustained and peak wind occurred at the Mississippi State Climate Lab in Starkville. This site reported maximum sustained winds of 52 mph and a peak gust of 64 mph.Overall, rainfall totals were held in check as Ivan steadily moved north. The heaviest rains were confined to far Eastern Mississippi where 3 to 4 inches fell over a 15 hour period. Due to the duration of the rain no flooding was reported.Across Eastern Mississippi, Hurricane Ivan was responsible for one fatality. This fatality occurred in Brooksville when a tree fell on a man. Damage from Ivan was estimated at $200 Million.",,PDS
200409,12,1725,200409,12,1730,1179887,5422514,MISSISSIPPI,28,2004,September,Hail,C,81,LEE,MEG,12-SEP-04 17:25:00,CST,12-SEP-04 17:30:00,0,0,0,0,.75K,,BROADCAST MEDIA,1.75,,,,,,,,,,,4,NW,TUPELO,4,NW,TUPELO,34.3,-88.76667,34.3,-88.76667,,,PDS
200409,12,1815,200409,12,1820,1179887,5422515,MISSISSIPPI,28,2004,September,Thunderstorm Wind,C,81,LEE,MEG,12-SEP-04 18:15:00,CST,12-SEP-04 18:20:00,0,0,0,0,5K,,BROADCAST MEDIA,50,EG,,,,,,,,,,,,SHANNON,,,SHANNON,34.11667,-88.71667,34.11667,-88.71667,,Some trees were blown down.,PDS
200409,12,1830,200409,12,1835,1179887,5422516,MISSISSIPPI,28,2004,September,Thunderstorm Wind,C,17,CHICKASAW,MEG,12-SEP-04 18:30:00,CST,12-SEP-04 18:35:00,0,0,0,0,1K,,BROADCAST MEDIA,55,EG,,,,,,,,,,,,OKOLONA,,,OKOLONA,34,-88.75,34,-88.75,,A shed was blown over and a lawn tractor was overturned.,PDS
200409,12,1839,200409,12,1845,1179887,5422517,MISSISSIPPI,28,2004,September,Thunderstorm Wind,C,95,MONROE,MEG,12-SEP-04 18:39:00,CST,12-SEP-04 18:45:00,0,0,0,0,5K,,LAW ENFORCEMENT,50,EG,,,,,,,,,,3,S,AMORY,3,S,AMORY,33.93333,-88.5,33.93333,-88.5,,Several trees were knocked down.,PDS
200409,12,1840,200409,12,1845,1179887,5422518,MISSISSIPPI,28,2004,September,Hail,C,95,MONROE,MEG,12-SEP-04 18:40:00,CST,12-SEP-04 18:45:00,0,0,0,0,.5K,,BROADCAST MEDIA,0.88,,,,,,,,,,,,,HATLEY,,,HATLEY,33.98333,-88.36667,33.98333,-88.36667,,,PDS
200409,12,1850,200409,12,1855,1179887,5422519,MISSISSIPPI,28,2004,September,Thunderstorm Wind,C,17,CHICKASAW,MEG,12-SEP-04 18:50:00,CST,12-SEP-04 18:55:00,0,0,0,0,10K,,BROADCAST MEDIA,50,EG,,,,,,,,,,,,OKOLONA,,,OKOLONA,34,-88.75,34,-88.75,,Several trees were blown down. One tree fell on top of a garage.,PDS
200409,16,0,200409,16,1600,1179490,5420746,MISSISSIPPI,28,2004,September,Hurricane (Typhoon),Z,52,LAUDERDALE,JAN,16-SEP-04 00:00:00,CST,16-SEP-04 16:00:00,0,0,0,0,93.75K,31.3K,OFFICIAL NWS OBS.,,,,,,,,,,,,,,,,,,,,,,"Hurricane Ivan made landfall at 2:02 AM, September 16, near Gulf Shores, Alabama as a upper Category 3 hurricane. The western side of Ivan effected a large portion of Eastern Mississippi as the center moved north through Alabama. Thousands of trees were blown down across Eastern Mississippi during the event as well as hundreds of power lines. The strong wind itself did not cause much structural damage, however the fallen trees did. These downed trees accounted for several hundred homes, mobile homes and businesses to be damaged or destroyed. Most locations across Eastern Mississippi reported sustained winds between 30 and 40 mph with Tropical Storm force gusts between 48 and 54 mph. The strongest reported winds occurred in Newton, Lauderdale and Oktibbeha counties. A Mississippi mesonet site, in Newton, reported maximum sustained winds of 42 mph and peak gust of 54 mph. At Key Field in Meridian, maximum sustained winds were reported at 43 mph with a peak gust of 61 mph. The highest sustained and peak wind occurred at the Mississippi State Climate Lab in Starkville. This site reported maximum sustained winds of 52 mph and a peak gust of 64 mph.Overall, rainfall totals were held in check as Ivan steadily moved north. The heaviest rains were confined to far Eastern Mississippi where 3 to 4 inches fell over a 15 hour period. Due to the duration of the rain no flooding was reported.Across Eastern Mississippi, Hurricane Ivan was responsible for one fatality. This fatality occurred in Brooksville when a tree fell on a man. Damage from Ivan was estimated at $200 Million.",,PDS
200408,23,1415,200408,23,1415,1178276,5418303,MISSISSIPPI,28,2004,August,Lightning,C,41,GREENE,MOB,23-AUG-04 14:15:00,CST,23-AUG-04 14:15:00,0,0,0,0,50K,,NEWSPAPER,,,,,,,,,,,,,,LEAKESVILLE,,,LEAKESVILLE,,,,,,Lightning struck a tower in Leakesville that housed most of Greene counties communication equipment and the Leakesville NOAA Weather Radio antenna.  The NOAA Weather Radio and the counties communications were off the air for about eighteen hours until repairs were made.,PDS
200409,16,0,200409,16,1600,1179490,5420743,MISSISSIPPI,28,2004,September,Hurricane (Typhoon),Z,66,JONES,JAN,16-SEP-04 00:00:00,CST,16-SEP-04 16:00:00,0,0,0,0,93.75K,31.3K,OFFICIAL NWS OBS.,,,,,,,,,,,,,,,,,,,,,,"Hurricane Ivan made landfall at 2:02 AM, September 16, near Gulf Shores, Alabama as a upper Category 3 hurricane. The western side of Ivan effected a large portion of Eastern Mississippi as the center moved north through Alabama. Thousands of trees were blown down across Eastern Mississippi during the event as well as hundreds of power lines. The strong wind itself did not cause much structural damage, however the fallen trees did. These downed trees accounted for several hundred homes, mobile homes and businesses to be damaged or destroyed. Most locations across Eastern Mississippi reported sustained winds between 30 and 40 mph with Tropical Storm force gusts between 48 and 54 mph. The strongest reported winds occurred in Newton, Lauderdale and Oktibbeha counties. A Mississippi mesonet site, in Newton, reported maximum sustained winds of 42 mph and peak gust of 54 mph. At Key Field in Meridian, maximum sustained winds were reported at 43 mph with a peak gust of 61 mph. The highest sustained and peak wind occurred at the Mississippi State Climate Lab in Starkville. This site reported maximum sustained winds of 52 mph and a peak gust of 64 mph.Overall, rainfall totals were held in check as Ivan steadily moved north. The heaviest rains were confined to far Eastern Mississippi where 3 to 4 inches fell over a 15 hour period. Due to the duration of the rain no flooding was reported.Across Eastern Mississippi, Hurricane Ivan was responsible for one fatality. This fatality occurred in Brooksville when a tree fell on a man. Damage from Ivan was estimated at $200 Million.",,PDS
200408,24,2000,200408,24,2005,1179627,5422111,MISSISSIPPI,28,2004,August,Hail,C,93,MARSHALL,MEG,24-AUG-04 20:00:00,CST,24-AUG-04 20:05:00,0,0,0,0,.1K,,GENERAL PUBLIC,1.00,,,,,,,,,,,,,WAITES,,,WAITES,34.7,-89.36667,34.7,-89.36667,,,PDS
200408,24,1930,200408,24,1935,1179627,5422112,MISSISSIPPI,28,2004,August,Thunderstorm Wind,C,107,PANOLA,MEG,24-AUG-04 19:30:00,CST,24-AUG-04 19:35:00,0,0,0,0,5K,,NEWSPAPER,50,EG,,,,,,,,,,,,BATESVILLE,,,BATESVILLE,34.31667,-89.95,34.31667,-89.95,,Some trees were blown down.,PDS
200409,14,1334,200409,16,1500,1179852,5422313,MISSISSIPPI,28,2004,September,Hurricane (Typhoon),Z,67,WAYNE,MOB,14-SEP-04 13:34:00,CST,16-SEP-04 15:00:00,0,0,0,0,,,NWS STORM SURVEY,,,,,,,,,,,,,,,,,,,,,,"Please see the detailed narrative on Hurricane Ivan under Alabama, Southwest, September 13-16, 2004.  Hurricane force winds, primarily in gusts, occurred over most interior portions of southeast Mississippi during the late evening hours of September 15th ,and the very early morning hours of September 16th.  Duration of the winds producing hurricane force gusts was around two  hours. These strong winds downed some trees across the region, some of which fell onto structures which were damaged as a result.   Although Ivan did produce wind damage across southeast Mississippi, this damage was neither as widespread nor as severe as was the wind damage over much of southwest Alabama and the western Florida panhandle.",,PDS
