BEGIN_YEARMONTH,BEGIN_DAY,BEGIN_TIME,END_YEARMONTH,END_DAY,END_TIME,EPISODE_ID,EVENT_ID,STATE,STATE_FIPS,YEAR,MONTH_NAME,EVENT_TYPE,CZ_TYPE,CZ_FIPS,CZ_NAME,WFO,BEGIN_DATE_TIME,CZ_TIMEZONE,END_DATE_TIME,INJURIES_DIRECT,INJURIES_INDIRECT,DEATHS_DIRECT,DEATHS_INDIRECT,DAMAGE_PROPERTY,DAMAGE_CROPS,SOURCE,MAGNITUDE,MAGNITUDE_TYPE,FLOOD_CAUSE,CATEGORY,TOR_F_SCALE,TOR_LENGTH,TOR_WIDTH,TOR_OTHER_WFO,TOR_OTHER_CZ_STATE,TOR_OTHER_CZ_FIPS,TOR_OTHER_CZ_NAME,BEGIN_RANGE,BEGIN_AZIMUTH,BEGIN_LOCATION,END_RANGE,END_AZIMUTH,END_LOCATION,BEGIN_LAT,BEGIN_LON,END_LAT,END_LON,EPISODE_NARRATIVE,EVENT_NARRATIVE,DATA_SOURCE
200412,22,1700,200412,23,0,1182729,5430617,MISSISSIPPI,28,2004,December,Ice Storm,Z,18,BOLIVAR,JAN,22-DEC-04 17:00:00,CST,23-DEC-04 00:00:00,0,0,0,0,300K,,EMERGENCY MANAGER,,,,,,,,,,,,,,,,,,,,,,,,PDS
200412,9,538,200412,9,539,1182727,5430610,MISSISSIPPI,28,2004,December,Tornado,C,69,KEMPER,JAN,09-DEC-04 05:38:00,CST,09-DEC-04 05:39:00,0,0,0,0,5K,,NWS STORM SURVEY,,,,,F0,.2,50,,,,,2,SW,DE KALB,2,SW,DE KALB,32.23333,-89.43333,32.28333,-89.38333,,This weak tornado downed several trees when it briefly touched down southwest of DeKalb.,PDS
200410,9,1500,200410,10,900,1187102,5431115,MISSISSIPPI,28,2004,October,Tropical Storm,Z,80,HANCOCK,LIX,09-OCT-04 15:00:00,CST,10-OCT-04 09:00:00,0,0,0,0,10K,,OFFICIAL NWS OBS.,,,,,,,,,,,,,,,,,,,,,,"Tropical Storm Matthew developed from a tropical depression in the southwest Gulf of Mexico on October 8 and initially moved to the east northeast across the western and central Gulf of Mexico before gradually turning to the northeast and north. Matthew made landfall as minimal tropical storm along the south central Louisiana coast near Cocodrie on October 10 and weakened to a tropical depression shortly after moving inland. Matthew continued north and moved across southeast Louisiana and southwest Mississippi as a tropical depression on the 10th before dissipating over extreme southeast Arkansas on October 11.Tropical storm force winds associated with Matthew affected the western portion of Mississippi Coast. Sustained winds of 34 knots (39 mph) and a maximum gust of 39 knots (45 mph) was recorded at the NOAA automated weather station at Waveland. The storm surge was generally 2 to 4 feet above normal along portions of the Mississippi coast with the highest storm surge recorded at Waveland at 5.13 ft MLLW. The lowest pressure recorded along the Mississippi coast was was 1005.4 mb at Gulfport on October 10th at 1654 CST.No tornadoes were reported. Storm total rainfall varied from 2 to 4 inches in Hancock and Harrison Counties. Some coastal flooding due to storm surge was reported in Hancock County. Based on reports, total storm damage was estimated at around 50 thousand dollars with approximately 40 percent of the damage due to wind ($20 thousand) and 60 percent due to storm surge ($30 thousand).",,PDS
200410,9,1500,200410,10,900,1187102,5431116,MISSISSIPPI,28,2004,October,Tropical Storm,Z,81,HARRISON,LIX,09-OCT-04 15:00:00,CST,10-OCT-04 09:00:00,0,0,0,0,10K,,OFFICIAL NWS OBS.,,,,,,,,,,,,,,,,,,,,,,"Tropical Storm Matthew developed from a tropical depression in the southwest Gulf of Mexico on October 8 and initially moved to the east northeast across the western and central Gulf of Mexico before gradually turning to the northeast and north. Matthew made landfall as minimal tropical storm along the south central Louisiana coast near Cocodrie on October 10 and weakened to a tropical depression shortly after moving inland. Matthew continued north and moved across southeast Louisiana and southwest Mississippi as a tropical depression on the 10th before dissipating over extreme southeast Arkansas on October 11.Tropical storm force winds associated with Matthew affected the western portion of Mississippi Coast. Sustained winds of 34 knots (39 mph) and a maximum gust of 39 knots (45 mph) was recorded at the NOAA automated weather station at Waveland. The storm surge was generally 2 to 4 feet above normal along portions of the Mississippi coast with the highest storm surge recorded at Waveland at 5.13 ft MLLW. The lowest pressure recorded along the Mississippi coast was was 1005.4 mb at Gulfport on October 10th at 1654 CST.No tornadoes were reported. Storm total rainfall varied from 2 to 4 inches in Hancock and Harrison Counties. Some coastal flooding due to storm surge was reported in Hancock County. Based on reports, total storm damage was estimated at around 50 thousand dollars with approximately 40 percent of the damage due to wind ($20 thousand) and 60 percent due to storm surge ($30 thousand).",,PDS
200408,30,1330,200408,30,1330,1187080,5432605,MISSISSIPPI,28,2004,August,Hail,C,47,HARRISON,LIX,30-AUG-04 13:30:00,CST,30-AUG-04 13:30:00,0,0,0,0,,,BROADCAST MEDIA,1.00,,,,,,,,,,,,,WORTHAM,,,WORTHAM,30.56667,-89.13333,30.56667,-89.13333,,Quarter size hail was observed.,PDS
200408,30,1330,200408,30,1330,1187081,5432606,MISSISSIPPI,28,2004,August,Thunderstorm Wind,C,47,HARRISON,LIX,30-AUG-04 13:30:00,CST,30-AUG-04 13:30:00,0,0,0,0,2K,,BROADCAST MEDIA,50,EG,,,,,,,,,,,,WORTHAM,,,WORTHAM,30.56667,-89.13333,30.56667,-89.13333,,Thunderstorm winds knocked down trees and a gazebo and damaged sheds.,PDS
200412,9,541,200412,9,552,1182727,5430611,MISSISSIPPI,28,2004,December,Thunderstorm Wind,C,69,KEMPER,JAN,09-DEC-04 05:41:00,CST,09-DEC-04 05:52:00,1,0,0,0,70K,,NWS STORM SURVEY,80,EG,,,,,,,,,,,,DE KALB,,,DE KALB,32.13333,-89.4,32.13333,-89.4,,One mobile home was rolled over and destroyed along with a roof blown off an apartment complex. Numerous trees and power lines were blown down with a few large trees falling onto houses. A total of eight homes sustained damage.,PDS
200412,9,550,200412,9,630,1182727,5430612,MISSISSIPPI,28,2004,December,Flash Flood,C,103,NOXUBEE,JAN,09-DEC-04 05:50:00,CST,09-DEC-04 06:30:00,0,0,0,0,2K,,LAW ENFORCEMENT,,,,,,,,,,,,,,MACON,,,MACON,32.51667,-89.05,32.51667,-89.05,,Numerous streets and roads were flooded in and around town.,PDS
200410,9,1500,200410,10,900,1187102,5431117,MISSISSIPPI,28,2004,October,Storm Surge/Tide,Z,81,HARRISON,LIX,09-OCT-04 15:00:00,CST,10-OCT-04 09:00:00,0,0,0,0,15K,,COASTAL OBSERVING STATION,,,,,,,,,,,,,,,,,,,,,,"Tropical Storm Matthew developed from a tropical depression in the southwest Gulf of Mexico on October 8 and initially moved to the east northeast across the western and central Gulf of Mexico before gradually turning to the northeast and north. Matthew made landfall as minimal tropical storm along the south central Louisiana coast near Cocodrie on October 10 and weakened to a tropical depression shortly after moving inland. Matthew continued north and moved across southeast Louisiana and southwest Mississippi as a tropical depression on the 10th before dissipating over extreme southeast Arkansas on October 11.Tropical storm force winds associated with Matthew affected the western portion of Mississippi Coast. Sustained winds of 34 knots (39 mph) and a maximum gust of 39 knots (45 mph) was recorded at the NOAA automated weather station at Waveland. The storm surge was generally 2 to 4 feet above normal along portions of the Mississippi coast with the highest storm surge recorded at Waveland at 5.13 ft MLLW. The lowest pressure recorded along the Mississippi coast was was 1005.4 mb at Gulfport on October 10th at 1654 CST.No tornadoes were reported. Storm total rainfall varied from 2 to 4 inches in Hancock and Harrison Counties. Some coastal flooding due to storm surge was reported in Hancock County. Based on reports, total storm damage was estimated at around 50 thousand dollars with approximately 40 percent of the damage due to wind ($20 thousand) and 60 percent due to storm surge ($30 thousand).",,PDS
200412,25,900,200412,25,1800,1187150,5431951,MISSISSIPPI,28,2004,December,Winter Storm,Z,80,HANCOCK,LIX,25-DEC-04 09:00:00,CST,25-DEC-04 18:00:00,0,0,0,0,,,NWS STORM SURVEY,,,,,,,,,,,,,,,,,,,,,,"A mixture of sleet and snow fell off and on during much of Christmas day resulting in a dusting to one half inch of accumulation across much of southwest, south and coastal Mississippi. Although not heavy, accumulation of ice and snow in coastal Mississippi is unusual and the winter weather impacted transportation. The mixture of sleet and snow caused a number of bridges and overpasses to become icy which resulted in some traffic accidents, and closure of some the elevated roadways.",,PDS
200412,25,900,200412,25,1800,1187150,5431952,MISSISSIPPI,28,2004,December,Winter Storm,Z,81,HARRISON,LIX,25-DEC-04 09:00:00,CST,25-DEC-04 18:00:00,0,0,0,0,,,NWS STORM SURVEY,,,,,,,,,,,,,,,,,,,,,,"A mixture of sleet and snow fell off and on during much of Christmas day resulting in a dusting to one half inch of accumulation across much of southwest, south and coastal Mississippi. Although not heavy, accumulation of ice and snow in coastal Mississippi is unusual and the winter weather impacted transportation. The mixture of sleet and snow caused a number of bridges and overpasses to become icy which resulted in some traffic accidents, and closure of some the elevated roadways.",,PDS
200412,6,1300,200412,6,1500,1183703,5432163,MISSISSIPPI,28,2004,December,Flash Flood,C,81,LEE,MEG,06-DEC-04 13:00:00,CST,06-DEC-04 15:00:00,0,0,0,0,5K,,NEWSPAPER,,,,,,,,,,,,,,SALTILLO,,,SALTILLO,,,,,,One home was flooded.,PDS
200412,25,900,200412,25,1800,1187150,5431953,MISSISSIPPI,28,2004,December,Winter Storm,Z,82,JACKSON,LIX,25-DEC-04 09:00:00,CST,25-DEC-04 18:00:00,0,0,0,0,,,NWS STORM SURVEY,,,,,,,,,,,,,,,,,,,,,,"A mixture of sleet and snow fell off and on during much of Christmas day resulting in a dusting to one half inch of accumulation across much of southwest, south and coastal Mississippi. Although not heavy, accumulation of ice and snow in coastal Mississippi is unusual and the winter weather impacted transportation. The mixture of sleet and snow caused a number of bridges and overpasses to become icy which resulted in some traffic accidents, and closure of some the elevated roadways.",,PDS
200412,9,510,200412,9,600,1182727,5430606,MISSISSIPPI,28,2004,December,Flash Flood,C,101,NEWTON,JAN,09-DEC-04 05:10:00,CST,09-DEC-04 06:00:00,0,0,0,0,5K,,EMERGENCY MANAGER,,,,,,,,,,,,,,LITTLE ROCK,,,LITTLE ROCK,31.85,-89.73333,31.85,-89.73333,,Heavy rains caused several roads to flood just north of Little Rock.,PDS
200412,9,505,200412,9,505,1182727,5430607,MISSISSIPPI,28,2004,December,Thunderstorm Wind,C,75,LAUDERDALE,JAN,09-DEC-04 05:05:00,CST,09-DEC-04 05:05:00,0,0,0,0,8K,,EMERGENCY MANAGER,55,EG,,,,,,,,,,,,SUQUALENA,,,SUQUALENA,31.98333,-89.75,31.98333,-89.75,,Several trees were blown down along Highway 19.,PDS
200412,9,506,200412,9,506,1182727,5430608,MISSISSIPPI,28,2004,December,Thunderstorm Wind,C,75,LAUDERDALE,JAN,09-DEC-04 05:06:00,CST,09-DEC-04 05:06:00,0,0,0,0,8K,,EMERGENCY MANAGER,55,EG,,,,,,,,,,5,W,MERIDIAN,5,W,MERIDIAN,31.96667,-89.68333,31.96667,-89.68333,,Several trees were blown down along Interstate 20 near exit 129.,PDS
200412,9,527,200412,9,528,1182727,5430609,MISSISSIPPI,28,2004,December,Tornado,C,69,KEMPER,JAN,09-DEC-04 05:27:00,CST,09-DEC-04 05:28:00,0,0,0,0,5K,,NWS STORM SURVEY,,,,,F0,.2,50,,,,,7,SW,DE KALB,7,SW,DE KALB,32.03333,-89.61667,32.21667,-89.4,,This weak tornado downed several trees when it briefly touched down southwest of DeKalb.,PDS
200412,9,515,200412,9,630,1182727,5430613,MISSISSIPPI,28,2004,December,Flash Flood,C,99,NESHOBA,JAN,09-DEC-04 05:15:00,CST,09-DEC-04 06:30:00,0,0,0,0,15K,,NEWSPAPER,,,,,,,,,,,,,,HOUSE,,,HOUSE,32.56667,-88.98333,32.58333,-88.96667,,Several roads were flooded across southeast Neshoba county. County road 4312 had a large section washed out.,PDS
200412,9,520,200412,9,522,1182727,5430614,MISSISSIPPI,28,2004,December,Thunderstorm Wind,C,99,NESHOBA,JAN,09-DEC-04 05:20:00,CST,09-DEC-04 05:22:00,0,0,0,0,30K,,NEWSPAPER,75,EG,,,,,,,,,,,,HERBERT SPGS,,,HERBERT SPGS,31.96667,-89.3,31.96667,-89.3,,One roof was partially blown off a home and several out buildings and car sheds were destroyed. Another home sustained minor roof damage as some shingles were blown off. Several trees and power lines were also blown down in the area.,PDS
200412,9,345,200412,9,600,1182727,5430615,MISSISSIPPI,28,2004,December,Flash Flood,C,87,LOWNDES,JAN,09-DEC-04 03:45:00,CST,09-DEC-04 06:00:00,0,0,0,0,25K,,NEWSPAPER,,,,,,,,,,,,,,COLUMBUS,,,COLUMBUS,,,,,,Numerous streets and roads were flooded with several closed due to high water. A portion of Newbell Road was closed due damage to the bridge supports.,PDS
200412,22,1700,200412,23,0,1182729,5430701,MISSISSIPPI,28,2004,December,Ice Storm,Z,19,SUNFLOWER,JAN,22-DEC-04 17:00:00,CST,23-DEC-04 00:00:00,0,0,0,0,100K,,EMERGENCY MANAGER,,,,,,,,,,,,,,,,,,,,,,,"An ice storm hit portions of the Mississippi Delta just before Christmas and coated most of Bolivar and Sunflower counties with 1/4 to 1/3 of an inch of ice. During the afternoon of December 22nd, a mix of freezing rain and sleet began to fall, by 5 PM the freezing rain became the dominant precipitation type and  accumulations near 1/4 of an inch began to occur on power lines and elevated surfaces. As the evening progressed, all roads were covered by a coating of ice as well as trees and power lines. By midnight, 38 automobile accidents occurred and numerous power lines were down causing power outages for most of Bolivar and Sunflower counties.",PDS
200410,9,1500,200410,10,900,1187102,5431118,MISSISSIPPI,28,2004,October,Storm Surge/Tide,Z,80,HANCOCK,LIX,09-OCT-04 15:00:00,CST,10-OCT-04 09:00:00,0,0,0,0,15K,,COASTAL OBSERVING STATION,,,,,,,,,,,,,,,,,,,,,,"Tropical Storm Matthew developed from a tropical depression in the southwest Gulf of Mexico on October 8 and initially moved to the east northeast across the western and central Gulf of Mexico before gradually turning to the northeast and north. Matthew made landfall as minimal tropical storm along the south central Louisiana coast near Cocodrie on October 10 and weakened to a tropical depression shortly after moving inland. Matthew continued north and moved across southeast Louisiana and southwest Mississippi as a tropical depression on the 10th before dissipating over extreme southeast Arkansas on October 11.Tropical storm force winds associated with Matthew affected the western portion of Mississippi Coast. Sustained winds of 34 knots (39 mph) and a maximum gust of 39 knots (45 mph) was recorded at the NOAA automated weather station at Waveland. The storm surge was generally 2 to 4 feet above normal along portions of the Mississippi coast with the highest storm surge recorded at Waveland at 5.13 ft MLLW. The lowest pressure recorded along the Mississippi coast was was 1005.4 mb at Gulfport on October 10th at 1654 CST.No tornadoes were reported. Storm total rainfall varied from 2 to 4 inches in Hancock and Harrison Counties. Some coastal flooding due to storm surge was reported in Hancock County. Based on reports, total storm damage was estimated at around 50 thousand dollars with approximately 40 percent of the damage due to wind ($20 thousand) and 60 percent due to storm surge ($30 thousand).",,PDS
200411,24,220,200411,24,250,1187131,5431509,MISSISSIPPI,28,2004,November,Thunderstorm Wind,C,5,AMITE,LIX,24-NOV-04 02:20:00,CST,24-NOV-04 02:50:00,0,0,0,0,5K,,LAW ENFORCEMENT,50,EG,,,,,,,,,,,,COUNTYWIDE,,,COUNTYWIDE,31.18333,-90.8,31.18333,-90.8,,A line of severe thunderstorms blew down trees in various parts of the county.,PDS
200412,25,1800,200412,25,1800,1183705,5432166,MISSISSIPPI,28,2004,December,Cold/Wind Chill,Z,17,ITAWAMBA,MEG,25-DEC-04 18:00:00,CST,25-DEC-04 18:00:00,0,0,1,0,0K,,NEWSPAPER,,,,,,,,,,,,,,,,,,,,,,,One man was found dead in a wooded area. The cause of death was hypthermia.,PDS
200409,15,1500,200409,16,600,1187089,5430959,MISSISSIPPI,28,2004,September,Hurricane (Typhoon),Z,82,JACKSON,LIX,15-SEP-04 15:00:00,CST,16-SEP-04 06:00:00,0,0,0,0,6M,,OFFICIAL NWS OBS.,,,,,,,,,,,,,,,,,,,,,,"Hurricane Ivan moved steadily northward across the the north-central Gulf of Mexico on September 15th before turning north-northeast and making landfall near Gulf Shores, Alabama as a Category 3 hurricane during the early morning of September 16th.Hurricane Ivan made landfall far enough to the east of the Mississippi Coast to minimize the damage to the coastal counties, however hurricane force winds did affect Jackson County. An anemometer on top of the Emergency Operation Center in downtown Pascagoula recorded a wind gust to 76 knots (88 mph) as the eye of the hurricane passed to the east of area. Tropical storm force winds occurred over Harrison and Hancock Counties with wind gusts approaching hurricane force in the coastal waters. A wind gust of 68 knots (78 mph) was recorded by an automated wind gage at Pointe Cadet in Biloxi Harbor, and 53 knot (61 mph) wind gust was recorded at the Emergency Operations Center in Waveland.Jackson County experienced the greatest amount of damage among coastal counties. A roof was blown off of an apartment building in Pascagoula and at least a dozen homes suffered major damage either from wind or from fallen trees. Around 100 homes had some type of wind damage, along with 30 mobile homes and 25 businesses. Trees and large tree limbs were toppled in many areas contributing to power outages in Jackson County. Wind damage was much less over Harrison, Hancock, and Pearl River counties. There were scattered reports of fallen trees and tree limbs, downing power lines and causing damage to some houses. The lowest pressure recorded along the Mississippi Coast was 975.6 mb at 2336 CST on September 15th at the Pascagoula Airport. However power to the weather instrument failed shortly after this reading and a lower reading is highly likely. At Keesler Air Force Base in Biloxi, the lowest pressure of 982.9 mb occurred at 0055 CST September 16th. Storm surge was generally 3 to 5 feet above normal along the coast. The highest storm surge recorded was at the mouth of the Pascagoula River near Pascagoula with a storm surge 6.72 ft NGVD. Some tidal surge flooding occurred in low lying areas near the coast. No tornadoes were reported. Storm total rainfall varied from an inch or less in Hancock County to around 6 inches in eastern Jackson County. The highest rainfall total was 6.29 inches at the Pascagoula Emergency Operations Center.No direct injuries or fatalities were noted in coastal Mississippi.Total storm damage was estimated at around 10 million dollars with approximately 80 percent of the damage due to wind ($6.7 million) and 20 percent ($ 2.3 million) due to storm surge damage.",,PDS
200409,15,1500,200409,16,600,1187089,5430960,MISSISSIPPI,28,2004,September,Hurricane (Typhoon),Z,80,HANCOCK,LIX,15-SEP-04 15:00:00,CST,16-SEP-04 06:00:00,0,0,0,0,.64M,,OFFICIAL NWS OBS.,,,,,,,,,,,,,,,,,,,,,,"Hurricane Ivan moved steadily northward across the the north-central Gulf of Mexico on September 15th before turning north-northeast and making landfall near Gulf Shores, Alabama as a Category 3 hurricane during the early morning of September 16th.Hurricane Ivan made landfall far enough to the east of the Mississippi Coast to minimize the damage to the coastal counties, however hurricane force winds did affect Jackson County. An anemometer on top of the Emergency Operation Center in downtown Pascagoula recorded a wind gust to 76 knots (88 mph) as the eye of the hurricane passed to the east of area. Tropical storm force winds occurred over Harrison and Hancock Counties with wind gusts approaching hurricane force in the coastal waters. A wind gust of 68 knots (78 mph) was recorded by an automated wind gage at Pointe Cadet in Biloxi Harbor, and 53 knot (61 mph) wind gust was recorded at the Emergency Operations Center in Waveland.Jackson County experienced the greatest amount of damage among coastal counties. A roof was blown off of an apartment building in Pascagoula and at least a dozen homes suffered major damage either from wind or from fallen trees. Around 100 homes had some type of wind damage, along with 30 mobile homes and 25 businesses. Trees and large tree limbs were toppled in many areas contributing to power outages in Jackson County. Wind damage was much less over Harrison, Hancock, and Pearl River counties. There were scattered reports of fallen trees and tree limbs, downing power lines and causing damage to some houses. The lowest pressure recorded along the Mississippi Coast was 975.6 mb at 2336 CST on September 15th at the Pascagoula Airport. However power to the weather instrument failed shortly after this reading and a lower reading is highly likely. At Keesler Air Force Base in Biloxi, the lowest pressure of 982.9 mb occurred at 0055 CST September 16th. Storm surge was generally 3 to 5 feet above normal along the coast. The highest storm surge recorded was at the mouth of the Pascagoula River near Pascagoula with a storm surge 6.72 ft NGVD. Some tidal surge flooding occurred in low lying areas near the coast. No tornadoes were reported. Storm total rainfall varied from an inch or less in Hancock County to around 6 inches in eastern Jackson County. The highest rainfall total was 6.29 inches at the Pascagoula Emergency Operations Center.No direct injuries or fatalities were noted in coastal Mississippi.Total storm damage was estimated at around 10 million dollars with approximately 80 percent of the damage due to wind ($6.7 million) and 20 percent ($ 2.3 million) due to storm surge damage.",,PDS
200409,15,1500,200409,16,600,1187089,5430961,MISSISSIPPI,28,2004,September,Hurricane (Typhoon),Z,81,HARRISON,LIX,15-SEP-04 15:00:00,CST,16-SEP-04 06:00:00,0,0,0,0,1.2M,,OFFICIAL NWS OBS.,,,,,,,,,,,,,,,,,,,,,,"Hurricane Ivan moved steadily northward across the the north-central Gulf of Mexico on September 15th before turning north-northeast and making landfall near Gulf Shores, Alabama as a Category 3 hurricane during the early morning of September 16th.Hurricane Ivan made landfall far enough to the east of the Mississippi Coast to minimize the damage to the coastal counties, however hurricane force winds did affect Jackson County. An anemometer on top of the Emergency Operation Center in downtown Pascagoula recorded a wind gust to 76 knots (88 mph) as the eye of the hurricane passed to the east of area. Tropical storm force winds occurred over Harrison and Hancock Counties with wind gusts approaching hurricane force in the coastal waters. A wind gust of 68 knots (78 mph) was recorded by an automated wind gage at Pointe Cadet in Biloxi Harbor, and 53 knot (61 mph) wind gust was recorded at the Emergency Operations Center in Waveland.Jackson County experienced the greatest amount of damage among coastal counties. A roof was blown off of an apartment building in Pascagoula and at least a dozen homes suffered major damage either from wind or from fallen trees. Around 100 homes had some type of wind damage, along with 30 mobile homes and 25 businesses. Trees and large tree limbs were toppled in many areas contributing to power outages in Jackson County. Wind damage was much less over Harrison, Hancock, and Pearl River counties. There were scattered reports of fallen trees and tree limbs, downing power lines and causing damage to some houses. The lowest pressure recorded along the Mississippi Coast was 975.6 mb at 2336 CST on September 15th at the Pascagoula Airport. However power to the weather instrument failed shortly after this reading and a lower reading is highly likely. At Keesler Air Force Base in Biloxi, the lowest pressure of 982.9 mb occurred at 0055 CST September 16th. Storm surge was generally 3 to 5 feet above normal along the coast. The highest storm surge recorded was at the mouth of the Pascagoula River near Pascagoula with a storm surge 6.72 ft NGVD. Some tidal surge flooding occurred in low lying areas near the coast. No tornadoes were reported. Storm total rainfall varied from an inch or less in Hancock County to around 6 inches in eastern Jackson County. The highest rainfall total was 6.29 inches at the Pascagoula Emergency Operations Center.No direct injuries or fatalities were noted in coastal Mississippi.Total storm damage was estimated at around 10 million dollars with approximately 80 percent of the damage due to wind ($6.7 million) and 20 percent ($ 2.3 million) due to storm surge damage.",,PDS
