BEGIN_YEARMONTH,BEGIN_DAY,BEGIN_TIME,END_YEARMONTH,END_DAY,END_TIME,EPISODE_ID,EVENT_ID,STATE,STATE_FIPS,YEAR,MONTH_NAME,EVENT_TYPE,CZ_TYPE,CZ_FIPS,CZ_NAME,WFO,BEGIN_DATE_TIME,CZ_TIMEZONE,END_DATE_TIME,INJURIES_DIRECT,INJURIES_INDIRECT,DEATHS_DIRECT,DEATHS_INDIRECT,DAMAGE_PROPERTY,DAMAGE_CROPS,SOURCE,MAGNITUDE,MAGNITUDE_TYPE,FLOOD_CAUSE,CATEGORY,TOR_F_SCALE,TOR_LENGTH,TOR_WIDTH,TOR_OTHER_WFO,TOR_OTHER_CZ_STATE,TOR_OTHER_CZ_FIPS,TOR_OTHER_CZ_NAME,BEGIN_RANGE,BEGIN_AZIMUTH,BEGIN_LOCATION,END_RANGE,END_AZIMUTH,END_LOCATION,BEGIN_LAT,BEGIN_LON,END_LAT,END_LON,EPISODE_NARRATIVE,EVENT_NARRATIVE,DATA_SOURCE
199605,18,1400,199605,21,1700,2035573,5555314,MARYLAND,24,1996,May,Heat,Z,13,PRINCE GEORGES,LWX,18-MAY-96 14:00:00,EST,21-MAY-96 17:00:00,0,0,0,0,,,,,,,,,,,,,,,,,,,,,,,,,"An early-season four-day heat wave, following a period of cool and generally cloudy weather, took it's toll on outdoor enthusiasts who were unprepared for the dramatic temperature swing.  Two persons suffered heat stroke in Washington Co (MDZ003), requiring hospitalization.  Temperatures for the period averaged in the mid to upper 90s, yet less than a week earlier, fruit crops in western Maryland were threatened by subfreezing temperatures.  In fact, daily maxima one and two days prior to the heat wave were in the 60s.  Several record high temperatures were shattered, including two at Patuxent River NAS (MDZ017) on the 19th and 20th.  In fact, Patuxent River NAS was the sole official site to reach the century mark (on the 20th).  Potomac Electric Power Co (PEPCO) induced a small-scale ""brownout"" in the Washington Metropolitan area to reduce energy consumption.",,PDC
199606,19,2300,199606,20,100,1014258,5561175,MARYLAND,24,1996,June,Flash Flood,C,31,MONTGOMERY,LWX,19-JUN-96 23:00:00,EST,20-JUN-96 01:00:00,0,0,0,0,40K,,,,,,,,,,,,,,,,N PORTION,,,N PORTION,,,,,"Yet another round of tropical convection developed over flood-weary north central Maryland during the late evening of the 19th.  Additional rainfall totals generally between 1 and 2 inches renewed flash flooding, closing hundreds of roads once again, including several main thoroughfares, from Baltimore City to Frederick Co.  No additional evacuations were necessary.Dozens of homes in Frederick Co had flooded basements once again, but flood waters were slowly receding on county farms.  Numerous roads were closed once again.",,PDC
199606,20,1250,199606,20,1330,2040880,5561176,MARYLAND,24,1996,June,Flash Flood,C,9,CALVERT,LWX,20-JUN-96 12:50:00,EST,20-JUN-96 13:30:00,0,0,0,0,,,,,,,,,,,,,,,,,PRINCE FREDERICK,,,PRINCE FREDERICK,,,,,"High standing water flooded the intersection of Sandy Point and Norwood Road in Prince Frederick.  A postal van became trapped, and a local resident had to rescue the driver.",,PDC
199606,19,30,199606,19,930,1014245,5560606,MARYLAND,24,1996,June,Flash Flood,C,13,CARROLL,LWX,19-JUN-96 00:30:00,EST,19-JUN-96 09:30:00,0,0,0,0,1M,,,,,,,,,,,,,,,,W PORTION,,,W PORTION,,,,,"Torrential convective rainfall moved across the northern tier of central Maryland during the early morning hours on the 19th, producing widespread and in some cases catastrophic flooding across the area.  Rainfall of over 5.5 inches fell in Emmitsburg, with up to 13 inches in nearby Gettysburg, Pennsylvania, during the late night hours.  The worst damage was in Emmitsburg, where numerous residences, businesses, and farms were flooded.  Nearly all roads leading into town, including the main thoroughfare (state route 140), were flooded and/or damaged.  Fifty evacuations occurred in Frederick Co, and 21 in Washington Co.  Several persons were rescued, including three volunteer fire fighters and four local women (Frederick Co).  An 18-foot mobile camper was destroyed near Emmitsburg after it was swept away by flood waters.There was one fatality approximately 3 miles southwest of Emmitsburg.  At 0000EST, a woman exited her van along Little Owens Creek and was promptly swept away by the floodwaters, which at the time were 3 feet over top of Eylers Valley Road.  The woman was found at noon the following day, approximately 1/4 mile downstream.In Washington Co, an overflowed creek near downtown Hagerstown punched a large hole into a cinder block wall at the municipal stadium, causing an estimated $100,000 in damage and cancelling an eight-game baseball home stand.  A home in Hagerstown was swept off it's foundation.  Numerous roads were submerged overnight through the following morning.  In Carroll Co, many roads were also flooded, including state route 140 at the Monocacy River bridge.  Damage along route 140 closed the highway for more than one week.  The Monocacy, which traverses Carroll and Frederick Cos, has a rapid flood response; in this event, flood stage was quickly surpassed on the 19th.  In fact, the crest of 25.5 feet was a flood of record.",,PDC
199606,19,500,199606,19,900,1014246,5560607,MARYLAND,24,1996,June,Flash Flood,C,31,MONTGOMERY,LWX,19-JUN-96 05:00:00,EST,19-JUN-96 09:00:00,0,0,0,0,30K,,,,,,,,,,,,,,,,NW PORTION,,,NW PORTION,,,,,,,PDC
199606,19,600,199606,19,900,1014247,5560608,MARYLAND,24,1996,June,Flash Flood,C,27,HOWARD,LWX,19-JUN-96 06:00:00,EST,19-JUN-96 09:00:00,0,0,0,0,20K,,,,,,,,,,,,,,,,NW PORTION,,,NW PORTION,,,,,"Areas which received flash flooding on the 18th were inundated with additional heavy rainfall during the morning of the 19th, causing a repeat performance.  Once again, several creeks and streams overflowed their banks, including Seneca Creek.  Closed state highways included route 28 near Dawsonville, route 109 near Barnesville, and route 121.  High standing water snarled traffic along interstate 270 in a construction zone between routes 118 and 121.  Other flooding was noted along Bennett Creek near the northern tip of Montgomery Co.  High standing water temporarily closed Wightman/Brink Road near the state route 27/355 interchange in Germantown.In Howard Co, some creeks overflowed their banks near the Montgomery/Frederick line, flooding area roads.",,PDC
199606,19,1115,199606,19,1500,1014248,5560609,MARYLAND,24,1996,June,Flash Flood,C,27,HOWARD,LWX,19-JUN-96 11:15:00,EST,19-JUN-96 15:00:00,0,0,0,0,10K,,,,,,,,,,,,,,,,NE PORTION,,,NE PORTION,,,,,,,PDC
199606,19,1115,199606,19,1500,1014249,5560610,MARYLAND,24,1996,June,Flash Flood,C,5,BALTIMORE,LWX,19-JUN-96 11:15:00,EST,19-JUN-96 15:00:00,0,0,2,0,25K,,,,,,,,,,,,,,,,S PORTION,,,S PORTION,,,,,,,PDC
199606,19,1200,199606,19,1500,2040872,5560611,MARYLAND,24,1996,June,Flash Flood,C,510,BALTIMORE CITY (C),LWX,19-JUN-96 12:00:00,EST,19-JUN-96 15:00:00,0,0,0,0,.1M,,,,,,,,,,,,,,,,CITYWIDE,,,CITYWIDE,,,,,,,PDC
199606,20,1220,199606,20,1250,2040881,5561177,MARYLAND,24,1996,June,Flash Flood,C,33,PRINCE GEORGE'S,LWX,20-JUN-96 12:20:00,EST,20-JUN-96 12:50:00,0,0,0,0,10K,,,,,,,,,,,,,,,,BOWIE,,,BOWIE,,,,,"High standing water was reported along state route 450, especially at the main intersections of Martha's Choice Circle, Bell Station Road, and state route 193.  A foot of water flooded the highway near the Free State and Market Place shopping centers.  Low-lying neighborhood streets reportedly had water, wood, and gravel running along them during the height of the storm.",,PDC
199606,20,1130,199606,20,1230,2040882,5561178,MARYLAND,24,1996,June,Flash Flood,C,37,ST. MARY'S,LWX,20-JUN-96 11:30:00,EST,20-JUN-96 12:30:00,0,0,0,0,5K,,,,,,,,,,,,,,,,LEXINGTON PARK,,,LEXINGTON PARK,,,,,High standing water was reported on several roadways in the area.  Over three inches of rain fell in less than 2 hours just over the line in neighboring Calvert Co.,,PDC
199606,20,1815,199606,20,1845,2040883,5561179,MARYLAND,24,1996,June,Flash Flood,C,43,WASHINGTON,LWX,20-JUN-96 18:15:00,EST,20-JUN-96 18:45:00,0,0,0,0,,,,,,,,,,,,,,,4,W,HAGERSTOWN,4,W,HAGERSTOWN,,,,,Federal highway 40 was closed due to high water from earlier torrential rains.,,PDC
199606,20,2150,199606,20,2150,1014263,5561180,MARYLAND,24,1996,June,Thunderstorm Wind,C,31,MONTGOMERY,LWX,20-JUN-96 21:50:00,EST,20-JUN-96 21:50:00,0,0,0,0,5K,,,,,,,,,,,,,,,,GLEN ECHO,,,GLEN ECHO,38.97,-77.13,38.97,-77.13,A rapidly developing thunderstorm knocked down several trees and large limbs in Glen Echo.,,PDC
199606,19,2245,199606,20,100,2040875,5561170,MARYLAND,24,1996,June,Flash Flood,C,5,BALTIMORE,LWX,19-JUN-96 22:45:00,EST,20-JUN-96 01:00:00,0,0,0,0,25K,,,,,,,,,,,,,,,,S PORTION,,,S PORTION,,,,,,,PDC
199606,19,2245,199606,20,100,2040876,5561171,MARYLAND,24,1996,June,Flash Flood,C,510,BALTIMORE CITY (C),LWX,19-JUN-96 22:45:00,EST,20-JUN-96 01:00:00,0,0,0,0,25K,,,,,,,,,,,,,,,,CITYWIDE,,,CITYWIDE,,,,,,,PDC
199606,19,2245,199606,20,100,2040877,5561172,MARYLAND,24,1996,June,Flash Flood,C,13,CARROLL,LWX,19-JUN-96 22:45:00,EST,20-JUN-96 01:00:00,0,0,0,0,40K,,,,,,,,,,,,,,,,S PORTION,,,S PORTION,,,,,,,PDC
199606,19,2245,199606,20,100,2040878,5561173,MARYLAND,24,1996,June,Flash Flood,C,27,HOWARD,LWX,19-JUN-96 22:45:00,EST,20-JUN-96 01:00:00,0,0,0,0,30K,,,,,,,,,,,,,,,,NW PORTION,,,NW PORTION,,,,,,,PDC
199606,10,1930,199606,10,2100,2040860,5560591,MARYLAND,24,1996,June,Flash Flood,C,31,MONTGOMERY,LWX,10-JUN-96 19:30:00,EST,10-JUN-96 21:00:00,0,0,0,0,40K,,,,,,,,,,,,,,,,COMUS,,,COMUS,,,,,,,PDC
199606,24,1631,199606,24,1636,2040891,5561189,MARYLAND,24,1996,June,Thunderstorm Wind,C,33,PRINCE GEORGE'S,LWX,24-JUN-96 16:31:00,EST,24-JUN-96 16:36:00,0,0,0,0,40K,,,,,,,,,,,,,,,,BOWIE,,,BOWIE,39,-76.78,39,-76.78,"Downburst damage also occurred in Bowie, where several trees and power lines were knocked down, with at least one onto a vehicle and one onto a home.  Passengers in the vehicle were taken to the hospital for evaluation, but no injuries were reported.  Lightning also struck several trees in the area.",,PDC
199602,16,1100,199602,16,1900,2029501,5541620,MARYLAND,24,1996,February,Heavy Snow,Z,7,HARFORD,LWX,16-FEB-96 11:00:00,EST,16-FEB-96 19:00:00,0,0,0,0,,,,,,,,,,,,,,,,,,,,,,,,,"A strong ""Alberta Clipper"", diving southeast from the upper midwest into the deep south, linked up with subtropical moisture lurking  along the southeast U.S. coast to develop a classic nor'easter, which moved from northeast South Carolina to off the Virginia Capes during the day on the 16th.  As the area of low pressure intensified, it wrapped Atlantic moisture well to the west, where modified arctic air was pouring in from southern Canada.The result was an area of heavy snow across all of eastern Maryland during the morning and early afternoon.  The heaviest snowfall was noted along the western shore of the Chesapeake Bay, where between 10 and 13 inches fell.  Over the immediate suburbs of Washington and Baltimore, 7 to 11 inches fell, with lesser amounts (4 to 6 inches) over areas of north central Maryland.The snowfall added to the already remarkable seasonal totals.  At Baltimore/Washington International Airport (MDZ014), the additional 9.8 inches brought the 1995/96 total to 55.1 inches, breaking the all-time record of 51.8 inches, set over 30 years prior, by 3.3 inches.  The record was shattered with still an entire calendar month of winter remaining.  Farther south, in Hollywood (MDZ017), the all-time record, dating back nearly a century, was nearly tied as the snow total reached 53.2 inches.  The standing record of 54.7 inches was set during the legendary winter of 1898/99, known for it's infamous February blizzard.",,PDC
199605,11,1704,199605,11,1704,2040783,5560380,MARYLAND,24,1996,May,Thunderstorm Wind,C,41,TALBOT,PHI,11-MAY-96 17:04:00,EST,11-MAY-96 17:04:00,0,0,0,0,,,,,,,,,,,,,,,,S,TRAPPE,5,,TRAPPE,38.60,-76.07,38.67,-76.07,A severe thunderstorm capsized a small boat along the Choptank River.  No serious injuries were reported.,,PDC
199606,4,1905,199606,4,1907,2040858,5560589,MARYLAND,24,1996,June,Tornado,C,21,FREDERICK,LWX,04-JUN-96 19:05:00,EST,04-JUN-96 19:07:00,0,0,0,0,.15M,,,,,,,F1,1,65,,,,,,W,MT AIRY,4,W,MT AIRY,39.38,-77.22,39.38,-77.20,"A severe thunderstorm produced wind damage along a 10-mile swath from eastern Frederick Co into extreme southern Carroll Co.  Downburst wind damage, in the form of 100 snapped or blown down trees, was noted along Green Valley Road (state route 75) near Green Hills.  An eyewitness in the area observed hail between 1 and 1 1/2 inches in diameter.  As the storm moved northeast towards Mt Airy, scattered tree damage and damage to trim on homes was also noted.  One home had it's carport blown off, and 3 others sustained fence damage.Approximately 4 miles southwest of Mt Airy a gustnado touched down in the Molesworth Hills subdivision, causing extensive damage to trees, moderate damage to five homes, and minor damage to about 10 other residences.  One home had a garage wall blown out.  A new home had a garage door blown inward, siding and roofing torn away, and a picture window blown in.  Two sheds were also damaged.  Three homes sustained roof damage from fallen trees, which also damaged two automobiles.  The tornado also totalled a late-model pickup truck, and blew out the windshield of a van. An eyewitness noted the gustnado, ""between 100 and 200 feet in width,"" heading towards him.  He took cover in a nearby ditch and escaped unharmed.In Mt. Airy (Carroll Co), straight-line winds blew down three large maple trees (1-2 feet in diameter), parts of which landed up to 20 feet away.  A few more trees were felled near the library.",,PDC
199606,4,1925,199606,4,1925,2040859,5560590,MARYLAND,24,1996,June,Lightning,C,13,CARROLL,LWX,04-JUN-96 19:25:00,EST,04-JUN-96 19:25:00,1,0,0,0,,,,,,,,,,,,,,,,,MANCHESTER,,,MANCHESTER,,,,,Lightning struck and injured a woman in Manchester.,,PDC
199606,19,2300,199606,20,100,2040879,5561174,MARYLAND,24,1996,June,Flash Flood,C,21,FREDERICK,LWX,19-JUN-96 23:00:00,EST,20-JUN-96 01:00:00,0,0,0,0,75K,,,,,,,,,,,,,,,,COUNTYWIDE,,,COUNTYWIDE,,,,,,,PDC
199606,24,1500,199606,24,1500,2047644,5563371,MARYLAND,24,1996,June,Lightning,C,23,GARRETT,PBZ,24-JUN-96 15:00:00,EST,24-JUN-96 15:00:00,0,0,0,0,1K,,,,,,,,,,,,,,,,KITZMILLER,,,KITZMILLER,,,,,A shed was struck by lightning and destroyed by fire.,,PDC
199605,18,1400,199605,21,1700,2035573,5555144,MARYLAND,24,1996,May,Heat,Z,6,NORTHERN BALTIMORE,LWX,18-MAY-96 14:00:00,EST,21-MAY-96 17:00:00,0,0,0,0,,,,,,,,,,,,,,,,,,,,,,,,,"An early-season four-day heat wave, following a period of cool and generally cloudy weather, took it's toll on outdoor enthusiasts who were unprepared for the dramatic temperature swing.  Two persons suffered heat stroke in Washington Co (MDZ003), requiring hospitalization.  Temperatures for the period averaged in the mid to upper 90s, yet less than a week earlier, fruit crops in western Maryland were threatened by subfreezing temperatures.  In fact, daily maxima one and two days prior to the heat wave were in the 60s.  Several record high temperatures were shattered, including two at Patuxent River NAS (MDZ017) on the 19th and 20th.  In fact, Patuxent River NAS was the sole official site to reach the century mark (on the 20th).  Potomac Electric Power Co (PEPCO) induced a small-scale ""brownout"" in the Washington Metropolitan area to reduce energy consumption.",,PDC
199606,20,1315,199606,20,1515,1031148,5583096,MARYLAND,24,1996,June,Flood,C,19,DORCHESTER,AKQ,20-JUN-96 13:15:00,EST,20-JUN-96 15:15:00,0,0,0,0,,,,,,,,,,,,,,,,,CAMBRIDGE,,,CAMBRIDGE,,,,,Three inches of rain in one hour produced flooding of several streets in the city of Cambridge.,,PDC
199605,18,1400,199605,21,1700,2035573,5555312,MARYLAND,24,1996,May,Heat,Z,10,HOWARD,LWX,18-MAY-96 14:00:00,EST,21-MAY-96 17:00:00,0,0,0,0,,,,,,,,,,,,,,,,,,,,,,,,,"An early-season four-day heat wave, following a period of cool and generally cloudy weather, took it's toll on outdoor enthusiasts who were unprepared for the dramatic temperature swing.  Two persons suffered heat stroke in Washington Co (MDZ003), requiring hospitalization.  Temperatures for the period averaged in the mid to upper 90s, yet less than a week earlier, fruit crops in western Maryland were threatened by subfreezing temperatures.  In fact, daily maxima one and two days prior to the heat wave were in the 60s.  Several record high temperatures were shattered, including two at Patuxent River NAS (MDZ017) on the 19th and 20th.  In fact, Patuxent River NAS was the sole official site to reach the century mark (on the 20th).  Potomac Electric Power Co (PEPCO) induced a small-scale ""brownout"" in the Washington Metropolitan area to reduce energy consumption.",,PDC
199605,21,1825,199605,21,1825,2040798,5560975,MARYLAND,24,1996,May,Thunderstorm Wind,C,41,TALBOT,PHI,21-MAY-96 18:25:00,EST,21-MAY-96 18:25:00,0,0,0,0,,,,,,,,,,,,,,,,,QUEEN ANNE,,,QUEEN ANNE,38.92,-75.97,38.92,-75.97,A severe thunderstorm uprooted several trees in Queen Anne.  These included one of the oldest known trees within the town.  One porch was damaged.,,PDC
199605,21,1835,199605,21,1835,2040799,5560976,MARYLAND,24,1996,May,Thunderstorm Wind,C,11,CAROLINE,PHI,21-MAY-96 18:35:00,EST,21-MAY-96 18:35:00,0,0,0,0,,,,,,,,,,,,,,,,,GREENSBORO,,,GREENSBORO,38.97,-75.8,38.97,-75.8,A severe thunderstorm uprooted several trees in Greensboro.  One tree punctured a hole in the roof of one house.,,PDC
199605,4,2215,199605,4,2230,2035569,5555137,MARYLAND,24,1996,May,Thunderstorm Wind,C,37,ST. MARY'S,LWX,04-MAY-96 22:15:00,EST,04-MAY-96 22:30:00,0,0,0,0,5K,,,70,,,,,,,,,,,,,MECHANICSVILLE,,,POINT NO POINT,38.43,-76.73,38.13,-76.32,"A second line of severe thunderstorms moved across St Mary's Co, causing additional tree damage in the Mechanicsville area.  A ship stationed at Pt. No Point recorded wind gusts between 70 and 80 knots roughly at 2227-2230EST.",,PDC
199606,20,2200,199606,20,2245,2040884,5561181,MARYLAND,24,1996,June,Flash Flood,C,31,MONTGOMERY,LWX,20-JUN-96 22:00:00,EST,20-JUN-96 22:45:00,0,0,0,0,15K,,,,,,,,,,,,,,,,GLEN ECHO,,,GLEN ECHO,,,,,"Associated torrential rains with a rapidly developing thunderstorm flooded the intersection of Goldsboro Road and Massachusetts Ave, washing out a portion of the intersection.",,PDC
199606,24,1145,199606,24,1200,1014265,5561182,MARYLAND,24,1996,June,Thunderstorm Wind,C,1,ALLEGANY,LWX,24-JUN-96 11:45:00,EST,24-JUN-96 12:00:00,0,0,0,0,20K,,,,,,,,,,,,,,,,COUNTYWIDE,,,COUNTYWIDE,39.65,-78.67,39.65,-78.67,Thunderstorm winds blew down trees and limbs across the county.,,PDC
199606,24,1315,199606,24,1315,2040885,5561183,MARYLAND,24,1996,June,Thunderstorm Wind,C,13,CARROLL,LWX,24-JUN-96 13:15:00,EST,24-JUN-96 13:15:00,0,0,0,0,5K,,,,,,,,,,,,,,,,TANEYTOWN,,,TANEYTOWN,39.67,-77.18,39.67,-77.18,A localized severe thunderstorm blew down scattered trees and large limbs in and north of Taneytown.,,PDC
199605,4,2230,199605,4,2230,2035570,5555138,MARYLAND,24,1996,May,Thunderstorm Wind,C,9,CALVERT,LWX,04-MAY-96 22:30:00,EST,04-MAY-96 22:30:00,0,0,0,0,2K,,,,,,,,,,,,,,,,ST LEONARD,,,ST LEONARD,38.47,-76.5,38.47,-76.5,Thunderstorm winds blew down trees in St Leonard (southern Calvert Co).,,PDC
199605,11,1505,199605,11,1505,2035571,5555139,MARYLAND,24,1996,May,Thunderstorm Wind,C,25,HARFORD,LWX,11-MAY-96 15:05:00,EST,11-MAY-96 15:05:00,0,0,0,0,8K,,,52,,,,,,,,,,,,,BEL AIR,,,BEL AIR,39.53,-76.35,39.53,-76.35,Estimated wind gusts to 60 mph felled several large trees and limbs in Bel Air.  A row of Bradford Pears was knocked down along Major's Choice Road.,,PDC
199606,24,1634,199606,24,1639,2040892,5561190,MARYLAND,24,1996,June,Tornado,C,33,PRINCE GEORGE'S,LWX,24-JUN-96 16:34:00,EST,24-JUN-96 16:39:00,0,0,0,0,.5M,,,,,,,F1,4,200,,,,,,NW,UPPER MARLBORO,1,SE,UPPER MARLBORO,38.83,-76.77,38.80,-76.72,"Another tornado touched down in the Fox Chase subdivision, one mile northwest of Upper Marlboro, and tracked east-southeast across federal highway 301 before exiting the county near state route 4.  The tornado continued into Waysons Corner in extreme southwestern Anne Arundel Co.  Along its track, dozens of trees were uprooted.  Damage in the residential areas included ripped siding and blown down chimneys.  The storm tore the roof from the Triangle Tobacco Whse. in Waysons Corner, forcing condemnation of the building.  A large tree fell onto a mobile home there as well.",,PDC
199606,14,1900,199606,14,1930,2047571,5562993,MARYLAND,24,1996,June,Flash Flood,C,23,GARRETT,PBZ,14-JUN-96 19:00:00,EST,14-JUN-96 19:30:00,0,0,0,0,1K,,,,,,,,,,,,,,,,HOYES,,,HOYES,,,,,Flash flooding led to mudslides onto sections of Route 42. Trees also slid down hillsides and onto the road.,,PDC
199606,4,1835,199606,4,1835,2040854,5560585,MARYLAND,24,1996,June,Thunderstorm Wind,C,31,MONTGOMERY,LWX,04-JUN-96 18:35:00,EST,04-JUN-96 18:35:00,0,0,0,0,25K,,,,,,,,,,,,,,,,DICKERSON,,,DICKERSON,39.22,-77.43,39.22,-77.43,"Thunderstorm winds blew 3/8 inch hail stones into the siding of a residence in Dickerson, peeling much of it off.  Damage from the wind-blown hail was estimated at $9,000.  A barn nearby had a sheet metal roof blown off, and damage was sustained to it's doors.",,PDC
199606,4,1855,199606,4,1855,2040855,5560586,MARYLAND,24,1996,June,Thunderstorm Wind,C,31,MONTGOMERY,LWX,04-JUN-96 18:55:00,EST,04-JUN-96 18:55:00,0,0,0,0,10K,,,,,,,,,,,,,,,,DAMASCUS,,,DAMASCUS,39.28,-77.2,39.28,-77.2,Thunderstorm winds knocked down several trees and large limbs along Clarksburg Road.,,PDC
199605,18,1200,199605,21,1700,2056474,5583059,MARYLAND,24,1996,May,Heat,Z,21,DORCHESTER,AKQ,18-MAY-96 12:00:00,EST,21-MAY-96 17:00:00,0,0,0,0,,,,,,,,,,,,,,,,,,,,,,,,,"AN EARLY-SEASON FOUR-DAY HEAT WAVE PRODUCED RECORD OR NEAR RECORD HIGH TEMPERATURES ACROSS THE LOWER MARYLAND EASTERN SHORE. HIGH TEMPERATURES WERE IN THE 80S ACROSS THE REGION ON MAY 18. THEN, ON MAY 19, MAY 20, AND MAY 21, HIGH TEMPERATUR",,PDC
199606,24,1815,199606,24,1815,2040903,5561203,MARYLAND,24,1996,June,Thunderstorm Wind,C,9,CALVERT,LWX,24-JUN-96 18:15:00,EST,24-JUN-96 18:15:00,0,0,0,0,25K,,,,,,,,,,,,,,,,DRUM POINT,,,DRUM POINT,38.33,-76.43,38.33,-76.43,Straight-line winds from a severe thunderstorm knocked down numerous trees and power lines near Drum Point.,,PDC
199605,4,2150,199605,4,2150,2035566,5555134,MARYLAND,24,1996,May,Thunderstorm Wind,C,33,PRINCE GEORGE'S,LWX,04-MAY-96 21:50:00,EST,04-MAY-96 21:50:00,0,0,0,0,10K,,,,,,,,,,,,,,,,ACCOKEEK,,,ACCOKEEK,38.67,-77.03,38.67,-77.03,"The same bow-echo which produced a wind gusts of 79 mph at Fort Belvoir (Fairfax Co Virginia) moved across the Potomac River into southern Prince Georges Co, causing substantial tree damage in Accokeek.  In an area 300 feet long by 40 feet wide along Farmington Road, 15 large trees were uprooted or snapped at one residence.",,PDC
199605,4,2205,199605,4,2205,2035567,5555135,MARYLAND,24,1996,May,Thunderstorm Wind,C,17,CHARLES,LWX,04-MAY-96 22:05:00,EST,04-MAY-96 22:05:00,0,0,0,0,5K,,,,,,,,,,,,,,,,LA PLATA,,,LA PLATA,38.53,-76.98,38.53,-76.98,The same line of thunderstorms that struck southern Prince Georges Co moments earlier blew down some trees and power lines in and around La Plata.  Scattered power outages also occurred in the area.,,PDC
199605,4,2210,199605,4,2225,2035568,5555136,MARYLAND,24,1996,May,Thunderstorm Wind,C,33,PRINCE GEORGE'S,LWX,04-MAY-96 22:10:00,EST,04-MAY-96 22:25:00,0,0,0,0,5K,,,,,,,,,,,,,,,,CLINTON,,,UPPER MARLBORO,38.77,-76.90,38.82,-76.75,"The bow-echo that struck southern Prince Georges and Charles Co continued to the east-northeast, causing scattered tree and power lines damage in Clinton and Upper Marlboro.",,PDC
199606,4,1820,199606,4,1820,2046029,5567070,MARYLAND,24,1996,June,Hail,C,15,CECIL,PHI,04-JUN-96 18:20:00,EST,04-JUN-96 18:20:00,0,0,0,0,,,,1.00,,,,,,,,,,,,,FRENCHTOWN,,,FRENCHTOWN,39.57,-76.07,39.57,-76.07,,,PDC
199605,18,1400,199605,21,1700,2035573,5555313,MARYLAND,24,1996,May,Heat,Z,11,SOUTHERN BALTIMORE,LWX,18-MAY-96 14:00:00,EST,21-MAY-96 17:00:00,0,0,0,0,,,,,,,,,,,,,,,,,,,,,,,,,"An early-season four-day heat wave, following a period of cool and generally cloudy weather, took it's toll on outdoor enthusiasts who were unprepared for the dramatic temperature swing.  Two persons suffered heat stroke in Washington Co (MDZ003), requiring hospitalization.  Temperatures for the period averaged in the mid to upper 90s, yet less than a week earlier, fruit crops in western Maryland were threatened by subfreezing temperatures.  In fact, daily maxima one and two days prior to the heat wave were in the 60s.  Several record high temperatures were shattered, including two at Patuxent River NAS (MDZ017) on the 19th and 20th.  In fact, Patuxent River NAS was the sole official site to reach the century mark (on the 20th).  Potomac Electric Power Co (PEPCO) induced a small-scale ""brownout"" in the Washington Metropolitan area to reduce energy consumption.",,PDC
199606,24,1730,199606,24,1730,2046078,5567643,MARYLAND,24,1996,June,Thunderstorm Wind,C,35,QUEEN ANNE'S,PHI,24-JUN-96 17:30:00,EST,24-JUN-96 17:30:00,0,0,0,0,,,,,,,,,,,,,,,,,CENTREVILLE,,,CENTREVILLE,39.05,-76.07,39.05,-76.07,A severe thunderstorm tore down wires in Centreville.,,PDC
199606,4,1805,199606,4,1805,2040853,5560584,MARYLAND,24,1996,June,Hail,C,25,HARFORD,LWX,04-JUN-96 18:05:00,EST,04-JUN-96 18:05:00,0,0,0,0,3K,,,.88,,,,,,,,,,,,,EAST PORTION,,,EAST PORTION,39.6,-76.2,39.6,-76.2,"Estimated penny- to nickel-sized hail fell in Bel Air, Churchville, Abingdon, and Port Deposit.  A few vehicles in Port Deposit sustained minor damage from hail dents.",,PDC
199606,11,1300,199606,11,1300,2046034,5567075,MARYLAND,24,1996,June,Lightning,C,15,CECIL,PHI,11-JUN-96 13:00:00,EST,11-JUN-96 13:00:00,0,0,0,0,10K,,,,,,,,,,,,,,,,SINGERLY,,,SINGERLY,,,,,"A lightning strike caused $10,000 damage to a house in Singerly.  The lightning apparently hit a poplar tree about 20 feet from the house, traveled along the roots underground, ""punched"" a hole in the wall and melted the phones and electrical system within the house.  No one was injured.",,PDC
