BEGIN_YEARMONTH,BEGIN_DAY,BEGIN_TIME,END_YEARMONTH,END_DAY,END_TIME,EPISODE_ID,EVENT_ID,STATE,STATE_FIPS,YEAR,MONTH_NAME,EVENT_TYPE,CZ_TYPE,CZ_FIPS,CZ_NAME,WFO,BEGIN_DATE_TIME,CZ_TIMEZONE,END_DATE_TIME,INJURIES_DIRECT,INJURIES_INDIRECT,DEATHS_DIRECT,DEATHS_INDIRECT,DAMAGE_PROPERTY,DAMAGE_CROPS,SOURCE,MAGNITUDE,MAGNITUDE_TYPE,FLOOD_CAUSE,CATEGORY,TOR_F_SCALE,TOR_LENGTH,TOR_WIDTH,TOR_OTHER_WFO,TOR_OTHER_CZ_STATE,TOR_OTHER_CZ_FIPS,TOR_OTHER_CZ_NAME,BEGIN_RANGE,BEGIN_AZIMUTH,BEGIN_LOCATION,END_RANGE,END_AZIMUTH,END_LOCATION,BEGIN_LAT,BEGIN_LON,END_LAT,END_LON,EPISODE_NARRATIVE,EVENT_NARRATIVE,DATA_SOURCE
199602,3,100,199602,3,600,2403652,5541604,MARYLAND,24,1996,February,Heavy Snow,Z,10,HOWARD,LWX,03-FEB-96 01:00:00,EST,03-FEB-96 06:00:00,0,0,0,0,,,,,,,,,,,,,,,,,,,,,,,,,"The continuation of a strong upper-level jet streak, combined with additional mid-level dynamics, generated surface low pressure over central Georgia by evening on the 2nd.  As the low moved to near Cape Hatteras overnight, a broad area of heavy snow overspread all of Maryland west of the Chesapeake Bay.  Areas that were hit with 4 to 13 inches of snow during an early-morning event received an additional 4 to 6 inches, leaving most of lower southern Maryland with a grand total of 12 to 18 inches.  Farther north, from the Potomac Highlands through the western suburbs of Baltimore and Washington, between 6 and 9 inches fell.Circulation around the surface system allowed arctic air to pour into the area during the heaviest snowfall.  Much of the snow fell at temperatures below 20 degrees, making it powdery.  The 6 to 9 inches were cleared by the next afternoon, but problems remained in lower southern Maryland, where snow removal (rather than plowing) was required.Very thin bands of heavy snow continued into early Sunday morning (the 4th) along the immediate western shore of the Chesapeake Bay, producing as much as 9 additional inches in southeastern Calvert (MDZ018) and northeastern St Mary's (MDZ017) Cos.  Storm totals in these areas were as high as 2 feet.The storm's exit ushered the coldest air in two years into the region.  Daytime temperatures on the 4th remained below 20 degrees, with wind chills ranging from 10 to 20 degrees below zero.  Light winds and clear skies, combined with deep snow cover, allowed temperatures to fall well below zero by dawn on the 5th at most locations.  Low temperature records were set on two consecutive calendar days at Baltimore/Washington International Airport (MDZ014), with 8 degrees late on the 4th and 1 degree below zero early on the 5th.",,PDC
199602,2,300,199602,3,600,2037242,5551585,MARYLAND,24,1996,February,Winter Storm,Z,19,TALBOT,PHI,02-FEB-96 03:00:00,EST,03-FEB-96 06:00:00,0,0,0,0,,,,,,,,,,,,,,,,,,,,,,,,,,,PDC
199602,2,300,199602,3,600,2037242,5551586,MARYLAND,24,1996,February,Winter Storm,Z,20,CAROLINE,PHI,02-FEB-96 03:00:00,EST,03-FEB-96 06:00:00,0,0,0,0,,,,,,,,,,,,,,,,,,,,,,,,,,,PDC
199604,23,1625,199604,23,1635,2031223,5549409,MARYLAND,24,1996,April,Thunderstorm Wind,C,21,FREDERICK,LWX,23-APR-96 16:25:00,EST,23-APR-96 16:35:00,0,0,0,0,,,,,,,,,,,,,,,,,WOODSBORO,,,ROCKY RIDGE,39.53,-77.32,39.60,-77.32,"A severe thunderstorm tracked through Frederick Co from southwest to northeast, knocking down numerous trees and cutting power to approximately 3000 customers.",,PDC
199604,23,2100,199604,23,2200,2031224,5549412,MARYLAND,24,1996,April,High Wind,Z,9,MONTGOMERY,LWX,23-APR-96 21:00:00,EST,23-APR-96 22:00:00,0,0,0,0,10K,,,,,,,,,,,,,,,,,,,,,,,,"Gusty gradient winds associated with a vigorous cold front caused numerous power outages across north central Maryland during the evening of the 23rd.  Baltimore Gas and Electric reported over 30,500 customers without power - a combination of minor damage from early (daytime) gusty winds ahead of the cold front and more substantial damage associated with the front.  The largest outages were clustered in Annapolis (MDZ014, 8100 customers); Baltimore City/Glen Burnie (MDZ011/14; 11,500 customers) and Howard Co (MDZ010; 4256 customers).",,PDC
199604,23,2100,199604,23,2200,2031224,5549411,MARYLAND,24,1996,April,High Wind,Z,5,CARROLL,LWX,23-APR-96 21:00:00,EST,23-APR-96 22:00:00,0,0,0,0,20K,,,,,,,,,,,,,,,,,,,,,,,,"Gusty gradient winds associated with a vigorous cold front caused numerous power outages across north central Maryland during the evening of the 23rd.  Baltimore Gas and Electric reported over 30,500 customers without power - a combination of minor damage from early (daytime) gusty winds ahead of the cold front and more substantial damage associated with the front.  The largest outages were clustered in Annapolis (MDZ014, 8100 customers); Baltimore City/Glen Burnie (MDZ011/14; 11,500 customers) and Howard Co (MDZ010; 4256 customers).",,PDC
199604,23,2100,199604,23,2200,2031224,5549413,MARYLAND,24,1996,April,High Wind,Z,10,HOWARD,LWX,23-APR-96 21:00:00,EST,23-APR-96 22:00:00,0,0,0,0,10K,,,,,,,,,,,,,,,,,,,,,,,,"Gusty gradient winds associated with a vigorous cold front caused numerous power outages across north central Maryland during the evening of the 23rd.  Baltimore Gas and Electric reported over 30,500 customers without power - a combination of minor damage from early (daytime) gusty winds ahead of the cold front and more substantial damage associated with the front.  The largest outages were clustered in Annapolis (MDZ014, 8100 customers); Baltimore City/Glen Burnie (MDZ011/14; 11,500 customers) and Howard Co (MDZ010; 4256 customers).",,PDC
199602,16,300,199602,17,500,2056349,5582331,MARYLAND,24,1996,February,Winter Storm,Z,21,DORCHESTER,AKQ,16-FEB-96 03:00:00,EST,17-FEB-96 05:00:00,0,0,0,0,,,,,,,,,,,,,,,,,,,,,,,,,"A STORM TRACKED NORTHEAST FROM WESTERN SOUTH CAROLINA THURSDAY NIGHT TO OFF THE NORTH CAROLINA COAST FRIDAY MORNING, THEN MOVED NORTH TO OFF THE MASSACHUSETTS COAST BY FRIDAY NIGHT. IT SPREAD HEAVY SNOW ACROSS THE LOWER MARYLAND EASTERN SHO",,PDC
199602,16,300,199602,17,500,2056349,5582332,MARYLAND,24,1996,February,Winter Storm,Z,22,WICOMICO,AKQ,16-FEB-96 03:00:00,EST,17-FEB-96 05:00:00,0,0,0,0,,,,,,,,,,,,,,,,,,,,,,,,,"A STORM TRACKED NORTHEAST FROM WESTERN SOUTH CAROLINA THURSDAY NIGHT TO OFF THE NORTH CAROLINA COAST FRIDAY MORNING, THEN MOVED NORTH TO OFF THE MASSACHUSETTS COAST BY FRIDAY NIGHT. IT SPREAD HEAVY SNOW ACROSS THE LOWER MARYLAND EASTERN SHO",,PDC
199602,16,300,199602,17,500,2056349,5582333,MARYLAND,24,1996,February,Winter Storm,Z,23,SOMERSET,AKQ,16-FEB-96 03:00:00,EST,17-FEB-96 05:00:00,0,0,0,0,,,,,,,,,,,,,,,,,,,,,,,,,"A STORM TRACKED NORTHEAST FROM WESTERN SOUTH CAROLINA THURSDAY NIGHT TO OFF THE NORTH CAROLINA COAST FRIDAY MORNING, THEN MOVED NORTH TO OFF THE MASSACHUSETTS COAST BY FRIDAY NIGHT. IT SPREAD HEAVY SNOW ACROSS THE LOWER MARYLAND EASTERN SHO",,PDC
199601,9,1600,199601,9,1800,2403633,5541142,MARYLAND,24,1996,January,Heavy Snow,Z,6,NORTHERN BALTIMORE,LWX,09-JAN-96 16:00:00,EST,09-JAN-96 18:00:00,0,0,0,0,,,,,,,,,,,,,,,,,,,,,,,,,"Low- and mid-level lift ahead of an ""Alberta Clipper"" added insult to injury only a day after the ""Blizzard of '96,"" dumping 4 to 6 inches of snow in a 5-hour period from lower southern Maryland through the northern suburbs of Baltimore.  The additional snowfall produced total snow depths similar to those over the Maryland and Virginia piedmont.",,PDC
199602,16,500,199602,16,2200,2037250,5551631,MARYLAND,24,1996,February,Heavy Snow,Z,8,CECIL,PHI,16-FEB-96 05:00:00,EST,16-FEB-96 22:00:00,0,0,0,0,,,,,,,,,,,,,,,,,,,,,,,,,"A low pressure system lingered over North Carolina on the 15th and developed quickly once it reached Cape Hatteras during the early morning hours of the 16th.  It then moved northeast over the Western Atlantic reaching the Gulf of Maine the morning of the 17th.  Its storm track was far enough offshore to keep cold air in place and to locate its axis of heavy snow over Delmar and New Jersey.  The traditionally ""snowier"" places farther northwest received less snow.Snow began by dawn on the 16th with the significant accumulation over by midnight.  Accumulations averaged 7 inches in Talbot County, 8 inches in Caroline County, 9 inches in Cecil and Queen Anne's Counties and 12 inches in Kent County.  Specific accumulations included 13 inches in Rock Hall, 9 inches in North East and 7 inches in Talbot.   There were numerous snow related accidents, especially in Cecil County.  In Cecil County injuries causing accidents occurred on Blue Ball Road in Elkton, Maryland State Route 272 near Hance Point Road, Maryland State Route 213 near Elk Forest Road, U.S. Route 40 at the Northeast Plaza, Maryland State Route 213 in Cherry Hill and Maryland State Route 273 at the Fair Hill Racetrack.",,PDC
199602,3,0,199602,3,600,2403652,5541601,MARYLAND,24,1996,February,Heavy Snow,Z,4,FREDERICK,LWX,03-FEB-96 00:00:00,EST,03-FEB-96 06:00:00,0,0,0,0,,,,,,,,,,,,,,,,,,,,,,,,,"The continuation of a strong upper-level jet streak, combined with additional mid-level dynamics, generated surface low pressure over central Georgia by evening on the 2nd.  As the low moved to near Cape Hatteras overnight, a broad area of heavy snow overspread all of Maryland west of the Chesapeake Bay.  Areas that were hit with 4 to 13 inches of snow during an early-morning event received an additional 4 to 6 inches, leaving most of lower southern Maryland with a grand total of 12 to 18 inches.  Farther north, from the Potomac Highlands through the western suburbs of Baltimore and Washington, between 6 and 9 inches fell.Circulation around the surface system allowed arctic air to pour into the area during the heaviest snowfall.  Much of the snow fell at temperatures below 20 degrees, making it powdery.  The 6 to 9 inches were cleared by the next afternoon, but problems remained in lower southern Maryland, where snow removal (rather than plowing) was required.Very thin bands of heavy snow continued into early Sunday morning (the 4th) along the immediate western shore of the Chesapeake Bay, producing as much as 9 additional inches in southeastern Calvert (MDZ018) and northeastern St Mary's (MDZ017) Cos.  Storm totals in these areas were as high as 2 feet.The storm's exit ushered the coldest air in two years into the region.  Daytime temperatures on the 4th remained below 20 degrees, with wind chills ranging from 10 to 20 degrees below zero.  Light winds and clear skies, combined with deep snow cover, allowed temperatures to fall well below zero by dawn on the 5th at most locations.  Low temperature records were set on two consecutive calendar days at Baltimore/Washington International Airport (MDZ014), with 8 degrees late on the 4th and 1 degree below zero early on the 5th.",,PDC
199603,7,2300,199603,8,1200,2056354,5582506,MARYLAND,24,1996,March,Winter Storm,Z,25,MARYLAND BEACHES,AKQ,07-MAR-96 23:00:00,EST,08-MAR-96 12:00:00,0,0,0,0,,,,,,,,,,,,,,,,,,,,,,,,,A LOW PRESSURE AREA DEVELOPED OVER THE CAROLINAS THEN TRACKED NORTHEAST OFF THE NORTH CAROLINA AND VIRGINIA COAST. IT SPREAD LIGHT SNOW ACROSS THE LOWER MARYLAND EASTERN SHORE FROM THURSDAY NIGHT THROUGH FRIDAY MORNING. SNOW AMOUNTS GENERAL,,PDC
199604,23,2000,199604,23,2100,2031224,5549410,MARYLAND,24,1996,April,High Wind,Z,4,FREDERICK,LWX,23-APR-96 20:00:00,EST,23-APR-96 21:00:00,0,0,0,0,10K,,,,,,,,,,,,,,,,,,,,,,,,"Gusty gradient winds associated with a vigorous cold front caused numerous power outages across north central Maryland during the evening of the 23rd.  Baltimore Gas and Electric reported over 30,500 customers without power - a combination of minor damage from early (daytime) gusty winds ahead of the cold front and more substantial damage associated with the front.  The largest outages were clustered in Annapolis (MDZ014, 8100 customers); Baltimore City/Glen Burnie (MDZ011/14; 11,500 customers) and Howard Co (MDZ010; 4256 customers).",,PDC
199602,5,300,199602,7,800,2056344,5584417,MARYLAND,24,1996,February,Cold/Wind Chill,Z,21,DORCHESTER,AKQ,05-FEB-96 03:00:00,EST,07-FEB-96 08:00:00,0,0,0,0,,,,,,,,,,,,,,,,,,,,,,,,,"AN ARCTIC AIRMASS SETTLED OVER THE MID ATLANTIC STATES RESULTING IN RECORD BREAKING COLD ACROSS THE LOWER MARYLAND EASTERN SHORE. THE TEMPERATURE DROPPED TO 1 BELOW ZERO AT THE SALISBURY AIRPORT ON THE MORNING OF THE 5TH, AND 2 BELOW ZERO O",,PDC
199602,5,300,199602,7,800,2056344,5584418,MARYLAND,24,1996,February,Cold/Wind Chill,Z,22,WICOMICO,AKQ,05-FEB-96 03:00:00,EST,07-FEB-96 08:00:00,0,0,0,0,,,,,,,,,,,,,,,,,,,,,,,,,"AN ARCTIC AIRMASS SETTLED OVER THE MID ATLANTIC STATES RESULTING IN RECORD BREAKING COLD ACROSS THE LOWER MARYLAND EASTERN SHORE. THE TEMPERATURE DROPPED TO 1 BELOW ZERO AT THE SALISBURY AIRPORT ON THE MORNING OF THE 5TH, AND 2 BELOW ZERO O",,PDC
199602,5,300,199602,7,800,2056344,5584419,MARYLAND,24,1996,February,Cold/Wind Chill,Z,23,SOMERSET,AKQ,05-FEB-96 03:00:00,EST,07-FEB-96 08:00:00,0,0,0,0,,,,,,,,,,,,,,,,,,,,,,,,,"AN ARCTIC AIRMASS SETTLED OVER THE MID ATLANTIC STATES RESULTING IN RECORD BREAKING COLD ACROSS THE LOWER MARYLAND EASTERN SHORE. THE TEMPERATURE DROPPED TO 1 BELOW ZERO AT THE SALISBURY AIRPORT ON THE MORNING OF THE 5TH, AND 2 BELOW ZERO O",,PDC
199602,5,300,199602,7,800,2056344,5584420,MARYLAND,24,1996,February,Cold/Wind Chill,Z,24,INLAND WORCESTER,AKQ,05-FEB-96 03:00:00,EST,07-FEB-96 08:00:00,0,0,0,0,,,,,,,,,,,,,,,,,,,,,,,,,"AN ARCTIC AIRMASS SETTLED OVER THE MID ATLANTIC STATES RESULTING IN RECORD BREAKING COLD ACROSS THE LOWER MARYLAND EASTERN SHORE. THE TEMPERATURE DROPPED TO 1 BELOW ZERO AT THE SALISBURY AIRPORT ON THE MORNING OF THE 5TH, AND 2 BELOW ZERO O",,PDC
199602,24,1030,199602,24,1430,2403653,5541787,MARYLAND,24,1996,February,High Wind,Z,14,ANNE ARUNDEL,LWX,24-FEB-96 10:30:00,EST,24-FEB-96 14:30:00,0,0,0,0,,,,52,,,,,,,,,,,,,,,,,,,,,"Gradient winds of 25 to 35 mph, with gusts to 60 mph, which occurred between an intense storm over the Canadian Maritimes and a strong high pressure ridge over the southeast U.S., produced minor damage and power outages in the Baltimore metropolitan region.  Baltimore Gas and Electric reported over 22,000 customers without power during the peak winds.  Most of the outages were the result of large limbs or trees which bent onto power lines.The wind gusts also knocked down small trees, and tore aluminum siding off a few homes over the northern and western suburbs.",,PDC
199602,24,1030,199602,24,1430,2403653,5541786,MARYLAND,24,1996,February,High Wind,Z,11,SOUTHERN BALTIMORE,LWX,24-FEB-96 10:30:00,EST,24-FEB-96 14:30:00,0,0,0,0,,,,52,,,,,,,,,,,,,,,,,,,,,"Gradient winds of 25 to 35 mph, with gusts to 60 mph, which occurred between an intense storm over the Canadian Maritimes and a strong high pressure ridge over the southeast U.S., produced minor damage and power outages in the Baltimore metropolitan region.  Baltimore Gas and Electric reported over 22,000 customers without power during the peak winds.  Most of the outages were the result of large limbs or trees which bent onto power lines.The wind gusts also knocked down small trees, and tore aluminum siding off a few homes over the northern and western suburbs.",,PDC
199603,1,2100,199603,2,1100,2056352,5582464,MARYLAND,24,1996,March,Winter Storm,Z,21,DORCHESTER,AKQ,01-MAR-96 21:00:00,EST,02-MAR-96 11:00:00,0,0,0,0,,,,,,,,,,,,,,,,,,,,,,,,,A LOW PRESSURE AREA TRACKED NORTHEAST FROM THE GULF OF MEXICO TO OFF THE NORTH CAROLINA COAST. IT SPREAD LIGHT SNOW ACROSS THE LOWER MARYLAND EASTERN SHORE FROM FRIDAY EVENING THROUGH SATURDAY MORNING. SNOW AMOUNTS GENERALLY RANGED FROM 1 T,,PDC
199608,12,1000,199608,13,800,2051407,5571210,MARYLAND,24,1996,August,Heavy Rain,Z,15,QUEEN ANNES,PHI,12-AUG-96 10:00:00,EST,13-AUG-96 08:00:00,0,0,0,0,,,,,,,,,,,,,,,,,,,,,,,,,"A low pressure system that developed along the Gulf Coast States on Monday morning the 12th moved northeast and passed through the Delmarva Peninsula the morning of the 13th.  It tapped the abundant moisture over the South and consequently produced heavy rain across all of the Maryland Eastern Shore.  Storm totals averaged 2 to 3 inches, but since this was spaced over 24 hours, flooding was generally confined to poor drainage locations.  Storm totals included 2.2 inches in Federalsburg.",,PDC
199610,8,600,199610,8,2000,2055728,5577346,MARYLAND,24,1996,October,Heavy Rain,Z,20,CAROLINE,PHI,08-OCT-96 06:00:00,EST,08-OCT-96 20:00:00,0,0,0,0,,,,,,,,,,,,,,,,,,,,,,,,,"Heavy rain associated with the remnants of Tropical Storm Josephine affected the Maryland Eastern Shore primarily during the daylight hours on the 8th.  Peak wind gusts reached between 30 and 40 mph in most areas.  While the heavy rain did cause the usual poor drainage flooding, recent dry weather and foliage still on the trees prevented further flooding.  The wind gusts did pull down some small limbs.  Storm totals included 2.40 inches in Federalsburg, 1.90 inches in Newark, Delaware and 0.87 inches in Conowingo.",,PDC
199607,19,1420,199607,19,1424,2043599,5568058,MARYLAND,24,1996,July,Tornado,C,21,FREDERICK,LWX,19-JUL-96 14:20:00,EST,19-JUL-96 14:24:00,0,0,0,0,80K,50K,,,,,,F1,2.2,200,,,,,,,ROSEMONT,,,BRUNSWICK,39.33,-77.63,39.32,-77.63,"The same supercell thunderstorm which produced the F2 tornado in Yarrowsburg (Washington Co) dropped a second tornado in Rosemont.  This tornado would track through Brunswick, cross the Potomac River, then continue an additional 4 miles through extreme northern Loudoun Co before dissipating.The tornado first touched down in Rosemont, damaging numerous trees as it crossed state route 17 and moved into Brunswick.  A service station's roof was partially damaged by a fallen tree.  Many of the homes in Brunswick were protected by the trees and the steep sloping terrain towards the Potomac.  At the bottom of this hill, just east of the Maryland state route 17/Virginia route 287 bridge, is a train station, the C&O Canal, and a campground.  The tornado maximized at this location, flattening numerous large hardwood trees.  Considering the number of trees that fell in this area it was amazing that none of the campers or C&O Canal visitors were injured or killed.  The tornado was witnessed crossing the Potomac into northern Loudoun Co.The twister tracked over mainly rural property in Loudoun Co, maintaining F1 strength while crossing Quarter Branch Road.  Most of the damage was to trees which were snapped, uprooted, or had large branches blown off.  Siding, shingles, and some insulation were blown off a home in its path.  A resident's automobile window was shattered.  The tornado weakened at this point, producing F0 damage (mostly large limbs/small trees) for the next 2 miles before dissipating in Taylorstown.",,PDC
199607,30,1630,199607,30,1630,2043609,5568222,MARYLAND,24,1996,July,Flash Flood,C,21,FREDERICK,LWX,30-JUL-96 16:30:00,EST,30-JUL-96 16:30:00,0,0,0,0,,,,,,,,,,,,,,,,,MIDDLETOWN,,,MIDDLETOWN,,,,,"A slow-moving thunderstorm, containing tropical downpours, dumped an estimated 2 to 3 inches of rain in an hour, causing localized street flooding in Middletown.  Street flooding was reported around the same time in Frederick.",,PDC
199607,30,1615,199607,30,1615,1017226,5568223,MARYLAND,24,1996,July,Flash Flood,C,43,WASHINGTON,LWX,30-JUL-96 16:15:00,EST,30-JUL-96 16:15:00,0,0,0,0,15K,,,,,,,,,,,,,,,,SE PORTION,,,SE PORTION,,,,,Slow-moving thunderstorms flooded numerous basements in the southeastern portion of the county.,,PDC
199607,30,1820,199607,30,1820,1017227,5568224,MARYLAND,24,1996,July,Hail,C,21,FREDERICK,LWX,30-JUL-96 18:20:00,EST,30-JUL-96 18:20:00,0,0,0,0,,,,.88,,,,,,,,,,,5,SW,FREDERICK,5,SW,FREDERICK,39.37,-77.48,39.37,-77.48,Nickel-sized hail was reported by an NWS Skywarn spotter at the intersection of Mount Zion Road and federal highway 340 just southwest of Frederick.,,PDC
199607,30,2010,199607,30,2010,2043610,5568225,MARYLAND,24,1996,July,Thunderstorm Wind,C,27,HOWARD,LWX,30-JUL-96 20:10:00,EST,30-JUL-96 20:10:00,0,0,0,0,10K,,,,,,,,,,,,,,,,LISBON,,,LISBON,39.33,-77.07,39.33,-77.07,Merging thunderstorms in western Howard Co produced severe wind gusts which knocked down numerous trees in Lisbon.,,PDC
199607,30,2045,199607,30,2100,2043611,5568226,MARYLAND,24,1996,July,Flash Flood,C,31,MONTGOMERY,LWX,30-JUL-96 20:45:00,EST,30-JUL-96 21:00:00,0,0,0,0,,,,,,,,,,,,,,,,,GERMANTOWN,,,GERMANTOWN,,,,,State route 118 was covered by high standing water in Germantown.,,PDC
199607,30,2115,199607,30,2120,2043612,5568227,MARYLAND,24,1996,July,Thunderstorm Wind,C,27,HOWARD,LWX,30-JUL-96 21:15:00,EST,30-JUL-96 21:20:00,0,0,0,0,15K,2K,,,,,,,,,,,,,,,COUNTYWIDE,,,COUNTYWIDE,39.27,-76.92,39.27,-76.92,"A severe thunderstorm moved through central and eastern Howard Co about one hour after another storm knocked down trees in Lisbon.  This storm damaged trees, and some power lines fell.",,PDC
199607,30,2200,199607,30,2200,2043613,5568228,MARYLAND,24,1996,July,Flash Flood,C,27,HOWARD,LWX,30-JUL-96 22:00:00,EST,30-JUL-96 22:00:00,0,0,0,0,10K,,,,,,,,,,,,,,,,ELKRIDGE,,,ELKRIDGE,,,,,Torrential rains flooded highway 1 near Elkridge.  The flooding was intense enough to wash away portions of the shoulders.,,PDC
199611,8,1630,199611,8,1715,2049867,5572784,MARYLAND,24,1996,November,Flash Flood,C,33,PRINCE GEORGE'S,LWX,08-NOV-96 16:30:00,EST,08-NOV-96 17:15:00,0,0,0,0,,,,,,,,,,,,,,,,,BELTSVILLE,,,BELTSVILLE,,,,,"A strong cold front pumped tropical moisture ahead of it, producing torrential rains which caused sporadic flash flooding across central Maryland during the afternoon and evening of the 8th.  Rain totals averaged 1.5 to 3 inches across the area, but locally higher amounts likely fell in some areas.  Flooding was most prevalent at low-lying locations when creeks and streams overflowed their banks.In Frederick Co, roads and low-lying areas were flooded near Urbana.  In Montgomery Co, closed roads included Beach Drive in Kensington, Watkins Mill Road (at a one lane bridge) in Gaithersburg, and Emery Lane in Olney.  Several roads were closed in western Howard Co as well.  Federal highway 1 was under one foot of water in Beltsville.  In Anne Arundel Co, high water closed roads in low-lying areas of Glen Burnie.In Baltimore Co, several motorists became trapped in their vehicles near Hereford as high water stalled out engines.  Fire and Rescue workers used rafts to get to the site; motorists escaped to safety through open windows.  Other low-lying areas of central Baltimore Co were under water, especially near the Western Run which overflowed its banks.The torrential rains slowed the Friday evening commute to a crawl, and numerous accidents occurred.  Two serious accidents were reported in Anne Arundel Co - a 37 year old man was struck and killed by a vehicle near Baltimore-Washington International Airport, and a school bus was struck by a minivan after the bus inadvertently ran a red light near Jessup.  The driver of the van sustained minor injuries.The storms knocked out power to nearly 1000 Maryland customers of Potomac Electric Power Co, and 2500 Baltimore Gas and Electric customers.",,PDC
199607,8,1805,199607,8,1805,1017201,5568044,MARYLAND,24,1996,July,Lightning,C,27,HOWARD,LWX,08-JUL-96 18:05:00,EST,08-JUL-96 18:05:00,0,0,0,0,75K,,,,,,,,,,,,,,,,COLUMBIA,,,COLUMBIA,,,,,"Lightning struck an apartment complex in the Oakland Mills subdivision, destroying two units and causing water damage at ten others.  Twenty residents were displaced by the combination of fire and water damage.",,PDC
199607,8,1805,199607,8,1815,2043586,5568045,MARYLAND,24,1996,July,Lightning,C,510,BALTIMORE CITY (C),LWX,08-JUL-96 18:05:00,EST,08-JUL-96 18:15:00,0,0,0,0,30K,,,,,,,,,,,,,,,,BALTIMORE CITY,,,BALTIMORE CITY,,,,,"Several trees were struck by lightning, and a home on Allendale Road which was also struck had its ceiling collapse.  Numerous traffic lights were temporarily knocked out as a result of the storm.  Baltimore Gas and Electric reported 23,000 customers without power in the metropolitan area.",,PDC
199608,12,1000,199608,13,800,2051407,5571067,MARYLAND,24,1996,August,Heavy Rain,Z,8,CECIL,PHI,12-AUG-96 10:00:00,EST,13-AUG-96 08:00:00,0,0,0,0,,,,,,,,,,,,,,,,,,,,,,,,,"A low pressure system that developed along the Gulf Coast States on Monday morning the 12th moved northeast and passed through the Delmarva Peninsula the morning of the 13th.  It tapped the abundant moisture over the South and consequently produced heavy rain across all of the Maryland Eastern Shore.  Storm totals averaged 2 to 3 inches, but since this was spaced over 24 hours, flooding was generally confined to poor drainage locations.  Storm totals included 2.2 inches in Federalsburg.",,PDC
199610,8,600,199610,8,2000,2055728,5577342,MARYLAND,24,1996,October,Heavy Rain,Z,8,CECIL,PHI,08-OCT-96 06:00:00,EST,08-OCT-96 20:00:00,0,0,0,0,,,,,,,,,,,,,,,,,,,,,,,,,"Heavy rain associated with the remnants of Tropical Storm Josephine affected the Maryland Eastern Shore primarily during the daylight hours on the 8th.  Peak wind gusts reached between 30 and 40 mph in most areas.  While the heavy rain did cause the usual poor drainage flooding, recent dry weather and foliage still on the trees prevented further flooding.  The wind gusts did pull down some small limbs.  Storm totals included 2.40 inches in Federalsburg, 1.90 inches in Newark, Delaware and 0.87 inches in Conowingo.",,PDC
