BEGIN_YEARMONTH,BEGIN_DAY,BEGIN_TIME,END_YEARMONTH,END_DAY,END_TIME,EPISODE_ID,EVENT_ID,STATE,STATE_FIPS,YEAR,MONTH_NAME,EVENT_TYPE,CZ_TYPE,CZ_FIPS,CZ_NAME,WFO,BEGIN_DATE_TIME,CZ_TIMEZONE,END_DATE_TIME,INJURIES_DIRECT,INJURIES_INDIRECT,DEATHS_DIRECT,DEATHS_INDIRECT,DAMAGE_PROPERTY,DAMAGE_CROPS,SOURCE,MAGNITUDE,MAGNITUDE_TYPE,FLOOD_CAUSE,CATEGORY,TOR_F_SCALE,TOR_LENGTH,TOR_WIDTH,TOR_OTHER_WFO,TOR_OTHER_CZ_STATE,TOR_OTHER_CZ_FIPS,TOR_OTHER_CZ_NAME,BEGIN_RANGE,BEGIN_AZIMUTH,BEGIN_LOCATION,END_RANGE,END_AZIMUTH,END_LOCATION,BEGIN_LAT,BEGIN_LON,END_LAT,END_LON,EPISODE_NARRATIVE,EVENT_NARRATIVE,DATA_SOURCE
199806,27,2110,199806,27,2120,2081956,5659871,WEST VIRGINIA,54,1998,June,Thunderstorm Wind,C,75,POCAHONTAS,RLX,27-JUN-98 21:10:00,EST,27-JUN-98 21:20:00,0,0,0,0,100K,,NEWSPAPER,,,,,,,,,,,,,,COUNTYWIDE,,,COUNTYWIDE,38.38,-80,38.38,-80,"Three consecutive nights of thunderstorms left western and northern counties with wind damage and flooding.   The first night was from Friday evening, the 26th, into early Saturday morning, the 27th.  The convection on the second and third nights was further south than the first night, hitting the Parkersburg to Charleston corridor the hardest.  Total rains were 6 to 10 inches across portions of Wood, Jackson, and northern Kanawha Counties, with 5 inches further northeast, into the Middle Island Creek basin.   The heaviest rain rates were with the second night of convection from late Saturday night. the 27th, into Sunday morning, the 28th.  The cloudbursts swept southeast from eastern Ohio, hitting Jackson, southern Roane, and northern Kanawha before dawn on Sunday.  Ripley of Jackson County measured 6.8 inches in the 4 hours from 0430 to 0830E.Serious flash flooding occurred.  Two people were killed in Kanawha County, along Little Sandy Creek in the Frame vicinity.  A woman tried to carry her 4 month old baby out of a flooded mobile home.  The baby was swept out of her arms.  An elderly blind man was swept off his front porch by the rising water, after a failed attempt by 4 men to carry the 200 pound man across a strong current.  Several private bridges and a small 100 year old church were swept away along the Little Sandy Creek basin.  Other nearby creeks had flooding also, such as Jordan Creek near Falling Rock.A federal disaster declaration for individual and public assistance was declared for 15 counties in West Virginia, 14 of which were in this section of the state.  They included, Kanawha, Clay, Roane, Jackson, Braxton, Calhoun, Wirt, Gilmer, Wood, Pleasants, Ritchie, Doddridge, Lewis, and Taylor.  About 240 dwellings  were destroyed, the most being from Wood, Kanawha, Roane, and Jackson Counties.  Nearly 500 homes had major damage, the most from Kanawha and Ritchie counties.  Around 100 dwelling had minor water damage.  These figures included mobile homes, many of which were located in areas most susceptible to stream flooding.   In Jackson County, the Northern Mobile Home Park, in the northern sections of Ripley, sat at the junction of Syramore Creek with its Left Fork.  About 12 mobile homes were washed into the creek just after dawn on the 28th.  The trailers were smashed against the Route 21 bridge, about 50 yards down the stream.  All total, 21 of the 23 trailers at this mobile home park were destroyed.   Luckily, everyone escaped uninjured.  One resident found only one item from their destroyed mobile home.  It was a book, describing the West Virginia flood of 1985.   Near Interstate 77, east of Ravenswood, Straight Fork heavily damaged Abels Mobile Home Park.  Along the Left Fork of Sandy Creek, the Dewey Thomas Hill Bridge was destroyed.  The 100 year old steel bridge washed into the stream, leaving only its concrete supports.  Further down the creek near Odaville, the Sarvis Fork Covered Bridge passed the test of time.  The high water mark was some 3 to 4 feet on the upstream outer wooden shell.  This bridge survived.  It was built around 1889.   The Lockhart Church, near the Route 21 and Medina Road intersection, had 4.5 to 5 feet of water inside.  The crest was even over the podium that was on the stage.   Local lifelong residents of the upper reaches of the Left Fork of Sandy Creek said it was the highest water levels they have ever seen.  One man was 89 years old.  Another man had accounts passed down to him of the famous 1889 cloudburst.  He said the water was even higher in 1889.    In Wood County, Neal Run destroyed about 50 mobile homes in 2 trailer parks in South Parkersburg on the morning of the 28th.  One resident said, ""It was unreal how fast the water came up.""  Little Tygart Creek caused severe flooding just south of Mineralwells, including the Lincolnshire development and Slate Creek Village.  Along Lee Creek, a mobile home with 2 occupants was washed downstream, until becoming lodged in trees.  The occupants escaped uninjured.  Stillwell and Pond Creeks also had significant flooding in Wood County.Besides the fatal flash flood along Little Sandy Creek in Kanawha County, the small streams feeding the Pocatalico River near Sissonville flooded on Sunday morning, the 28th.  People were rescued by boat.  This included the Haines Branch region.   The river at Sissonville rose some 25 feet between 1100E and 1500E on the 28th from the rains early Sunday morning.  As the small streams were starting to recede, and the Pocatalico River was starting to crest out, the third night of convection started during Sunday evening, the 28th.  The rain maximum this third night was in southern Roane to southern Jackson County. This caused more small stream flooding and resulted in a record crest of 35.5 feet on the Pocatalico River around 1000E on Monday the 29th.  The Sissonville Middle School had 2 feet of water in the library.    In Ritchie County, after the initial flash flood near Cairo Friday night, more flash flooding occurred.  Bunnell Run flooded Pennsboro, about 50 people had to be evacuated.  Two manufactured homes  were destroyed, and 6 homes had major damage in Pennsboro.  One resident said, ""It has never been like this.  My whole house was flooded.  Everything I have is ruined.""  The Pennsboro Fire Chief said, ""There was no time to do anything.  Some of my men didn't even make it out of their homes when the water hit. "" A Pontiac car dealership in Pennsboro had several cars flooded.In Roane County, most of the severe flooding was from the Cicerone-Kettle area on toward Cotton.  One house on Green Creek was swept away, prompting the emergency director to say, ""It must have been some force, because it took everything and there was nothing left but the ground.""In Gilmer County, Normantown had homes and businesses flooded by Steer Creek.  Private bridges were destroyed.  In Wirt County, a small bridge was washed out near Elizabeth.In Doddridge and Pleasant County, after the initial small stream flooding, high water lingered along the  Middle Island Creek.  People were evacuated from Arvilla of Pleasants County.  The Pricetown firehouse was flooded by Polk Creek.  Prolong power outages occurred in Wirt, Doddridge, Tyler, Pleasants, Ritchie, and Pocahontas Counties.    In the aftermath of the small stream flooding, only minor river flooding occurred.  The West Fork River crested about 3 to 4 feet above flood stage on the forecast point near Clarksburg.  The level was 16.5 feet.  Flooding was confined to streets.  On the Ohio River, a crest at or just over flood stage occurred from near Ravenswood on through Point Pleasant.",A 75 year old barn was blown down at Lobelia.  Fruit trees were lost in the Arbovale region.,PDC
199804,8,1549,199804,8,1549,2076748,5641425,WEST VIRGINIA,54,1998,April,Hail,C,9,BROOKE,PBZ,08-APR-98 15:49:00,EST,08-APR-98 15:49:00,0,0,0,0,,,,.75,,,,,,,,,,,5,E,WELLSBURG,5,E,WELLSBURG,40.27,-80.5,40.27,-80.5,,,PDC
199806,16,1450,199806,16,1450,2081945,5659479,WEST VIRGINIA,54,1998,June,Hail,C,87,ROANE,RLX,16-JUN-98 14:50:00,EST,16-JUN-98 14:50:00,0,0,0,0,,,LAW ENFORCEMENT,.75,,,,,,,,,,,,,SPENCER,,,SPENCER,38.8,-81.35,38.8,-81.35,Unusually large hail for  the Mountain State occurred in central counties.  Insurance companies estimated on the order of 4000 claims across West Virginia with this event.  The majority of the damage was from hail damaging vehicles.,,PDC
199806,16,1512,199806,16,1512,2081945,5659785,WEST VIRGINIA,54,1998,June,Hail,C,33,HARRISON,RLX,16-JUN-98 15:12:00,EST,16-JUN-98 15:12:00,0,0,0,0,750K,,BROADCAST MEDIA,2.75,,,,,,,,,,,,,CLARKSBURG,,,CLARKSBURG,39.28,-80.35,39.28,-80.35,Unusually large hail for  the Mountain State occurred in central counties.  Insurance companies estimated on the order of 4000 claims across West Virginia with this event.  The majority of the damage was from hail damaging vehicles.,"Baseball size hail fell at the Mount Clair Golf Course, breaking wind shields on vehicles.  The Laurel Park  section of town saw leaves stripped off the trees.  The hail was described as bigger than golfballs.",PDC
199804,15,1710,199804,15,1710,2074188,5632932,WEST VIRGINIA,54,1998,April,Thunderstorm Wind,C,99,WAYNE,RLX,15-APR-98 17:10:00,EST,15-APR-98 17:10:00,0,0,0,0,5K,,,,,,,,,,,,,,2,W,WAYNE,2,W,WAYNE,38.22,-82.47,38.22,-82.47,,"Several trees were blown down along Patrick Creek,",PDC
199806,26,2255,199806,26,2255,2081953,5659553,WEST VIRGINIA,54,1998,June,Thunderstorm Wind,C,85,RITCHIE,RLX,26-JUN-98 22:55:00,EST,26-JUN-98 22:55:00,0,0,0,0,2K,,LAW ENFORCEMENT,,,,,,,,,,,,,,HARRISVILLE,,,HARRISVILLE,39.2,-81.05,39.2,-81.05,"The first of three consecutive nights of thunderstorms caused mostly minor damage, associated with the wind gusts.  The most significant event this night was the flash flood in Ritchie County.",,PDC
199806,27,30,199806,27,30,2081953,5659554,WEST VIRGINIA,54,1998,June,Thunderstorm Wind,C,21,GILMER,RLX,27-JUN-98 00:30:00,EST,27-JUN-98 00:30:00,0,0,0,0,2K,,LAW ENFORCEMENT,,,,,,,,,,,,,,GLENVILLE,,,GLENVILLE,38.93,-80.83,38.93,-80.83,"The first of three consecutive nights of thunderstorms caused mostly minor damage, associated with the wind gusts.  The most significant event this night was the flash flood in Ritchie County.",,PDC
199806,27,25,199806,27,25,2081953,5659555,WEST VIRGINIA,54,1998,June,Thunderstorm Wind,C,13,CALHOUN,RLX,27-JUN-98 00:25:00,EST,27-JUN-98 00:25:00,0,0,0,0,2K,,LAW ENFORCEMENT,,,,,,,,,,,,,,GRANTSVILLE,,,GRANTSVILLE,38.92,-81.1,38.92,-81.1,"The first of three consecutive nights of thunderstorms caused mostly minor damage, associated with the wind gusts.  The most significant event this night was the flash flood in Ritchie County.",Trees were down along Routes 16 and 5.,PDC
199806,27,42,199806,27,42,2081953,5659556,WEST VIRGINIA,54,1998,June,Thunderstorm Wind,C,7,BRAXTON,RLX,27-JUN-98 00:42:00,EST,27-JUN-98 00:42:00,0,0,0,0,1K,,LAW ENFORCEMENT,,,,,,,,,,,,,,TESLA,,,TESLA,38.6,-80.7,38.6,-80.7,"The first of three consecutive nights of thunderstorms caused mostly minor damage, associated with the wind gusts.  The most significant event this night was the flash flood in Ritchie County.",,PDC
199806,16,1403,199806,16,1403,2081945,5659469,WEST VIRGINIA,54,1998,June,Hail,C,19,FAYETTE,RLX,16-JUN-98 14:03:00,EST,16-JUN-98 14:03:00,0,0,0,0,30K,,GENERAL PUBLIC,1.50,,,,,,,,,,,,,MEADOW BRIDGE,,,MEADOW BRIDGE,37.85,-80.85,37.85,-80.85,Unusually large hail for  the Mountain State occurred in central counties.  Insurance companies estimated on the order of 4000 claims across West Virginia with this event.  The majority of the damage was from hail damaging vehicles.,,PDC
199807,21,1615,199807,21,1630,2082875,5663066,WEST VIRGINIA,54,1998,July,Thunderstorm Wind,C,65,MORGAN,LWX,21-JUL-98 16:15:00,EST,21-JUL-98 16:30:00,0,0,0,0,12K,5K,EMERGENCY MANAGER,,,,,,,,,,,,,,COUNTYWIDE,,,COUNTYWIDE,39.57,-78.25,39.57,-78.25,"A small but potent line of severe thunderstorms developed over the eastern West Virginia panhandle during the late afternoon.  Microbursts produced wind gusts in excess of 80 mph across portions of northern Berkeley and Jefferson Cos, increasing the amount of damage, which was fairly extensive to trees and wires.  Some property damage was observed as well.The storms first intensified in Morgan Co.  Widespread scattered damage occurred mainly to trees/large limbs and power lines.  The main cell developed an impressive microburst as it traversed northern Berkeley Co, producing widespread damage to trees, large limbs, and power lines.  A 50 by 30 area of double-metal roof was ripped from an automobile manufacturing plant in Martinsburg, with associated structural damage noted to the supporting steel girders.  Assorted minor property damage (e.g. shingles, siding, yard articles) was noted in neighborhoods north of Martinsburg between Hedgesville and Falling Waters.Moments later, the storm raced southeast through northern and eastern Jefferson Co.  An identical wind gust (82 mph) was recorded by a spotter in Shepherdstown; emergency management officials noted tree/limb and wire damage in the area.  An off-duty meteorologist reported numerous trees had been knocked down in the Harpers Ferry/Bolivar area of eastern Jefferson Co.",,PDC
199812,6,0,199812,6,2359,2151072,5676952,WEST VIRGINIA,54,1998,December,Heat,Z,7,MASON,RLX,06-DEC-98 00:00:00,EST,06-DEC-98 23:59:00,0,0,0,0,,,TRAINED SPOTTER,,,,,,,,,,,,,,,,,,,,,,"A prolong warm spell from late November continued for the first week of December.  The warmest temperatures came on the 6th. Readings of 70 to 75 degrees were common in the lowlands, with 60s in the mountains.  The calendar day minimum temperature at Charleston was only 62 degrees for the 6th.",,PDC
199806,19,535,199806,19,930,2149278,5669774,WEST VIRGINIA,54,1998,June,Flash Flood,C,69,OHIO,PBZ,19-JUN-98 05:35:00,EST,19-JUN-98 09:30:00,0,0,0,0,100K,,LAW ENFORCEMENT,,,,,,,,,,,,,,WHEELING,,,WHEELING,,,,,,"Torrential thunderstorm rains forced small creeks and storm sewers to overflow.  Several streets in the Wheeling area were closed due to flooding, including US Route 40.  Carters Run Creek overflowed, flooding a house and causing it to collapse.  No injuries were reported.",PDC
199807,21,1100,199807,22,1700,2082874,5663065,WEST VIRGINIA,54,1998,July,Heat,Z,53,JEFFERSON,LWX,21-JUL-98 11:00:00,EST,22-JUL-98 17:00:00,0,0,0,0,,,NEWSPAPER,,,,,,,,,,,,,,,,,,,,,,"After an unusually pleasant start to the month, a singular heat wave affected the eastern panhandle of West Virginia during the climatological peak of the highest annual temperatures.  The heat wave, caused by the combination of hot humid air associated with ""Bermuda"" high pressure and increasingly dry ground, caused temperatures to soar into the mid and upper 90s.  The heat index, however, equalled or exceeded 100 each afternoon.  This heat wave was less tolerable than those in recent years since much of the summer had been cooler and less humid than normal.",,PDC
199805,24,2030,199805,24,2030,2076811,5640276,WEST VIRGINIA,54,1998,May,Hail,C,81,RALEIGH,RLX,24-MAY-98 20:30:00,EST,24-MAY-98 20:30:00,0,0,0,0,75K,,,1.00,,,,,,,,,,,,,BECKLEY,,,BECKLEY,37.78,-81.18,37.78,-81.18,Widespread thunderstorms contained hail and some strong wind gusts.  Cabell County residents were hit by 2 or 3 separate thunderstorms.  An estimated 400 insurance claims were filed from the Huntington vicinity from these storms.  The damage was mostly dented vehicles from the large hail.   A  few homes had minor damage.,A few vehicles were damaged.,PDC
199805,4,2100,199805,4,2300,1060747,5645836,WEST VIRGINIA,54,1998,May,Flash Flood,C,57,MINERAL,LWX,04-MAY-98 21:00:00,EST,04-MAY-98 23:00:00,0,0,0,0,,,LAW ENFORCEMENT,,,,,,,,,,,,,,NORTHWEST PORTION,,,NORTHWEST PORTION,,,,,"Slow-moving thunderstorms with very heavy rain aligned across the northwestern portion of Mineral Co, dumping between 1 1/2 and 2 inches of rain in less than 3 hours onto saturated ground.  Several streams and creeks overflowed their banks, and some basements likely flooded in and around Keyser.",,PDC
199805,24,2335,199805,24,2335,2076811,5640277,WEST VIRGINIA,54,1998,May,Hail,C,59,MINGO,RLX,24-MAY-98 23:35:00,EST,24-MAY-98 23:35:00,0,0,0,0,,,,1.00,,,,,,,,,,,,,WILLIAMSON ARPT,,,WILLIAMSON ARPT,37.68,-82.27,37.68,-82.27,Widespread thunderstorms contained hail and some strong wind gusts.  Cabell County residents were hit by 2 or 3 separate thunderstorms.  An estimated 400 insurance claims were filed from the Huntington vicinity from these storms.  The damage was mostly dented vehicles from the large hail.   A  few homes had minor damage.,,PDC
199807,30,1705,199807,30,1710,2082876,5663070,WEST VIRGINIA,54,1998,July,Thunderstorm Wind,C,3,BERKELEY,LWX,30-JUL-98 17:05:00,EST,30-JUL-98 17:10:00,0,0,0,0,50K,10K,EMERGENCY MANAGER,,,,,,,,,,,,,,BUNKER HILL,,,BUNKER HILL,39.33,-78.05,39.33,-78.05,"A pulse-severe mini-supercell thunderstorm rapidly developed near the border of Frederick Co, Virginia and Berkeley Co during the late afternoon.  Shortly after the storm exhibited strong low- and mid-level rotation, a combination of large hail, damaging straight-line winds, and a tornado occurred in the Bunker Hill area.The most impressive event was a brief tornado, witnessed for much of its path by a local resident.  The twister touched down along Tory Town Road and continued east-southeast along Sam Mason Road, crossing Interstate 81 before dissipating shortly after crossing federal highway 11.  The tornado had multiple vortices - the eyewitness noted at least 5 spinning finger-shaped tendrils as the twister passed.Damage on Tory Town Road included a pushed in a wall of a home, one uprooted tree which totalled a parked sport-utility vehicle, and a destroyed barn.  Along and just north of Sam Mason Road, damage included numerous snapped and twisted tree tops.  One uprooted tree smashed into a home causing substantial damage to an adjacent shop.  Five windows were blown out.  Along Sam Mason Road east of Interstate 81 , at least a dozen large trees were uprooted, and several sheds were damaged.  One of the sheds was large - 12 by 36 feet.  Two horses inside sustained minor injuries (from cuts).Straight-line wind damage occurred about a mile northeast of the tornado's location - along and near Runnymeade Road.  Two barns were blown down, and several large trees fell, one onto a vehicle and another onto a house.  Hail, ranging in size from marble to occasionally golf ball, fell - in one case prior to the tornado touch down.Allegheny Power estimated between 500 and 1,000 customers lost electricity during the storms.",,PDC
199806,28,2230,199806,28,2230,2081956,5658502,WEST VIRGINIA,54,1998,June,Thunderstorm Wind,C,101,WEBSTER,RLX,28-JUN-98 22:30:00,EST,28-JUN-98 22:30:00,0,0,0,0,20K,,LAW ENFORCEMENT,,,,,,,,,,,,,,WEBSTER SPGS,,,WEBSTER SPGS,38.48,-80.42,38.48,-80.42,"Three consecutive nights of thunderstorms left western and northern counties with wind damage and flooding.   The first night was from Friday evening, the 26th, into early Saturday morning, the 27th.  The convection on the second and third nights was further south than the first night, hitting the Parkersburg to Charleston corridor the hardest.  Total rains were 6 to 10 inches across portions of Wood, Jackson, and northern Kanawha Counties, with 5 inches further northeast, into the Middle Island Creek basin.   The heaviest rain rates were with the second night of convection from late Saturday night. the 27th, into Sunday morning, the 28th.  The cloudbursts swept southeast from eastern Ohio, hitting Jackson, southern Roane, and northern Kanawha before dawn on Sunday.  Ripley of Jackson County measured 6.8 inches in the 4 hours from 0430 to 0830E.Serious flash flooding occurred.  Two people were killed in Kanawha County, along Little Sandy Creek in the Frame vicinity.  A woman tried to carry her 4 month old baby out of a flooded mobile home.  The baby was swept out of her arms.  An elderly blind man was swept off his front porch by the rising water, after a failed attempt by 4 men to carry the 200 pound man across a strong current.  Several private bridges and a small 100 year old church were swept away along the Little Sandy Creek basin.  Other nearby creeks had flooding also, such as Jordan Creek near Falling Rock.A federal disaster declaration for individual and public assistance was declared for 15 counties in West Virginia, 14 of which were in this section of the state.  They included, Kanawha, Clay, Roane, Jackson, Braxton, Calhoun, Wirt, Gilmer, Wood, Pleasants, Ritchie, Doddridge, Lewis, and Taylor.  About 240 dwellings  were destroyed, the most being from Wood, Kanawha, Roane, and Jackson Counties.  Nearly 500 homes had major damage, the most from Kanawha and Ritchie counties.  Around 100 dwelling had minor water damage.  These figures included mobile homes, many of which were located in areas most susceptible to stream flooding.   In Jackson County, the Northern Mobile Home Park, in the northern sections of Ripley, sat at the junction of Syramore Creek with its Left Fork.  About 12 mobile homes were washed into the creek just after dawn on the 28th.  The trailers were smashed against the Route 21 bridge, about 50 yards down the stream.  All total, 21 of the 23 trailers at this mobile home park were destroyed.   Luckily, everyone escaped uninjured.  One resident found only one item from their destroyed mobile home.  It was a book, describing the West Virginia flood of 1985.   Near Interstate 77, east of Ravenswood, Straight Fork heavily damaged Abels Mobile Home Park.  Along the Left Fork of Sandy Creek, the Dewey Thomas Hill Bridge was destroyed.  The 100 year old steel bridge washed into the stream, leaving only its concrete supports.  Further down the creek near Odaville, the Sarvis Fork Covered Bridge passed the test of time.  The high water mark was some 3 to 4 feet on the upstream outer wooden shell.  This bridge survived.  It was built around 1889.   The Lockhart Church, near the Route 21 and Medina Road intersection, had 4.5 to 5 feet of water inside.  The crest was even over the podium that was on the stage.   Local lifelong residents of the upper reaches of the Left Fork of Sandy Creek said it was the highest water levels they have ever seen.  One man was 89 years old.  Another man had accounts passed down to him of the famous 1889 cloudburst.  He said the water was even higher in 1889.    In Wood County, Neal Run destroyed about 50 mobile homes in 2 trailer parks in South Parkersburg on the morning of the 28th.  One resident said, ""It was unreal how fast the water came up.""  Little Tygart Creek caused severe flooding just south of Mineralwells, including the Lincolnshire development and Slate Creek Village.  Along Lee Creek, a mobile home with 2 occupants was washed downstream, until becoming lodged in trees.  The occupants escaped uninjured.  Stillwell and Pond Creeks also had significant flooding in Wood County.Besides the fatal flash flood along Little Sandy Creek in Kanawha County, the small streams feeding the Pocatalico River near Sissonville flooded on Sunday morning, the 28th.  People were rescued by boat.  This included the Haines Branch region.   The river at Sissonville rose some 25 feet between 1100E and 1500E on the 28th from the rains early Sunday morning.  As the small streams were starting to recede, and the Pocatalico River was starting to crest out, the third night of convection started during Sunday evening, the 28th.  The rain maximum this third night was in southern Roane to southern Jackson County. This caused more small stream flooding and resulted in a record crest of 35.5 feet on the Pocatalico River around 1000E on Monday the 29th.  The Sissonville Middle School had 2 feet of water in the library.    In Ritchie County, after the initial flash flood near Cairo Friday night, more flash flooding occurred.  Bunnell Run flooded Pennsboro, about 50 people had to be evacuated.  Two manufactured homes  were destroyed, and 6 homes had major damage in Pennsboro.  One resident said, ""It has never been like this.  My whole house was flooded.  Everything I have is ruined.""  The Pennsboro Fire Chief said, ""There was no time to do anything.  Some of my men didn't even make it out of their homes when the water hit. "" A Pontiac car dealership in Pennsboro had several cars flooded.In Roane County, most of the severe flooding was from the Cicerone-Kettle area on toward Cotton.  One house on Green Creek was swept away, prompting the emergency director to say, ""It must have been some force, because it took everything and there was nothing left but the ground.""In Gilmer County, Normantown had homes and businesses flooded by Steer Creek.  Private bridges were destroyed.  In Wirt County, a small bridge was washed out near Elizabeth.In Doddridge and Pleasant County, after the initial small stream flooding, high water lingered along the  Middle Island Creek.  People were evacuated from Arvilla of Pleasants County.  The Pricetown firehouse was flooded by Polk Creek.  Prolong power outages occurred in Wirt, Doddridge, Tyler, Pleasants, Ritchie, and Pocahontas Counties.    In the aftermath of the small stream flooding, only minor river flooding occurred.  The West Fork River crested about 3 to 4 feet above flood stage on the forecast point near Clarksburg.  The level was 16.5 feet.  Flooding was confined to streets.  On the Ohio River, a crest at or just over flood stage occurred from near Ravenswood on through Point Pleasant.",Fallen trees knocked out the electricity and caused minor damage to a few dwellings.,PDC
