BEGIN_YEARMONTH,BEGIN_DAY,BEGIN_TIME,END_YEARMONTH,END_DAY,END_TIME,EPISODE_ID,EVENT_ID,STATE,STATE_FIPS,YEAR,MONTH_NAME,EVENT_TYPE,CZ_TYPE,CZ_FIPS,CZ_NAME,WFO,BEGIN_DATE_TIME,CZ_TIMEZONE,END_DATE_TIME,INJURIES_DIRECT,INJURIES_INDIRECT,DEATHS_DIRECT,DEATHS_INDIRECT,DAMAGE_PROPERTY,DAMAGE_CROPS,SOURCE,MAGNITUDE,MAGNITUDE_TYPE,FLOOD_CAUSE,CATEGORY,TOR_F_SCALE,TOR_LENGTH,TOR_WIDTH,TOR_OTHER_WFO,TOR_OTHER_CZ_STATE,TOR_OTHER_CZ_FIPS,TOR_OTHER_CZ_NAME,BEGIN_RANGE,BEGIN_AZIMUTH,BEGIN_LOCATION,END_RANGE,END_AZIMUTH,END_LOCATION,BEGIN_LAT,BEGIN_LON,END_LAT,END_LON,EPISODE_NARRATIVE,EVENT_NARRATIVE,DATA_SOURCE
200107,11,1520,200107,11,1520,1118810,5256696,ALABAMA,1,2001,July,Thunderstorm Wind,C,69,HOUSTON,TAE,11-JUL-01 15:20:00,EST,11-JUL-01 15:20:00,0,0,0,0,5K,,EMERGENCY MANAGER,,,,,,,,,,,,,,WICKSBURG,,,WICKSBURG,31.2,-85.63333,31.2,-85.63333,,Trees and power lines down.  Reported by the Houston County EMA.,PDS
200107,5,1430,200107,5,1445,1119220,5257136,ALABAMA,1,2001,July,Thunderstorm Wind,C,15,CALHOUN,BMX,05-JUL-01 14:30:00,CST,05-JUL-01 14:45:00,0,0,0,0,5K,0K,EMERGENCY MANAGER,55,E,,,,,,,,,,,,COUNTYWIDE,,,COUNTYWIDE,33.8,-85.81667,33.8,-85.81667,"A line of severe thunderstorms entered northern Alabama just after noon CDT and moved through mainly the eastern two thirds of north and central Alabama.  The storms exited southeast Alabama just after 6 pm CDT.  Severe Thunderstorm Warnings were issued for 27 separate counties with a total of 31 Severe Thunderstorm Warnings issued during the event.  During each of the 31 Severe Thunderstorm Warnings, damaging wind gusts occurred.  Numerous trees and power lines were blown down across north and central Alabama.  Several locations received more concentrated damage than others, but generally the damage occurred in a sporadic manner where varying storm intensity concentrated  higher wind gusts.  No injuries were reported during this event with respect to the wind damage.",,PDS
200107,5,1515,200107,5,1530,1119220,5257134,ALABAMA,1,2001,July,Thunderstorm Wind,C,7,BIBB,BMX,05-JUL-01 15:15:00,CST,05-JUL-01 15:30:00,0,0,0,0,2K,0K,EMERGENCY MANAGER,55,E,,,,,,,,,,,,COUNTYWIDE,,,COUNTYWIDE,33,-87.1,33,-87.1,"A line of severe thunderstorms entered northern Alabama just after noon CDT and moved through mainly the eastern two thirds of north and central Alabama.  The storms exited southeast Alabama just after 6 pm CDT.  Severe Thunderstorm Warnings were issued for 27 separate counties with a total of 31 Severe Thunderstorm Warnings issued during the event.  During each of the 31 Severe Thunderstorm Warnings, damaging wind gusts occurred.  Numerous trees and power lines were blown down across north and central Alabama.  Several locations received more concentrated damage than others, but generally the damage occurred in a sporadic manner where varying storm intensity concentrated  higher wind gusts.  No injuries were reported during this event with respect to the wind damage.",,PDS
200107,10,1540,200107,10,1540,1119231,5257248,ALABAMA,1,2001,July,Thunderstorm Wind,C,43,CULLMAN,BMX,10-JUL-01 15:40:00,CST,10-JUL-01 15:40:00,0,0,0,0,2K,0K,EMERGENCY MANAGER,50,E,,,,,,,,,,,,CULLMAN,,,CULLMAN,34.18333,-86.83333,34.18333,-86.83333,,Trees were blown down just west and southwest of the city of Cullman.  Some trees were also knocked down near Holly Pond.,PDS
200107,10,1600,200107,10,1600,1119232,5257249,ALABAMA,1,2001,July,Thunderstorm Wind,C,19,CHEROKEE,BMX,10-JUL-01 16:00:00,CST,10-JUL-01 16:00:00,0,0,0,0,1K,0K,TRAINED SPOTTER,50,E,,,,,,,,,,,,LEESBURG,,,LEESBURG,34.18333,-85.75,34.18333,-85.75,,Trees were blown down in Leesburg.,PDS
200107,10,1550,200107,10,1612,1119233,5257250,ALABAMA,1,2001,July,Thunderstorm Wind,C,9,BLOUNT,BMX,10-JUL-01 15:50:00,CST,10-JUL-01 16:12:00,0,0,0,0,2K,0K,EMERGENCY MANAGER,50,E,,,,,,,,,,,,COUNTYWIDE,,,COUNTYWIDE,34,-86.56667,34,-86.56667,,A few trees were blown down throughout the entire county.,PDS
200107,10,1700,200107,10,1700,1119234,5257251,ALABAMA,1,2001,July,Hail,C,81,LEE,BMX,10-JUL-01 17:00:00,CST,10-JUL-01 17:00:00,0,0,0,0,0K,0K,LAW ENFORCEMENT,1.00,,,,,,,,,,,,,LOACHAPOKA,,,LOACHAPOKA,32.6,-85.58333,32.6,-85.58333,,Quarter size hail was reported in western Lee County near Loachapoka.,PDS
200104,29,1720,200104,29,1720,1119235,5257252,ALABAMA,1,2001,April,Thunderstorm Wind,C,55,ETOWAH,BMX,29-APR-01 17:20:00,CST,29-APR-01 17:20:00,0,0,0,0,70K,0K,INSURANCE COMPANY,50,E,,,,,,,,,,,,GADSDEN,,,GADSDEN,34.01667,-86.01667,34.01667,-86.01667,,Wind from a thunderstorm damaged the side of an apartment building on Forest Avenue ripping siding material away.  Flying debris also damaged a car.,PDS
200107,5,1300,200107,5,1400,1119224,5257240,ALABAMA,1,2001,July,Flash Flood,C,103,MORGAN,BMX,05-JUL-01 13:00:00,CST,05-JUL-01 14:00:00,0,0,0,0,3K,0K,EMERGENCY MANAGER,,,,,,,,,,,,,,COUNTYWIDE,,,COUNTYWIDE,,,,,,Very heavy rainfall in a short period of time covered many roads with high water.  This water made many roads temporarily impassable.,PDS
200107,5,1400,200107,5,1500,1119225,5257241,ALABAMA,1,2001,July,Flash Flood,C,127,WALKER,BMX,05-JUL-01 14:00:00,CST,05-JUL-01 15:00:00,0,0,0,0,3K,0K,EMERGENCY MANAGER,,,,,,,,,,,,,,CORDOVA,,,CORDOVA,,,,,,Several roads were covered with water and temporarily impassable in and around the city of Cordova.,PDS
200107,9,1835,200107,9,1835,1119226,5257242,ALABAMA,1,2001,July,Thunderstorm Wind,C,43,CULLMAN,BMX,09-JUL-01 18:35:00,CST,09-JUL-01 18:35:00,0,0,0,0,5K,0K,EMERGENCY MANAGER,50,E,,,,,,,,,,7,E,VINEMONT,7,E,VINEMONT,34.25,-86.75,34.25,-86.75,,Several trees were blown down in the Gold Ridge community.  One residence had minor roof damage.,PDS
200107,9,1840,200107,9,1840,1119226,5257243,ALABAMA,1,2001,July,Thunderstorm Wind,C,43,CULLMAN,BMX,09-JUL-01 18:40:00,CST,09-JUL-01 18:40:00,0,0,0,0,2K,0K,EMERGENCY MANAGER,50,E,,,,,,,,,,,,FAIRVIEW,,,FAIRVIEW,34.25,-86.68333,34.25,-86.68333,,A few power lines were knocked down in Fairview.,PDS
200107,9,1820,200107,9,1840,1119227,5257244,ALABAMA,1,2001,July,Thunderstorm Wind,C,55,ETOWAH,BMX,09-JUL-01 18:20:00,CST,09-JUL-01 18:40:00,0,0,0,0,4K,0K,EMERGENCY MANAGER,50,E,,,,,,,,,,,,COUNTYWIDE,,,COUNTYWIDE,34.03333,-86,34.03333,-86,,"Numerous trees and power lines were blown down across the county.  The most significant damage occurred in Gadsden, Rainbow City, and Southside.",PDS
200107,9,1900,200107,9,1900,1119228,5257245,ALABAMA,1,2001,July,Thunderstorm Wind,C,15,CALHOUN,BMX,09-JUL-01 19:00:00,CST,09-JUL-01 19:00:00,0,0,0,0,2K,0K,GOVT OFFICIAL,50,E,,,,,,,,,,,,JACKSONVILLE,,,JACKSONVILLE,33.81667,-85.76667,33.81667,-85.76667,,Trees were knocked down along Roy Webb Road in Jacksonville.,PDS
200107,10,1500,200107,10,1500,1119229,5257246,ALABAMA,1,2001,July,Thunderstorm Wind,C,43,CULLMAN,BMX,10-JUL-01 15:00:00,CST,10-JUL-01 15:00:00,0,0,0,0,1K,0K,EMERGENCY MANAGER,50,E,,,,,,,,,,,,VINEMONT,,,VINEMONT,34.25,-86.86667,34.25,-86.86667,,Trees were blown down across US 31 near Vinemont.,PDS
200107,5,1145,200107,5,1215,1119220,5257143,ALABAMA,1,2001,July,Thunderstorm Wind,C,71,JACKSON,BMX,05-JUL-01 11:45:00,CST,05-JUL-01 12:15:00,0,0,0,0,2K,0K,EMERGENCY MANAGER,55,E,,,,,,,,,,,,COUNTYWIDE,,,COUNTYWIDE,34.71667,-85.96667,34.71667,-85.96667,"A line of severe thunderstorms entered northern Alabama just after noon CDT and moved through mainly the eastern two thirds of north and central Alabama.  The storms exited southeast Alabama just after 6 pm CDT.  Severe Thunderstorm Warnings were issued for 27 separate counties with a total of 31 Severe Thunderstorm Warnings issued during the event.  During each of the 31 Severe Thunderstorm Warnings, damaging wind gusts occurred.  Numerous trees and power lines were blown down across north and central Alabama.  Several locations received more concentrated damage than others, but generally the damage occurred in a sporadic manner where varying storm intensity concentrated  higher wind gusts.  No injuries were reported during this event with respect to the wind damage.",,PDS
200107,5,1415,200107,5,1435,1119220,5257144,ALABAMA,1,2001,July,Thunderstorm Wind,C,73,JEFFERSON,BMX,05-JUL-01 14:15:00,CST,05-JUL-01 14:35:00,0,0,0,0,15K,0K,EMERGENCY MANAGER,55,E,,,,,,,,,,,,COUNTYWIDE,,,COUNTYWIDE,33.56667,-87.88333,33.56667,-87.88333,"A line of severe thunderstorms entered northern Alabama just after noon CDT and moved through mainly the eastern two thirds of north and central Alabama.  The storms exited southeast Alabama just after 6 pm CDT.  Severe Thunderstorm Warnings were issued for 27 separate counties with a total of 31 Severe Thunderstorm Warnings issued during the event.  During each of the 31 Severe Thunderstorm Warnings, damaging wind gusts occurred.  Numerous trees and power lines were blown down across north and central Alabama.  Several locations received more concentrated damage than others, but generally the damage occurred in a sporadic manner where varying storm intensity concentrated  higher wind gusts.  No injuries were reported during this event with respect to the wind damage.",,PDS
200107,21,1745,200107,21,1745,1119236,5257253,ALABAMA,1,2001,July,Lightning,C,73,JEFFERSON,BMX,21-JUL-01 17:45:00,CST,21-JUL-01 17:45:00,0,0,0,0,150K,0K,NEWSPAPER,,,,,,,,,,,,,,BIRMINGHAM,,,BIRMINGHAM,,,,,,Lightning was believed the cause of a fire at St. Francis Xavier Church off Montclair Road in Birmingham.  A lightning bolt apparently struck the church at 6:45 pm CDT during a wedding rehearsal starting the fire which went undetected for some minutes.  One fire fighter was injured fighting the ensuing fire which did signifcant damage to the church building.,PDS
200107,20,1720,200107,20,1720,1119237,5257254,ALABAMA,1,2001,July,Thunderstorm Wind,C,73,JEFFERSON,BMX,20-JUL-01 17:20:00,CST,20-JUL-01 17:20:00,0,0,0,0,10K,0K,LAW ENFORCEMENT,50,E,,,,,,,,,,,,HOMEWOOD,,,HOMEWOOD,33.48333,-86.76667,33.48333,-86.76667,,A few trees were blown down in the city of Homewood.  One large tree fell onto an automobile and severely damaged it.  Other trees fell and temporarily blocked roadways.,PDS
200107,5,1145,200107,5,1230,1119220,5257145,ALABAMA,1,2001,July,Thunderstorm Wind,C,77,LAUDERDALE,BMX,05-JUL-01 11:45:00,CST,05-JUL-01 12:30:00,0,0,0,0,5K,0K,EMERGENCY MANAGER,55,E,,,,,,,,,,,,COUNTYWIDE,,,COUNTYWIDE,34.9,-87.68333,34.9,-87.68333,"A line of severe thunderstorms entered northern Alabama just after noon CDT and moved through mainly the eastern two thirds of north and central Alabama.  The storms exited southeast Alabama just after 6 pm CDT.  Severe Thunderstorm Warnings were issued for 27 separate counties with a total of 31 Severe Thunderstorm Warnings issued during the event.  During each of the 31 Severe Thunderstorm Warnings, damaging wind gusts occurred.  Numerous trees and power lines were blown down across north and central Alabama.  Several locations received more concentrated damage than others, but generally the damage occurred in a sporadic manner where varying storm intensity concentrated  higher wind gusts.  No injuries were reported during this event with respect to the wind damage.",,PDS
200107,5,1450,200107,5,1510,1119220,5257157,ALABAMA,1,2001,July,Thunderstorm Wind,C,125,TUSCALOOSA,BMX,05-JUL-01 14:50:00,CST,05-JUL-01 15:10:00,0,0,0,0,4K,0K,EMERGENCY MANAGER,55,E,,,,,,,,,,,,COUNTYWIDE,,,COUNTYWIDE,33.3,-87.53333,33.3,-87.53333,"A line of severe thunderstorms entered northern Alabama just after noon CDT and moved through mainly the eastern two thirds of north and central Alabama.  The storms exited southeast Alabama just after 6 pm CDT.  Severe Thunderstorm Warnings were issued for 27 separate counties with a total of 31 Severe Thunderstorm Warnings issued during the event.  During each of the 31 Severe Thunderstorm Warnings, damaging wind gusts occurred.  Numerous trees and power lines were blown down across north and central Alabama.  Several locations received more concentrated damage than others, but generally the damage occurred in a sporadic manner where varying storm intensity concentrated  higher wind gusts.  No injuries were reported during this event with respect to the wind damage.",,PDS
200107,5,1240,200107,5,1300,1119220,5257146,ALABAMA,1,2001,July,Thunderstorm Wind,C,79,LAWRENCE,BMX,05-JUL-01 12:40:00,CST,05-JUL-01 13:00:00,0,0,0,0,5K,0K,EMERGENCY MANAGER,55,E,,,,,,,,,,,,COUNTYWIDE,,,COUNTYWIDE,34.55,-87.31667,34.55,-87.31667,"A line of severe thunderstorms entered northern Alabama just after noon CDT and moved through mainly the eastern two thirds of north and central Alabama.  The storms exited southeast Alabama just after 6 pm CDT.  Severe Thunderstorm Warnings were issued for 27 separate counties with a total of 31 Severe Thunderstorm Warnings issued during the event.  During each of the 31 Severe Thunderstorm Warnings, damaging wind gusts occurred.  Numerous trees and power lines were blown down across north and central Alabama.  Several locations received more concentrated damage than others, but generally the damage occurred in a sporadic manner where varying storm intensity concentrated  higher wind gusts.  No injuries were reported during this event with respect to the wind damage.",,PDS
200107,5,1625,200107,5,1650,1119220,5257147,ALABAMA,1,2001,July,Thunderstorm Wind,C,81,LEE,BMX,05-JUL-01 16:25:00,CST,05-JUL-01 16:50:00,0,0,0,0,2K,0K,EMERGENCY MANAGER,55,E,,,,,,,,,,,,COUNTYWIDE,,,COUNTYWIDE,32.58333,-85.35,32.58333,-85.35,"A line of severe thunderstorms entered northern Alabama just after noon CDT and moved through mainly the eastern two thirds of north and central Alabama.  The storms exited southeast Alabama just after 6 pm CDT.  Severe Thunderstorm Warnings were issued for 27 separate counties with a total of 31 Severe Thunderstorm Warnings issued during the event.  During each of the 31 Severe Thunderstorm Warnings, damaging wind gusts occurred.  Numerous trees and power lines were blown down across north and central Alabama.  Several locations received more concentrated damage than others, but generally the damage occurred in a sporadic manner where varying storm intensity concentrated  higher wind gusts.  No injuries were reported during this event with respect to the wind damage.",,PDS
200107,5,1120,200107,5,1200,1119220,5257148,ALABAMA,1,2001,July,Thunderstorm Wind,C,83,LIMESTONE,BMX,05-JUL-01 11:20:00,CST,05-JUL-01 12:00:00,0,0,0,0,6K,0K,EMERGENCY MANAGER,55,E,,,,,,,,,,,,COUNTYWIDE,,,COUNTYWIDE,34.75,-87.01667,34.75,-87.01667,"A line of severe thunderstorms entered northern Alabama just after noon CDT and moved through mainly the eastern two thirds of north and central Alabama.  The storms exited southeast Alabama just after 6 pm CDT.  Severe Thunderstorm Warnings were issued for 27 separate counties with a total of 31 Severe Thunderstorm Warnings issued during the event.  During each of the 31 Severe Thunderstorm Warnings, damaging wind gusts occurred.  Numerous trees and power lines were blown down across north and central Alabama.  Several locations received more concentrated damage than others, but generally the damage occurred in a sporadic manner where varying storm intensity concentrated  higher wind gusts.  No injuries were reported during this event with respect to the wind damage.",,PDS
200106,3,1255,200106,3,1300,1116159,5250200,ALABAMA,1,2001,June,Hail,C,9,BLOUNT,BMX,03-JUN-01 12:55:00,CST,03-JUN-01 13:00:00,0,0,0,0,0K,0K,GENERAL PUBLIC,0.75,,,,,,,,,,,,,HAYDEN,,,HAYDEN,33.88333,-86.76667,33.81667,-86.6,,Several reports were received of up to dime size hail from Hayden to Remlap.,PDS
200106,26,1515,200106,26,1515,1116197,5251746,ALABAMA,1,2001,June,Hail,C,89,MADISON,BMX,26-JUN-01 15:15:00,CST,26-JUN-01 15:15:00,0,0,0,0,0K,0K,EMERGENCY MANAGER,0.75,,,,,,,,,,,10,S,HUNTSVILLE,10,S,HUNTSVILLE,34.58333,-86.61667,34.58333,-86.61667,,Dime size hail was observed 10 miles south of Huntsville.,PDS
200106,26,1615,200106,26,1615,1116198,5251747,ALABAMA,1,2001,June,Hail,C,65,HALE,BMX,26-JUN-01 16:15:00,CST,26-JUN-01 16:15:00,0,0,0,0,0K,0K,GENERAL PUBLIC,0.75,,,,,,,,,,,,,AKRON,,,AKRON,32.86667,-87.73333,32.86667,-87.73333,,Dime size hail fell in the city of Akron.  Numerous large tree limbs were also snapped off during this storm.,PDS
200106,26,1625,200106,26,1625,1116199,5251748,ALABAMA,1,2001,June,Hail,C,119,SUMTER,BMX,26-JUN-01 16:25:00,CST,26-JUN-01 16:25:00,0,0,0,0,0K,0K,GENERAL PUBLIC,0.75,,,,,,,,,,,,,WARSAW,,,WARSAW,32.93333,-88.2,32.93333,-88.2,,Dime size hail was reported near Warsaw.,PDS
200107,5,1445,200107,5,1500,1119220,5257155,ALABAMA,1,2001,July,Thunderstorm Wind,C,121,TALLADEGA,BMX,05-JUL-01 14:45:00,CST,05-JUL-01 15:00:00,0,0,0,0,2K,0K,EMERGENCY MANAGER,55,E,,,,,,,,,,,,COUNTYWIDE,,,COUNTYWIDE,33.38333,-86.15,33.38333,-86.15,"A line of severe thunderstorms entered northern Alabama just after noon CDT and moved through mainly the eastern two thirds of north and central Alabama.  The storms exited southeast Alabama just after 6 pm CDT.  Severe Thunderstorm Warnings were issued for 27 separate counties with a total of 31 Severe Thunderstorm Warnings issued during the event.  During each of the 31 Severe Thunderstorm Warnings, damaging wind gusts occurred.  Numerous trees and power lines were blown down across north and central Alabama.  Several locations received more concentrated damage than others, but generally the damage occurred in a sporadic manner where varying storm intensity concentrated  higher wind gusts.  No injuries were reported during this event with respect to the wind damage.",,PDS
200107,5,1545,200107,5,1610,1119220,5257156,ALABAMA,1,2001,July,Thunderstorm Wind,C,123,TALLAPOOSA,BMX,05-JUL-01 15:45:00,CST,05-JUL-01 16:10:00,0,0,0,0,4K,0K,EMERGENCY MANAGER,55,E,,,,,,,,,,,,COUNTYWIDE,,,COUNTYWIDE,32.8,-85.85,32.8,-85.85,"A line of severe thunderstorms entered northern Alabama just after noon CDT and moved through mainly the eastern two thirds of north and central Alabama.  The storms exited southeast Alabama just after 6 pm CDT.  Severe Thunderstorm Warnings were issued for 27 separate counties with a total of 31 Severe Thunderstorm Warnings issued during the event.  During each of the 31 Severe Thunderstorm Warnings, damaging wind gusts occurred.  Numerous trees and power lines were blown down across north and central Alabama.  Several locations received more concentrated damage than others, but generally the damage occurred in a sporadic manner where varying storm intensity concentrated  higher wind gusts.  No injuries were reported during this event with respect to the wind damage.",,PDS
200106,28,1310,200106,28,1310,1116209,5251759,ALABAMA,1,2001,June,Hail,C,101,MONTGOMERY,BMX,28-JUN-01 13:10:00,CST,28-JUN-01 13:10:00,0,0,0,0,0K,0K,TRAINED SPOTTER,0.88,,,,,,,,,,,,,MONTGOMERY,,,MONTGOMERY,32.38333,-86.3,32.38333,-86.3,,Nickel size hail was reported in the eastern part of Montgomery.,PDS
200106,22,1630,200106,22,1630,1116444,5251692,ALABAMA,1,2001,June,Lightning,C,129,WASHINGTON,MOB,22-JUN-01 16:30:00,CST,22-JUN-01 16:30:00,1,0,0,0,,,EMERGENCY MANAGER,,,,,,,,,,,,,,TIBBIE,,,TIBBIE,,,,,,Lightning indirectly struck a woman while she was standing on the back porch of her home during a thunderstorm.   The woman was not hospitalized as she was checked by emergency medical personnel at the scene and declared to be not significantly injured.,PDS
200106,19,1500,200106,19,1510,1116445,5251693,ALABAMA,1,2001,June,Thunderstorm Wind,C,131,WILCOX,MOB,19-JUN-01 15:00:00,CST,19-JUN-01 15:10:00,0,0,0,0,30K,,NEWSPAPER,60,E,,,,,,,,,,,,CAMDEN,,,CAMDEN,31.98333,-87.28333,31.98333,-87.28333,,"Trees were blown down and some roofs of houses were damaged, mainly due to falling trees,  as strong thunderstorms moved through the area.   A roof was also peeled off a larger building in the downtown area.",PDS
200106,4,1430,200106,4,1435,1116160,5250201,ALABAMA,1,2001,June,Thunderstorm Wind,C,51,ELMORE,BMX,04-JUN-01 14:30:00,CST,04-JUN-01 14:35:00,0,0,0,0,1K,0K,EMERGENCY MANAGER,50,E,,,,,,,,,,4,S,WETUMPKA,4,S,WETUMPKA,32.5,-86.21667,32.5,-86.21667,Dime size hail was reported in southern Elmore County around Wetumpka.  A few trees were also blown down in the southern part of the county near Wetumpka.,,PDS
200106,3,1300,200106,3,1300,1116145,5250184,ALABAMA,1,2001,June,Hail,C,57,FAYETTE,BMX,03-JUN-01 13:00:00,CST,03-JUN-01 13:00:00,0,0,0,0,0K,0K,EMERGENCY MANAGER,0.75,,,,,,,,,,,,,FAYETTE,,,FAYETTE,33.68333,-87.83333,33.68333,-87.83333,,Dime size hail was observed just south of Fayette.,PDS
200106,3,1325,200106,3,1340,1116146,5250185,ALABAMA,1,2001,June,Hail,C,15,CALHOUN,BMX,03-JUN-01 13:25:00,CST,03-JUN-01 13:40:00,0,0,0,0,3K,0K,EMERGENCY MANAGER,1.75,,,,,,,,,,,,,DUKE,,,DUKE,33.83333,-85.9,33.83333,-85.9,,Nickel to golf ball size hail was reported on SR 204 in and near Duke.  A funnel cloud was also reported with this storm.,PDS
200106,3,1340,200106,3,1340,1116147,5250186,ALABAMA,1,2001,June,Hail,C,43,CULLMAN,BMX,03-JUN-01 13:40:00,CST,03-JUN-01 13:40:00,0,0,0,0,0K,0K,EMERGENCY MANAGER,0.88,,,,,,,,,,,,,WEST PT,,,WEST PT,34.23333,-86.95,34.23333,-86.95,,Nickel size hail was observed in northern Cullman County near West Point and near Battleground.,PDS
200106,3,1340,200106,3,1400,1116148,5250187,ALABAMA,1,2001,June,Hail,C,17,CHAMBERS,BMX,03-JUN-01 13:40:00,CST,03-JUN-01 14:00:00,0,0,0,0,0K,0K,LAW ENFORCEMENT,0.75,,,,,,,,,,,5,W,LAFAYETTE,5,W,LAFAYETTE,32.9,-85.46667,32.88333,-85.18333,,Dime size hail fell from just west of Lafayette to Lanett.,PDS
200106,3,1410,200106,3,1410,1116149,5250188,ALABAMA,1,2001,June,Thunderstorm Wind,C,73,JEFFERSON,BMX,03-JUN-01 14:10:00,CST,03-JUN-01 14:10:00,0,0,0,0,4K,0K,LAW ENFORCEMENT,50,E,,,,,,,,,,,,WARRIOR,,,WARRIOR,33.81667,-86.81667,33.81667,-86.81667,,Trees and power lines were blown down in Warrior.,PDS
200106,3,1411,200106,3,1411,1116150,5250189,ALABAMA,1,2001,June,Hail,C,127,WALKER,BMX,03-JUN-01 14:11:00,CST,03-JUN-01 14:11:00,0,0,0,0,0K,0K,EMERGENCY MANAGER,0.88,,,,,,,,,,,,,JASPER,,,JASPER,33.83333,-87.28333,33.83333,-87.28333,,Nickel size hail fell just north of Jasper.,PDS
200106,26,2142,200106,26,2142,1116208,5251758,ALABAMA,1,2001,June,Hail,C,89,MADISON,BMX,26-JUN-01 21:42:00,CST,26-JUN-01 21:42:00,0,0,0,0,0K,0K,FIRE DEPT/RESCUE SQUAD,0.75,,,,,,,,,,,,,OWENS XRDS,,,OWENS XRDS,34.58333,-86.46667,34.58333,-86.46667,,Dime size hail fell in the Owens Crossroads area.,PDS
200106,26,1836,200106,26,1836,1116203,5251752,ALABAMA,1,2001,June,Hail,C,73,JEFFERSON,BMX,26-JUN-01 18:36:00,CST,26-JUN-01 18:36:00,0,0,0,0,2K,0K,GENERAL PUBLIC,1.75,,,,,,,,,,,7,NNE,OAK GROVE,7,NNE,OAK GROVE,33.55,-87.1,33.55,-87.1,,Quarter to golf ball size hail was reported between Sylvan Springs and Birmingport.  The hail fell mainly across rural western Jefferson County.,PDS
200106,26,1849,200106,26,1849,1116203,5251753,ALABAMA,1,2001,June,Hail,C,73,JEFFERSON,BMX,26-JUN-01 18:49:00,CST,26-JUN-01 18:49:00,0,0,0,0,3K,0K,TRAINED SPOTTER,1.75,,,,,,,,,,,,,GRAYSVILLE,,,GRAYSVILLE,33.63333,-86.96667,33.63333,-86.96667,,Quarter to golf ball size hail was observed in Graysville.  Fifty-three (53) mph wind gusts were measured at an amateur weather station.,PDS
200106,26,1858,200106,26,1858,1116204,5251754,ALABAMA,1,2001,June,Hail,C,73,JEFFERSON,BMX,26-JUN-01 18:58:00,CST,26-JUN-01 18:58:00,0,0,0,0,0K,0K,TRAINED SPOTTER,0.75,,,,,,,,,,,,,LIPSCOMB,,,LIPSCOMB,33.4,-86.93333,33.4,-86.93333,,Dime size hail fell near Lipscomb.,PDS
200106,26,1615,200106,26,1615,1116205,5251755,ALABAMA,1,2001,June,Lightning,C,133,WINSTON,BMX,26-JUN-01 16:15:00,CST,26-JUN-01 16:15:00,0,0,0,0,4K,0K,EMERGENCY MANAGER,,,,,,,,,,,,,,DOUBLE SPGS,,,DOUBLE SPGS,,,,,,Four cows were killed by a lightning strike near Double Springs.,PDS
200106,26,1907,200106,26,1907,1116206,5251756,ALABAMA,1,2001,June,Hail,C,73,JEFFERSON,BMX,26-JUN-01 19:07:00,CST,26-JUN-01 19:07:00,0,0,0,0,0K,0K,TRAINED SPOTTER,0.88,,,,,,,,,,,,,MOUNTAIN BROOK,,,MOUNTAIN BROOK,33.5,-86.75,33.5,-86.75,,Nickel size hail was reported near Brookwood Mall.,PDS
200106,26,1930,200106,26,1930,1116207,5251757,ALABAMA,1,2001,June,Hail,C,73,JEFFERSON,BMX,26-JUN-01 19:30:00,CST,26-JUN-01 19:30:00,0,0,0,0,0K,0K,LAW ENFORCEMENT,0.75,,,,,,,,,,,,,MOUNTAIN BROOK,,,MOUNTAIN BROOK,33.5,-86.75,33.5,-86.75,,Dime size hail was observed near Fire Station #2 on Overton Road.,PDS
200106,26,1636,200106,26,1636,1116200,5251749,ALABAMA,1,2001,June,Hail,C,133,WINSTON,BMX,26-JUN-01 16:36:00,CST,26-JUN-01 16:36:00,0,0,0,0,0K,0K,EMERGENCY MANAGER,0.88,,,,,,,,,,,6,S,DOUBLE SPGS,6,S,DOUBLE SPGS,34.06667,-87.4,34.06667,-87.4,,Dime to nickel size hail was observed just south of Double Springs.,PDS
200106,26,1615,200106,26,1615,1116201,5251750,ALABAMA,1,2001,June,Hail,C,71,JACKSON,BMX,26-JUN-01 16:15:00,CST,26-JUN-01 16:15:00,0,0,0,0,0K,0K,OFFICIAL NWS OBS.,1.00,,,,,,,,,,,,,HOLLYTREE,,,HOLLYTREE,34.8,-86.25,34.8,-86.25,,Dime to quarter size hail fell in the Hollytree area.,PDS
200106,26,1733,200106,26,1733,1116202,5251751,ALABAMA,1,2001,June,Hail,C,107,PICKENS,BMX,26-JUN-01 17:33:00,CST,26-JUN-01 17:33:00,0,0,0,0,0K,0K,LAW ENFORCEMENT,0.88,,,,,,,,,,,,,CARROLLTON,,,CARROLLTON,33.26667,-88.1,33.26667,-88.1,,Nickel size hail was reported in Carrollton.,PDS
200106,4,1430,200106,4,1435,1116160,5250202,ALABAMA,1,2001,June,Hail,C,51,ELMORE,BMX,04-JUN-01 14:30:00,CST,04-JUN-01 14:35:00,0,0,0,0,0K,0K,EMERGENCY MANAGER,0.75,,,,,,,,,,,,,WETUMPKA,,,WETUMPKA,32.55,-86.21667,32.55,-86.21667,Dime size hail was reported in southern Elmore County around Wetumpka.  A few trees were also blown down in the southern part of the county near Wetumpka.,,PDS
200106,4,1330,200106,4,1330,1116161,5250203,ALABAMA,1,2001,June,Thunderstorm Wind,C,1,AUTAUGA,BMX,04-JUN-01 13:30:00,CST,04-JUN-01 13:30:00,0,0,0,0,1K,0K,POST OFFICE,50,E,,,,,,,,,,,,MARBURY,,,MARBURY,32.7,-86.48333,32.7,-86.48333,,A few trees were knocked down near Marbury.,PDS
