BEGIN_YEARMONTH,BEGIN_DAY,BEGIN_TIME,END_YEARMONTH,END_DAY,END_TIME,EPISODE_ID,EVENT_ID,STATE,STATE_FIPS,YEAR,MONTH_NAME,EVENT_TYPE,CZ_TYPE,CZ_FIPS,CZ_NAME,WFO,BEGIN_DATE_TIME,CZ_TIMEZONE,END_DATE_TIME,INJURIES_DIRECT,INJURIES_INDIRECT,DEATHS_DIRECT,DEATHS_INDIRECT,DAMAGE_PROPERTY,DAMAGE_CROPS,SOURCE,MAGNITUDE,MAGNITUDE_TYPE,FLOOD_CAUSE,CATEGORY,TOR_F_SCALE,TOR_LENGTH,TOR_WIDTH,TOR_OTHER_WFO,TOR_OTHER_CZ_STATE,TOR_OTHER_CZ_FIPS,TOR_OTHER_CZ_NAME,BEGIN_RANGE,BEGIN_AZIMUTH,BEGIN_LOCATION,END_RANGE,END_AZIMUTH,END_LOCATION,BEGIN_LAT,BEGIN_LON,END_LAT,END_LON,EPISODE_NARRATIVE,EVENT_NARRATIVE,DATA_SOURCE
200107,5,1730,200107,5,1732,1119591,5259649,ALABAMA,1,2001,July,Thunderstorm Wind,C,23,CHOCTAW,MOB,05-JUL-01 17:30:00,CST,05-JUL-01 17:32:00,0,0,0,0,5K,,EMERGENCY MANAGER,50,E,,,,,,,,,,,,BUTLER,,,BUTLER,32.08333,-88.21667,32.08333,-88.21667,,Several trees were blown down by thunderstorm winds near Butler.,PDS
200107,2,1105,200107,2,1110,1119593,5259651,ALABAMA,1,2001,July,Waterspout,C,3,BALDWIN,MOB,02-JUL-01 11:05:00,CST,02-JUL-01 11:10:00,0,0,0,0,,,EMERGENCY MANAGER,,,,,,,,,,,,,,FAIRHOPE,,,FAIRHOPE,,,,,,"A waterspout was observed over Mobile Bay, east of Fairhope.  The waterspout remained over the Bay and dissipated over the water.",PDS
200107,26,815,200107,26,817,1119594,5259652,ALABAMA,1,2001,July,Waterspout,C,3,BALDWIN,MOB,26-JUL-01 08:15:00,CST,26-JUL-01 08:17:00,0,0,0,0,,,EMERGENCY MANAGER,,,,,,,,,,,,,,ORANGE BEACH,,,ORANGE BEACH,,,,,,A waterspout was observed offshore south of Orange Beach.  The waterspout remained offshore and dissipated over the Gulf.,PDS
200107,20,2115,200107,20,2117,1119595,5259653,ALABAMA,1,2001,July,Hail,C,39,COVINGTON,MOB,20-JUL-01 21:15:00,CST,20-JUL-01 21:17:00,0,0,0,0,,,EMERGENCY MANAGER,0.75,,,,,,,,,,,,,RIVER FALLS,,,RIVER FALLS,31.35,-86.55,31.35,-86.55,,,PDS
200108,6,900,200108,6,2100,1121336,5264135,ALABAMA,1,2001,August,Heavy Rain,C,87,MACON,BMX,06-AUG-01 09:00:00,CST,06-AUG-01 21:00:00,0,0,0,0,0,0K,"AWOS,ASOS,MESONET,ETC",,,,,,,,,,,,,,COUNTYWIDE,,,COUNTYWIDE,,,,,"The remnants of Tropical Storm Barry moved northwestward cutting across the southern and central portions of Alabama.  The center of the remnants moved from Dallas County across Hale, Greene, and Pickens counties.  Heavy rain occurred generally from Troy to Montgomery to the Birmingham area with much of the area getting 1.50 to 3 inches of rain.  Relatively dry conditions in the week before helped to reduce the impact of any heavy rain.  One big impact of the rain was the cancellation of an N'Sync concert scheduled for Legion Field in Birmingham.  The loss from the cancellation of the concert alone was estimated to be $2 million.Wind was not a major factor with the storm as wind gusts in the area peaked out around 35 mph.  Some specific wind gust values included Birmingham with 31 mph, Calera with 29 mph, Montgomery with 39 mph, and Troy with 31 mph.",,PDS
200108,6,900,200108,6,2100,1121336,5264136,ALABAMA,1,2001,August,Heavy Rain,C,101,MONTGOMERY,BMX,06-AUG-01 09:00:00,CST,06-AUG-01 21:00:00,0,0,0,0,0K,0K,"AWOS,ASOS,MESONET,ETC",,,,,,,,,,,,,,COUNTYWIDE,,,COUNTYWIDE,,,,,"The remnants of Tropical Storm Barry moved northwestward cutting across the southern and central portions of Alabama.  The center of the remnants moved from Dallas County across Hale, Greene, and Pickens counties.  Heavy rain occurred generally from Troy to Montgomery to the Birmingham area with much of the area getting 1.50 to 3 inches of rain.  Relatively dry conditions in the week before helped to reduce the impact of any heavy rain.  One big impact of the rain was the cancellation of an N'Sync concert scheduled for Legion Field in Birmingham.  The loss from the cancellation of the concert alone was estimated to be $2 million.Wind was not a major factor with the storm as wind gusts in the area peaked out around 35 mph.  Some specific wind gust values included Birmingham with 31 mph, Calera with 29 mph, Montgomery with 39 mph, and Troy with 31 mph.",,PDS
200107,8,1600,200107,8,1610,1119581,5259556,ALABAMA,1,2001,July,Funnel Cloud,C,129,WASHINGTON,MOB,08-JUL-01 16:00:00,CST,08-JUL-01 16:10:00,0,0,0,0,,,STORM CHASER,,,,,,,,,,,,,,MC INTOSH,,,MC INTOSH,,,,,,A spotter followed a funnel cloud along US Highway 43 from near McIntosh to Sunflower.  The funnel never touched down and no damage was found.,PDS
200107,12,1615,200107,12,1617,1119584,5259559,ALABAMA,1,2001,July,Hail,C,97,MOBILE,MOB,12-JUL-01 16:15:00,CST,12-JUL-01 16:17:00,0,0,0,0,,,GENERAL PUBLIC,1.00,,,,,,,,,,,,,KUSHLA,,,KUSHLA,30.81667,-88.16667,30.81667,-88.16667,,,PDS
200107,12,1700,200107,12,1800,1119585,5259560,ALABAMA,1,2001,July,Flash Flood,C,97,MOBILE,MOB,12-JUL-01 17:00:00,CST,12-JUL-01 18:00:00,0,0,0,0,,,LAW ENFORCEMENT,,,,,,,,,,,,,,CENTRAL PORTION,,,CENTRAL PORTION,,,,,,Heavy rains caused street flooding in the central parts of the county.  Some secondary roads had to be closed near Lott Road and in downtown Mobile.  The streets were closed for about an hour until the rain stopped and the streets drained.  Radar estimated that three to five inches of rain fell in a two hour period.,PDS
200108,10,800,200108,10,1000,1121344,5264218,ALABAMA,1,2001,August,Flash Flood,C,83,LIMESTONE,BMX,10-AUG-01 08:00:00,CST,10-AUG-01 10:00:00,0,0,0,0,12K,0K,NEWSPAPER,,,,,,,,,,,,,,COUNTYWIDE,,,COUNTYWIDE,,,,,,Several roads throughout the county temporarily had two to three feet of water over them.  This flooded several vehicles and made the roads impassable.,PDS
200108,12,1700,200108,12,1900,1121345,5264219,ALABAMA,1,2001,August,Flash Flood,C,89,MADISON,BMX,12-AUG-01 17:00:00,CST,12-AUG-01 19:00:00,0,0,0,0,5K,0K,EMERGENCY MANAGER,,,,,,,,,,,,,,COUNTYWIDE,,,COUNTYWIDE,,,,,,Several roads were temporarily covered by high water and were very hazardous to travel on.  The area mainly affected by the heavy rainfall was just north of Huntsville.,PDS
200108,18,1506,200108,18,1506,1121348,5264223,ALABAMA,1,2001,August,Thunderstorm Wind,C,117,SHELBY,BMX,18-AUG-01 15:06:00,CST,18-AUG-01 15:06:00,0,0,0,0,1K,0K,NWS EMPLOYEE(OFF DUTY),50,E,,,,,,,,,,,,CALERA,,,CALERA,33.1,-86.76667,33.1,-86.76667,,Trees were blown down in the vicinity of the Shelby County Airport.,PDS
200108,18,1530,200108,18,1530,1121349,5264224,ALABAMA,1,2001,August,Thunderstorm Wind,C,111,RANDOLPH,BMX,18-AUG-01 15:30:00,CST,18-AUG-01 15:30:00,0,0,0,0,4K,0K,EMERGENCY MANAGER,55,E,,,,,,,,,,,,WEDOWEE,,,WEDOWEE,33.3,-85.46667,33.3,-85.46667,,The courthouse in Wedowee sustained minor roof damage in the form of shingles being removed.  The power was also interrupted for a few hours.,PDS
200108,19,1700,200108,19,1700,1121350,5264225,ALABAMA,1,2001,August,Thunderstorm Wind,C,75,LAMAR,BMX,19-AUG-01 17:00:00,CST,19-AUG-01 17:00:00,0,0,0,0,1K,0K,LAW ENFORCEMENT,50,E,,,,,,,,,,,,MILLPORT,,,MILLPORT,33.56667,-88.08333,33.56667,-88.08333,,A few trees and power lines were blown down in Millport and also in Kennedy.,PDS
200108,27,1300,200108,27,1300,1121351,5264226,ALABAMA,1,2001,August,Hail,C,77,LAUDERDALE,BMX,27-AUG-01 13:00:00,CST,27-AUG-01 13:00:00,0,0,0,0,0K,0K,EMERGENCY MANAGER,0.88,,,,,,,,,,,,,FLORENCE,,,FLORENCE,34.8,-87.66667,34.8,-87.66667,,Dime to nickel size hail fell in and around the city of Florence.,PDS
200108,27,1306,200108,27,1306,1121351,5264227,ALABAMA,1,2001,August,Thunderstorm Wind,C,77,LAUDERDALE,BMX,27-AUG-01 13:06:00,CST,27-AUG-01 13:06:00,0,0,0,0,5K,0K,EMERGENCY MANAGER,57,E,,,,,,,,,,,,LEXINGTON,,,LEXINGTON,34.96667,-87.36667,34.96667,-87.36667,,Wind gusts were estimated at 60 to 70 miles an hour.  This strong wind blew down a large ham radio antenna.,PDS
200108,27,1307,200108,27,1307,1121352,5264228,ALABAMA,1,2001,August,Thunderstorm Wind,C,33,COLBERT,BMX,27-AUG-01 13:07:00,CST,27-AUG-01 13:07:00,0,0,0,0,2K,0K,EMERGENCY MANAGER,50,E,,,,,,,,,,,,LEIGHTON,,,LEIGHTON,34.7,-87.51667,34.7,-87.51667,Trees were blown down near Leighton.  Nickel size hail was also reported with this storm.,,PDS
200108,27,1307,200108,27,1307,1121352,5264229,ALABAMA,1,2001,August,Hail,C,33,COLBERT,BMX,27-AUG-01 13:07:00,CST,27-AUG-01 13:07:00,0,0,0,0,0K,0K,EMERGENCY MANAGER,0.88,,,,,,,,,,,,,LEIGHTON,,,LEIGHTON,34.7,-87.51667,34.7,-87.51667,Trees were blown down near Leighton.  Nickel size hail was also reported with this storm.,,PDS
200108,6,900,200108,6,2100,1121336,5264133,ALABAMA,1,2001,August,Heavy Rain,C,51,ELMORE,BMX,06-AUG-01 09:00:00,CST,06-AUG-01 21:00:00,0,0,0,0,0,0K,"AWOS,ASOS,MESONET,ETC",,,,,,,,,,,,,,COUNTYWIDE,,,COUNTYWIDE,,,,,"The remnants of Tropical Storm Barry moved northwestward cutting across the southern and central portions of Alabama.  The center of the remnants moved from Dallas County across Hale, Greene, and Pickens counties.  Heavy rain occurred generally from Troy to Montgomery to the Birmingham area with much of the area getting 1.50 to 3 inches of rain.  Relatively dry conditions in the week before helped to reduce the impact of any heavy rain.  One big impact of the rain was the cancellation of an N'Sync concert scheduled for Legion Field in Birmingham.  The loss from the cancellation of the concert alone was estimated to be $2 million.Wind was not a major factor with the storm as wind gusts in the area peaked out around 35 mph.  Some specific wind gust values included Birmingham with 31 mph, Calera with 29 mph, Montgomery with 39 mph, and Troy with 31 mph.",,PDS
200108,6,900,200108,6,2100,1121336,5264131,ALABAMA,1,2001,August,Heavy Rain,C,21,CHILTON,BMX,06-AUG-01 09:00:00,CST,06-AUG-01 21:00:00,0,0,0,0,0,0K,"AWOS,ASOS,MESONET,ETC",,,,,,,,,,,,,,COUNTYWIDE,,,COUNTYWIDE,,,,,"The remnants of Tropical Storm Barry moved northwestward cutting across the southern and central portions of Alabama.  The center of the remnants moved from Dallas County across Hale, Greene, and Pickens counties.  Heavy rain occurred generally from Troy to Montgomery to the Birmingham area with much of the area getting 1.50 to 3 inches of rain.  Relatively dry conditions in the week before helped to reduce the impact of any heavy rain.  One big impact of the rain was the cancellation of an N'Sync concert scheduled for Legion Field in Birmingham.  The loss from the cancellation of the concert alone was estimated to be $2 million.Wind was not a major factor with the storm as wind gusts in the area peaked out around 35 mph.  Some specific wind gust values included Birmingham with 31 mph, Calera with 29 mph, Montgomery with 39 mph, and Troy with 31 mph.",,PDS
200108,6,900,200108,6,2100,1121336,5264132,ALABAMA,1,2001,August,Heavy Rain,C,37,COOSA,BMX,06-AUG-01 09:00:00,CST,06-AUG-01 21:00:00,0,0,0,0,0,0K,"AWOS,ASOS,MESONET,ETC",,,,,,,,,,,,,,COUNTYWIDE,,,COUNTYWIDE,,,,,"The remnants of Tropical Storm Barry moved northwestward cutting across the southern and central portions of Alabama.  The center of the remnants moved from Dallas County across Hale, Greene, and Pickens counties.  Heavy rain occurred generally from Troy to Montgomery to the Birmingham area with much of the area getting 1.50 to 3 inches of rain.  Relatively dry conditions in the week before helped to reduce the impact of any heavy rain.  One big impact of the rain was the cancellation of an N'Sync concert scheduled for Legion Field in Birmingham.  The loss from the cancellation of the concert alone was estimated to be $2 million.Wind was not a major factor with the storm as wind gusts in the area peaked out around 35 mph.  Some specific wind gust values included Birmingham with 31 mph, Calera with 29 mph, Montgomery with 39 mph, and Troy with 31 mph.",,PDS
200109,18,1700,200109,18,1700,1122745,5266468,ALABAMA,1,2001,September,Lightning,C,33,COLBERT,BMX,18-SEP-01 17:00:00,CST,18-SEP-01 17:00:00,0,0,0,0,25K,0K,FIRE DEPT/RESCUE SQUAD,,,,,,,,,,,,,,CHEROKEE,,,CHEROKEE,,,,,A thunderstorm became severe moving across the city of Cherokee in western Colbert County.  The thunderstorm produced 1 inch hail and downed a number of trees across the town.  Lightning also struck at least two houses causing fires that did damage to two houses.,,PDS
200110,13,1140,200110,13,1141,1123869,5269734,ALABAMA,1,2001,October,Thunderstorm Wind,C,25,CLARKE,MOB,13-OCT-01 11:40:00,CST,13-OCT-01 11:41:00,0,0,0,0,10K,,EMERGENCY MANAGER,50,E,,,,,,,,,,,,JACKSON,,,JACKSON,31.51667,-87.88333,31.51667,-87.88333,,"Several trees were blown down along State Highway 69, north of Jackson.",PDS
200110,13,1900,200110,13,1902,1123902,5269660,ALABAMA,1,2001,October,Thunderstorm Wind,C,3,BALDWIN,MOB,13-OCT-01 19:00:00,CST,13-OCT-01 19:02:00,0,0,0,0,10K,,EMERGENCY MANAGER,50,E,,,,,,,,,,,,FAIRHOPE,,,FAIRHOPE,30.51667,-87.9,30.51667,-87.9,,Trees were blown down near Fairhope.,PDS
200110,13,940,200110,13,1130,1123915,5269673,ALABAMA,1,2001,October,High Surf,Z,63,LOWER MOBILE,MOB,13-OCT-01 09:40:00,CST,13-OCT-01 11:30:00,0,0,0,0,3K,,EMERGENCY MANAGER,,,,,,,,,,,,,,,,,,,,,,,"Southerly winds of 15 to 25 mph caused heavy surf along the coastal area.  The strong winds caused tides of 1-2 feet above normal.  The higher than normal tides sent water splashing over the Causeway,  and also put some water in the road near the Dog River.",PDS
200110,13,1835,200110,13,1840,1123896,5269827,ALABAMA,1,2001,October,Thunderstorm Wind,C,97,MOBILE,MOB,13-OCT-01 18:35:00,CST,13-OCT-01 18:40:00,0,0,0,0,60K,,EMERGENCY MANAGER,64,M,,,,,,,,,,,,MOBILE,,,MOBILE,30.7,-88.08333,30.7,-88.08333,,"A 74 mph wind gust was recorded at the WKRG-TV studios near the malls in Mobile as a line of severe thunderstorms rolled through the area.  The strong winds damaged two satellite dishes at the TV station.  In addition, the same line of thunderstorms blew trees down in and around the Tillmans Corner area.",PDS
200110,13,1225,200110,13,1226,1123897,5269828,ALABAMA,1,2001,October,Tornado,C,3,BALDWIN,MOB,13-OCT-01 12:25:00,CST,13-OCT-01 12:26:00,0,0,0,0,250K,,NWS STORM SURVEY,,,,,F3,1,440,,,,,,,FOLEY,,,FOLEY,30.41667,-87.68333,30.41667,-87.68333,,"An F3 tornado initially touched down just south of the Grove Home Park on County Road 16.  The tornado then tracked north just east of County Road 65 to County Road 12, just southwest of Foley.  The tornado blew down numerous trees, destroyed a manufactured home and damaged several others in the Grove Home Park.  The tornado destroyed two large cement block buildings and damaged another three near County Road 12.   A large panel truck filled with heavy tools was picked up and carried about 60 feet,  and several other cars were thrown 15 to 25 feet.  No injuries were reported.",PDS
200110,13,1400,200110,13,1405,1123877,5269742,ALABAMA,1,2001,October,Thunderstorm Wind,C,99,MONROE,MOB,13-OCT-01 14:00:00,CST,13-OCT-01 14:05:00,0,0,0,0,15K,,LAW ENFORCEMENT,60,E,,,,,,,,,,,,FRISCO CITY,,,FRISCO CITY,31.43333,-87.41667,31.43333,-87.41667,,"Trees were reported down near the community.  One fell on the roof of a house, producing some damage.",PDS
200109,13,1400,200109,13,1400,1123117,5268221,ALABAMA,1,2001,September,Rip Current,C,3,BALDWIN,MOB,13-SEP-01 14:00:00,CST,13-SEP-01 14:00:00,0,0,1,0,,,EMERGENCY MANAGER,,,,,,,,,,,,,,ORANGE BEACH,,,ORANGE BEACH,,,,,,"A 67-year-old Florida man drowned while swimming in the western beach area of Orange Beach.  The man was swimming approximately 50 feet offshore, between the first and second sandbars, when he was apparently pulled under by rough surf and strong rip currents.  A person swimming nearby tried to rescue the man, but the currents were too strong for the individual to save the drowning man.  Red Flags, which are used to alert swimmers to dangerous swimming and water conditions, were flying along area beaches.   The rough surf and dangerous rip currents were the result, in part, to Tropical Storm Gabrielle, which was moving east across the far southeastern Gulf of Mexico.",PDS
200108,6,900,200108,6,2100,1121336,5264138,ALABAMA,1,2001,August,Heavy Rain,C,109,PIKE,BMX,06-AUG-01 09:00:00,CST,06-AUG-01 21:00:00,0,0,0,0,0K,0K,"AWOS,ASOS,MESONET,ETC",,,,,,,,,,,,,,COUNTYWIDE,,,COUNTYWIDE,,,,,"The remnants of Tropical Storm Barry moved northwestward cutting across the southern and central portions of Alabama.  The center of the remnants moved from Dallas County across Hale, Greene, and Pickens counties.  Heavy rain occurred generally from Troy to Montgomery to the Birmingham area with much of the area getting 1.50 to 3 inches of rain.  Relatively dry conditions in the week before helped to reduce the impact of any heavy rain.  One big impact of the rain was the cancellation of an N'Sync concert scheduled for Legion Field in Birmingham.  The loss from the cancellation of the concert alone was estimated to be $2 million.Wind was not a major factor with the storm as wind gusts in the area peaked out around 35 mph.  Some specific wind gust values included Birmingham with 31 mph, Calera with 29 mph, Montgomery with 39 mph, and Troy with 31 mph.",,PDS
200108,6,900,200108,6,2100,1121336,5264139,ALABAMA,1,2001,August,Heavy Rain,C,117,SHELBY,BMX,06-AUG-01 09:00:00,CST,06-AUG-01 21:00:00,0,0,0,0,0K,0K,"AWOS,ASOS,MESONET,ETC",,,,,,,,,,,,,,COUNTYWIDE,,,COUNTYWIDE,,,,,"The remnants of Tropical Storm Barry moved northwestward cutting across the southern and central portions of Alabama.  The center of the remnants moved from Dallas County across Hale, Greene, and Pickens counties.  Heavy rain occurred generally from Troy to Montgomery to the Birmingham area with much of the area getting 1.50 to 3 inches of rain.  Relatively dry conditions in the week before helped to reduce the impact of any heavy rain.  One big impact of the rain was the cancellation of an N'Sync concert scheduled for Legion Field in Birmingham.  The loss from the cancellation of the concert alone was estimated to be $2 million.Wind was not a major factor with the storm as wind gusts in the area peaked out around 35 mph.  Some specific wind gust values included Birmingham with 31 mph, Calera with 29 mph, Montgomery with 39 mph, and Troy with 31 mph.",,PDS
200110,13,1815,200110,13,1825,1123893,5269824,ALABAMA,1,2001,October,Thunderstorm Wind,C,97,MOBILE,MOB,13-OCT-01 18:15:00,CST,13-OCT-01 18:25:00,0,0,0,0,100K,,LAW ENFORCEMENT,59,M,,,,,,,,,,,,WILMER,,,WILMER,30.81667,-88.35,30.78333,-88.25,,A line of severe thunderstorms moved across the county producing damage at several different locations.   Some of the most significant damage occurred in Semmes where trees were blown down and a plant nursery sustained considerable damage.  Tree and roof damage also occurred in the Wilmer area.   Wind shear detection instruments at the Mobile Regional Airport  recorded a wind gust of 68 mph as the squall line moved across the airport.,PDS
200110,13,1755,200110,13,1800,1123894,5269825,ALABAMA,1,2001,October,Thunderstorm Wind,C,53,ESCAMBIA,MOB,13-OCT-01 17:55:00,CST,13-OCT-01 18:00:00,0,0,0,0,10K,,LAW ENFORCEMENT,60,E,,,,,,,,,,,,APPLETON,,,APPLETON,31.11667,-87.06667,31.11667,-87.06667,,Trees were blown down in the Appleton area as a line of thunderstorms moved through.,PDS
200110,13,1815,200110,13,1820,1123895,5269826,ALABAMA,1,2001,October,Thunderstorm Wind,C,35,CONECUH,MOB,13-OCT-01 18:15:00,CST,13-OCT-01 18:20:00,0,0,0,0,10K,,LAW ENFORCEMENT,60,E,,,,,,,,,,,,REPTON,,,REPTON,31.4,-87.25,31.4,-87.25,,Trees were blown down as a line of thunderstorms passed through the community.,PDS
200110,13,1845,200110,13,1847,1123901,5269659,ALABAMA,1,2001,October,Thunderstorm Wind,C,35,CONECUH,MOB,13-OCT-01 18:45:00,CST,13-OCT-01 18:47:00,0,0,0,0,15K,,EMERGENCY MANAGER,50,E,,,,,,,,,,,,EVERGREEN,,,EVERGREEN,31.43333,-86.96667,31.43333,-86.96667,,High winds from a thunderstorm blew down several trees and power lines in and around Evergreen.,PDS
200110,13,1910,200110,13,1911,1123903,5269661,ALABAMA,1,2001,October,Thunderstorm Wind,C,3,BALDWIN,MOB,13-OCT-01 19:10:00,CST,13-OCT-01 19:11:00,0,0,0,0,40K,,EMERGENCY MANAGER,60,E,,,,,,,,,,,,SUMMERDALE,,,SUMMERDALE,30.48333,-87.7,30.48333,-87.7,,High winds damaged a large Silo near Summerdale.,PDS
200110,13,1922,200110,13,1925,1123904,5269662,ALABAMA,1,2001,October,Thunderstorm Wind,C,3,BALDWIN,MOB,13-OCT-01 19:22:00,CST,13-OCT-01 19:25:00,0,0,0,0,50K,,EMERGENCY MANAGER,60,E,,,,,,,,,,,,GULF SHRS,,,GULF SHRS,30.28333,-87.68333,30.28333,-87.68333,,High winds along the leading edge of a squall line damaged several tents at the Shrimp Festival being held in Gulf Shores..  Several trees were also blown over near Marlow.,PDS
200110,13,2015,200110,13,2025,1123906,5269664,ALABAMA,1,2001,October,Thunderstorm Wind,C,13,BUTLER,MOB,13-OCT-01 20:15:00,CST,13-OCT-01 20:25:00,0,0,0,0,20K,,EMERGENCY MANAGER,60,E,,,,,,,,,,,,GREENVILLE,,,GREENVILLE,31.83333,-86.63333,31.53333,-86.71667,,"High winds, along the leading edge of a squall line, blew down several trees and power lines from Greenville to McKenzie.",PDS
200110,13,2025,200110,13,2027,1123907,5269665,ALABAMA,1,2001,October,Thunderstorm Wind,C,41,CRENSHAW,MOB,13-OCT-01 20:25:00,CST,13-OCT-01 20:27:00,0,0,0,0,10K,,EMERGENCY MANAGER,50,E,,,,,,,,,,,,DOZIER,,,DOZIER,31.5,-86.36667,31.5,-86.36667,,High winds blew down several trees near Dozier.,PDS
200110,13,630,200110,13,631,1123866,5269823,ALABAMA,1,2001,October,Tornado,C,3,BALDWIN,MOB,13-OCT-01 06:30:00,CST,13-OCT-01 06:31:00,0,0,0,0,50K,,NWS STORM SURVEY,,,,,F1,.1,30,,,,,,,FAIRHOPE,,,FAIRHOPE,30.51667,-87.9,30.51667,-87.9,,An F1 tornado touched down for a short time near Fairhope.  The tornado caused major damage to a warehouse roof and two large metal doors were blown in.  Several trees and a fence were also blown down.,PDS
200110,13,1945,200110,13,1947,1123908,5269666,ALABAMA,1,2001,October,Thunderstorm Wind,C,53,ESCAMBIA,MOB,13-OCT-01 19:45:00,CST,13-OCT-01 19:47:00,0,0,0,0,20K,,EMERGENCY MANAGER,55,E,,,,,,,,,,,,ATMORE,,,ATMORE,31.03333,-87.5,31.21667,-87.46667,,"High winds, along the leading edge of a squall line, blew down several trees between Huxford and Atmore.",PDS
200110,13,2030,200110,13,2032,1123910,5269668,ALABAMA,1,2001,October,Thunderstorm Wind,C,39,COVINGTON,MOB,13-OCT-01 20:30:00,CST,13-OCT-01 20:32:00,0,0,0,0,10K,,EMERGENCY MANAGER,50,E,,,,,,,,,,,,ANDALUSIA,,,ANDALUSIA,31.3,-86.48333,31.3,-86.48333,,"Several trees were blown down along U. S Highway 29,  just southwest of Andalusia, near Carolina.",PDS
200110,13,2110,200110,13,2111,1123911,5269669,ALABAMA,1,2001,October,Hail,C,39,COVINGTON,MOB,13-OCT-01 21:10:00,CST,13-OCT-01 21:11:00,0,0,0,0,,,EMERGENCY MANAGER,1.75,,,,,,,,,,,,,OPP,,,OPP,31.28333,-86.25,31.28333,-86.25,,Golfball size hail was reported near Opp.  No damage was reported.,PDS
200110,13,2045,200110,13,2046,1123912,5269670,ALABAMA,1,2001,October,Thunderstorm Wind,C,13,BUTLER,MOB,13-OCT-01 20:45:00,CST,13-OCT-01 20:46:00,0,0,0,0,10K,,EMERGENCY MANAGER,50,E,,,,,,,,,,,,GREENVILLE,,,GREENVILLE,31.83333,-86.63333,31.83333,-86.63333,,High winds blew down several trees east of Greenville.,PDS
200110,13,2045,200110,13,2047,1123913,5269671,ALABAMA,1,2001,October,Thunderstorm Wind,C,41,CRENSHAW,MOB,13-OCT-01 20:45:00,CST,13-OCT-01 20:47:00,0,0,0,0,15K,,EMERGENCY MANAGER,55,E,,,,,,,,,,,,LUVERNE,,,LUVERNE,31.71667,-86.26667,31.71667,-86.26667,,High winds blew down several trees and power lines near Luverne.,PDS
200110,13,635,200110,13,636,1123867,5269732,ALABAMA,1,2001,October,Tornado,C,3,BALDWIN,MOB,13-OCT-01 06:35:00,CST,13-OCT-01 06:36:00,0,0,0,0,10K,,NWS STORM SURVEY,,,,,F0,.1,20,,,,,,,MONTROSE,,,MONTROSE,30.56667,-87.9,30.56667,-87.9,,An F0 tornado briefly touched down along U. S. Highway 98 near Montrose.  The tornado blew several trees down.,PDS
200110,13,1130,200110,13,1131,1123868,5269733,ALABAMA,1,2001,October,Thunderstorm Wind,C,129,WASHINGTON,MOB,13-OCT-01 11:30:00,CST,13-OCT-01 11:31:00,0,0,0,0,15K,,EMERGENCY MANAGER,50,E,,,,,,,,,,,,WAGARVILLE,,,WAGARVILLE,31.43333,-88.03333,31.43333,-88.03333,,Trees and power lines were blown down by high thunderstorm winds near Wagarville.,PDS
200110,13,1200,200110,13,1201,1123870,5269735,ALABAMA,1,2001,October,Tornado,C,3,BALDWIN,MOB,13-OCT-01 12:00:00,CST,13-OCT-01 12:01:00,0,0,0,0,20K,,NWS STORM SURVEY,,,,,F0,.2,30,,,,,,,GULF SHRS,,,GULF SHRS,30.28333,-87.68333,30.28333,-87.68333,,A strong waterspout moved ashore in Gulf Shores near State Highway 59 where it damaged several small booths associated with the Shrimp Festival.  The tornado tracked north and damaged some roofs to homes along 6th avenue.,PDS
200110,13,1215,200110,13,1216,1123871,5269736,ALABAMA,1,2001,October,Thunderstorm Wind,C,53,ESCAMBIA,MOB,13-OCT-01 12:15:00,CST,13-OCT-01 12:16:00,0,0,0,0,10K,,EMERGENCY MANAGER,50,E,,,,,,,,,,,,MC CULLOUGH,,,MC CULLOUGH,31.16667,-87.53333,31.16667,-87.53333,,High winds from a thunderstorm blew down several trees in the McCullough area.,PDS
200110,13,1235,200110,13,1236,1123872,5269737,ALABAMA,1,2001,October,Thunderstorm Wind,C,99,MONROE,MOB,13-OCT-01 12:35:00,CST,13-OCT-01 12:36:00,0,0,0,0,20K,,EMERGENCY MANAGER,50,E,,,,,,,,,,,,GOODWAY,,,GOODWAY,31.33333,-87.43333,31.33333,-87.43333,,High winds from a thunderstorm blew several trees down and turned over a travel trailer near Goodway.,PDS
200109,3,1030,200109,3,1030,1122746,5266248,ALABAMA,1,2001,September,Heavy Rain,C,73,JEFFERSON,BMX,03-SEP-01 10:30:00,CST,03-SEP-01 10:30:00,1,0,1,0,18K,0K,NEWSPAPER,,,,,,,,,,,,,,PALMERDALE,,,PALMERDALE,,,,,,"Heavy rain weakened the root system of a large oak tree that toppled onto a passing truck killing a 15-year old male passenger and injuring the driver.  Three to five inches of rain fell in the area, and the Sheriffs Department investigator believed that standing water surrouding the tree weakened the root system allowing the tree to fall.",PDS
200108,31,1700,200108,31,1900,1121354,5262761,ALABAMA,1,2001,August,Flash Flood,C,73,JEFFERSON,BMX,31-AUG-01 17:00:00,CST,31-AUG-01 19:00:00,0,0,0,0,40K,0K,BROADCAST MEDIA,,,,,,,,,,,,,,BIRMINGHAM,,,BIRMINGHAM,,,,,,"Very heavy rain in a short period of time flooded several locations in the city of Birmingham.  Several roads were temporarily impassable in Hoover and Birmingham.  An automobile dealership, Med Center Mazda, reported several vehicles underwater and severely damaged.",PDS
