BEGIN_YEARMONTH,BEGIN_DAY,BEGIN_TIME,END_YEARMONTH,END_DAY,END_TIME,EPISODE_ID,EVENT_ID,STATE,STATE_FIPS,YEAR,MONTH_NAME,EVENT_TYPE,CZ_TYPE,CZ_FIPS,CZ_NAME,WFO,BEGIN_DATE_TIME,CZ_TIMEZONE,END_DATE_TIME,INJURIES_DIRECT,INJURIES_INDIRECT,DEATHS_DIRECT,DEATHS_INDIRECT,DAMAGE_PROPERTY,DAMAGE_CROPS,SOURCE,MAGNITUDE,MAGNITUDE_TYPE,FLOOD_CAUSE,CATEGORY,TOR_F_SCALE,TOR_LENGTH,TOR_WIDTH,TOR_OTHER_WFO,TOR_OTHER_CZ_STATE,TOR_OTHER_CZ_FIPS,TOR_OTHER_CZ_NAME,BEGIN_RANGE,BEGIN_AZIMUTH,BEGIN_LOCATION,END_RANGE,END_AZIMUTH,END_LOCATION,BEGIN_LAT,BEGIN_LON,END_LAT,END_LON,EPISODE_NARRATIVE,EVENT_NARRATIVE,DATA_SOURCE
200102,16,1341,200102,16,1410,1111555,5234093,ALABAMA,1,2001,February,Thunderstorm Wind,C,107,PICKENS,BMX,16-FEB-01 13:41:00,CST,16-FEB-01 14:10:00,0,0,0,0,100K,0K,EMERGENCY MANAGER,75,E,,,,,,,,,,,,COUNTYWIDE,,,COUNTYWIDE,33.25,-88.06667,33.25,-88.06667,"A large bow echo or derecho, a long-lived and widespread convective wind storm, swept across much of the northern two thirds of Alabama.  The wind storm moved into western Alabama around 141 PM and exited the eastern counties around 438 PM.  Wind gusts were estimated between 60 and 105 miles an hour during the event and these gusts produced extensive wind damage throughout the entire area, similar to F0 and F1 tornado damage.  The American Red Cross estimated that at least 2500 homes were damaged and some destroyed.  Major electrical transmission lines were down in Tuscaloosa and Fayette Counties.  Alabama Power estimated that at least 400,000 homes and businesses were initially without power, which is one third of their total customers.  According to Alabama Power, this event ranked as the third highest ever for power outages in the state of Alabama.",Pickens County reported numerous trees and power lines knocked down.  Numerous homes reported roof damage.,PDS
200103,3,1700,200103,3,2000,1111889,5236730,ALABAMA,1,2001,March,Flash Flood,C,85,LOWNDES,BMX,03-MAR-01 17:00:00,CST,03-MAR-01 20:00:00,0,0,0,0,18K,0K,LAW ENFORCEMENT,,,,,,,,,,,,,,COUNTYWIDE,,,COUNTYWIDE,,,,,,Several roads were covered with high water and impassible.,PDS
200103,3,1400,200103,3,1600,1111890,5236731,ALABAMA,1,2001,March,Flash Flood,C,113,RUSSELL,BMX,03-MAR-01 14:00:00,CST,03-MAR-01 16:00:00,0,0,0,0,14K,0K,LAW ENFORCEMENT,,,,,,,,,,,,,,SEALE,,,SEALE,,,,,,Several roads were flooded in and around Seale.  A few of the roads had portions washed away.,PDS
200103,12,1115,200103,12,1115,1111891,5236732,ALABAMA,1,2001,March,Hail,C,47,DALLAS,BMX,12-MAR-01 11:15:00,CST,12-MAR-01 11:15:00,0,0,0,0,0K,0K,EMERGENCY MANAGER,0.75,,,,,,,,,,,,,SELMA,,,SELMA,32.4,-87.01667,32.4,-87.01667,,Penny size hail was reported in Selma.,PDS
200103,12,1145,200103,12,1230,1111891,5236733,ALABAMA,1,2001,March,Flash Flood,C,47,DALLAS,BMX,12-MAR-01 11:45:00,CST,12-MAR-01 12:30:00,0,0,0,0,25K,0K,EMERGENCY MANAGER,,,,,,,,,,,,,,SELMA,,,SELMA,,,,,,Major street flooding occurred in Selma.  Several automobiles were flooded and damaged.,PDS
200103,12,1245,200103,12,1345,1111892,5236734,ALABAMA,1,2001,March,Flash Flood,C,51,ELMORE,BMX,12-MAR-01 12:45:00,CST,12-MAR-01 13:45:00,0,0,0,0,5K,0K,LAW ENFORCEMENT,,,,,,,,,,,,,,WETUMPKA,,,WETUMPKA,,,,,,Roads were flooded and temporarily impassible on the western side of Wetumpka.,PDS
200103,12,1245,200103,12,1400,1111893,5236735,ALABAMA,1,2001,March,Flash Flood,C,1,AUTAUGA,BMX,12-MAR-01 12:45:00,CST,12-MAR-01 14:00:00,0,0,0,0,15K,0K,EMERGENCY MANAGER,,,,,,,,,,,,,,COUNTYWIDE,,,COUNTYWIDE,,,,,,Many roads across the county were flooded and temporarily impassable.,PDS
200102,16,1450,200102,16,1540,1111555,5234094,ALABAMA,1,2001,February,Thunderstorm Wind,C,7,BIBB,BMX,16-FEB-01 14:50:00,CST,16-FEB-01 15:40:00,0,0,0,0,10K,0K,EMERGENCY MANAGER,65,E,,,,,,,,,,,,COUNTYWIDE,,,COUNTYWIDE,33,-87.1,33,-87.1,"A large bow echo or derecho, a long-lived and widespread convective wind storm, swept across much of the northern two thirds of Alabama.  The wind storm moved into western Alabama around 141 PM and exited the eastern counties around 438 PM.  Wind gusts were estimated between 60 and 105 miles an hour during the event and these gusts produced extensive wind damage throughout the entire area, similar to F0 and F1 tornado damage.  The American Red Cross estimated that at least 2500 homes were damaged and some destroyed.  Major electrical transmission lines were down in Tuscaloosa and Fayette Counties.  Alabama Power estimated that at least 400,000 homes and businesses were initially without power, which is one third of their total customers.  According to Alabama Power, this event ranked as the third highest ever for power outages in the state of Alabama.",Bibb County reported numerous trees blown down.,PDS
200103,15,155,200103,15,155,1111894,5236736,ALABAMA,1,2001,March,Thunderstorm Wind,C,123,TALLAPOOSA,BMX,15-MAR-01 01:55:00,CST,15-MAR-01 01:55:00,0,0,0,0,2K,0K,LAW ENFORCEMENT,50,E,,,,,,,,,,,,CARRVILLE,,,CARRVILLE,32.55,-85.86667,32.55,-85.86667,,Several trees and power lines were blown down near the intersection of SR 49 and SR 14.,PDS
200103,15,200,200103,15,200,1111895,5236737,ALABAMA,1,2001,March,Thunderstorm Wind,C,87,MACON,BMX,15-MAR-01 02:00:00,CST,15-MAR-01 02:00:00,0,0,0,0,18K,0K,LAW ENFORCEMENT,60,E,,,,,,,,,,,,NOTASULGA,,,NOTASULGA,32.56667,-85.66667,32.56667,-85.66667,,A vacant mobile was destroyed and several power lines were damaged along SR 199 near Notasulga.,PDS
200103,15,210,200103,15,210,1111896,5236738,ALABAMA,1,2001,March,Thunderstorm Wind,C,81,LEE,BMX,15-MAR-01 02:10:00,CST,15-MAR-01 02:10:00,0,0,0,0,2K,0K,LAW ENFORCEMENT,50,E,,,,,,,,,,,,LOACHAPOKA,,,LOACHAPOKA,32.6,-85.58333,32.6,-85.58333,,Several trees were knocked down along SR 14 and also on Lee Road.,PDS
200103,15,215,200103,15,215,1111896,5236739,ALABAMA,1,2001,March,Thunderstorm Wind,C,81,LEE,BMX,15-MAR-01 02:15:00,CST,15-MAR-01 02:15:00,0,0,0,0,2K,0K,LAW ENFORCEMENT,52,E,,,,,,,,,,,,AUBURN,,,AUBURN,32.61667,-85.46667,32.61667,-85.46667,,The Lee County Sheriff estimated wind gusts around 60 miles an hour in Auburn.,PDS
200103,3,1805,200103,3,1810,1112082,5237053,ALABAMA,1,2001,March,Thunderstorm Wind,C,35,CONECUH,MOB,03-MAR-01 18:05:00,CST,03-MAR-01 18:10:00,0,0,0,0,5K,,LAW ENFORCEMENT,55,E,,,,,,,,,,,,CASTLEBERRY,,,CASTLEBERRY,31.3,-87.01667,31.3,-87.01667,,Sheriff reported a large tree and other debris over County Road 19 to the west of the community.,PDS
200103,12,550,200103,12,555,1112085,5237056,ALABAMA,1,2001,March,Hail,C,129,WASHINGTON,MOB,12-MAR-01 05:50:00,CST,12-MAR-01 05:55:00,0,0,0,0,,,LAW ENFORCEMENT,2.00,,,,,,,,,,,,,VINEGAR BEND,,,VINEGAR BEND,31.26667,-88.35,31.26667,-88.35,,,PDS
200103,12,620,200103,12,625,1112086,5237057,ALABAMA,1,2001,March,Hail,C,25,CLARKE,MOB,12-MAR-01 06:20:00,CST,12-MAR-01 06:25:00,0,0,0,0,,,EMERGENCY MANAGER,0.88,,,,,,,,,,,,,OPINE,,,OPINE,31.9,-87.96667,31.9,-87.96667,,,PDS
200103,12,645,200103,12,650,1112087,5237058,ALABAMA,1,2001,March,Hail,C,35,CONECUH,MOB,12-MAR-01 06:45:00,CST,12-MAR-01 06:50:00,0,0,0,0,,,EMERGENCY MANAGER,0.75,,,,,,,,,,,,,OWASSA,,,OWASSA,31.5,-86.93333,31.5,-86.93333,,,PDS
200103,12,920,200103,12,925,1112088,5237059,ALABAMA,1,2001,March,Hail,C,23,CHOCTAW,MOB,12-MAR-01 09:20:00,CST,12-MAR-01 09:25:00,0,0,0,0,5K,,EMERGENCY MANAGER,0.88,,,,,,,,,,,,,GILBERTOWN,,,GILBERTOWN,31.86667,-88.31667,31.86667,-88.31667,,Lightning also struck a house in the community as the thunderstorm moved through.,PDS
200103,3,230,200103,3,1830,1112120,5235800,ALABAMA,1,2001,March,Flash Flood,C,23,CHOCTAW,MOB,03-MAR-01 02:30:00,CST,03-MAR-01 18:30:00,0,0,0,0,10K,,EMERGENCY MANAGER,,,,,,,,,,,,,,COUNTYWIDE,,,COUNTYWIDE,,,,,Heavy rains across the counties caused many secondary roads to washout.  Several of the roads were closed throughout the day due to high water.  Radar estimated three to five inches of rain fell across the area.,,PDS
200103,3,230,200103,3,1830,1112120,5235801,ALABAMA,1,2001,March,Flash Flood,C,91,MARENGO,MOB,03-MAR-01 02:30:00,CST,03-MAR-01 18:30:00,0,0,0,0,10K,,EMERGENCY MANAGER,,,,,,,,,,,,,,COUNTYWIDE,,,COUNTYWIDE,,,,,Heavy rains across the counties caused many secondary roads to washout.  Several of the roads were closed throughout the day due to high water.  Radar estimated three to five inches of rain fell across the area.,,PDS
200103,3,230,200103,3,1830,1112121,5235802,ALABAMA,1,2001,March,Flash Flood,C,25,CLARKE,MOB,03-MAR-01 02:30:00,CST,03-MAR-01 18:30:00,0,0,0,0,365K,,EMERGENCY MANAGER,,,,,,,,,,,,,,COUNTYWIDE,,,COUNTYWIDE,,,,,"Heavy rainfall caused extensive washouts to secondary roads and bridges across the counties.  Most of the water had drained by sunset and most of the roads were reopened.  However, some of the roads and bridges, especially in Clarke county, had to be rebuilt and were closed for several days before they were reopened.  Radar estimated four to six inches of rainfall fell across the area.",,PDS
200103,3,230,200103,3,1830,1112121,5235803,ALABAMA,1,2001,March,Flash Flood,C,129,WASHINGTON,MOB,03-MAR-01 02:30:00,CST,03-MAR-01 18:30:00,0,0,0,0,30K,,EMERGENCY MANAGER,,,,,,,,,,,,,,COUNTYWIDE,,,COUNTYWIDE,,,,,"Heavy rainfall caused extensive washouts to secondary roads and bridges across the counties.  Most of the water had drained by sunset and most of the roads were reopened.  However, some of the roads and bridges, especially in Clarke county, had to be rebuilt and were closed for several days before they were reopened.  Radar estimated four to six inches of rainfall fell across the area.",,PDS
200102,21,2320,200102,21,2350,1111543,5233996,ALABAMA,1,2001,February,Thunderstorm Wind,C,57,FAYETTE,BMX,21-FEB-01 23:20:00,CST,21-FEB-01 23:50:00,0,0,0,0,20K,0K,EMERGENCY MANAGER,55,E,,,,,,,,,,,,COUNTYWIDE,,,COUNTYWIDE,33.73333,-87.75,33.73333,-87.75,,Numerous trees and power lines were snapped off or blown down in the northern part of the county.  Hail of unknown size accompanied these storms.,PDS
200102,9,1800,200102,9,1800,1111538,5233690,ALABAMA,1,2001,February,Thunderstorm Wind,C,125,TUSCALOOSA,BMX,09-FEB-01 18:00:00,CST,09-FEB-01 18:00:00,0,0,0,0,3K,0K,EMERGENCY MANAGER,55,E,,,,,,,,,,,,TUSCALOOSA,,,TUSCALOOSA,33.2,-87.56667,33.2,-87.56667,,The glass windows in front of the Home Depot were blown in and broken.,PDS
200102,9,1805,200102,9,1805,1111538,5233691,ALABAMA,1,2001,February,Thunderstorm Wind,C,125,TUSCALOOSA,BMX,09-FEB-01 18:05:00,CST,09-FEB-01 18:05:00,0,0,0,0,2K,0K,EMERGENCY MANAGER,50,E,,,,,,,,,,,,BROOKWOOD,,,BROOKWOOD,33.28333,-87.28333,33.28333,-87.28333,,Trees were blown down on SR 216 in Brookwood.,PDS
200102,22,106,200102,22,106,1111546,5233999,ALABAMA,1,2001,February,Hail,C,73,JEFFERSON,BMX,22-FEB-01 01:06:00,CST,22-FEB-01 01:06:00,0,0,0,0,0K,0K,LAW ENFORCEMENT,1.00,,,,,,,,,,,,,PINSON,,,PINSON,33.68333,-86.68333,33.68333,-86.68333,,Quarter size hail fell in Pinson.,PDS
200102,21,1810,200102,21,1810,1111547,5234000,ALABAMA,1,2001,February,Hail,C,47,DALLAS,BMX,21-FEB-01 18:10:00,CST,21-FEB-01 18:10:00,0,0,0,0,0K,0K,GENERAL PUBLIC,0.88,,,,,,,,,,,,,SAFFORD,,,SAFFORD,32.28333,-87.36667,32.28333,-87.36667,,Nickel size hail fell just north of Safford.,PDS
200102,16,1410,200102,16,1455,1111555,5234333,ALABAMA,1,2001,February,Thunderstorm Wind,C,125,TUSCALOOSA,BMX,16-FEB-01 14:10:00,CST,16-FEB-01 14:55:00,2,0,0,0,250K,0K,EMERGENCY MANAGER,65,E,,,,,,,,,,,,COUNTYWIDE,,,COUNTYWIDE,33.3,-87.53333,33.3,-87.53333,"A large bow echo or derecho, a long-lived and widespread convective wind storm, swept across much of the northern two thirds of Alabama.  The wind storm moved into western Alabama around 141 PM and exited the eastern counties around 438 PM.  Wind gusts were estimated between 60 and 105 miles an hour during the event and these gusts produced extensive wind damage throughout the entire area, similar to F0 and F1 tornado damage.  The American Red Cross estimated that at least 2500 homes were damaged and some destroyed.  Major electrical transmission lines were down in Tuscaloosa and Fayette Counties.  Alabama Power estimated that at least 400,000 homes and businesses were initially without power, which is one third of their total customers.  According to Alabama Power, this event ranked as the third highest ever for power outages in the state of Alabama.",Tuscaloosa County reported numerous trees and power lines blown down countywide.  Many of the fallen trees caused roads to be closed temporarily.  Numerous homes were damaged.  Wind gusts of 80 mph were measured in Northport and the Tuscaloosa Airport had 60 mph winds.  Numerous funnel cloud reports were received throughout the county.  One man was injured when a tree fell on his automobile on Highway 43.  One 18-wheel truck was overturned on a bridge over the Black Warrior River.  Several businesses reported broken windows.  One firefighter was injured in Northport when a tree fell on him.  This event occurred as the firefighter was cleaning up debris.  Quarter size hail was also reported with these storms.,PDS
200102,16,1425,200102,16,1510,1111555,5234334,ALABAMA,1,2001,February,Thunderstorm Wind,C,127,WALKER,BMX,16-FEB-01 14:25:00,CST,16-FEB-01 15:10:00,0,0,0,0,55K,0K,EMERGENCY MANAGER,60,E,,,,,,,,,,,,COUNTYWIDE,,,COUNTYWIDE,33.81667,-87.25,33.81667,-87.25,"A large bow echo or derecho, a long-lived and widespread convective wind storm, swept across much of the northern two thirds of Alabama.  The wind storm moved into western Alabama around 141 PM and exited the eastern counties around 438 PM.  Wind gusts were estimated between 60 and 105 miles an hour during the event and these gusts produced extensive wind damage throughout the entire area, similar to F0 and F1 tornado damage.  The American Red Cross estimated that at least 2500 homes were damaged and some destroyed.  Major electrical transmission lines were down in Tuscaloosa and Fayette Counties.  Alabama Power estimated that at least 400,000 homes and businesses were initially without power, which is one third of their total customers.  According to Alabama Power, this event ranked as the third highest ever for power outages in the state of Alabama.",Walker County reported numerous trees and power lines down.  Numerous homes and automobiles were damaged from the falling trees.  A few homes had their roofs torn off and a few barns were totally destroyed.  No injury reports were received.,PDS
200102,9,1735,200102,9,1735,1111537,5233688,ALABAMA,1,2001,February,Thunderstorm Wind,C,133,WINSTON,BMX,09-FEB-01 17:35:00,CST,09-FEB-01 17:35:00,0,0,0,0,5K,0K,EMERGENCY MANAGER,50,E,,,,,,,,,,,,ARLEY,,,ARLEY,34.06667,-87.21667,34.06667,-87.21667,,Trees were knocked down just south of Arley.  An automobile collided with a downed tree on CR 41.  No injuries were reported.,PDS
200102,9,1745,200102,9,1745,1111539,5233992,ALABAMA,1,2001,February,Thunderstorm Wind,C,43,CULLMAN,BMX,09-FEB-01 17:45:00,CST,09-FEB-01 17:45:00,0,0,0,0,2K,0K,EMERGENCY MANAGER,50,E,,,,,,,,,,,,CRANE HILL,,,CRANE HILL,34.1,-87.05,34.1,-87.05,,Trees were knocked down near the city of Crane Hill.,PDS
200102,25,115,200102,25,120,1111058,5232319,ALABAMA,1,2001,February,Thunderstorm Wind,C,91,MARENGO,MOB,25-FEB-01 01:15:00,CST,25-FEB-01 01:20:00,0,0,0,0,15K,,EMERGENCY MANAGER,75,E,,,,,,,,,,,,SWEET WATER,,,SWEET WATER,32.1,-87.86667,32.1,-87.86667,,Strong thunderstorm winds completely removed the roof  of a mobile home.  Trees that were blown down by the storm produced damage to two other nearby homes.,PDS
200102,27,1640,200102,27,1645,1111059,5232320,ALABAMA,1,2001,February,Hail,C,99,MONROE,MOB,27-FEB-01 16:40:00,CST,27-FEB-01 16:45:00,0,0,0,0,,,EMERGENCY MANAGER,0.88,,,,,,,,,,,,,PETERMAN,,,PETERMAN,31.58333,-87.26667,31.58333,-87.26667,,,PDS
200102,27,1645,200102,27,1650,1111060,5232321,ALABAMA,1,2001,February,Thunderstorm Wind,C,99,MONROE,MOB,27-FEB-01 16:45:00,CST,27-FEB-01 16:50:00,0,0,0,0,5K,,EMERGENCY MANAGER,55,E,,,,,,,,,,7,NE,PETERMAN,7,NE,PETERMAN,31.65,-87.18333,31.65,-87.18333,,"Thunderstorm winds blew down trees near Grey's Store, which is about 7 miles northeast of Peterman.",PDS
200102,27,1650,200102,27,1655,1111061,5232322,ALABAMA,1,2001,February,Thunderstorm Wind,C,35,CONECUH,MOB,27-FEB-01 16:50:00,CST,27-FEB-01 16:55:00,0,0,0,0,5K,,EMERGENCY MANAGER,55,E,,,,,,,,,,,,NICHBURG,,,NICHBURG,31.48333,-87.13333,31.48333,-87.13333,,Trees were blown down by strong thunderstorms north of the community.  Most of the downed trees were located between Pine Orchard and Ramah.,PDS
200102,21,2310,200102,21,2345,1111540,5233993,ALABAMA,1,2001,February,Thunderstorm Wind,C,93,MARION,BMX,21-FEB-01 23:10:00,CST,21-FEB-01 23:45:00,0,0,0,0,250K,0K,EMERGENCY MANAGER,65,E,,,,,,,,,,,,COUNTYWIDE,,,COUNTYWIDE,34.11667,-87.88333,34.11667,-87.88333,,"Dime to quarter size hail was reported across Marion County with a line of thunderstorms that moved through.  The hail completely covered the ground in many locations.  These severe thunderstorms produced significant wind damage mainly across the southern part of the county near Guin, Winfield, and Hamilton.  Wind speeds were estimated between 60 and 80 miles an hour.  Numerous trees and power lines were snapped off or blown over in this area and many roads became impassible.  Numerous homes and businesses received moderate to major damage which ranged from broken windows to partial roof removal.  Several automobiles were damaged by falling trees.  No injuries were reported.",PDS
200102,21,2235,200102,21,2235,1111541,5233994,ALABAMA,1,2001,February,Hail,C,105,PERRY,BMX,21-FEB-01 22:35:00,CST,21-FEB-01 22:35:00,0,0,0,0,0K,0K,GENERAL PUBLIC,1.00,,,,,,,,,,,,,MARION,,,MARION,32.63333,-87.31667,32.63333,-87.31667,,Quarter size hail was reported near Marion.,PDS
200102,21,2250,200102,21,2330,1111542,5233995,ALABAMA,1,2001,February,Thunderstorm Wind,C,75,LAMAR,BMX,21-FEB-01 22:50:00,CST,21-FEB-01 23:30:00,0,0,0,0,120K,0K,AMATEUR RADIO,65,E,,,,,,,,,,,,COUNTYWIDE,,,COUNTYWIDE,33.81667,-86.1,33.81667,-86.1,,"Severe thunderstorms produced damaging winds across Lamar County.  The most significant damage occurred across the northern half of the county mainly from Sulligent northward.  Numerous trees and power lines were blown down and a roof was completely torn off a building.  On the Marion and Lamar county line, one building was destroyed and a 180 ft. high radio tower repeater site was knocked over.  Hail of unknown size also accompanied these storms.  No injuries were reported.",PDS
200102,22,11,200102,22,11,1111544,5233997,ALABAMA,1,2001,February,Hail,C,127,WALKER,BMX,22-FEB-01 00:11:00,CST,22-FEB-01 00:11:00,0,0,0,0,0K,0K,LAW ENFORCEMENT,1.00,,,,,,,,,,,,,JASPER,,,JASPER,33.83333,-87.28333,33.83333,-87.28333,,One inch diameter size hail was reported in the city of Jasper.,PDS
200102,22,107,200102,22,107,1111545,5233998,ALABAMA,1,2001,February,Hail,C,59,FRANKLIN,BMX,22-FEB-01 01:07:00,CST,22-FEB-01 01:07:00,0,0,0,0,0K,0K,LAW ENFORCEMENT,0.75,,,,,,,,,,,,,PHIL CAMPBELL,,,PHIL CAMPBELL,34.35,-87.7,34.35,-87.7,,Dime size hail was reported in Phil Campbell.,PDS
200102,16,1605,200102,16,1632,1111555,5234198,ALABAMA,1,2001,February,Thunderstorm Wind,C,29,CLEBURNE,BMX,16-FEB-01 16:05:00,CST,16-FEB-01 16:32:00,0,0,0,0,10K,0K,EMERGENCY MANAGER,60,E,,,,,,,,,,,,COUNTYWIDE,,,COUNTYWIDE,33.71667,-85.56667,33.71667,-85.56667,"A large bow echo or derecho, a long-lived and widespread convective wind storm, swept across much of the northern two thirds of Alabama.  The wind storm moved into western Alabama around 141 PM and exited the eastern counties around 438 PM.  Wind gusts were estimated between 60 and 105 miles an hour during the event and these gusts produced extensive wind damage throughout the entire area, similar to F0 and F1 tornado damage.  The American Red Cross estimated that at least 2500 homes were damaged and some destroyed.  Major electrical transmission lines were down in Tuscaloosa and Fayette Counties.  Alabama Power estimated that at least 400,000 homes and businesses were initially without power, which is one third of their total customers.  According to Alabama Power, this event ranked as the third highest ever for power outages in the state of Alabama.",Cleburne County reported numerous trees and power lines knocked down and snapped off.  Several homes and businesses received varying degrees of roof damage.  Many roads were closed because of downed trees.,PDS
200102,16,1632,200102,16,1650,1111555,5234275,ALABAMA,1,2001,February,Thunderstorm Wind,C,111,RANDOLPH,BMX,16-FEB-01 16:32:00,CST,16-FEB-01 16:50:00,0,0,0,0,3K,0K,EMERGENCY MANAGER,50,E,,,,,,,,,,,,COUNTYWIDE,,,COUNTYWIDE,33.31667,-85.46667,33.31667,-85.46667,"A large bow echo or derecho, a long-lived and widespread convective wind storm, swept across much of the northern two thirds of Alabama.  The wind storm moved into western Alabama around 141 PM and exited the eastern counties around 438 PM.  Wind gusts were estimated between 60 and 105 miles an hour during the event and these gusts produced extensive wind damage throughout the entire area, similar to F0 and F1 tornado damage.  The American Red Cross estimated that at least 2500 homes were damaged and some destroyed.  Major electrical transmission lines were down in Tuscaloosa and Fayette Counties.  Alabama Power estimated that at least 400,000 homes and businesses were initially without power, which is one third of their total customers.  According to Alabama Power, this event ranked as the third highest ever for power outages in the state of Alabama.",Randolph County reported several trees and power lines blown down throughout the county.,PDS
200102,16,1500,200102,16,1530,1111555,5234199,ALABAMA,1,2001,February,Thunderstorm Wind,C,43,CULLMAN,BMX,16-FEB-01 15:00:00,CST,16-FEB-01 15:30:00,0,0,0,0,60K,0K,EMERGENCY MANAGER,60,E,,,,,,,,,,,,COUNTYWIDE,,,COUNTYWIDE,34.15,-86.86667,34.15,-86.86667,"A large bow echo or derecho, a long-lived and widespread convective wind storm, swept across much of the northern two thirds of Alabama.  The wind storm moved into western Alabama around 141 PM and exited the eastern counties around 438 PM.  Wind gusts were estimated between 60 and 105 miles an hour during the event and these gusts produced extensive wind damage throughout the entire area, similar to F0 and F1 tornado damage.  The American Red Cross estimated that at least 2500 homes were damaged and some destroyed.  Major electrical transmission lines were down in Tuscaloosa and Fayette Counties.  Alabama Power estimated that at least 400,000 homes and businesses were initially without power, which is one third of their total customers.  According to Alabama Power, this event ranked as the third highest ever for power outages in the state of Alabama.",Cullman County reported numerous trees and power lines blown down.  The Cold Springs School was damaged by falling trees and power lines.  Several trees fell on vehicles and homes causing damage.  One mobile home was destroyed on CR 52.  A funnel cloud was sighted on Golf Course Road.  Small hail also accompanied these storms.,PDS
200102,16,1505,200102,16,1550,1111555,5234276,ALABAMA,1,2001,February,Thunderstorm Wind,C,117,SHELBY,BMX,16-FEB-01 15:05:00,CST,16-FEB-01 15:50:00,0,0,0,0,3K,0K,EMERGENCY MANAGER,55,E,,,,,,,,,,,,COUNTYWIDE,,,COUNTYWIDE,33.25,-86.68333,33.25,-86.68333,"A large bow echo or derecho, a long-lived and widespread convective wind storm, swept across much of the northern two thirds of Alabama.  The wind storm moved into western Alabama around 141 PM and exited the eastern counties around 438 PM.  Wind gusts were estimated between 60 and 105 miles an hour during the event and these gusts produced extensive wind damage throughout the entire area, similar to F0 and F1 tornado damage.  The American Red Cross estimated that at least 2500 homes were damaged and some destroyed.  Major electrical transmission lines were down in Tuscaloosa and Fayette Counties.  Alabama Power estimated that at least 400,000 homes and businesses were initially without power, which is one third of their total customers.  According to Alabama Power, this event ranked as the third highest ever for power outages in the state of Alabama.",Shelby County reported numerous trees and power lines blown down.  The most concentrated damage was in the northern part of the county.,PDS
200104,3,1400,200104,3,2000,1113474,5242276,ALABAMA,1,2001,April,Flash Flood,C,127,WALKER,BMX,03-APR-01 14:00:00,CST,03-APR-01 20:00:00,0,0,0,0,18K,0K,EMERGENCY MANAGER,,,,,,,,,,,,,,COUNTYWIDE,,,COUNTYWIDE,,,,,,Numerous roads throughout the county were flooded.  Many of these roads were temporarily impassable.,PDS
200104,3,2130,200104,3,2130,1112856,5240505,ALABAMA,1,2001,April,Lightning,C,23,CHOCTAW,MOB,03-APR-01 21:30:00,CST,03-APR-01 21:30:00,0,0,0,0,20K,,EMERGENCY MANAGER,,,,,,,,,,,,,,BUTLER,,,BUTLER,,,,,,Lightning struck an abandoned house and caught it on fire.  The fire destroyed part of the house before firefighters could extinguish the blaze. No one was injured.,PDS
200104,24,1755,200104,24,1758,1112857,5240506,ALABAMA,1,2001,April,Waterspout,C,3,BALDWIN,MOB,24-APR-01 17:55:00,CST,24-APR-01 17:58:00,0,0,0,0,,,LAW ENFORCEMENT,,,,,,,,,,,,,,ORANGE BEACH,,,ORANGE BEACH,,,,,,A waterspout was observed just offshore of Orange Beach.  The spout remained offshore for several minutes then dissipated over the water.,PDS
200104,3,2030,200104,3,2130,1112844,5240422,ALABAMA,1,2001,April,Flash Flood,C,129,WASHINGTON,MOB,03-APR-01 20:30:00,CST,03-APR-01 21:30:00,0,0,0,0,3K,,EMERGENCY MANAGER,,,,,,,,,,,,,,MILLRY,,,MILLRY,,,,,,Heavy rains along County Road 34 caused temporary street flooding between Millry and Bigbee.  Several dirt roads that run off of County Road 34 had to be closed until the water drained.  Radar estimated that four to six inches of rain fell across the area in a three hour period.,PDS
200104,4,600,200104,4,602,1112845,5240423,ALABAMA,1,2001,April,Hail,C,91,MARENGO,MOB,04-APR-01 06:00:00,CST,04-APR-01 06:02:00,0,0,0,0,,,LAW ENFORCEMENT,0.75,,,,,,,,,,,,,MYRTLEWOOD,,,MYRTLEWOOD,32.26667,-87.95,32.26667,-87.95,,,PDS
