BEGIN_YEARMONTH,BEGIN_DAY,BEGIN_TIME,END_YEARMONTH,END_DAY,END_TIME,EPISODE_ID,EVENT_ID,STATE,STATE_FIPS,YEAR,MONTH_NAME,EVENT_TYPE,CZ_TYPE,CZ_FIPS,CZ_NAME,WFO,BEGIN_DATE_TIME,CZ_TIMEZONE,END_DATE_TIME,INJURIES_DIRECT,INJURIES_INDIRECT,DEATHS_DIRECT,DEATHS_INDIRECT,DAMAGE_PROPERTY,DAMAGE_CROPS,SOURCE,MAGNITUDE,MAGNITUDE_TYPE,FLOOD_CAUSE,CATEGORY,TOR_F_SCALE,TOR_LENGTH,TOR_WIDTH,TOR_OTHER_WFO,TOR_OTHER_CZ_STATE,TOR_OTHER_CZ_FIPS,TOR_OTHER_CZ_NAME,BEGIN_RANGE,BEGIN_AZIMUTH,BEGIN_LOCATION,END_RANGE,END_AZIMUTH,END_LOCATION,BEGIN_LAT,BEGIN_LON,END_LAT,END_LON,EPISODE_NARRATIVE,EVENT_NARRATIVE,DATA_SOURCE
200101,19,1040,200101,19,1050,1110441,5228487,ALABAMA,1,2001,January,Thunderstorm Wind,C,45,DALE,TAE,19-JAN-01 10:40:00,EST,19-JAN-01 10:50:00,0,0,0,0,1K,,EMERGENCY MANAGER,,,,,,,,,,,,,,COUNTYWIDE,,,COUNTYWIDE,31.38333,-85.63333,31.38333,-85.63333,,Several trees down across county roads.  Reported by the Dale County EMA.,PDS
200101,19,1205,200101,19,1205,1110441,5228488,ALABAMA,1,2001,January,Thunderstorm Wind,C,61,GENEVA,TAE,19-JAN-01 12:05:00,EST,19-JAN-01 12:05:00,0,0,0,0,600K,,EMERGENCY MANAGER,,,,,,,,,,,,1,W,GENEVA,1,W,GENEVA,31.03333,-85.9,31.03333,-85.9,,"Roof damage to 30 homes and eight mobile homes, 15 cars damaged, a high school's roof and wall toppled, roof damage to a water treatment plant, and numerous trees and power lines down.  Reported by the Geneva County EMA.",PDS
200101,19,1458,200101,19,1458,1110441,5228489,ALABAMA,1,2001,January,Thunderstorm Wind,C,67,HENRY,TAE,19-JAN-01 14:58:00,EST,19-JAN-01 14:58:00,0,0,0,0,1K,,FIRE DEPT/RESCUE SQUAD,,,,,,,,,,,,8,SSE,HALEBURG,8,SSE,HALEBURG,31.3,-85.08333,31.3,-85.08333,,Several trees down.  Reported by the Henry County EMA.,PDS
200101,1,300,200101,1,900,1110293,5228047,ALABAMA,1,2001,January,Winter Storm,Z,55,MONROE,MOB,01-JAN-01 03:00:00,CST,01-JAN-01 09:00:00,0,0,0,0,,,EMERGENCY MANAGER,,,,,,,,,,,,,,,,,,,,,,"A Winter Storm produced a band of snow across portions of Southwest Alabama.   One-half to one  inch of snowfall accumulated generally along and north of a Chatom to Camden line.    Some locations between Butler and Thomasville reported snowfall accumulations of about one inch.  The wintery weather resulted in no injuries, and travel across the region was not significantly impacted.",,PDS
200101,1,300,200101,1,900,1110293,5228048,ALABAMA,1,2001,January,Winter Storm,Z,52,WASHINGTON,MOB,01-JAN-01 03:00:00,CST,01-JAN-01 09:00:00,0,0,0,0,,,EMERGENCY MANAGER,,,,,,,,,,,,,,,,,,,,,,"A Winter Storm produced a band of snow across portions of Southwest Alabama.   One-half to one  inch of snowfall accumulated generally along and north of a Chatom to Camden line.    Some locations between Butler and Thomasville reported snowfall accumulations of about one inch.  The wintery weather resulted in no injuries, and travel across the region was not significantly impacted.",,PDS
200101,1,300,200101,1,900,1110293,5228049,ALABAMA,1,2001,January,Winter Storm,Z,54,WILCOX,MOB,01-JAN-01 03:00:00,CST,01-JAN-01 09:00:00,0,0,0,0,,,EMERGENCY MANAGER,,,,,,,,,,,,,,,,,,,,,,"A Winter Storm produced a band of snow across portions of Southwest Alabama.   One-half to one  inch of snowfall accumulated generally along and north of a Chatom to Camden line.    Some locations between Butler and Thomasville reported snowfall accumulations of about one inch.  The wintery weather resulted in no injuries, and travel across the region was not significantly impacted.",,PDS
200101,19,710,200101,19,715,1110282,5227923,ALABAMA,1,2001,January,Thunderstorm Wind,C,129,WASHINGTON,MOB,19-JAN-01 07:10:00,CST,19-JAN-01 07:15:00,0,0,0,0,10K,,LAW ENFORCEMENT,55,E,,,,,,,,,,,,CHATOM,,,CHATOM,31.46667,-88.25,31.46667,-88.25,,High thunderstorm winds downed trees and power lines in the community.,PDS
200101,19,720,200101,19,725,1110283,5227924,ALABAMA,1,2001,January,Thunderstorm Wind,C,129,WASHINGTON,MOB,19-JAN-01 07:20:00,CST,19-JAN-01 07:25:00,0,0,0,0,8K,,LAW ENFORCEMENT,55,E,,,,,,,,,,,,MC INTOSH,,,MC INTOSH,31.26667,-88.03333,31.26667,-88.03333,,Thunderstorm winds blew down trees along Highway 43 near McIntosh.,PDS
200101,1,300,200101,1,900,1110293,5228044,ALABAMA,1,2001,January,Winter Storm,Z,51,CHOCTAW,MOB,01-JAN-01 03:00:00,CST,01-JAN-01 09:00:00,0,0,0,0,,,EMERGENCY MANAGER,,,,,,,,,,,,,,,,,,,,,,"A Winter Storm produced a band of snow across portions of Southwest Alabama.   One-half to one  inch of snowfall accumulated generally along and north of a Chatom to Camden line.    Some locations between Butler and Thomasville reported snowfall accumulations of about one inch.  The wintery weather resulted in no injuries, and travel across the region was not significantly impacted.",,PDS
200101,1,300,200101,1,900,1110293,5228045,ALABAMA,1,2001,January,Winter Storm,Z,53,CLARKE,MOB,01-JAN-01 03:00:00,CST,01-JAN-01 09:00:00,0,0,0,0,,,EMERGENCY MANAGER,,,,,,,,,,,,,,,,,,,,,,"A Winter Storm produced a band of snow across portions of Southwest Alabama.   One-half to one  inch of snowfall accumulated generally along and north of a Chatom to Camden line.    Some locations between Butler and Thomasville reported snowfall accumulations of about one inch.  The wintery weather resulted in no injuries, and travel across the region was not significantly impacted.",,PDS
200101,1,300,200101,1,900,1110293,5228046,ALABAMA,1,2001,January,Winter Storm,Z,39,MARENGO,MOB,01-JAN-01 03:00:00,CST,01-JAN-01 09:00:00,0,0,0,0,,,EMERGENCY MANAGER,,,,,,,,,,,,,,,,,,,,,,"A Winter Storm produced a band of snow across portions of Southwest Alabama.   One-half to one  inch of snowfall accumulated generally along and north of a Chatom to Camden line.    Some locations between Butler and Thomasville reported snowfall accumulations of about one inch.  The wintery weather resulted in no injuries, and travel across the region was not significantly impacted.",,PDS
200101,19,950,200101,19,955,1110288,5228039,ALABAMA,1,2001,January,Thunderstorm Wind,C,13,BUTLER,MOB,19-JAN-01 09:50:00,CST,19-JAN-01 09:55:00,0,0,0,0,5K,,EMERGENCY MANAGER,55,E,,,,,,,,,,,,FOREST HOME,,,FOREST HOME,31.86667,-86.83333,31.86667,-86.83333,,High thunderstorm winds blew down trees northwest of Forest Home.,PDS
200101,19,955,200101,19,1000,1110289,5228040,ALABAMA,1,2001,January,Thunderstorm Wind,C,41,CRENSHAW,MOB,19-JAN-01 09:55:00,CST,19-JAN-01 10:00:00,0,0,0,0,5K,,EMERGENCY MANAGER,55,E,,,,,,,,,,,,HONORAVILLE,,,HONORAVILLE,31.9,-86.4,31.9,-86.4,,Trees were blown down north of the community by strong thunderstorm winds.,PDS
200101,29,1540,200101,29,1545,1110291,5228042,ALABAMA,1,2001,January,Thunderstorm Wind,C,91,MARENGO,MOB,29-JAN-01 15:40:00,CST,29-JAN-01 15:45:00,0,0,0,0,3K,,EMERGENCY MANAGER,55,E,,,,,,,,,,,,LINDEN,,,LINDEN,32.3,-87.8,32.3,-87.8,,Several trees were blown down along State Road 69 as thunderstorms moved through the area.,PDS
200101,19,730,200101,19,735,1110284,5227925,ALABAMA,1,2001,January,Thunderstorm Wind,C,97,MOBILE,MOB,19-JAN-01 07:30:00,CST,19-JAN-01 07:35:00,0,0,0,0,2K,,NWS EMPLOYEE(OFF DUTY),55,E,,,,,,,,,,,,MOBILE,,,MOBILE,30.7,-88.08333,30.7,-88.08333,,A couple of trees were reported blown down by high thunderstorm winds at locations south and west of the Mobile Regional Airport.,PDS
200101,19,745,200101,19,750,1110285,5227926,ALABAMA,1,2001,January,Thunderstorm Wind,C,25,CLARKE,MOB,19-JAN-01 07:45:00,CST,19-JAN-01 07:50:00,0,0,0,0,15K,,EMERGENCY MANAGER,60,E,,,,,,,,,,,,THOMASVILLE,,,THOMASVILLE,31.91667,-87.73333,31.78333,-87.73333,,"Numerous trees and some power lines were blown down, and some minor roof damage also occurred as a line of severe thunderstorms moved across the area.  Most of the wind damage occurred just east of Highway 43, along Basset Creek, between Thomasville and Fulton.",PDS
200101,19,805,200101,19,810,1110286,5227927,ALABAMA,1,2001,January,Thunderstorm Wind,C,131,WILCOX,MOB,19-JAN-01 08:05:00,CST,19-JAN-01 08:10:00,0,0,0,0,5K,,EMERGENCY MANAGER,50,E,,,,,,,,,,,,PINE HILL,,,PINE HILL,31.98333,-87.58333,31.98333,-87.58333,,Trees were reported downed by strong thunderstorm winds just south of the community.,PDS
200112,14,45,200112,14,50,1125552,5275549,ALABAMA,1,2001,December,Thunderstorm Wind,C,97,MOBILE,MOB,14-DEC-01 00:45:00,CST,14-DEC-01 00:50:00,0,0,0,0,25K,,BROADCAST MEDIA,60,E,,,,,,,,,,,,BUCKS,,,BUCKS,31.01667,-88.05,31.01667,-88.05,,Strong thunderstorm winds produced minor damage to a manufactured home on Highway 43 near Bucks.  Slightly  more significant damage to a nearby outbuilding and a small boat which was sitting near the outbuilding also occurred.,PDS
200101,19,930,200101,19,930,1110693,5231095,ALABAMA,1,2001,January,Thunderstorm Wind,C,51,ELMORE,BMX,19-JAN-01 09:30:00,CST,19-JAN-01 09:30:00,0,0,0,0,3K,0K,BROADCAST MEDIA,50,E,,,,,,,,,,,,ECLECTIC,,,ECLECTIC,32.63333,-86.03333,32.63333,-86.03333,,Trees and power lines were knocked down in Eclectic.,PDS
200101,29,1520,200101,29,1520,1110694,5231096,ALABAMA,1,2001,January,Thunderstorm Wind,C,125,TUSCALOOSA,BMX,29-JAN-01 15:20:00,CST,29-JAN-01 15:20:00,0,0,0,0,1K,0K,EMERGENCY MANAGER,50,E,,,,,,,,,,,,TUSCALOOSA,,,TUSCALOOSA,33.2,-87.56667,33.2,-87.56667,,Trees were blown down in the northern part of Tuscaloosa.,PDS
200101,29,1644,200101,29,1644,1110695,5231097,ALABAMA,1,2001,January,Thunderstorm Wind,C,73,JEFFERSON,BMX,29-JAN-01 16:44:00,CST,29-JAN-01 16:44:00,0,0,0,0,2K,0K,EMERGENCY MANAGER,50,E,,,,,,,,,,,,BIRMINGHAM,,,BIRMINGHAM,33.51667,-86.81667,33.51667,-86.81667,,Trees and power lines were knocked down on 4th Avenue South.,PDS
200101,19,850,200101,19,905,1110687,5231089,ALABAMA,1,2001,January,Thunderstorm Wind,C,85,LOWNDES,BMX,19-JAN-01 08:50:00,CST,19-JAN-01 09:05:00,0,0,0,0,3K,0K,EMERGENCY MANAGER,50,E,,,,,,,,,,,,HAYNEVILLE,,,HAYNEVILLE,32.18333,-86.6,32.18333,-86.6,,Trees and power lines were blown down near Gordonsville and in Hayneville.,PDS
200101,19,924,200101,19,927,1110696,5231197,ALABAMA,1,2001,January,Thunderstorm Wind,C,101,MONTGOMERY,BMX,19-JAN-01 09:24:00,CST,19-JAN-01 09:27:00,0,0,0,0,150K,0K,NWS EMPLOYEE(OFF DUTY),65,E,,,,,,,,,,3,NE,MONTGOMERY,3,NE,MONTGOMERY,32.41667,-86.26667,32.45,-86.21667,,A second path of damage occurred slightly north of the tornado path. Damage occurred from the north side of Gunter Air Force Station along Congressman Dickinson Drive through the Eastern Boulevard/Congressman Dickinson Interchange and into a residential area of Madison Park. One mobile home was de-roofed and one other house suffered signficant roof damage in this area. Other damage was primarily in the form of downed trees and power lines and minor roof damage (shingles removed). This damage path was about 3 miles long and about 200 yards wide. This event was produced by a strong thunderstorm that exhibited a bowing characteristic which is frequently accompanied by weak tornadoes and strong straight-line wind. Wind gusts with the thunderstorms were measured at 48 mph at 9:15 AM at Dannelly Field and 61 mph at Maxwell Air Force base at 9:19 AM.,PDS
200101,19,919,200101,19,919,1110696,5231198,ALABAMA,1,2001,January,Thunderstorm Wind,C,101,MONTGOMERY,BMX,19-JAN-01 09:19:00,CST,19-JAN-01 09:19:00,0,0,0,0,10K,0K,"AWOS,ASOS,MESONET,ETC",53,M,,,,,,,,,,,,MAXWELL AFB,,,MAXWELL AFB,32.38333,-86.35,32.38333,-86.35,,Wind was measured at 61 mph at Maxwell Air Force Base as a bow echo moved through the area.,PDS
200101,19,1030,200101,19,1030,1110690,5231092,ALABAMA,1,2001,January,Thunderstorm Wind,C,17,CHAMBERS,BMX,19-JAN-01 10:30:00,CST,19-JAN-01 10:30:00,0,0,0,0,2K,0K,LAW ENFORCEMENT,50,E,,,,,,,,,,,,LAFAYETTE,,,LAFAYETTE,32.9,-85.38333,32.9,-85.38333,,One large tree was knocked down and blocked CR 289.  The tree caused damage to a fence and a pole.,PDS
200101,19,1040,200101,19,1040,1110691,5231093,ALABAMA,1,2001,January,Thunderstorm Wind,C,81,LEE,BMX,19-JAN-01 10:40:00,CST,19-JAN-01 10:40:00,0,0,0,0,2K,0K,LAW ENFORCEMENT,50,E,,,,,,,,,,6,S,OPELIKA,6,S,OPELIKA,32.56667,-85.36667,32.56667,-85.36667,,Trees were blown down in the Beauregard area.,PDS
200101,19,1000,200101,19,1000,1110692,5231094,ALABAMA,1,2001,January,Thunderstorm Wind,C,87,MACON,BMX,19-JAN-01 10:00:00,CST,19-JAN-01 10:00:00,0,0,0,0,2K,0K,LAW ENFORCEMENT,55,E,,,,,,,,,,,,TUSKEGEE,,,TUSKEGEE,32.43333,-85.7,32.43333,-85.7,,"Power lines were blown down just north of Tuskegee.  The damage occurred on Franklin Road, Oak Street, and School Street.",PDS
200101,19,922,200101,19,925,1110696,5231098,ALABAMA,1,2001,January,Tornado,C,101,MONTGOMERY,BMX,19-JAN-01 09:22:00,CST,19-JAN-01 09:25:00,4,0,0,0,450K,0K,NWS STORM SURVEY,,,,,F0,2.3,100,,,,,2,E,MONTGOMERY,2,E,MONTGOMERY,32.38333,-86.26667,32.4,-86.23333,,A tornado from a bow echo configuration first touched down just west of Greenwood Cemetery on Three Mile Branch in eastern Montgomery (city). The tornado was moving northeastward at approximately 50 mph and moved through the Forest Hills area downing trees and causing minor structural damage to some homes. The tornado crossed the Atlanta Highway and continued to down trees in the Johnstown area of eastern Montgomery. Much of the damage here occurred when trees fell onto structures. The tornado appeared to end on the south edge of Gunter Industrial Park.   Several minor injuries were reported.,PDS
200101,19,1015,200101,19,1015,1110688,5231090,ALABAMA,1,2001,January,Thunderstorm Wind,C,123,TALLAPOOSA,BMX,19-JAN-01 10:15:00,CST,19-JAN-01 10:15:00,0,0,0,0,2K,0K,EMERGENCY MANAGER,50,E,,,,,,,,,,,,REELTOWN,,,REELTOWN,32.6,-85.8,32.6,-85.8,,Trees were knocked down in Reeltown.,PDS
200101,19,930,200101,19,945,1110689,5231091,ALABAMA,1,2001,January,Thunderstorm Wind,C,51,ELMORE,BMX,19-JAN-01 09:30:00,CST,19-JAN-01 09:45:00,0,0,0,0,1K,0K,EMERGENCY MANAGER,50,E,,,,,,,,,,,,WARE,,,WARE,32.45,-86.05,32.45,-86.05,,Trees were blown down in Ware and across extreme southeast Elmore County.,PDS
200102,16,1500,200102,16,1500,1111533,5233683,ALABAMA,1,2001,February,Heat,Z,24,JEFFERSON,BMX,16-FEB-01 15:00:00,CST,16-FEB-01 15:00:00,0,0,0,0,0K,0K,"AWOS,ASOS,MESONET,ETC",,,,,,,,,,,,,,,,,,,,,,,The afternoon high temperature observed at the Birmingham International Airport was 80 degrees.  This temperature established a new daily high temperature.,PDS
200102,16,1500,200102,16,1500,1111534,5233684,ALABAMA,1,2001,February,Heat,Z,44,MONTGOMERY,BMX,16-FEB-01 15:00:00,CST,16-FEB-01 15:00:00,0,0,0,0,0K,0K,"AWOS,ASOS,MESONET,ETC",,,,,,,,,,,,,,,,,,,,,,,The afternoon high temperature recorded at Dannelly Field was 81 degrees.  This temperature tied the previous daily record high temperature.,PDS
200102,9,1733,200102,9,1733,1111535,5233685,ALABAMA,1,2001,February,Thunderstorm Wind,C,127,WALKER,BMX,09-FEB-01 17:33:00,CST,09-FEB-01 17:33:00,0,0,0,0,2K,0K,GOVT OFFICIAL,50,E,,,,,,,,,,15,N,JASPER,15,N,JASPER,34.05,-87.28333,34.05,-87.28333,,A few trees were blown down in Curry and in a couple of other locations in northern Walker County.,PDS
200102,9,1704,200102,9,1704,1111536,5233686,ALABAMA,1,2001,February,Thunderstorm Wind,C,57,FAYETTE,BMX,09-FEB-01 17:04:00,CST,09-FEB-01 17:04:00,0,0,0,0,8K,0K,EMERGENCY MANAGER,55,E,,,,,,,,,,12,NE,FAYETTE,12,NE,FAYETTE,33.8,-87.68333,33.8,-87.68333,,"Several trees were blown down, two barns sustained damage, and one home reported shingle damage in the Fowler's Crossroads area.",PDS
200102,9,1706,200102,9,1706,1111536,5233687,ALABAMA,1,2001,February,Thunderstorm Wind,C,57,FAYETTE,BMX,09-FEB-01 17:06:00,CST,09-FEB-01 17:06:00,0,0,0,0,4K,0K,EMERGENCY MANAGER,50,E,,,,,,,,,,5,W,FAYETTE,5,W,FAYETTE,33.68333,-87.91667,33.68333,-87.91667,,A few trees and power lines were knocked down just west of the city of Fayette.,PDS
200102,25,30,200102,25,30,1111549,5234085,ALABAMA,1,2001,February,Thunderstorm Wind,C,33,COLBERT,BMX,25-FEB-01 00:30:00,CST,25-FEB-01 00:30:00,0,0,0,0,2K,0K,AMATEUR RADIO,50,E,,,,,,,,,,,,CHEROKEE,,,CHEROKEE,34.75,-87.96667,34.75,-87.96667,,Trees were blown down just west of Cherokee.,PDS
200102,16,1600,200102,16,1620,1111555,5234196,ALABAMA,1,2001,February,Thunderstorm Wind,C,21,CHILTON,BMX,16-FEB-01 16:00:00,CST,16-FEB-01 16:20:00,0,0,0,0,5K,0K,EMERGENCY MANAGER,55,E,,,,,,,,,,,,COUNTYWIDE,,,COUNTYWIDE,32.86667,-86.73333,32.86667,-86.73333,"A large bow echo or derecho, a long-lived and widespread convective wind storm, swept across much of the northern two thirds of Alabama.  The wind storm moved into western Alabama around 141 PM and exited the eastern counties around 438 PM.  Wind gusts were estimated between 60 and 105 miles an hour during the event and these gusts produced extensive wind damage throughout the entire area, similar to F0 and F1 tornado damage.  The American Red Cross estimated that at least 2500 homes were damaged and some destroyed.  Major electrical transmission lines were down in Tuscaloosa and Fayette Counties.  Alabama Power estimated that at least 400,000 homes and businesses were initially without power, which is one third of their total customers.  According to Alabama Power, this event ranked as the third highest ever for power outages in the state of Alabama.",Chilton County reported numerous trees blown down in the Pleasant Grove area.  The remainder of the county only had a few trees blown down.,PDS
200102,9,1500,200102,9,1500,1111532,5233682,ALABAMA,1,2001,February,Heat,Z,6,MADISON,BMX,09-FEB-01 15:00:00,CST,09-FEB-01 15:00:00,0,0,0,0,0K,0K,"AWOS,ASOS,MESONET,ETC",,,,,,,,,,,,,,,,,,,,,,,The afternoon high temperature measured at the Huntsville International Airport was 76 degrees.  This temperature tied the previous daily record high temperature.,PDS
200102,9,1748,200102,9,1748,1111538,5233689,ALABAMA,1,2001,February,Thunderstorm Wind,C,125,TUSCALOOSA,BMX,09-FEB-01 17:48:00,CST,09-FEB-01 17:48:00,0,0,0,0,2K,0K,EMERGENCY MANAGER,50,E,,,,,,,,,,,,TUSCALOOSA,,,TUSCALOOSA,33.2,-87.56667,33.2,-87.56667,,Trees were blown down just northeast of Tuscaloosa.,PDS
200102,16,1408,200102,16,1430,1111555,5234202,ALABAMA,1,2001,February,Thunderstorm Wind,C,57,FAYETTE,BMX,16-FEB-01 14:08:00,CST,16-FEB-01 14:30:00,0,0,0,0,250K,0K,EMERGENCY MANAGER,75,E,,,,,,,,,,,,COUNTYWIDE,,,COUNTYWIDE,33.73333,-87.75,33.73333,-87.75,"A large bow echo or derecho, a long-lived and widespread convective wind storm, swept across much of the northern two thirds of Alabama.  The wind storm moved into western Alabama around 141 PM and exited the eastern counties around 438 PM.  Wind gusts were estimated between 60 and 105 miles an hour during the event and these gusts produced extensive wind damage throughout the entire area, similar to F0 and F1 tornado damage.  The American Red Cross estimated that at least 2500 homes were damaged and some destroyed.  Major electrical transmission lines were down in Tuscaloosa and Fayette Counties.  Alabama Power estimated that at least 400,000 homes and businesses were initially without power, which is one third of their total customers.  According to Alabama Power, this event ranked as the third highest ever for power outages in the state of Alabama.","Fayette County reported numerous trees and power lines blown down throughout the county.  A number of the trees fell onto automobiles and homes causing major damage.  A doctors office had its roof torn off in Fayette, and one mobile home was overturned.  No injuries were reported.",PDS
200103,3,1700,200103,3,2000,1111887,5234648,ALABAMA,1,2001,March,Flash Flood,C,1,AUTAUGA,BMX,03-MAR-01 17:00:00,CST,03-MAR-01 20:00:00,0,0,0,0,22K,0K,NEWSPAPER,,,,,,,,,,,,,,COUNTYWIDE,,,COUNTYWIDE,,,,,,A few roads were covered with water and a few homes received minor flood damage.  Many area creeks and streams topped the banks causing minor flooding.  Radar estimated rainfall of 7 to 9 inches over a 28 hour period.,PDS
200102,16,1710,200102,16,1730,1111555,5234332,ALABAMA,1,2001,February,Thunderstorm Wind,C,123,TALLAPOOSA,BMX,16-FEB-01 17:10:00,CST,16-FEB-01 17:30:00,0,0,0,0,3K,0K,EMERGENCY MANAGER,55,E,,,,,,,,,,,,COUNTYWIDE,,,COUNTYWIDE,32.8,-85.85,32.8,-85.85,"A large bow echo or derecho, a long-lived and widespread convective wind storm, swept across much of the northern two thirds of Alabama.  The wind storm moved into western Alabama around 141 PM and exited the eastern counties around 438 PM.  Wind gusts were estimated between 60 and 105 miles an hour during the event and these gusts produced extensive wind damage throughout the entire area, similar to F0 and F1 tornado damage.  The American Red Cross estimated that at least 2500 homes were damaged and some destroyed.  Major electrical transmission lines were down in Tuscaloosa and Fayette Counties.  Alabama Power estimated that at least 400,000 homes and businesses were initially without power, which is one third of their total customers.  According to Alabama Power, this event ranked as the third highest ever for power outages in the state of Alabama.",Tallapoosa County reported several trees down.  The most damage occurred across the southern half of the county.,PDS
200103,3,2200,200103,3,2200,1112342,5237868,ALABAMA,1,2001,March,Flash Flood,C,61,GENEVA,TAE,03-MAR-01 22:00:00,EST,03-MAR-01 22:00:00,0,0,0,0,5K,,EMERGENCY MANAGER,,,,,,,,,,,,,,SAMSON,,,SAMSON,,,,,,"Armstrong, Azela, and County Roads 153 and 9 under water.  Reported by the Geneva County EMA.",PDS
200103,3,2200,200103,3,2210,1112342,5237869,ALABAMA,1,2001,March,Thunderstorm Wind,C,61,GENEVA,TAE,03-MAR-01 22:00:00,EST,03-MAR-01 22:10:00,0,0,0,0,1K,,EMERGENCY MANAGER,,,,,,,,,,,,,,COUNTYWIDE,,,COUNTYWIDE,31.08333,-85.88333,31.08333,-85.88333,,Several trees down.  Reported by the Geneva County EMA.,PDS
200102,16,1543,200102,16,1610,1111555,5234331,ALABAMA,1,2001,February,Thunderstorm Wind,C,121,TALLADEGA,BMX,16-FEB-01 15:43:00,CST,16-FEB-01 16:10:00,0,0,0,0,6K,0K,EMERGENCY MANAGER,55,E,,,,,,,,,,,,COUNTYWIDE,,,COUNTYWIDE,33.38333,-86.15,33.38333,-86.15,"A large bow echo or derecho, a long-lived and widespread convective wind storm, swept across much of the northern two thirds of Alabama.  The wind storm moved into western Alabama around 141 PM and exited the eastern counties around 438 PM.  Wind gusts were estimated between 60 and 105 miles an hour during the event and these gusts produced extensive wind damage throughout the entire area, similar to F0 and F1 tornado damage.  The American Red Cross estimated that at least 2500 homes were damaged and some destroyed.  Major electrical transmission lines were down in Tuscaloosa and Fayette Counties.  Alabama Power estimated that at least 400,000 homes and businesses were initially without power, which is one third of their total customers.  According to Alabama Power, this event ranked as the third highest ever for power outages in the state of Alabama.",Talladega County reported numerous trees and power lines knocked down.  A few homes received minor roof damage.  The most concentrated damage occurred in the northern part of the county.,PDS
200102,16,1440,200102,16,1525,1111555,5234271,ALABAMA,1,2001,February,Thunderstorm Wind,C,73,JEFFERSON,BMX,16-FEB-01 14:40:00,CST,16-FEB-01 15:25:00,4,0,1,0,400K,0K,EMERGENCY MANAGER,75,E,,,,,,,,,,,,COUNTYWIDE,,,COUNTYWIDE,33.56667,-87.88333,33.56667,-87.88333,"A large bow echo or derecho, a long-lived and widespread convective wind storm, swept across much of the northern two thirds of Alabama.  The wind storm moved into western Alabama around 141 PM and exited the eastern counties around 438 PM.  Wind gusts were estimated between 60 and 105 miles an hour during the event and these gusts produced extensive wind damage throughout the entire area, similar to F0 and F1 tornado damage.  The American Red Cross estimated that at least 2500 homes were damaged and some destroyed.  Major electrical transmission lines were down in Tuscaloosa and Fayette Counties.  Alabama Power estimated that at least 400,000 homes and businesses were initially without power, which is one third of their total customers.  According to Alabama Power, this event ranked as the third highest ever for power outages in the state of Alabama.","Jefferson County reported numerous trees and power lines down.  One woman was killed in Ensley when a large tree smashed her car.  One person was injured when a tree fell onto an automobile traveling down  Mountain Brook Parkway.  One person was injured when an 18-wheel truck was blown over on Interstate 65.  Two people sustained minor injuries when a tree fell on a doctor's office building.  Wind gust of 68 mph were reported at the Birmingham International Airport.  Wind gusts of 99 mph were measured at the grandstand level of Legion Field.  Wind gusts of 80 mph or more occurred on Red Mountain.  Area officials estimated that a very large percentage of county roads were temporarily closed due to downed trees.  Many more trees fell on automobiles, homes,  and businesses causing major damage.  Legion Field sustained damage to the large video screen used for replays at the professional football games.  Two private aircraft at the Birmingham International Airport were damaged.  The roof was torn off a portion of Riley Elementary School in southwest Birmingham.  The storms also sheared roofs off buildings and broke several windows.  Hail up to the size of golf balls was also reported with these storms.",PDS
