BEGIN_YEARMONTH,BEGIN_DAY,BEGIN_TIME,END_YEARMONTH,END_DAY,END_TIME,EPISODE_ID,EVENT_ID,STATE,STATE_FIPS,YEAR,MONTH_NAME,EVENT_TYPE,CZ_TYPE,CZ_FIPS,CZ_NAME,WFO,BEGIN_DATE_TIME,CZ_TIMEZONE,END_DATE_TIME,INJURIES_DIRECT,INJURIES_INDIRECT,DEATHS_DIRECT,DEATHS_INDIRECT,DAMAGE_PROPERTY,DAMAGE_CROPS,SOURCE,MAGNITUDE,MAGNITUDE_TYPE,FLOOD_CAUSE,CATEGORY,TOR_F_SCALE,TOR_LENGTH,TOR_WIDTH,TOR_OTHER_WFO,TOR_OTHER_CZ_STATE,TOR_OTHER_CZ_FIPS,TOR_OTHER_CZ_NAME,BEGIN_RANGE,BEGIN_AZIMUTH,BEGIN_LOCATION,END_RANGE,END_AZIMUTH,END_LOCATION,BEGIN_LAT,BEGIN_LON,END_LAT,END_LON,EPISODE_NARRATIVE,EVENT_NARRATIVE,DATA_SOURCE
199706,13,1525,199706,13,1525,2065195,5602316,TENNESSEE,47,1997,June,Thunderstorm Wind,C,141,PUTNAM,OHX,13-JUN-97 15:25:00,CST,13-JUN-97 15:25:00,0,0,0,0,,,,50,,,,,,,,,,,,,COOKEVILLE,,,COOKEVILLE,36.17,-85.5,36.17,-85.5,,Numerous trees were blown down.,PDC
199701,24,1625,199701,24,1625,2059319,5589103,TENNESSEE,47,1997,January,Hail,C,187,WILLIAMSON,OHX,24-JAN-97 16:25:00,CST,24-JAN-97 16:25:00,0,0,0,0,,,,1.75,,,,,,,,,,,,,NOLENSVILLE,,,NOLENSVILLE,35.95,-86.68,35.95,-86.68,Hail was reported by weather spotter and local law enforcement.,,PDC
199701,10,400,199701,10,1400,2058339,5588723,TENNESSEE,47,1997,January,Heavy Snow,Z,20,GIBSON,MEG,10-JAN-97 04:00:00,CST,10-JAN-97 14:00:00,0,0,0,0,.01K,,,,,,,,,,,,,,,,,,,,,,,,Snow fell across much of southwest Tennessee with accumulations of 3 to 5 inches over most of the area.,,PDC
199701,10,400,199701,10,1400,2058339,5588724,TENNESSEE,47,1997,January,Heavy Snow,Z,48,LAUDERDALE,MEG,10-JAN-97 04:00:00,CST,10-JAN-97 14:00:00,0,0,0,0,.01K,,,,,,,,,,,,,,,,,,,,,,,,Snow fell across much of southwest Tennessee with accumulations of 3 to 5 inches over most of the area.,,PDC
199701,8,1800,199701,9,200,2058338,5588712,TENNESSEE,47,1997,January,Winter Storm,Z,1,LAKE,MEG,08-JAN-97 18:00:00,CST,09-JAN-97 02:00:00,0,0,0,0,.01K,,,,,,,,,,,,,,,,,,,,,,,,,,PDC
199701,24,1545,199701,24,1545,2059316,5589100,TENNESSEE,47,1997,January,Hail,C,81,HICKMAN,OHX,24-JAN-97 15:45:00,CST,24-JAN-97 15:45:00,0,0,0,0,,,,.75,,,,,,,,,,,5,N,CENTERVILLE,5,N,CENTERVILLE,35.85,-87.47,35.85,-87.47,Report was by local law enforcement.,,PDC
199701,24,1610,199701,24,1610,2059317,5589101,TENNESSEE,47,1997,January,Hail,C,119,MAURY,OHX,24-JAN-97 16:10:00,CST,24-JAN-97 16:10:00,0,0,0,0,,,,.75,,,,,,,,,,,10,NE,COLUMBIA,10,NE,COLUMBIA,35.72,-86.92,35.72,-86.92,Report was by local law enforcement.,,PDC
199701,24,1610,199701,24,1610,2059318,5589102,TENNESSEE,47,1997,January,Hail,C,187,WILLIAMSON,OHX,24-JAN-97 16:10:00,CST,24-JAN-97 16:10:00,0,0,0,0,,,,.75,,,,,,,,,,,15,SW,FRANKLIN,15,SW,FRANKLIN,35.77,-87.08,35.77,-87.08,Local law enforcement reported hail covering the ground.,,PDC
199705,26,1620,199705,26,1625,1042092,5597626,TENNESSEE,47,1997,May,Hail,C,95,LAKE,MEG,26-MAY-97 16:20:00,CST,26-MAY-97 16:25:00,0,0,0,0,.01K,,,.75,,,,,,,,,,,,,TIPTONVILLE,,,TIPTONVILLE,36.38,-89.48,36.38,-89.48,,,PDC
199705,26,1635,199705,26,1635,1042092,5597627,TENNESSEE,47,1997,May,Thunderstorm Wind,C,131,OBION,MEG,26-MAY-97 16:35:00,CST,26-MAY-97 16:35:00,0,0,0,0,2.5K,,,,,,,,,,,,,,,,OBION,,,OBION,36.27,-89.2,36.27,-89.2,,A satellite dish was destroyed. Two tool sheds and a chimney were damaged. Several trees and a power pole were blown down.,PDC
199705,26,1710,199705,26,1718,1042092,5597628,TENNESSEE,47,1997,May,Hail,C,53,GIBSON,MEG,26-MAY-97 17:10:00,CST,26-MAY-97 17:18:00,0,0,0,0,.02K,,,.75,,,,,,,,,,,,,RUTHERFORD,,,TRENTON,36.13,-88.98,35.98,-88.93,,,PDC
199706,13,2300,199706,14,100,2065196,5602460,TENNESSEE,47,1997,June,Flash Flood,C,43,DICKSON,OHX,13-JUN-97 23:00:00,CST,14-JUN-97 01:00:00,0,0,0,0,,,,,,,,,,,,,,,,,CHARLOTTE,,,CHARLOTTE,,,,,,Several roads had high water.,PDC
199702,28,1235,199702,28,1235,2058125,5585913,TENNESSEE,47,1997,February,Flood,C,107,MCMINN,MRX,28-FEB-97 12:35:00,EST,28-FEB-97 12:35:00,0,0,0,0,,,,,,,,,,,,,,,,,ETOWAH & ATHENS,,,ETOWAH & ATHENS,,,,,"County roads 427, 501, 527, 750, 783 closed due to water. Small creeks out of their banks.",,PDC
199702,28,1235,199702,28,1235,2058126,5585914,TENNESSEE,47,1997,February,Flood,C,121,MEIGS,MRX,28-FEB-97 12:35:00,EST,28-FEB-97 12:35:00,0,0,0,0,,,,,,,,,,,,,,,,,BIG SPRINGS/DECATUR,,,BIG SPRINGS/DECATUR,,,,,"Fork Creek overran county road 322, impeding traffic. Several small creeks out of their banks. Many normally dry culverts overflowing.",,PDC
199701,24,1653,199701,24,1715,2059333,5589119,TENNESSEE,47,1997,January,Tornado,C,189,WILSON,OHX,24-JAN-97 16:53:00,CST,24-JAN-97 17:15:00,0,0,0,0,2M,,,,,,,F2,10.7,440,,,,,,,VINE,,W,WATERTOWN,36.03,-86.37,36.10,-86.17,A tornado in Wilson county started near Vine at Fall Creek Rd. and Hwy 231. The tornado moved northeast and affected the area of Norene especially on Sherrilltown Rd. and Phillips Rd. Storm damage for Wilson county was 2 million dollars. The tornado went from Norene to 2 miles west of Watertown. 100 hogs were killed near Norene on Blue Well Rd. when a barn collapsed on the hogs. 7 homes and 7 mobile homes were destroyed. 40 other homes sustained damage. A dozen barns were destroyed.,,PDC
199701,24,1736,199701,24,1737,2059334,5589120,TENNESSEE,47,1997,January,Tornado,C,165,SUMNER,OHX,24-JAN-97 17:36:00,CST,24-JAN-97 17:37:00,0,0,0,0,,,,,,,,F0,.3,10,,,,,2,W,PORTLAND,2,W,PORTLAND,36.58,-86.55,36.58,-86.55,SKYWARN Spotter observed the tornado. It did no damage. Path length and width are approximations.,,PDC
199705,27,1700,199705,27,1700,2062216,5592151,TENNESSEE,47,1997,May,Flash Flood,C,143,RHEA,MRX,27-MAY-97 17:00:00,EST,27-MAY-97 17:00:00,0,0,0,0,5K,,,,,,,,,,,,,,,,EVENSVILLE,,,EVENSVILLE,,,,,Roads flooded and some closed for a short time.  Highway 27 passable in only one lane for a while between 6-6:45 pm.  Little Richland Creek out of its banks along Highway 27 near Evensville.  Water up to the doors of homes in a mobile home park.,,PDC
199705,31,2315,199705,31,2359,2062217,5592152,TENNESSEE,47,1997,May,Flood,C,143,RHEA,MRX,31-MAY-97 23:15:00,EST,31-MAY-97 23:59:00,0,0,0,0,,,,,,,,,,,,,,,,,COUNTYWIDE,,,COUNTYWIDE,,,,,Minor street and highway flooding throughout the counties.,,PDC
199705,31,2315,199705,31,2359,2062217,5592153,TENNESSEE,47,1997,May,Flood,C,11,BRADLEY,MRX,31-MAY-97 23:15:00,EST,31-MAY-97 23:59:00,0,0,0,0,,,,,,,,,,,,,,,,,COUNTYWIDE,,,COUNTYWIDE,,,,,Minor street and highway flooding throughout the counties.,,PDC
199701,24,1650,199701,24,1658,2059341,5589733,TENNESSEE,47,1997,January,Tornado,C,103,LINCOLN,OHX,24-JAN-97 16:50:00,CST,24-JAN-97 16:58:00,0,0,0,0,.25M,,,,,,,F2,4.2,200,,,,,,NE,DELLROSE,2,NE,DELLROSE,35.13,-86.78,35.18,-86.73,Hot Rock area was hardest hit. 3 homes were totally destroyed and 9 more were damaged by the tornado. 14 outbuildings and one house trailer were damaged.  Tornado path width and length are approximations.,,PDC
199703,1,1602,199703,1,1607,2060864,5595263,TENNESSEE,47,1997,March,Tornado,C,33,CROCKETT,MEG,01-MAR-97 16:02:00,CST,01-MAR-97 16:07:00,0,0,0,0,5K,,,,,,,F2,5,100,,,,,,SW,ALAMO,2,NE,ALAMO,35.77,-89.15,35.82,-89.08,A tornado developed in Crockett County near the town of Alamo. A long porch from a brick house was ripped off. The tornado continued northeast into Gibson county. Several business were damaged and a storage shed was destroyed as the tornado moved through the county. The tornado then reached Carroll county where it reached its peak intensity. Significant damage occurred in the town of McKenzie. Sixty-seven homes and ten businesses were damaged or destroyed. Four people were injured as well.,,PDC
199703,1,1607,199703,1,1640,2060864,5595264,TENNESSEE,47,1997,March,Tornado,C,53,GIBSON,MEG,01-MAR-97 16:07:00,CST,01-MAR-97 16:40:00,0,0,0,0,25K,,,,,,,F2,15,100,,,,,,W,HUMBOLDT,1,NE,MILAN,35.82,-88.93,35.97,-88.70,A tornado developed in Crockett County near the town of Alamo. A long porch from a brick house was ripped off. The tornado continued northeast into Gibson county. Several business were damaged and a storage shed was destroyed as the tornado moved through the county. The tornado then reached Carroll county where it reached its peak intensity. Significant damage occurred in the town of McKenzie. Sixty-seven homes and ten businesses were damaged or destroyed. Four people were injured as well.,,PDC
199703,29,40,199703,29,40,2060955,5596919,TENNESSEE,47,1997,March,Hail,C,13,CAMPBELL,MRX,29-MAR-97 00:40:00,EST,29-MAR-97 00:40:00,0,0,0,0,,,,.75,,,,,,,,,,,,,COUNTYWIDE,,,COUNTYWIDE,36.38,-84.15,36.38,-84.15,A severe thunderstorm produced 3/4 inch hail in the county.,,PDC
199703,29,47,199703,29,47,2060956,5596920,TENNESSEE,47,1997,March,Hail,C,63,HAMBLEN,MRX,29-MAR-97 00:47:00,EST,29-MAR-97 00:47:00,0,0,0,0,,,,.75,,,,,,,,,,,,,W PART OF COUNTY,,,W PART OF COUNTY,36.22,-83.4,36.22,-83.4,A severe thunderstorm produced 3/4 inch hail in west part of county.,,PDC
199706,13,1820,199706,13,1820,2064270,5603915,TENNESSEE,47,1997,June,Thunderstorm Wind,C,89,JEFFERSON,MRX,13-JUN-97 18:20:00,EST,13-JUN-97 18:20:00,0,0,0,0,14K,11K,,,,,,,,,,,,,,,COUNTYWIDE,,,COUNTYWIDE,36.05,-83.47,36.05,-83.47,,Numerous trees and powerlines down throughout the county.,PDC
199706,13,1820,199706,13,1820,1042569,5603916,TENNESSEE,47,1997,June,Thunderstorm Wind,C,57,GRAINGER,MRX,13-JUN-97 18:20:00,EST,13-JUN-97 18:20:00,0,0,0,0,14K,12K,,,,,,,,,,,,,,,COUNTYWIDE,,,COUNTYWIDE,36.27,-83.5,36.27,-83.5,,Numerous trees and powerlines down throughout the county.,PDC
199706,13,1830,199706,13,1830,2064271,5603917,TENNESSEE,47,1997,June,Thunderstorm Wind,C,67,HANCOCK,MRX,13-JUN-97 18:30:00,EST,13-JUN-97 18:30:00,0,0,0,0,10K,8K,,,,,,,,,,,,,,,COUNTYWIDE,,,COUNTYWIDE,36.48,-83.25,36.48,-83.25,,Numerous trees and powerlines down throughout the county.,PDC
199706,13,1850,199706,13,1850,2064272,5603918,TENNESSEE,47,1997,June,Thunderstorm Wind,C,155,SEVIER,MRX,13-JUN-97 18:50:00,EST,13-JUN-97 18:50:00,0,0,0,0,,10K,,,,,,,,,,,,,8,W,SEVIERVILLE,8,W,SEVIERVILLE,35.87,-83.72,35.87,-83.72,,Trees down on Thomas Circle and in western portion of the county.,PDC
199703,29,45,199703,29,45,2060957,5596921,TENNESSEE,47,1997,March,Hail,C,89,JEFFERSON,MRX,29-MAR-97 00:45:00,EST,29-MAR-97 00:45:00,0,0,0,0,,,,.75,,,,,,,,,,,,,JEFFERSON CITY,,,JEFFERSON CITY,36.12,-83.48,36.12,-83.48,A severe thunderstorm produced 3/4 inch hail in Jefferson City.,,PDC
199703,29,106,199703,29,106,2060958,5596922,TENNESSEE,47,1997,March,Hail,C,143,RHEA,MRX,29-MAR-97 01:06:00,EST,29-MAR-97 01:06:00,0,0,0,0,,,,4.00,,,,,,,,,,,,,E PART OF COUNTY,,,E PART OF COUNTY,35.57,-84.82,35.57,-84.82,A severe thunderstorm produced baseball-sized hail just west of Rhea/Meigs county line.,,PDC
199703,29,120,199703,29,120,1039014,5596923,TENNESSEE,47,1997,March,Hail,C,121,MEIGS,MRX,29-MAR-97 01:20:00,EST,29-MAR-97 01:20:00,0,0,0,0,,,,1.75,,,,,,,,,,,,,N PART OF COUNTY,,,N PART OF COUNTY,35.65,-84.68,35.65,-84.68,A severe thunderstorm produced 1 3/4 inch hail in northern part of county.,,PDC
199703,29,130,199703,29,130,2060959,5596924,TENNESSEE,47,1997,March,Hail,C,107,MCMINN,MRX,29-MAR-97 01:30:00,EST,29-MAR-97 01:30:00,0,0,0,0,,,,.75,,,,,,,,,,,,,JUST N OF ATHENS,,,JUST N OF ATHENS,35.45,-84.6,35.45,-84.6,A severe thunderstorm produced 3/4 inch hail just north of Athens.,,PDC
199705,26,955,199705,26,955,2063404,5598030,TENNESSEE,47,1997,May,Thunderstorm Wind,C,81,HICKMAN,OHX,26-MAY-97 09:55:00,CST,26-MAY-97 09:55:00,0,0,0,0,1K,,,,,,,,,,,,,,3,N,PINEWOOD,3,N,PINEWOOD,35.97,-87.48,35.97,-87.48,,A few power lines were down.,PDC
199705,26,940,199705,26,940,2063404,5598031,TENNESSEE,47,1997,May,Thunderstorm Wind,C,85,HUMPHREYS,OHX,26-MAY-97 09:40:00,CST,26-MAY-97 09:40:00,0,0,0,0,,,,50,,,,,,,,,,,5,S,MC EWEN,5,S,MC EWEN,36.05,-87.63,36.05,-87.63,,A few trees were blown down.,PDC
199705,26,1015,199705,26,1015,2063404,5598032,TENNESSEE,47,1997,May,Thunderstorm Wind,C,21,CHEATHAM,OHX,26-MAY-97 10:15:00,CST,26-MAY-97 10:15:00,0,0,0,0,1K,,,,,,,,,,,,,,,,PLEASANT VIEW,,,PLEASANT VIEW,36.4,-87.03,36.4,-87.03,,A few power lines were down.,PDC
199705,26,1020,199705,26,1020,2063404,5598033,TENNESSEE,47,1997,May,Thunderstorm Wind,C,37,DAVIDSON,OHX,26-MAY-97 10:20:00,CST,26-MAY-97 10:20:00,0,0,0,0,,,,50,,,,,,,,,,,2,SE,BELLEVUE,2,SE,BELLEVUE,36.05,-86.9,36.05,-86.9,,A few trees were blown down.,PDC
199705,26,1030,199705,26,1030,2063404,5598034,TENNESSEE,47,1997,May,Thunderstorm Wind,C,187,WILLIAMSON,OHX,26-MAY-97 10:30:00,CST,26-MAY-97 10:30:00,0,0,0,0,,,,50,,,,,,,,,,,,,FRANKLIN,,,FRANKLIN,35.92,-86.9,35.92,-86.9,,Several trees were blown down.,PDC
199706,21,1440,199706,21,1440,2064256,5603800,TENNESSEE,47,1997,June,Thunderstorm Wind,C,9,BLOUNT,MRX,21-JUN-97 14:40:00,EST,21-JUN-97 14:40:00,0,0,0,0,,9K,,,,,,,,,,,,,,,TOWNSEND,,,CADES COVE,35.67,-83.77,35.62,-83.83,Several large trees down across Laurel Creek Road about 2-3 miles out of Cades Cove.  A large tree down across Highway 73 at Great Smoky Mountains National Park entrance.,,PDC
199706,24,1430,199706,24,1430,2064257,5603801,TENNESSEE,47,1997,June,Thunderstorm Wind,C,121,MEIGS,MRX,24-JUN-97 14:30:00,EST,24-JUN-97 14:30:00,0,0,0,0,,8K,,,,,,,,,,,,,,,BIG SPG,,,BIG SPG,35.4,-84.92,35.4,-84.92,Trees down near Big Spring.,,PDC
199706,25,1720,199706,25,1720,1042551,5603802,TENNESSEE,47,1997,June,Thunderstorm Wind,C,25,CLAIBORNE,MRX,25-JUN-97 17:20:00,EST,25-JUN-97 17:20:00,0,0,0,0,,2K,,,,,,,,,,,,,,,CARR QUARRY,,,COUNTYWIDE,36.50,-83.67,36.45,-83.70,"Large limbs blown off trees, mainly in south part of county.",,PDC
199702,21,515,199702,21,520,1037013,5590664,TENNESSEE,47,1997,February,Thunderstorm Wind,C,77,HENDERSON,MEG,21-FEB-97 05:15:00,CST,21-FEB-97 05:20:00,0,0,0,0,1.1K,,,,,,,,,,,,,,,,HURON,,,HURON,35.58,-88.53,35.58,-88.53,A window was blown out of a trailer. Several trees and power lines were blown down.,,PDC
199705,2,1715,199705,2,1715,2063405,5598123,TENNESSEE,47,1997,May,Thunderstorm Wind,C,51,FRANKLIN,OHX,02-MAY-97 17:15:00,CST,02-MAY-97 17:15:00,0,0,0,0,1K,,,,,,,,,,,,,,,,DECHERD,,,DECHERD,35.22,-86.08,35.22,-86.08,,Local law enforcement reported a telephone pole and power lines were down.,PDC
199705,26,2049,199705,26,2049,2063404,5598114,TENNESSEE,47,1997,May,Hail,C,37,DAVIDSON,OHX,26-MAY-97 20:49:00,CST,26-MAY-97 20:49:00,0,0,0,0,,,,1.00,,,,,,,,,,,,,NASHVILLE,,,NASHVILLE,36.13,-86.83,36.13,-86.83,,Quarter size hail reported at I-40/440 junction.,PDC
199705,26,2150,199705,26,2150,2063404,5598115,TENNESSEE,47,1997,May,Thunderstorm Wind,C,149,RUTHERFORD,OHX,26-MAY-97 21:50:00,CST,26-MAY-97 21:50:00,0,0,0,0,1K,,,,,,,,,,,,,,,,LASCASSAS,,,LASCASSAS,35.93,-86.32,35.93,-86.32,,A few power lines were down.,PDC
199705,1,48,199705,1,48,2063405,5598116,TENNESSEE,47,1997,May,Hail,C,31,COFFEE,OHX,01-MAY-97 00:48:00,CST,01-MAY-97 00:48:00,0,0,0,0,,,,.75,,,,,,,,,,,,,MANCHESTER,,,MANCHESTER,35.48,-86.08,35.48,-86.08,,Sheriff's office reported dime size hail in Manchester.,PDC
199705,2,1630,199705,2,1630,2063405,5598117,TENNESSEE,47,1997,May,Thunderstorm Wind,C,117,MARSHALL,OHX,02-MAY-97 16:30:00,CST,02-MAY-97 16:30:00,0,0,0,0,.5K,,,50,,,,,,,,,,,,,CHAPEL HILL,,,CHAPEL HILL,35.63,-86.7,35.63,-86.7,,Sheriff's office reported power lines down.,PDC
199705,2,1649,199705,2,1649,2063405,5598118,TENNESSEE,47,1997,May,Hail,C,3,BEDFORD,OHX,02-MAY-97 16:49:00,CST,02-MAY-97 16:49:00,0,0,0,0,,,,.75,,,,,,,,,,,,,WHEEL,,,WHEEL,35.48,-86.63,35.48,-86.63,,Sheriff's office reported dime size hail.,PDC
199705,2,1649,199705,2,1649,2063405,5598119,TENNESSEE,47,1997,May,Thunderstorm Wind,C,3,BEDFORD,OHX,02-MAY-97 16:49:00,CST,02-MAY-97 16:49:00,0,0,0,0,5K,,,50,,,,,,,,,,,,,NORMANDY,,,NORMANDY,35.45,-86.28,35.45,-86.28,,Sheriff's office reported many power lines down.,PDC
199705,26,1100,199705,26,1100,2063404,5598036,TENNESSEE,47,1997,May,Thunderstorm Wind,C,119,MAURY,OHX,26-MAY-97 11:00:00,CST,26-MAY-97 11:00:00,0,0,0,0,,,,50,,,,,,,,,,,9,E,COLUMBIA,9,E,COLUMBIA,35.62,-86.9,35.62,-86.9,,2 trees were blown down.,PDC
199706,13,1340,199706,13,1340,2065194,5602082,TENNESSEE,47,1997,June,Thunderstorm Wind,C,187,WILLIAMSON,OHX,13-JUN-97 13:40:00,CST,13-JUN-97 13:40:00,0,0,0,0,,,,50,,,,,,,,,,,,,NOLENSVILLE,,,NOLENSVILLE,35.95,-86.68,35.95,-86.68,,Several trees were blown down.,PDC
199703,1,400,199703,11,0,2060855,5595067,TENNESSEE,47,1997,March,Flood,Z,90,HARDEMAN,MEG,01-MAR-97 04:00:00,CST,11-MAR-97 00:00:00,0,0,0,0,.15M,,,,,,,,,,,,,,,,,,,,,,,,"Excessive rainfall during the first few days of March along with rivers that were already high caused prolonged flooding along the Mississippi and Tennessee rivers as well as their tributaries. Along the Mississippi, the river reached levels that had not been seen since 1937. Numerous roads were closed for days. In several counties people had to be evacuated from homes including 400 persons in the town of Rives in Obion county. In Madison county, two persons were killed when their car was swept off a flooded road. One person was killed in Shelby county when his car went over a flooded bridge. One man was also killed in Obion county when he fell out of a boat helping people out of their homes.",,PDC
199703,1,400,199703,11,0,2060855,5595068,TENNESSEE,47,1997,March,Flood,Z,92,HARDIN,MEG,01-MAR-97 04:00:00,CST,11-MAR-97 00:00:00,0,0,0,0,5K,,,,,,,,,,,,,,,,,,,,,,,,"Excessive rainfall during the first few days of March along with rivers that were already high caused prolonged flooding along the Mississippi and Tennessee rivers as well as their tributaries. Along the Mississippi, the river reached levels that had not been seen since 1937. Numerous roads were closed for days. In several counties people had to be evacuated from homes including 400 persons in the town of Rives in Obion county. In Madison county, two persons were killed when their car was swept off a flooded road. One person was killed in Shelby county when his car went over a flooded bridge. One man was also killed in Obion county when he fell out of a boat helping people out of their homes.",,PDC
199703,1,400,199703,11,0,2060855,5595069,TENNESSEE,47,1997,March,Flood,Z,54,HENDERSON,MEG,01-MAR-97 04:00:00,CST,11-MAR-97 00:00:00,0,0,0,0,.1M,,,,,,,,,,,,,,,,,,,,,,,,"Excessive rainfall during the first few days of March along with rivers that were already high caused prolonged flooding along the Mississippi and Tennessee rivers as well as their tributaries. Along the Mississippi, the river reached levels that had not been seen since 1937. Numerous roads were closed for days. In several counties people had to be evacuated from homes including 400 persons in the town of Rives in Obion county. In Madison county, two persons were killed when their car was swept off a flooded road. One person was killed in Shelby county when his car went over a flooded bridge. One man was also killed in Obion county when he fell out of a boat helping people out of their homes.",,PDC
199703,5,628,199703,5,628,2060378,5595600,TENNESSEE,47,1997,March,Thunderstorm Wind,C,37,DAVIDSON,OHX,05-MAR-97 06:28:00,CST,05-MAR-97 06:28:00,0,0,0,0,,,,50,,,,,,,,,,,,,NASHVILLE,,,NASHVILLE,36.13,-86.83,36.13,-86.83,Large tree limb was down at downtown Nashville.,,PDC
199703,5,638,199703,5,915,2060379,5595601,TENNESSEE,47,1997,March,Flash Flood,C,37,DAVIDSON,OHX,05-MAR-97 06:38:00,CST,05-MAR-97 09:15:00,0,0,0,0,,,,,,,,,,,,,,,,,NASHVILLE,,,NASHVILLE,,,,,Roads were flooded in the downtown area near the Bicentennial Mall.Culverts were full.,,PDC
199703,5,1300,199703,5,1600,1038386,5595622,TENNESSEE,47,1997,March,Flash Flood,C,83,HOUSTON,OHX,05-MAR-97 13:00:00,CST,05-MAR-97 16:00:00,0,0,0,0,,,,,,,,,,,,,,,,,COUNTYWIDE,,,COUNTYWIDE,,,,,The Highway Department reported many roads were closed due to high water. Bridges were also washed out.,,PDC
199703,5,1300,199703,5,1600,2060399,5595623,TENNESSEE,47,1997,March,Flash Flood,C,125,MONTGOMERY,OHX,05-MAR-97 13:00:00,CST,05-MAR-97 16:00:00,0,0,0,0,,,,,,,,,,,,,,,,,COUNTYWIDE,,,COUNTYWIDE,,,,,Some roads were closed due to high water.,,PDC
199703,5,1300,199703,5,1600,2060400,5595624,TENNESSEE,47,1997,March,Flash Flood,C,27,CLAY,OHX,05-MAR-97 13:00:00,CST,05-MAR-97 16:00:00,0,0,0,0,,,,,,,,,,,,,,,,,COUNTYWIDE,,,COUNTYWIDE,,,,,Several roads were under water.,,PDC
199703,5,1300,199703,5,1600,2060401,5595625,TENNESSEE,47,1997,March,Flash Flood,C,117,MARSHALL,OHX,05-MAR-97 13:00:00,CST,05-MAR-97 16:00:00,0,0,0,0,,,,,,,,,,,,,,,,,COUNTYWIDE,,,COUNTYWIDE,,,,,Several roads were under water.,,PDC
199703,5,1300,199703,5,1600,1038390,5595626,TENNESSEE,47,1997,March,Flash Flood,C,177,WARREN,OHX,05-MAR-97 13:00:00,CST,05-MAR-97 16:00:00,0,0,0,0,,,,,,,,,,,,,,,,,COUNTYWIDE,,,COUNTYWIDE,,,,,Several roads were under water.,,PDC
199706,17,145,199706,17,150,2065283,5609284,TENNESSEE,47,1997,June,Lightning,C,167,TIPTON,MEG,17-JUN-97 01:45:00,CST,17-JUN-97 01:50:00,0,0,0,0,1K,,,,,,,,,,,,,,,,COVINGTON,,,COVINGTON,,,,,,One house was damaged by a fire started by lightning.,PDC
199706,17,115,199706,17,125,2065283,5609282,TENNESSEE,47,1997,June,Thunderstorm Wind,C,157,SHELBY,MEG,17-JUN-97 01:15:00,CST,17-JUN-97 01:25:00,0,0,0,0,5K,,,,,,,,,,,,,,,,BARTLETT,,,BARTLETT,35.2,-89.88,35.2,-89.88,,A gas station had its roof collapse. Several trees fell on some power lines.,PDC
199702,28,1812,199702,28,1817,2059136,5590683,TENNESSEE,47,1997,February,Hail,C,33,CROCKETT,MEG,28-FEB-97 18:12:00,CST,28-FEB-97 18:17:00,0,0,0,0,.75K,,,1.75,,,,,,,,,,,,,ALAMO,,,ALAMO,35.78,-89.12,35.78,-89.12,,,PDC
199702,28,1907,199702,28,1912,2059137,5590684,TENNESSEE,47,1997,February,Hail,C,47,FAYETTE,MEG,28-FEB-97 19:07:00,CST,28-FEB-97 19:12:00,0,0,0,0,.01K,,,.75,,,,,,,,,,,,,ROSSVILLE,,,ROSSVILLE,35.05,-89.55,35.05,-89.55,,,PDC
199703,2,1700,199703,3,1520,2064172,5605148,TENNESSEE,47,1997,March,Flash Flood,C,149,RUTHERFORD,OHX,02-MAR-97 17:00:00,CST,03-MAR-97 15:20:00,0,0,0,0,,,,,,,,,,,,,,,,,COUNTYWIDE,,,COUNTYWIDE,,,,,,17 roads were covered with high water.,PDC
199703,2,1500,199703,2,2200,2064172,5605144,TENNESSEE,47,1997,March,Flash Flood,C,3,BEDFORD,OHX,02-MAR-97 15:00:00,CST,02-MAR-97 22:00:00,0,0,0,0,,,,,,,,,,,,,,,,,COUNTYWIDE,,,COUNTYWIDE,,,,,,High water on several roads around the county.,PDC
199706,13,1910,199706,13,1910,2064279,5604026,TENNESSEE,47,1997,June,Thunderstorm Wind,C,107,MCMINN,MRX,13-JUN-97 19:10:00,EST,13-JUN-97 19:10:00,0,0,0,0,,9K,,,,,,,,,,,,,,,ATHENS,,,ATHENS,35.45,-84.6,35.45,-84.6,,"Trees down on Decatur Pike, North Jackson Street and College Street.",PDC
199706,13,1905,199706,13,1925,2064280,5604027,TENNESSEE,47,1997,June,Thunderstorm Wind,C,59,GREENE,MRX,13-JUN-97 19:05:00,EST,13-JUN-97 19:25:00,0,0,0,0,10K,8K,,,,,,,,,,,,,,,MOSHEIM,,,GREENEVILLE,36.20,-82.95,36.17,-82.83,,Roof damage and trees down near Mosheim and Greeneville.,PDC
199706,13,1920,199706,13,1920,2064281,5604028,TENNESSEE,47,1997,June,Thunderstorm Wind,C,179,WASHINGTON,MRX,13-JUN-97 19:20:00,EST,13-JUN-97 19:20:00,0,0,0,0,,4K,,,,,,,,,,,,,,,COUNTYWIDE,,,COUNTYWIDE,36.48,-82.5,36.48,-82.5,,A man in the Gray community was trapped in his car from falling trees.  Trees  blown down between Jonesborough and Johnson City.,PDC
199706,13,1925,199706,13,1925,2064282,5604029,TENNESSEE,47,1997,June,Thunderstorm Wind,C,163,SULLIVAN,MRX,13-JUN-97 19:25:00,EST,13-JUN-97 19:25:00,0,0,0,0,,,,52,,,,,,,,,,,,,BRISTOL,,,BRISTOL,36.58,-82.18,36.58,-82.18,,,PDC
199703,2,2230,199703,2,2235,2060821,5594869,TENNESSEE,47,1997,March,Hail,C,53,GIBSON,MEG,02-MAR-97 22:30:00,CST,02-MAR-97 22:35:00,0,0,0,0,.01K,,,.75,,,,,,,,,,,,,RUTHERFORD,,,RUTHERFORD,36.13,-88.98,36.13,-88.98,,,PDC
199704,19,1448,199704,19,1448,2062304,5593135,TENNESSEE,47,1997,April,Hail,C,15,CANNON,OHX,19-APR-97 14:48:00,CST,19-APR-97 14:48:00,0,0,0,0,,,,.88,,,,,,,,,,,,,WOODBURY,,,WOODBURY,35.83,-86.08,35.83,-86.08,Sheriff's office reported nickel size hail.,,PDC
199704,19,1510,199704,19,1510,2062304,5593136,TENNESSEE,47,1997,April,Hail,C,177,WARREN,OHX,19-APR-97 15:10:00,CST,19-APR-97 15:10:00,0,0,0,0,,,,.75,,,,,,,,,,,,,CENTERTOWN,,,CENTERTOWN,35.72,-85.92,35.72,-85.92,Sheriff's office reported nickel size hail.,Sheriff's office reported dime size hail.,PDC
199704,19,1520,199704,19,1520,2062304,5593137,TENNESSEE,47,1997,April,Hail,C,149,RUTHERFORD,OHX,19-APR-97 15:20:00,CST,19-APR-97 15:20:00,0,0,0,0,,,,.88,,,,,,,,,,,12,SE,MURFREESBORO,12,SE,MURFREESBORO,35.73,-86.27,35.73,-86.27,Sheriff's office reported nickel size hail.,Nickel size hail covered the ground.,PDC
199705,26,1818,199705,26,1823,1042092,5597767,TENNESSEE,47,1997,May,Thunderstorm Wind,C,77,HENDERSON,MEG,26-MAY-97 18:18:00,CST,26-MAY-97 18:23:00,0,0,0,0,1K,,,,,,,,,,,,,,,,PARKER XRDS,,,PARKER XRDS,35.8,-88.4,35.8,-88.4,,Several cars were rolled over trapping three persons. No injuries were reported.,PDC
199705,26,1300,199705,26,1305,1042092,5597768,TENNESSEE,47,1997,May,Thunderstorm Wind,C,131,OBION,MEG,26-MAY-97 13:00:00,CST,26-MAY-97 13:05:00,0,0,0,0,30K,,,,,,,,,,,,,,,,RIVES,,,RIVES,36.37,-89.05,36.37,-89.05,,A large farm shed was demolished.,PDC
199706,13,1343,199706,13,1343,2065194,5602081,TENNESSEE,47,1997,June,Thunderstorm Wind,C,37,DAVIDSON,OHX,13-JUN-97 13:43:00,CST,13-JUN-97 13:43:00,0,0,0,0,10K,,,50,,,,,,,,,,,,,JOELTON,,,JOELTON,36.32,-86.87,36.32,-86.87,,Numerous trees down. A tree fell on top of a house.,PDC
199705,19,1800,199705,19,1800,2063408,5598242,TENNESSEE,47,1997,May,Thunderstorm Wind,C,103,LINCOLN,OHX,19-MAY-97 18:00:00,CST,19-MAY-97 18:00:00,0,0,0,0,,,,50,,,,,,,,,,,,,TAFT,,,TAFT,35.02,-86.73,35.02,-86.73,,EMA director reported a few trees down.,PDC
199705,19,1600,199705,19,1600,2063409,5598243,TENNESSEE,47,1997,May,Thunderstorm Wind,C,81,HICKMAN,OHX,19-MAY-97 16:00:00,CST,19-MAY-97 16:00:00,0,0,0,0,,,,50,,,,,,,,,,,,,COUNTYWIDE,,,COUNTYWIDE,35.82,-87.47,35.82,-87.47,,Highway department reported about 5 trees blown down.,PDC
199705,19,1630,199705,19,1630,2063409,5598244,TENNESSEE,47,1997,May,Thunderstorm Wind,C,187,WILLIAMSON,OHX,19-MAY-97 16:30:00,CST,19-MAY-97 16:30:00,0,0,0,0,,,,50,,,,,,,,,,,,,FAIRVIEW,,,FAIRVIEW,35.98,-87.12,35.98,-87.12,,Sheriff's office reported a few trees blown down.,PDC
