BEGIN_YEARMONTH,BEGIN_DAY,BEGIN_TIME,END_YEARMONTH,END_DAY,END_TIME,EPISODE_ID,EVENT_ID,STATE,STATE_FIPS,YEAR,MONTH_NAME,EVENT_TYPE,CZ_TYPE,CZ_FIPS,CZ_NAME,WFO,BEGIN_DATE_TIME,CZ_TIMEZONE,END_DATE_TIME,INJURIES_DIRECT,INJURIES_INDIRECT,DEATHS_DIRECT,DEATHS_INDIRECT,DAMAGE_PROPERTY,DAMAGE_CROPS,SOURCE,MAGNITUDE,MAGNITUDE_TYPE,FLOOD_CAUSE,CATEGORY,TOR_F_SCALE,TOR_LENGTH,TOR_WIDTH,TOR_OTHER_WFO,TOR_OTHER_CZ_STATE,TOR_OTHER_CZ_FIPS,TOR_OTHER_CZ_NAME,BEGIN_RANGE,BEGIN_AZIMUTH,BEGIN_LOCATION,END_RANGE,END_AZIMUTH,END_LOCATION,BEGIN_LAT,BEGIN_LON,END_LAT,END_LON,EPISODE_NARRATIVE,EVENT_NARRATIVE,DATA_SOURCE
199703,28,2130,199703,28,2130,1038425,5595833,TENNESSEE,47,1997,March,Thunderstorm Wind,C,41,DEKALB,OHX,28-MAR-97 21:30:00,CST,28-MAR-97 21:30:00,0,0,0,0,,,,50,,,,,,,,,,,,,BELK,,,BELK,35.83,-85.7,35.83,-85.7,2 trees were blown down.,,PDC
199703,28,2130,199703,28,2130,2060436,5595834,TENNESSEE,47,1997,March,Hail,C,41,DEKALB,OHX,28-MAR-97 21:30:00,CST,28-MAR-97 21:30:00,0,0,0,0,,,,.75,,,,,,,,,,,,,BELK,,,BELK,35.83,-85.7,35.83,-85.7,Dime size hail was reported.,,PDC
199706,13,1500,199706,13,1500,2065194,5602309,TENNESSEE,47,1997,June,Thunderstorm Wind,C,159,SMITH,OHX,13-JUN-97 15:00:00,CST,13-JUN-97 15:00:00,0,0,0,0,,,,50,,,,,,,,,,,,,DEFEATED,,,DEFEATED,36.32,-85.9,36.32,-85.9,,A few trees were blown down.,PDC
199701,10,1100,199701,10,2300,2058105,5585283,TENNESSEE,47,1997,January,Winter Storm,Z,43,SOUTHEAST GREENE,MRX,10-JAN-97 11:00:00,EST,10-JAN-97 23:00:00,0,0,0,0,,,,,,,,,,,,,,,,,,,,,,,,,"An arctic cold front and associated upper level disturbance swept through the southern Appalachians. Snowfall amounts were 1-3 inches in southeast Tennessee, 2-4 inches across the northern Cumberland plateau and central east Tennessee, and 3-5 inches in northeast Tennessee.",,PDC
199701,10,1100,199701,10,2300,2058105,5585284,TENNESSEE,47,1997,January,Winter Storm,Z,44,WASHINGTON,MRX,10-JAN-97 11:00:00,EST,10-JAN-97 23:00:00,0,0,0,0,,,,,,,,,,,,,,,,,,,,,,,,,"An arctic cold front and associated upper level disturbance swept through the southern Appalachians. Snowfall amounts were 1-3 inches in southeast Tennessee, 2-4 inches across the northern Cumberland plateau and central east Tennessee, and 3-5 inches in northeast Tennessee.",,PDC
199701,10,1100,199701,10,2300,2058105,5585285,TENNESSEE,47,1997,January,Winter Storm,Z,45,UNICOI,MRX,10-JAN-97 11:00:00,EST,10-JAN-97 23:00:00,0,0,0,0,,,,,,,,,,,,,,,,,,,,,,,,,"An arctic cold front and associated upper level disturbance swept through the southern Appalachians. Snowfall amounts were 1-3 inches in southeast Tennessee, 2-4 inches across the northern Cumberland plateau and central east Tennessee, and 3-5 inches in northeast Tennessee.",,PDC
199701,10,1100,199701,10,2300,2058105,5585281,TENNESSEE,47,1997,January,Winter Storm,Z,41,COCKE/SMOKY MOUNTAINS,MRX,10-JAN-97 11:00:00,EST,10-JAN-97 23:00:00,0,0,0,0,,,,,,,,,,,,,,,,,,,,,,,,,"An arctic cold front and associated upper level disturbance swept through the southern Appalachians. Snowfall amounts were 1-3 inches in southeast Tennessee, 2-4 inches across the northern Cumberland plateau and central east Tennessee, and 3-5 inches in northeast Tennessee.",,PDC
199706,14,1520,199706,14,1520,2064302,5604150,TENNESSEE,47,1997,June,Thunderstorm Wind,C,1,ANDERSON,MRX,14-JUN-97 15:20:00,EST,14-JUN-97 15:20:00,0,0,0,0,,2K,,,,,,,,,,,,,,,CLINTON,,,CLINTON,36.12,-84.13,36.12,-84.13,,Two trees down on Pumpkin Road near Clinton.,PDC
199706,14,1530,199706,14,1530,2064303,5604151,TENNESSEE,47,1997,June,Thunderstorm Wind,C,145,ROANE,MRX,14-JUN-97 15:30:00,EST,14-JUN-97 15:30:00,0,0,0,0,,11K,,,,,,,,,,,,,4,E,KINGSTON,4,E,KINGSTON,35.87,-84.45,35.87,-84.45,,Trees blown down over eastern part of county.,PDC
199706,14,1,199706,14,1,2064294,5604041,TENNESSEE,47,1997,June,Thunderstorm Wind,C,139,POLK,MRX,14-JUN-97 00:01:00,EST,14-JUN-97 00:01:00,0,0,0,0,23K,17K,,,,,,,,,,,,,,,BENTON,,,BENTON,35.18,-84.67,35.18,-84.67,,Powerlines down in and around the city of Benton with many power outages.  Total power and communications blackout at sheriff's dispatch for about 40 minutes.,PDC
199706,14,14,199706,14,14,2064295,5604042,TENNESSEE,47,1997,June,Thunderstorm Wind,C,11,BRADLEY,MRX,14-JUN-97 00:14:00,EST,14-JUN-97 00:14:00,0,0,0,0,,18K,,,,,,,,,,,,,10,SSW,CLEVELAND,10,SSW,CLEVELAND,35.03,-84.95,35.03,-84.95,,Several trees down in the southern portion of the county near the Georgia border.  One giant oak tree down on Red Clay Park Road and other trees down on Hunt Road.,PDC
199706,14,14,199706,14,14,2064296,5604043,TENNESSEE,47,1997,June,Thunderstorm Wind,C,139,POLK,MRX,14-JUN-97 00:14:00,EST,14-JUN-97 00:14:00,0,0,0,0,,2K,,,,,,,,,,,,,,,DUCKTOWN,,,DUCKTOWN,35.03,-84.38,35.03,-84.38,,Several large limbs downed on roadway.,PDC
199706,14,9,199706,14,9,2064297,5604044,TENNESSEE,47,1997,June,Thunderstorm Wind,C,9,BLOUNT,MRX,14-JUN-97 00:09:00,EST,14-JUN-97 00:09:00,0,0,0,0,,5K,,,,,,,,,,,,,1,NW,TOWNSEND,1,NW,TOWNSEND,35.68,-83.78,35.68,-83.78,,"Several trees downed along and near Route 321 east, just outside of Townsend.",PDC
199706,14,1,199706,14,400,2064298,5604045,TENNESSEE,47,1997,June,Flash Flood,C,123,MONROE,MRX,14-JUN-97 00:01:00,EST,14-JUN-97 04:00:00,0,0,0,0,,,,,,,,,,,,,,,,,COUNTYWIDE,,,COUNTYWIDE,,,,,,"Numerous streets and roads covered with water countywide but especially in the cities of Sweetwater, Tellico Plains, Madisonville and Vonore.  Some roads were covered with water up to 2 feet or more in depth.",PDC
199706,14,735,199706,14,735,2064299,5604046,TENNESSEE,47,1997,June,Hail,C,65,HAMILTON,MRX,14-JUN-97 07:35:00,EST,14-JUN-97 07:35:00,0,0,0,0,,,,.75,,,,,,,,,,,2,E,LOOKOUT MTN,2,E,LOOKOUT MTN,34.98,-85.23,34.98,-85.23,,,PDC
199706,13,1710,199706,13,1710,2065196,5602743,TENNESSEE,47,1997,June,Thunderstorm Wind,C,85,HUMPHREYS,OHX,13-JUN-97 17:10:00,CST,13-JUN-97 17:10:00,0,0,0,0,,,,60,,,,,,,,,,,,,NEW JOHNSONVILLE,,,NEW JOHNSONVILLE,36.02,-87.97,36.02,-87.97,,Winds were estimated to be 60 mph.,PDC
199706,13,1715,199706,13,1715,2065196,5602744,TENNESSEE,47,1997,June,Thunderstorm Wind,C,85,HUMPHREYS,OHX,13-JUN-97 17:15:00,CST,13-JUN-97 17:15:00,0,0,0,0,5K,,,60,,,,,,,,,,,,,NEW JOHNSONVILLE,,,NEW JOHNSONVILLE,36.02,-87.97,36.02,-87.97,,Power poles were down.,PDC
199706,13,1745,199706,13,1745,2065196,5602745,TENNESSEE,47,1997,June,Thunderstorm Wind,C,5,BENTON,OHX,13-JUN-97 17:45:00,CST,13-JUN-97 17:45:00,0,0,0,0,,,,50,,,,,,,,,,,5,SW,HOLLADAY,5,SW,HOLLADAY,35.82,-88.22,35.82,-88.22,,A few trees were blown down at Natchez Trace State Park.,PDC
199706,13,1745,199706,13,1745,2065196,5602746,TENNESSEE,47,1997,June,Thunderstorm Wind,C,43,DICKSON,OHX,13-JUN-97 17:45:00,CST,13-JUN-97 17:45:00,0,0,0,0,,,,50,,,,,,,,,,,,,DICKSON,,,DICKSON,36.08,-87.38,36.08,-87.38,,A few large tree limbs were down.,PDC
199706,13,1800,199706,13,1800,2065196,5602747,TENNESSEE,47,1997,June,Thunderstorm Wind,C,81,HICKMAN,OHX,13-JUN-97 18:00:00,CST,13-JUN-97 18:00:00,0,0,0,0,,,,50,,,,,,,,,,,5,W,CENTERVILLE,5,W,CENTERVILLE,35.78,-87.55,35.78,-87.55,,A few trees were blown down.,PDC
199705,26,1130,199705,26,1130,2063404,5598037,TENNESSEE,47,1997,May,Thunderstorm Wind,C,149,RUTHERFORD,OHX,26-MAY-97 11:30:00,CST,26-MAY-97 11:30:00,0,0,0,0,1K,,,,,,,,,,,,,,,,EAGLEVILLE,,,EAGLEVILLE,35.75,-86.65,35.75,-86.65,,A few power lines were blown down.,PDC
199705,27,245,199705,27,250,2063823,5597779,TENNESSEE,47,1997,May,Thunderstorm Wind,C,167,TIPTON,MEG,27-MAY-97 02:45:00,CST,27-MAY-97 02:50:00,0,0,0,0,5K,,,,,,,,,,,,,,,,BRIGHTON,,,BRIGHTON,35.48,-89.73,35.48,-89.73,,Numerous trees and power lines were knocked down.,PDC
199705,27,300,199705,27,305,2063823,5597780,TENNESSEE,47,1997,May,Hail,C,157,SHELBY,MEG,27-MAY-97 03:00:00,CST,27-MAY-97 03:05:00,0,0,0,0,.01K,,,.75,,,,,,,,,,,,,MEMPHIS,,,MEMPHIS,35.13,-90.02,35.13,-90.02,,,PDC
199705,27,310,199705,27,315,2063823,5597781,TENNESSEE,47,1997,May,Hail,C,157,SHELBY,MEG,27-MAY-97 03:10:00,CST,27-MAY-97 03:15:00,0,0,0,0,.05K,,,.88,,,,,,,,,,,,,COLLIERVILLE,,,COLLIERVILLE,35.05,-89.67,35.05,-89.67,,,PDC
199705,27,340,199705,27,345,2063823,5597782,TENNESSEE,47,1997,May,Hail,C,47,FAYETTE,MEG,27-MAY-97 03:40:00,CST,27-MAY-97 03:45:00,0,0,0,0,.01K,,,.75,,,,,,,,,,,,,SOMERVILLE,,,SOMERVILLE,35.25,-89.35,35.25,-89.35,,,PDC
199705,27,400,199705,27,405,2063823,5597783,TENNESSEE,47,1997,May,Hail,C,69,HARDEMAN,MEG,27-MAY-97 04:00:00,CST,27-MAY-97 04:05:00,0,0,0,0,.05K,,,.88,,,,,,,,,,,,,WHITEVILLE,,,WHITEVILLE,35.33,-89.15,35.33,-89.15,,,PDC
199701,10,1100,199701,10,2300,2058105,5586372,TENNESSEE,47,1997,January,Winter Storm,Z,15,HANCOCK,MRX,10-JAN-97 11:00:00,EST,10-JAN-97 23:00:00,0,0,0,0,,,,,,,,,,,,,,,,,,,,,,,,,"An arctic cold front and associated upper level disturbance swept through the southern Appalachians. Snowfall amounts were 1-3 inches in southeast Tennessee, 2-4 inches across the northern Cumberland plateau and central east Tennessee, and 3-5 inches in northeast Tennessee.",,PDC
199706,28,1340,199706,28,1515,2065199,5602878,TENNESSEE,47,1997,June,Flash Flood,C,133,OVERTON,OHX,28-JUN-97 13:40:00,CST,28-JUN-97 15:15:00,0,0,0,0,,,,,,,,,,,,,,,,,COUNTYWIDE,,,COUNTYWIDE,,,,,,Many roads were completely underwater especially HWY 293 (Rickman-Monterey Highway) between HWY 42 and HWY 84.,PDC
199706,28,2155,199706,28,2240,2065199,5602879,TENNESSEE,47,1997,June,Flash Flood,C,99,LAWRENCE,OHX,28-JUN-97 21:55:00,CST,28-JUN-97 22:40:00,0,0,0,0,,,,,,,,,,,,,,,,,FIVE PTS,,,FIVE PTS,,,,,,Numerous roads had water 2 to 3 inches deep.,PDC
199706,28,2145,199706,29,10,2065199,5602880,TENNESSEE,47,1997,June,Flash Flood,C,181,WAYNE,OHX,28-JUN-97 21:45:00,CST,29-JUN-97 00:10:00,0,0,0,0,,,,,,,,,,,,,,,,,CLIFTON,,,CLIFTON,,,,,,Highway 114 was flooded.,PDC
199706,28,2256,199706,29,100,2065199,5602881,TENNESSEE,47,1997,June,Flash Flood,C,55,GILES,OHX,28-JUN-97 22:56:00,CST,29-JUN-97 01:00:00,0,0,0,0,,,,,,,,,,,,,,,,,NORTH PORTION,,,NORTH PORTION,,,,,,Numerous roads had high water.,PDC
199706,21,1450,199706,21,1450,2064251,5603794,TENNESSEE,47,1997,June,Flash Flood,C,65,HAMILTON,MRX,21-JUN-97 14:50:00,EST,21-JUN-97 14:50:00,0,0,0,0,,,,,,,,,,,,,,,,,CHATTANOOGA,,,CHATTANOOGA,,,,,Numerous reports of flash flooding throughout the Chattanooga area.,,PDC
199706,21,1544,199706,21,1544,2064252,5603795,TENNESSEE,47,1997,June,Flash Flood,C,129,MORGAN,MRX,21-JUN-97 15:44:00,EST,21-JUN-97 15:44:00,0,0,0,0,,,,,,,,,,,,,,,,,COUNTYWIDE,,,COUNTYWIDE,,,,,Street and ditch and small stream flooding throughout most of the county.,,PDC
199706,26,1602,199706,26,1700,2065200,5602882,TENNESSEE,47,1997,June,Flash Flood,C,177,WARREN,OHX,26-JUN-97 16:02:00,CST,26-JUN-97 17:00:00,0,0,0,0,,,,,,,,,,,,,,,,,MC MINNVILLE,,,MC MINNVILLE,,,,,,2 or 3 streets closed in town due to high water. There is high water on may county roads throughout Warren county.,PDC
199706,29,1905,199706,29,2200,2065200,5602883,TENNESSEE,47,1997,June,Flash Flood,C,181,WAYNE,OHX,29-JUN-97 19:05:00,CST,29-JUN-97 22:00:00,0,0,0,0,,,,,,,,,,,,,,,,,EASTERN SECTIONS,,,EASTERN SECTIONS,,,,,,Some secondary roads had high water in eastern part of county.,PDC
199706,29,1905,199706,29,2200,2065200,5602884,TENNESSEE,47,1997,June,Flash Flood,C,99,LAWRENCE,OHX,29-JUN-97 19:05:00,CST,29-JUN-97 22:00:00,0,0,0,0,,,,,,,,,,,,,,,,,WESTERN SECTIONS,,,WESTERN SECTIONS,,,,,,Some secondary roads had high water in western part of Wayne county.,PDC
199706,30,1405,199706,30,1600,2065200,5602885,TENNESSEE,47,1997,June,Flash Flood,C,125,MONTGOMERY,OHX,30-JUN-97 14:05:00,CST,30-JUN-97 16:00:00,0,0,0,0,,,,,,,,,,,,,,,,,CLARKSVILLE,,,CLARKSVILLE,,,,,,"4 to 5 inches of water were on several major roads such as state highway 79 between Woodlawn and Clarksville, and U.S. Route 41A northbound near Clarksville.",PDC
199705,26,2015,199705,26,2020,1042092,5597766,TENNESSEE,47,1997,May,Hail,C,23,CHESTER,MEG,26-MAY-97 20:15:00,CST,26-MAY-97 20:20:00,0,0,0,0,.01K,,,.75,,,,,,,,,,,,,HENDERSON,,,HENDERSON,35.43,-88.67,35.43,-88.67,,,PDC
199706,13,1830,199706,13,1850,2064273,5603919,TENNESSEE,47,1997,June,Thunderstorm Wind,C,65,HAMILTON,MRX,13-JUN-97 18:30:00,EST,13-JUN-97 18:50:00,0,0,0,0,15K,9K,,,,,,,,,,,,,,,BAKEWELL,,,BIRCHWOOD,35.35,-85.13,35.37,-85.00,,Numerous trees and powerlines downacross the northern part of the county.,PDC
199706,13,1810,199706,13,1810,2064274,5603920,TENNESSEE,47,1997,June,Thunderstorm Wind,C,25,CLAIBORNE,MRX,13-JUN-97 18:10:00,EST,13-JUN-97 18:10:00,0,0,0,0,20K,15K,,,,,,,,,,,,,,,COUNTYWIDE,,,COUNTYWIDE,36.45,-83.7,36.45,-83.7,,Trees down all over Harrogate blocking Highway 25E between Tazewell and Harrogate.  Roofs blown off trailers in southern part of county in Powell Valley area.  Trees and powerlines down throughout county.,PDC
199706,13,1830,199706,13,1830,2064275,5603921,TENNESSEE,47,1997,June,Thunderstorm Wind,C,73,HAWKINS,MRX,13-JUN-97 18:30:00,EST,13-JUN-97 18:30:00,0,0,0,0,15K,7K,,,,,,,,,,,,,,,COUNTYWIDE,,,COUNTYWIDE,36.42,-82.97,36.42,-82.97,,Trees and powerlines down throughout county.,PDC
199706,13,1845,199706,13,1845,2064278,5603924,TENNESSEE,47,1997,June,Thunderstorm Wind,C,89,JEFFERSON,MRX,13-JUN-97 18:45:00,EST,13-JUN-97 18:45:00,0,0,0,0,10K,5K,,,,,,,,,,,,,,,DANDRIDGE,,,NEW MARKET,36.02,-83.42,36.10,-83.55,,Trees down near Dandridge on Chestnut Grove.  Powerlines down in New Market.,PDC
199706,14,1815,199706,14,1815,2064311,5604159,TENNESSEE,47,1997,June,Flash Flood,C,155,SEVIER,MRX,14-JUN-97 18:15:00,EST,14-JUN-97 18:15:00,0,0,0,0,,,,,,,,,,,,,,,,,SEVIERVILLE,,,SEVIERVILLE,,,,,,Creeks out of their banks on Henrytown Road.  Flash flooding had washed out part of Henrytown Road.,PDC
199706,14,1745,199706,14,1745,2064312,5604160,TENNESSEE,47,1997,June,Flash Flood,C,63,HAMBLEN,MRX,14-JUN-97 17:45:00,EST,14-JUN-97 17:45:00,0,0,0,0,,,,,,,,,,,,,,,,,COUNTYWIDE,,,COUNTYWIDE,,,,,,Hamblen county EOC reported numerous bridges washed out on backroads in eastern and southern parts of the county.,PDC
199706,1,0,199706,1,100,2064313,5604161,TENNESSEE,47,1997,June,Flood,C,107,MCMINN,MRX,01-JUN-97 00:00:00,EST,01-JUN-97 01:00:00,0,0,0,0,,,,,,,,,,,,,,,,,COUNTYWIDE,,,COUNTYWIDE,,,,,Minor street and highway flooding throughout the counties.,,PDC
199701,10,1100,199701,10,2300,2058105,5585289,TENNESSEE,47,1997,January,Winter Storm,Z,67,ROANE,MRX,10-JAN-97 11:00:00,EST,10-JAN-97 23:00:00,0,0,0,0,,,,,,,,,,,,,,,,,,,,,,,,,"An arctic cold front and associated upper level disturbance swept through the southern Appalachians. Snowfall amounts were 1-3 inches in southeast Tennessee, 2-4 inches across the northern Cumberland plateau and central east Tennessee, and 3-5 inches in northeast Tennessee.",,PDC
199701,10,1100,199701,10,2300,2058105,5585290,TENNESSEE,47,1997,January,Winter Storm,Z,68,LOUDON,MRX,10-JAN-97 11:00:00,EST,10-JAN-97 23:00:00,0,0,0,0,,,,,,,,,,,,,,,,,,,,,,,,,"An arctic cold front and associated upper level disturbance swept through the southern Appalachians. Snowfall amounts were 1-3 inches in southeast Tennessee, 2-4 inches across the northern Cumberland plateau and central east Tennessee, and 3-5 inches in northeast Tennessee.",,PDC
199701,10,1100,199701,10,2300,2058105,5585291,TENNESSEE,47,1997,January,Winter Storm,Z,69,KNOX,MRX,10-JAN-97 11:00:00,EST,10-JAN-97 23:00:00,0,0,0,0,,,,,,,,,,,,,,,,,,,,,,,,,"An arctic cold front and associated upper level disturbance swept through the southern Appalachians. Snowfall amounts were 1-3 inches in southeast Tennessee, 2-4 inches across the northern Cumberland plateau and central east Tennessee, and 3-5 inches in northeast Tennessee.",,PDC
199701,10,1100,199701,10,2300,2058105,5585301,TENNESSEE,47,1997,January,Winter Storm,Z,87,SOUTHEAST MONROE,MRX,10-JAN-97 11:00:00,EST,10-JAN-97 23:00:00,0,0,0,0,,,,,,,,,,,,,,,,,,,,,,,,,"An arctic cold front and associated upper level disturbance swept through the southern Appalachians. Snowfall amounts were 1-3 inches in southeast Tennessee, 2-4 inches across the northern Cumberland plateau and central east Tennessee, and 3-5 inches in northeast Tennessee.",,PDC
199701,10,1100,199701,10,2300,2058105,5586369,TENNESSEE,47,1997,January,Winter Storm,Z,12,SCOTT,MRX,10-JAN-97 11:00:00,EST,10-JAN-97 23:00:00,0,0,0,0,,,,,,,,,,,,,,,,,,,,,,,,,"An arctic cold front and associated upper level disturbance swept through the southern Appalachians. Snowfall amounts were 1-3 inches in southeast Tennessee, 2-4 inches across the northern Cumberland plateau and central east Tennessee, and 3-5 inches in northeast Tennessee.",,PDC
199701,10,1100,199701,10,2300,2058105,5586370,TENNESSEE,47,1997,January,Winter Storm,Z,13,CAMPBELL,MRX,10-JAN-97 11:00:00,EST,10-JAN-97 23:00:00,0,0,0,0,,,,,,,,,,,,,,,,,,,,,,,,,"An arctic cold front and associated upper level disturbance swept through the southern Appalachians. Snowfall amounts were 1-3 inches in southeast Tennessee, 2-4 inches across the northern Cumberland plateau and central east Tennessee, and 3-5 inches in northeast Tennessee.",,PDC
199701,10,1100,199701,10,2300,2058105,5586371,TENNESSEE,47,1997,January,Winter Storm,Z,14,CLAIBORNE,MRX,10-JAN-97 11:00:00,EST,10-JAN-97 23:00:00,0,0,0,0,,,,,,,,,,,,,,,,,,,,,,,,,"An arctic cold front and associated upper level disturbance swept through the southern Appalachians. Snowfall amounts were 1-3 inches in southeast Tennessee, 2-4 inches across the northern Cumberland plateau and central east Tennessee, and 3-5 inches in northeast Tennessee.",,PDC
199701,10,1100,199701,10,2300,2058105,5585302,TENNESSEE,47,1997,January,Winter Storm,Z,99,HAMILTON,MRX,10-JAN-97 11:00:00,EST,10-JAN-97 23:00:00,0,0,0,0,,,,,,,,,,,,,,,,,,,,,,,,,"An arctic cold front and associated upper level disturbance swept through the southern Appalachians. Snowfall amounts were 1-3 inches in southeast Tennessee, 2-4 inches across the northern Cumberland plateau and central east Tennessee, and 3-5 inches in northeast Tennessee.",,PDC
199706,13,1930,199706,13,1930,2064287,5604034,TENNESSEE,47,1997,June,Thunderstorm Wind,C,19,CARTER,MRX,13-JUN-97 19:30:00,EST,13-JUN-97 19:30:00,0,0,0,0,,5K,,,,,,,,,,,,,,SW,ELIZABETHTON,4,S,ELIZABETHTON,36.32,-82.27,36.30,-82.22,,Numerous trees down on Powder Branch Road and Gap Creek Road.,PDC
199706,27,1735,199706,27,1750,2065289,5609296,TENNESSEE,47,1997,June,Thunderstorm Wind,C,157,SHELBY,MEG,27-JUN-97 17:35:00,CST,27-JUN-97 17:50:00,0,0,0,0,10K,,,,,,,,,,,,,,,,MEMPHIS,,,MEMPHIS,35.13,-90.02,35.13,-90.02,,"Numerous trees, power lines and several street signs were knocked down.",PDC
199706,27,1805,199706,27,1810,2065289,5609297,TENNESSEE,47,1997,June,Thunderstorm Wind,C,157,SHELBY,MEG,27-JUN-97 18:05:00,CST,27-JUN-97 18:10:00,0,0,0,0,5K,,,,,,,,,,,,,,,,COLLIERVILLE,,,COLLIERVILLE,35.05,-89.67,35.05,-89.67,,Several large trees were blown down.,PDC
199705,26,1030,199705,26,1030,2063403,5598022,TENNESSEE,47,1997,May,Thunderstorm Wind,C,187,WILLIAMSON,OHX,26-MAY-97 10:30:00,CST,26-MAY-97 10:30:00,0,0,0,0,,,,50,,,,,,,,,,,,,FRANKLIN,,,FRANKLIN,35.92,-86.9,35.92,-86.9,,Williamson county EMA reported several trees down around the county.,PDC
199701,10,1100,199701,10,2300,2058105,5585279,TENNESSEE,47,1997,January,Winter Storm,Z,39,HAMBLEN,MRX,10-JAN-97 11:00:00,EST,10-JAN-97 23:00:00,0,0,0,0,,,,,,,,,,,,,,,,,,,,,,,,,"An arctic cold front and associated upper level disturbance swept through the southern Appalachians. Snowfall amounts were 1-3 inches in southeast Tennessee, 2-4 inches across the northern Cumberland plateau and central east Tennessee, and 3-5 inches in northeast Tennessee.",,PDC
199705,19,1900,199705,19,1905,2063829,5597895,TENNESSEE,47,1997,May,Thunderstorm Wind,C,77,HENDERSON,MEG,19-MAY-97 19:00:00,CST,19-MAY-97 19:05:00,0,0,0,0,2K,,,,,,,,,,,,,,,,LEXINGTON,,,LEXINGTON,35.65,-88.4,35.65,-88.4,,A drive-in restaurant lost part of its awning and winds blew a sign out of the ground and damaged speakers and fixtures. Another restaurant had its sign knocked down.,PDC
199705,26,1830,199705,26,1830,2063404,5598113,TENNESSEE,47,1997,May,Hail,C,39,DECATUR,OHX,26-MAY-97 18:30:00,CST,26-MAY-97 18:30:00,0,0,0,0,,,,1.50,,,,,,,,,,,,,PARSONS,,,PARSONS,35.65,-88.13,35.65,-88.13,,Ping pong ball  size hail reported at Parsons.,PDC
199705,2,1650,199705,2,1650,2063405,5598122,TENNESSEE,47,1997,May,Thunderstorm Wind,C,103,LINCOLN,OHX,02-MAY-97 16:50:00,CST,02-MAY-97 16:50:00,0,0,0,0,,,,50,,,,,,,,,,,,,DELLROSE,,,DELLROSE,35.12,-86.82,35.12,-86.82,,Local law enforcement reported a few  trees blown down.,PDC
199701,10,1100,199701,10,2300,2058105,5585277,TENNESSEE,47,1997,January,Winter Storm,Z,37,UNION,MRX,10-JAN-97 11:00:00,EST,10-JAN-97 23:00:00,0,0,0,0,,,,,,,,,,,,,,,,,,,,,,,,,"An arctic cold front and associated upper level disturbance swept through the southern Appalachians. Snowfall amounts were 1-3 inches in southeast Tennessee, 2-4 inches across the northern Cumberland plateau and central east Tennessee, and 3-5 inches in northeast Tennessee.",,PDC
199701,10,1100,199701,10,2300,2058105,5585278,TENNESSEE,47,1997,January,Winter Storm,Z,38,GRAINGER,MRX,10-JAN-97 11:00:00,EST,10-JAN-97 23:00:00,0,0,0,0,,,,,,,,,,,,,,,,,,,,,,,,,"An arctic cold front and associated upper level disturbance swept through the southern Appalachians. Snowfall amounts were 1-3 inches in southeast Tennessee, 2-4 inches across the northern Cumberland plateau and central east Tennessee, and 3-5 inches in northeast Tennessee.",,PDC
199706,13,1740,199706,13,1740,2064262,5603907,TENNESSEE,47,1997,June,Thunderstorm Wind,C,13,CAMPBELL,MRX,13-JUN-97 17:40:00,EST,13-JUN-97 17:40:00,0,0,0,0,20K,9K,,,,,,,,,,,,,,,COUNTYWIDE,,,COUNTYWIDE,36.38,-84.15,36.38,-84.15,,Numerous trees and powerlines down throughout county.,PDC
199706,13,1740,199706,13,1740,2064263,5603908,TENNESSEE,47,1997,June,Thunderstorm Wind,C,1,ANDERSON,MRX,13-JUN-97 17:40:00,EST,13-JUN-97 17:40:00,0,0,0,0,1K,5K,,52,,,,,,,,,,,,,ANDERSONVILLE,,,LAKE CITY,36.20,-84.03,36.22,-84.15,,Several trees down and a flag pole blown down in Andersonville.  Several trees down in Lake City.,PDC
199706,13,1800,199706,13,1800,2064264,5603909,TENNESSEE,47,1997,June,Thunderstorm Wind,C,65,HAMILTON,MRX,13-JUN-97 18:00:00,EST,13-JUN-97 18:00:00,0,0,0,0,,7K,,,,,,,,,,,,,,,SALE CREEK,,,SALE CREEK,35.38,-85.12,35.38,-85.12,,Several trees down in northern part of county in and around Sale Creek.,PDC
199705,26,2055,199705,26,2100,1042092,5597765,TENNESSEE,47,1997,May,Hail,C,71,HARDIN,MEG,26-MAY-97 20:55:00,CST,26-MAY-97 21:00:00,0,0,0,0,.35K,,,1.25,,,,,,,,,,,,,COUNCE,,,COUNCE,35.05,-88.28,35.05,-88.28,,,PDC
199705,28,1730,199705,28,1915,2063825,5597890,TENNESSEE,47,1997,May,Flood,C,113,MADISON,MEG,28-MAY-97 17:30:00,CST,28-MAY-97 19:15:00,0,0,0,0,.1K,,,,,,,,,,,,,,,,JACKSON,,,JACKSON,,,,,,Heavy rain produced urban flooding in the Jackson area. Several roads accumulated 6 to 8 inches of water on them forcing them to be closed for a few hours.,PDC
199705,30,1703,199705,30,1708,2063826,5597891,TENNESSEE,47,1997,May,Hail,C,167,TIPTON,MEG,30-MAY-97 17:03:00,CST,30-MAY-97 17:08:00,0,0,0,0,.75K,,,1.75,,,,,,,,,,,4,W,COVINGTON,4,W,COVINGTON,35.57,-89.73,35.57,-89.73,,,PDC
199705,26,2030,199705,26,2035,1042092,5597764,TENNESSEE,47,1997,May,Thunderstorm Wind,C,109,MCNAIRY,MEG,26-MAY-97 20:30:00,CST,26-MAY-97 20:35:00,0,0,0,0,5K,,,,,,,,,,,,,,,,MC NAIRY,,,MC NAIRY,35.32,-88.63,35.32,-88.63,,Several trees and power lines were blown down.,PDC
199706,13,1745,199706,13,1745,2064265,5603910,TENNESSEE,47,1997,June,Thunderstorm Wind,C,25,CLAIBORNE,MRX,13-JUN-97 17:45:00,EST,13-JUN-97 17:45:00,0,0,0,0,,5K,,,,,,,,,,,,,5,N,TAZEWELL,5,N,TAZEWELL,36.52,-83.57,36.52,-83.57,,Numerous trees down just north of Tazewell.,PDC
199706,13,1740,199706,13,1740,2064266,5603911,TENNESSEE,47,1997,June,Thunderstorm Wind,C,105,LOUDON,MRX,13-JUN-97 17:40:00,EST,13-JUN-97 17:40:00,0,0,0,0,,11K,,,,,,,,,,,,,,,PHILADELPHIA,,,PHILADELPHIA,35.68,-84.4,35.68,-84.4,,Numerous trees down in southern portion of the county near and west of Philadelphia.,PDC
199706,13,1755,199706,13,1755,2064267,5603912,TENNESSEE,47,1997,June,Hail,C,93,KNOX,MRX,13-JUN-97 17:55:00,EST,13-JUN-97 17:55:00,0,0,0,0,,,,.75,,,,,,,,,,,,,KNOXVILLE,,,KNOXVILLE,35.97,-83.93,35.97,-83.93,,Three-quarter inch hail just off the I-640 bypass.,PDC
199706,13,1817,199706,13,1817,2064268,5603913,TENNESSEE,47,1997,June,Thunderstorm Wind,C,9,BLOUNT,MRX,13-JUN-97 18:17:00,EST,13-JUN-97 18:17:00,0,0,0,0,,9K,,,,,,,,,,,,,7,S,MARYVILLE,7,S,MARYVILLE,35.65,-83.97,35.65,-83.97,,Numerous trees downnear and along Montvale Road.  High water problems on Highway 411 south and on Old Niles Ferry Road.,PDC
199706,13,1800,199706,13,1800,2064269,5603914,TENNESSEE,47,1997,June,Thunderstorm Wind,C,173,UNION,MRX,13-JUN-97 18:00:00,EST,13-JUN-97 18:00:00,0,0,0,0,18K,15K,,,,,,,,,,,,,,,COUNTYWIDE,,,COUNTYWIDE,36.28,-83.85,36.28,-83.85,,Numerous trees and powerlines down throughout county.,PDC
199706,28,1230,199706,28,1415,2065199,5602472,TENNESSEE,47,1997,June,Flash Flood,C,177,WARREN,OHX,28-JUN-97 12:30:00,CST,28-JUN-97 14:15:00,0,0,0,0,,,,,,,,,,,,,,,,,MC MINNVILLE,,,MC MINNVILLE,,,,,,One foot of water over roads in southeast part of town. 4 or 5 roads were barricaded due to high water.,PDC
199706,27,1910,199706,27,1915,2065289,5609384,TENNESSEE,47,1997,June,Thunderstorm Wind,C,69,HARDEMAN,MEG,27-JUN-97 19:10:00,CST,27-JUN-97 19:15:00,0,0,0,0,1K,,,,,,,,,,,,,,,,CLOVERPORT,,,CLOVERPORT,35.4,-89.02,35.4,-89.02,,A few power lines were blown down.,PDC
199705,19,1700,199705,19,1700,2063408,5598133,TENNESSEE,47,1997,May,Thunderstorm Wind,C,161,STEWART,OHX,19-MAY-97 17:00:00,CST,19-MAY-97 17:00:00,0,0,0,0,,,,50,,,,,,,,,,,,,BIG ROCK,,,BIG ROCK,36.58,-87.75,36.58,-87.75,,Highway department reported a tree blown down.,PDC
199705,19,1619,199705,19,1619,2063408,5598134,TENNESSEE,47,1997,May,Thunderstorm Wind,C,187,WILLIAMSON,OHX,19-MAY-97 16:19:00,CST,19-MAY-97 16:19:00,0,0,0,0,50K,,,,,,,,,,,,,,,,FAIRVIEW,,,FAIRVIEW,35.98,-87.12,35.98,-87.12,,Trees and wires were down.,PDC
