BEGIN_YEARMONTH,BEGIN_DAY,BEGIN_TIME,END_YEARMONTH,END_DAY,END_TIME,EPISODE_ID,EVENT_ID,STATE,STATE_FIPS,YEAR,MONTH_NAME,EVENT_TYPE,CZ_TYPE,CZ_FIPS,CZ_NAME,WFO,BEGIN_DATE_TIME,CZ_TIMEZONE,END_DATE_TIME,INJURIES_DIRECT,INJURIES_INDIRECT,DEATHS_DIRECT,DEATHS_INDIRECT,DAMAGE_PROPERTY,DAMAGE_CROPS,SOURCE,MAGNITUDE,MAGNITUDE_TYPE,FLOOD_CAUSE,CATEGORY,TOR_F_SCALE,TOR_LENGTH,TOR_WIDTH,TOR_OTHER_WFO,TOR_OTHER_CZ_STATE,TOR_OTHER_CZ_FIPS,TOR_OTHER_CZ_NAME,BEGIN_RANGE,BEGIN_AZIMUTH,BEGIN_LOCATION,END_RANGE,END_AZIMUTH,END_LOCATION,BEGIN_LAT,BEGIN_LON,END_LAT,END_LON,EPISODE_NARRATIVE,EVENT_NARRATIVE,DATA_SOURCE
199701,5,430,199701,5,430,2058102,5586365,TENNESSEE,47,1997,January,Thunderstorm Wind,C,171,UNICOI,MRX,05-JAN-97 04:30:00,EST,05-JAN-97 04:30:00,0,0,0,0,,7K,,,,,,,,,,,,,,,ERWIN,,,ERWIN,36.15,-82.42,36.15,-82.42,A few trees down across the county.  Reported by the sheriff's office.,,PDC
199701,5,430,199701,5,430,2058103,5586366,TENNESSEE,47,1997,January,Thunderstorm Wind,C,19,CARTER,MRX,05-JAN-97 04:30:00,EST,05-JAN-97 04:30:00,0,0,0,0,,2K,,,,,,,,,,,,,,,COUNTYWIDE,,,COUNTYWIDE,36.28,-82.15,36.28,-82.15,Tree down near lake.  Reported by sheriff's office.,,PDC
199705,26,1710,199705,26,1715,1042092,5597759,TENNESSEE,47,1997,May,Thunderstorm Wind,C,53,GIBSON,MEG,26-MAY-97 17:10:00,CST,26-MAY-97 17:15:00,0,0,0,0,1K,,,,,,,,,,,,,,,,KENTON,,,KENTON,36.2,-89.02,36.2,-89.02,,The roof of a house was blown off.,PDC
199705,26,1820,199705,26,1820,1042092,5597760,TENNESSEE,47,1997,May,Hail,C,97,LAUDERDALE,MEG,26-MAY-97 18:20:00,CST,26-MAY-97 18:20:00,0,0,0,0,.01K,,,.75,,,,,,,,,,,,,HALLS,,,HALLS,35.87,-89.4,35.87,-89.4,,,PDC
199705,26,1900,199705,26,1905,1042092,5597761,TENNESSEE,47,1997,May,Hail,C,75,HAYWOOD,MEG,26-MAY-97 19:00:00,CST,26-MAY-97 19:05:00,0,0,0,0,.76K,,,1.75,,,,,,,,,,,5,N,BROWNSVILLE,5,N,BROWNSVILLE,35.67,-89.27,35.67,-89.27,,,PDC
199705,26,1915,199705,26,1920,1042092,5597762,TENNESSEE,47,1997,May,Thunderstorm Wind,C,75,HAYWOOD,MEG,26-MAY-97 19:15:00,CST,26-MAY-97 19:20:00,0,0,0,0,1K,,,,,,,,,,,,,,,,BROWNSVILLE,,,BROWNSVILLE,35.6,-89.27,35.6,-89.27,,Several trees were knocked down.,PDC
199703,28,2055,199703,28,2055,2060422,5595819,TENNESSEE,47,1997,March,Hail,C,169,TROUSDALE,OHX,28-MAR-97 20:55:00,CST,28-MAR-97 20:55:00,0,0,0,0,,,,.75,,,,,,,,,,,,,PROVIDENCE,,,PROVIDENCE,36.33,-86.15,36.33,-86.15,Sheriff reported dime size hail.,,PDC
199703,28,2100,199703,28,2100,2060423,5595820,TENNESSEE,47,1997,March,Hail,C,111,MACON,OHX,28-MAR-97 21:00:00,CST,28-MAR-97 21:00:00,0,0,0,0,,,,.75,,,,,,,,,,,,,RED BOILING SPGS,,,RED BOILING SPGS,36.53,-85.85,36.53,-85.85,Penny size hail was reported by sheriff's office.,,PDC
199703,28,2140,199703,28,2140,2060424,5595821,TENNESSEE,47,1997,March,Thunderstorm Wind,C,55,GILES,OHX,28-MAR-97 21:40:00,CST,28-MAR-97 21:40:00,0,0,0,0,,,,50,,,,,,,,,,,,,LYNNVILLE,,,LYNNVILLE,35.38,-87,35.38,-87,Trees and power lines down at Lynnville.,,PDC
199703,29,30,199703,29,30,2060952,5596916,TENNESSEE,47,1997,March,Hail,C,93,KNOX,MRX,29-MAR-97 00:30:00,EST,29-MAR-97 00:30:00,0,0,0,0,,,,.75,,,,,,,,,,,,,KNOXVILLE,,,KNOXVILLE,35.97,-83.93,35.97,-83.93,Hail broke out windshield of truck.,,PDC
199703,29,45,199703,29,45,2060953,5596917,TENNESSEE,47,1997,March,Hail,C,123,MONROE,MRX,29-MAR-97 00:45:00,EST,29-MAR-97 00:45:00,0,0,0,0,,,,.75,,,,,,,,,,,,,TELLICO PLAINS,,,TELLICO PLAINS,35.37,-84.3,35.37,-84.3,A severe thunderstorm produced 3/4 inch hail near Tellico Plains.,,PDC
199703,29,25,199703,29,25,2060954,5596918,TENNESSEE,47,1997,March,Hail,C,107,MCMINN,MRX,29-MAR-97 00:25:00,EST,29-MAR-97 00:25:00,0,0,0,0,,,,.75,,,,,,,,,,,,,ENGLEWOOD,,,ENGLEWOOD,35.43,-84.48,35.43,-84.48,A severe thunderstorm produced 3/4 inch hail near Englewood.,,PDC
199705,2,1930,199705,2,1930,2062208,5592139,TENNESSEE,47,1997,May,Thunderstorm Wind,C,11,BRADLEY,MRX,02-MAY-97 19:30:00,EST,02-MAY-97 19:30:00,0,0,0,0,,20K,,,,,,,,,,,,,,,SOUTH END OF COUNTY,,,SOUTH END OF COUNTY,35.02,-84.87,35.02,-84.87,Severe thunderstorm winds blew down many trees.,,PDC
199706,13,2245,199706,14,0,2065196,5602462,TENNESSEE,47,1997,June,Flash Flood,C,187,WILLIAMSON,OHX,13-JUN-97 22:45:00,CST,14-JUN-97 00:00:00,0,0,0,0,,,,,,,,,,,,,,,,,FRANKLIN,,,FRANKLIN,,,,,,High water was over several roads near the Galleria Mall.,PDC
199703,1,400,199703,11,0,2060855,5595072,TENNESSEE,47,1997,March,Flood,Z,48,LAUDERDALE,MEG,01-MAR-97 04:00:00,CST,11-MAR-97 00:00:00,0,0,0,0,5M,.15M,,,,,,,,,,,,,,,,,,,,,,,"Excessive rainfall during the first few days of March along with rivers that were already high caused prolonged flooding along the Mississippi and Tennessee rivers as well as their tributaries. Along the Mississippi, the river reached levels that had not been seen since 1937. Numerous roads were closed for days. In several counties people had to be evacuated from homes including 400 persons in the town of Rives in Obion county. In Madison county, two persons were killed when their car was swept off a flooded road. One person was killed in Shelby county when his car went over a flooded bridge. One man was also killed in Obion county when he fell out of a boat helping people out of their homes.",,PDC
199703,1,400,199703,11,0,2060855,5595073,TENNESSEE,47,1997,March,Flood,Z,91,MCNAIRY,MEG,01-MAR-97 04:00:00,CST,11-MAR-97 00:00:00,0,0,0,0,1M,,,,,,,,,,,,,,,,,,,,,,,,"Excessive rainfall during the first few days of March along with rivers that were already high caused prolonged flooding along the Mississippi and Tennessee rivers as well as their tributaries. Along the Mississippi, the river reached levels that had not been seen since 1937. Numerous roads were closed for days. In several counties people had to be evacuated from homes including 400 persons in the town of Rives in Obion county. In Madison county, two persons were killed when their car was swept off a flooded road. One person was killed in Shelby county when his car went over a flooded bridge. One man was also killed in Obion county when he fell out of a boat helping people out of their homes.",,PDC
199701,5,58,199701,5,58,2058072,5586330,TENNESSEE,47,1997,January,Thunderstorm Wind,C,49,FENTRESS,MRX,05-JAN-97 00:58:00,CST,05-JAN-97 00:58:00,0,0,0,0,,5K,,,,,,,,,,,,,,,COUNTYWIDE,,,COUNTYWIDE,36.35,-84.9,36.35,-84.9,Trees downed all across the county.  Reported by sheriff's office.,,PDC
199701,5,54,199701,5,54,1035847,5586331,TENNESSEE,47,1997,January,Thunderstorm Wind,C,35,CUMBERLAND,MRX,05-JAN-97 00:54:00,CST,05-JAN-97 00:54:00,0,0,0,0,10K,4K,,,,,,,,,,,,,10,N,CROSSVILLE,10,N,CROSSVILLE,36.1,-85.03,36.1,-85.03,Tree and a powerline downed in northern part of county. Reported by sheriff's office.,,PDC
199701,5,105,199701,5,105,1035848,5586332,TENNESSEE,47,1997,January,Thunderstorm Wind,C,151,SCOTT,MRX,05-JAN-97 01:05:00,EST,05-JAN-97 01:05:00,0,0,0,0,,8K,,,,,,,,,,,,,,,WEST PART OF COUNTY,,,WEST PART OF COUNTY,36.42,-84.63,36.42,-84.63,Trees downed and winds estimated at 45 to 65 mph across western part of county. Reported by a ham radio operator.,,PDC
199706,28,2145,199706,28,2145,2065199,5602470,TENNESSEE,47,1997,June,Thunderstorm Wind,C,181,WAYNE,OHX,28-JUN-97 21:45:00,CST,28-JUN-97 21:45:00,0,0,0,0,,,,50,,,,,,,,,,,,,WAYNESBORO,,,WAYNESBORO,35.32,-87.77,35.32,-87.77,,Trees were blown down.,PDC
199706,28,833,199706,28,1045,2065199,5602471,TENNESSEE,47,1997,June,Flash Flood,C,125,MONTGOMERY,OHX,28-JUN-97 08:33:00,CST,28-JUN-97 10:45:00,0,0,0,0,10K,,,,,,,,,,,,,,,,CLARKSVILLE,,,CLARKSVILLE,,,,,,High water on several roads. One car was submerged.  Water got into a basement.,PDC
199706,13,2345,199706,14,100,2065196,5602463,TENNESSEE,47,1997,June,Flash Flood,C,187,WILLIAMSON,OHX,13-JUN-97 23:45:00,CST,14-JUN-97 01:00:00,0,0,0,0,,,,,,,,,,,,,,,,,FAIRVIEW,,,FAIRVIEW,,,,,,2 roads were closed due to high water.,PDC
199706,21,610,199706,21,610,2065197,5602464,TENNESSEE,47,1997,June,Thunderstorm Wind,C,81,HICKMAN,OHX,21-JUN-97 06:10:00,CST,21-JUN-97 06:10:00,0,0,0,0,,,,50,,,,,,,,,,,5,SE,CENTERVILLE,5,SE,CENTERVILLE,35.73,-87.4,35.73,-87.4,,Local law enforcement reported 3 trees were blown down,PDC
199706,21,1330,199706,21,1330,2065197,5602465,TENNESSEE,47,1997,June,Thunderstorm Wind,C,161,STEWART,OHX,21-JUN-97 13:30:00,CST,21-JUN-97 13:30:00,0,0,0,0,,,,50,,,,,,,,,,,,,DOVER,,,DOVER,36.48,-87.83,36.48,-87.83,,"Several trees were down on Bagsby Hill Road, just north of Dover.",PDC
199706,21,1330,199706,21,1330,2065197,5602466,TENNESSEE,47,1997,June,Thunderstorm Wind,C,161,STEWART,OHX,21-JUN-97 13:30:00,CST,21-JUN-97 13:30:00,0,0,0,0,,,,50,,,,,,,,,,,,,BUMPUS MILLS,,,BUMPUS MILLS,36.6,-87.82,36.6,-87.82,,Sheriff's office reported several trees were blown down.,PDC
199706,21,1200,199706,21,1400,2065197,5602467,TENNESSEE,47,1997,June,Flash Flood,C,99,LAWRENCE,OHX,21-JUN-97 12:00:00,CST,21-JUN-97 14:00:00,0,0,0,0,,,,,,,,,,,,,,,,,LAWRENCEBURG,,,LAWRENCEBURG,,,,,,"Quail Drive was under water. A vehicle stalled, but the occupant was able to walk to higher ground. Quail Drive is a flood proned area during heavy rains.",PDC
199706,23,1657,199706,23,1657,2065198,5602468,TENNESSEE,47,1997,June,Thunderstorm Wind,C,51,FRANKLIN,OHX,23-JUN-97 16:57:00,CST,23-JUN-97 16:57:00,0,0,0,0,,,,50,,,,,,,,,,,,,COWAN,,,COWAN,35.17,-86.02,35.17,-86.02,,Cowan Police Department reported one tree was blown down.,PDC
199706,28,1115,199706,28,1115,2065199,5602469,TENNESSEE,47,1997,June,Thunderstorm Wind,C,149,RUTHERFORD,OHX,28-JUN-97 11:15:00,CST,28-JUN-97 11:15:00,0,0,0,0,1K,,,,,,,,,,,,,,,,CHRISTIANA,,,CHRISTIANA,35.72,-86.4,35.72,-86.4,,Several trees were blown down on power lines.,PDC
199704,21,1825,199704,21,1825,1039054,5594105,TENNESSEE,47,1997,April,Hail,C,107,MCMINN,MRX,21-APR-97 18:25:00,EST,21-APR-97 18:25:00,0,0,0,0,,,,1.75,,,,,,,,,,,,,RICEVILLE,,,RICEVILLE,35.38,-84.7,35.38,-84.7,Funnel clouds were reported with this storm. However there were no confirmed touchdowns.,,PDC
199704,21,1855,199704,21,1855,2060997,5594106,TENNESSEE,47,1997,April,Hail,C,123,MONROE,MRX,21-APR-97 18:55:00,EST,21-APR-97 18:55:00,0,0,0,0,,,,.75,,,,,,,,,,,,,MADISONVILLE,,,MADISONVILLE,35.52,-84.37,35.52,-84.37,,,PDC
199703,2,1446,199703,3,600,2064170,5605029,TENNESSEE,47,1997,March,Flash Flood,C,43,DICKSON,OHX,02-MAR-97 14:46:00,CST,03-MAR-97 06:00:00,0,0,0,0,,,,,,,,,,,,,,,,,COUNTYWIDE,,,COUNTYWIDE,,,,,,Widespread flooding countywide. 2 county roads had 3- 5 inches of water over road near Slayden.,PDC
199703,2,1453,199703,3,600,2064170,5605030,TENNESSEE,47,1997,March,Flash Flood,C,81,HICKMAN,OHX,02-MAR-97 14:53:00,CST,03-MAR-97 06:00:00,0,0,0,0,100K,,,,,,,,,,,,,,,,COUNTYWIDE,,,COUNTYWIDE,,,,,,Widespread flooding around county. 2 bridges were washed out and a few roads had high water over them near Pinewood.,PDC
199701,10,1100,199701,10,2300,2058105,5585286,TENNESSEE,47,1997,January,Winter Storm,Z,46,NORTHWEST CARTER,MRX,10-JAN-97 11:00:00,EST,10-JAN-97 23:00:00,0,0,0,0,,,,,,,,,,,,,,,,,,,,,,,,,"An arctic cold front and associated upper level disturbance swept through the southern Appalachians. Snowfall amounts were 1-3 inches in southeast Tennessee, 2-4 inches across the northern Cumberland plateau and central east Tennessee, and 3-5 inches in northeast Tennessee.",,PDC
199701,10,1100,199701,10,2300,2058105,5585287,TENNESSEE,47,1997,January,Winter Storm,Z,47,SOUTHEAST CARTER,MRX,10-JAN-97 11:00:00,EST,10-JAN-97 23:00:00,0,0,0,0,,,,,,,,,,,,,,,,,,,,,,,,,"An arctic cold front and associated upper level disturbance swept through the southern Appalachians. Snowfall amounts were 1-3 inches in southeast Tennessee, 2-4 inches across the northern Cumberland plateau and central east Tennessee, and 3-5 inches in northeast Tennessee.",,PDC
199701,10,1100,199701,10,2300,2058105,5585288,TENNESSEE,47,1997,January,Winter Storm,Z,66,CUMBERLAND,MRX,10-JAN-97 11:00:00,EST,10-JAN-97 23:00:00,0,0,0,0,,,,,,,,,,,,,,,,,,,,,,,,,"An arctic cold front and associated upper level disturbance swept through the southern Appalachians. Snowfall amounts were 1-3 inches in southeast Tennessee, 2-4 inches across the northern Cumberland plateau and central east Tennessee, and 3-5 inches in northeast Tennessee.",,PDC
199703,5,1200,199703,5,1345,2060396,5595619,TENNESSEE,47,1997,March,Flash Flood,C,41,DEKALB,OHX,05-MAR-97 12:00:00,CST,05-MAR-97 13:45:00,0,0,0,0,,,,,,,,,,,,,,,,,COUNTYWIDE,,,COUNTYWIDE,,,,,Many roads were under water. Rock slide on U.S. HWY 70.,,PDC
199703,1,415,199703,1,415,1038322,5595256,TENNESSEE,47,1997,March,Hail,C,85,HUMPHREYS,OHX,01-MAR-97 04:15:00,CST,01-MAR-97 04:15:00,0,0,0,0,,,,.88,,,,,,,,,,,,,WAVERLY,,,WAVERLY,36.08,-87.8,36.08,-87.8,Local law enforcement reported nickel size hail.,,PDC
199703,1,420,199703,1,420,2060339,5595257,TENNESSEE,47,1997,March,Thunderstorm Wind,C,165,SUMNER,OHX,01-MAR-97 04:20:00,CST,01-MAR-97 04:20:00,0,0,0,0,50K,,,,,,,,,,,,,,,,WESTMORELAND,,,WESTMORELAND,36.57,-86.25,36.57,-86.25,Mobile home was damaged. A roof was blown off a home. The report was by local law enforcement.,,PDC
199703,1,445,199703,1,445,2060340,5595258,TENNESSEE,47,1997,March,Thunderstorm Wind,C,111,MACON,OHX,01-MAR-97 04:45:00,CST,01-MAR-97 04:45:00,0,0,0,0,,,,50,,,,,,,,,,,,,NORTHERN SECTIONS,,,NORTHERN SECTIONS,36.58,-86.02,36.58,-86.02,A few trees were blown down.,,PDC
199703,28,2225,199703,28,2225,2060419,5595816,TENNESSEE,47,1997,March,Hail,C,103,LINCOLN,OHX,28-MAR-97 22:25:00,CST,28-MAR-97 22:25:00,0,0,0,0,,,,.75,,,,,,,,,,,,,KELSO,,,KELSO,35.13,-86.47,35.13,-86.47,Dime size hail reported by SKYWARN Spotter.,,PDC
199703,5,1500,199703,5,1500,2060941,5596905,TENNESSEE,47,1997,March,Thunderstorm Wind,C,9,BLOUNT,MRX,05-MAR-97 15:00:00,EST,05-MAR-97 15:00:00,0,0,0,0,14K,8K,,,,,,,,,,,,,,,COUNTYWIDE,,,COUNTYWIDE,35.7,-83.93,35.7,-83.93,A few trees and power lines down throughout county.,,PDC
199703,5,1630,199703,5,1630,2060942,5596906,TENNESSEE,47,1997,March,Thunderstorm Wind,C,19,CARTER,MRX,05-MAR-97 16:30:00,EST,05-MAR-97 16:30:00,0,0,0,0,11K,9K,,,,,,,,,,,,,,,COUNTYWIDE,,,COUNTYWIDE,36.28,-82.15,36.28,-82.15,A few trees and power lines blown down throughout county.,,PDC
199704,19,1738,199704,19,1738,2060990,5594098,TENNESSEE,47,1997,April,Hail,C,65,HAMILTON,MRX,19-APR-97 17:38:00,EST,19-APR-97 17:38:00,0,0,0,0,,,,.75,,,,,,,,,,,,,MOWBRAY,,,MOWBRAY,35.28,-85.23,35.28,-85.23,A severe thunderstorm left 3/4 inch hail 2 inches deep on the ground.,,PDC
199704,21,1526,199704,21,1526,2060991,5594099,TENNESSEE,47,1997,April,Hail,C,1,ANDERSON,MRX,21-APR-97 15:26:00,EST,21-APR-97 15:26:00,0,0,0,0,,,,.75,,,,,,,,,,,,,CLINTON,,,CLINTON,36.12,-84.13,36.12,-84.13,,,PDC
199704,21,1550,199704,21,1550,2060992,5594100,TENNESSEE,47,1997,April,Hail,C,93,KNOX,MRX,21-APR-97 15:50:00,EST,21-APR-97 15:50:00,0,0,0,0,,,,.75,,,,,,,,,,,,,NE PART OF COUNTY,,,NE PART OF COUNTY,36.12,-83.75,36.12,-83.75,,,PDC
199703,1,212,199703,1,212,2060334,5595251,TENNESSEE,47,1997,March,Thunderstorm Wind,C,119,MAURY,OHX,01-MAR-97 02:12:00,CST,01-MAR-97 02:12:00,0,0,0,0,,,,50,,,,,,,,,,,,,SPRING HILL,,,SPRING HILL,35.75,-86.93,35.75,-86.93,Local law enforcement reported a few trees blown down.,,PDC
199703,28,2238,199703,28,2238,2060420,5595817,TENNESSEE,47,1997,March,Hail,C,51,FRANKLIN,OHX,28-MAR-97 22:38:00,CST,28-MAR-97 22:38:00,0,0,0,0,,,,1.75,,,,,,,,,,,,,HUNTLAND,,,HUNTLAND,35.05,-86.27,35.05,-86.27,T.E.M.A. reported golf ball size hail at Huntland.,,PDC
199706,12,2340,199706,13,2340,2064241,5603784,TENNESSEE,47,1997,June,Flash Flood,C,105,LOUDON,MRX,12-JUN-97 23:40:00,EST,13-JUN-97 23:40:00,0,0,0,0,,,,,,,,,,,,,,,,,COUNTYWIDE,,,COUNTYWIDE,,,,,"Water 5 feet deep across the road at junction of Old Route 95 and Harrison Road due to stream overflow.  Water 5 feet deep across the road at junctions of Monterey Drive and Stockton Road with Highway 72 due to stream overflow.  High water on Browder Hollow Road, on Mulberry Street in Loudon and at juntion of Hotchkiss Hollow Road and Breazale Road.",,PDC
199706,19,1850,199706,19,1850,2064242,5603785,TENNESSEE,47,1997,June,Thunderstorm Wind,C,1,ANDERSON,MRX,19-JUN-97 18:50:00,EST,19-JUN-97 18:50:00,0,0,0,0,10K,5K,,,,,,,,,,,,,,,CLINTON,,,CLINTON,36.12,-84.13,36.12,-84.13,A telephone pole and a few trees down just west of Clinton.,,PDC
199706,20,1515,199706,20,1515,2064243,5603786,TENNESSEE,47,1997,June,Thunderstorm Wind,C,29,COCKE,MRX,20-JUN-97 15:15:00,EST,20-JUN-97 15:15:00,0,0,0,0,12K,6K,,,,,,,,,,,,,,,HARTFORD,,,HARTFORD,35.82,-83.15,35.82,-83.15,,,PDC
199706,20,1532,199706,20,1532,2064244,5603787,TENNESSEE,47,1997,June,Thunderstorm Wind,C,171,UNICOI,MRX,20-JUN-97 15:32:00,EST,20-JUN-97 15:32:00,0,0,0,0,,5K,,,,,,,,,,,,,,,ROCKY FORK,,,ROCKY FORK,36.03,-82.55,36.03,-82.55,A few trees blown down on state highway 352 near Rocky Fork.,,PDC
199706,20,1440,199706,20,1440,2064245,5603788,TENNESSEE,47,1997,June,Hail,C,49,FENTRESS,MRX,20-JUN-97 14:40:00,CST,20-JUN-97 14:40:00,0,0,0,0,,,,1.75,,,,,,,,,,,,,COUNTYWIDE,,,COUNTYWIDE,36.35,-84.9,36.35,-84.9,,,PDC
199703,28,2205,199703,28,2205,2060417,5595814,TENNESSEE,47,1997,March,Hail,C,141,PUTNAM,OHX,28-MAR-97 22:05:00,CST,28-MAR-97 22:05:00,0,0,0,0,,,,1.75,,,,,,,,,,,,,SILVER PT,,,SILVER PT,36.1,-85.72,36.1,-85.72,Golf ball size hail reported by E.M.A. official.,,PDC
199703,28,2205,199703,28,2205,2060418,5595815,TENNESSEE,47,1997,March,Hail,C,141,PUTNAM,OHX,28-MAR-97 22:05:00,CST,28-MAR-97 22:05:00,0,0,0,0,,,,1.75,,,,,,,,,,,,,BAXTER,,,BAXTER,36.15,-85.63,36.15,-85.63,Golf ball size hail reported by E.M.A. official at junction of HWY 56 and U.S. Route 70.,,PDC
199703,5,930,199703,5,930,2060935,5596899,TENNESSEE,47,1997,March,Hail,C,151,SCOTT,MRX,05-MAR-97 09:30:00,EST,05-MAR-97 09:30:00,0,0,0,0,,6K,,.75,,,,,,,,,,,,,NW PART OF COUNTY,,,NW PART OF COUNTY,36.52,-84.65,36.52,-84.65,Three-quarter inch sized hail reported in northwest part of county. Trees down in Fiarview community. Some windows blown out at WBNT radio station.,,PDC
199703,5,905,199703,5,905,2060936,5596900,TENNESSEE,47,1997,March,Hail,C,49,FENTRESS,MRX,05-MAR-97 09:05:00,CST,05-MAR-97 09:05:00,0,0,0,0,,,,.75,,,,,,,,,,,,,SOUTH PART OF COUNTY,,,SOUTH PART OF COUNTY,36.18,-84.98,36.18,-84.98,Dime-sized hail in southern part of county.,,PDC
199703,28,2155,199703,28,2205,2060439,5595838,TENNESSEE,47,1997,March,Tornado,C,133,OVERTON,OHX,28-MAR-97 21:55:00,CST,28-MAR-97 22:05:00,2,0,0,0,.25M,,,,,,,F2,5.9,440,,,,,,SW,LIVINGSTON,1,,ALPINE,36.37,-85.33,36.40,-85.22,A trailer was overturned and destroyed. 3 people were trapped inside and 2 of them sustained minor injuries. Several homes were damaged in the Goose Creek area near Alpine. A few barns were damaged near Livingston and another barn was damaged near Alpine. Many trees and power lines were down. Path length and width are approximations.,,PDC
199703,3,520,199703,3,700,2060927,5596891,TENNESSEE,47,1997,March,Flash Flood,C,1,ANDERSON,MRX,03-MAR-97 05:20:00,EST,03-MAR-97 07:00:00,0,0,0,0,,,,,,,,,,,,,,,,,COUNTYWIDE,,,COUNTYWIDE,,,,,Heavy rain training over the county caused widespread flooding. Several routes closed including Highway 116...Highway 441 and I-75 in the Lake City area...and Highway 330 around the community of Frost Bottom.,,PDC
199703,1,400,199703,11,0,2060855,5595071,TENNESSEE,47,1997,March,Flood,Z,1,LAKE,MEG,01-MAR-97 04:00:00,CST,11-MAR-97 00:00:00,0,0,0,0,1M,,,,,,,,,,,,,,,,,,,,,,,,"Excessive rainfall during the first few days of March along with rivers that were already high caused prolonged flooding along the Mississippi and Tennessee rivers as well as their tributaries. Along the Mississippi, the river reached levels that had not been seen since 1937. Numerous roads were closed for days. In several counties people had to be evacuated from homes including 400 persons in the town of Rives in Obion county. In Madison county, two persons were killed when their car was swept off a flooded road. One person was killed in Shelby county when his car went over a flooded bridge. One man was also killed in Obion county when he fell out of a boat helping people out of their homes.",,PDC
199701,5,338,199701,5,338,2058098,5586360,TENNESSEE,47,1997,January,Thunderstorm Wind,C,59,GREENE,MRX,05-JAN-97 03:38:00,EST,05-JAN-97 03:38:00,0,0,0,0,21K,8K,,,,,,,,,,,,,,,COUNTYWIDE,,,COUNTYWIDE,36.18,-82.87,36.18,-82.87,Trees and powerlines downed all across the county.  Reported by the sheriff's office.,,PDC
199701,5,345,199701,5,345,2058099,5586361,TENNESSEE,47,1997,January,Thunderstorm Wind,C,163,SULLIVAN,MRX,05-JAN-97 03:45:00,EST,05-JAN-97 03:45:00,0,0,0,0,,10K,,,,,,,,,,,,,,,COUNTYWIDE,,,COUNTYWIDE,36.5,-82.28,36.5,-82.28,Trees down across entire county. Reported by local dispatch.,,PDC
199701,10,1100,199701,10,2300,2058105,5585299,TENNESSEE,47,1997,January,Winter Storm,Z,85,MCMINN,MRX,10-JAN-97 11:00:00,EST,10-JAN-97 23:00:00,0,0,0,0,,,,,,,,,,,,,,,,,,,,,,,,,"An arctic cold front and associated upper level disturbance swept through the southern Appalachians. Snowfall amounts were 1-3 inches in southeast Tennessee, 2-4 inches across the northern Cumberland plateau and central east Tennessee, and 3-5 inches in northeast Tennessee.",,PDC
199701,10,1100,199701,10,2300,2058105,5585300,TENNESSEE,47,1997,January,Winter Storm,Z,86,NORTHWEST MONROE,MRX,10-JAN-97 11:00:00,EST,10-JAN-97 23:00:00,0,0,0,0,,,,,,,,,,,,,,,,,,,,,,,,,"An arctic cold front and associated upper level disturbance swept through the southern Appalachians. Snowfall amounts were 1-3 inches in southeast Tennessee, 2-4 inches across the northern Cumberland plateau and central east Tennessee, and 3-5 inches in northeast Tennessee.",,PDC
199701,10,1100,199701,10,2300,2058105,5585303,TENNESSEE,47,1997,January,Winter Storm,Z,100,BRADLEY,MRX,10-JAN-97 11:00:00,EST,10-JAN-97 23:00:00,0,0,0,0,,,,,,,,,,,,,,,,,,,,,,,,,"An arctic cold front and associated upper level disturbance swept through the southern Appalachians. Snowfall amounts were 1-3 inches in southeast Tennessee, 2-4 inches across the northern Cumberland plateau and central east Tennessee, and 3-5 inches in northeast Tennessee.",,PDC
199703,5,1030,199703,5,1030,2060937,5596901,TENNESSEE,47,1997,March,Hail,C,151,SCOTT,MRX,05-MAR-97 10:30:00,EST,05-MAR-97 10:30:00,0,0,0,0,,,,.75,,,,,,,,,,,,,HUNTSVILLE,,,HUNTSVILLE,36.42,-84.48,36.42,-84.48,Dime-sized hail covered the ground in Huntsville.,,PDC
199703,5,1430,199703,5,1430,2060939,5596903,TENNESSEE,47,1997,March,Thunderstorm Wind,C,143,RHEA,MRX,05-MAR-97 14:30:00,EST,05-MAR-97 14:30:00,0,0,0,0,,4K,,,,,,,,,,,,,,,COUNTYWIDE,,,COUNTYWIDE,35.58,-84.87,35.58,-84.87,A few trees blown down.,,PDC
199703,5,1515,199703,5,1515,2060940,5596904,TENNESSEE,47,1997,March,Thunderstorm Wind,C,155,SEVIER,MRX,05-MAR-97 15:15:00,EST,05-MAR-97 15:15:00,0,0,0,0,,3K,,,,,,,,,,,,,,,EXTREME N PART OF CO,,,EXTREME N PART OF CO,35.92,-83.73,35.92,-83.73,A few trees down in extreme northern part of county near Jefferson county line.,,PDC
199703,1,545,199703,1,600,2060860,5595090,TENNESSEE,47,1997,March,Tornado,C,109,MCNAIRY,MEG,01-MAR-97 05:45:00,CST,01-MAR-97 06:00:00,0,0,0,0,.3M,,,,,,,F2,5,200,,,,,,,RAMER,,,SELMER,35.07,-88.63,35.18,-88.60,A tornado touched down near the town of Ramer and moved northeast toward the town of Selmer. Forty-eight homes and two businesses were damaged or destroyed. One farm which housed emus was damaged and nine emus were killed. Several trees were uprooted or shredded.,,PDC
199703,28,1920,199703,28,1920,2060406,5595803,TENNESSEE,47,1997,March,Hail,C,43,DICKSON,OHX,28-MAR-97 19:20:00,CST,28-MAR-97 19:20:00,0,0,0,0,,,,1.50,,,,,,,,,,,2,N,DICKSON,2,N,DICKSON,36.12,-87.38,36.12,-87.38,SKYWARN spotter reported large hail.,,PDC
199703,28,1935,199703,28,1935,2060407,5595804,TENNESSEE,47,1997,March,Hail,C,81,HICKMAN,OHX,28-MAR-97 19:35:00,CST,28-MAR-97 19:35:00,0,0,0,0,,,,.75,,,,,,,,,,,,,CENTERVILLE,,,CENTERVILLE,35.78,-87.47,35.78,-87.47,Dime size hail reported by amateur radio operator in western part of the city.,,PDC
199703,28,1936,199703,28,1936,2060408,5595805,TENNESSEE,47,1997,March,Hail,C,21,CHEATHAM,OHX,28-MAR-97 19:36:00,CST,28-MAR-97 19:36:00,0,0,0,0,,,,.75,,,,,,,,,,,,,CHAPMANSBORO,,,CHAPMANSBORO,36.35,-87.17,36.35,-87.17,SKYWARN Spotter reported dime size hail.,,PDC
199703,28,1955,199703,28,1955,2060409,5595806,TENNESSEE,47,1997,March,Hail,C,37,DAVIDSON,OHX,28-MAR-97 19:55:00,CST,28-MAR-97 19:55:00,0,0,0,0,,,,.88,,,,,,,,,,,,,NASHVILLE,,,NASHVILLE,36.13,-86.83,36.13,-86.83,Amateur radio operator relayed report of nickel size hail at Opryland Park.,,PDC
199703,28,2000,199703,28,2000,2060410,5595807,TENNESSEE,47,1997,March,Hail,C,37,DAVIDSON,OHX,28-MAR-97 20:00:00,CST,28-MAR-97 20:00:00,0,0,0,0,,,,.88,,,,,,,,,,,,,GOODLETTSVILLE,,,GOODLETTSVILLE,36.32,-86.72,36.32,-86.72,Emergency management official reported nickel size hail.,,PDC
199703,28,2004,199703,28,2004,2060411,5595808,TENNESSEE,47,1997,March,Hail,C,37,DAVIDSON,OHX,28-MAR-97 20:04:00,CST,28-MAR-97 20:04:00,0,0,0,0,,,,1.75,,,,,,,,,,,,,MADISON,,,MADISON,36.25,-86.77,36.25,-86.77,SKYWARN Spotter reported golf ball size hail.,,PDC
199703,28,1959,199703,28,1959,2060412,5595809,TENNESSEE,47,1997,March,Hail,C,81,HICKMAN,OHX,28-MAR-97 19:59:00,CST,28-MAR-97 19:59:00,0,0,0,0,,,,1.00,,,,,,,,,,,,,NORTHERN SECTION,,,NORTHERN SECTION,35.38,-87.45,35.38,-87.45,Amateur radio operator reported quarter size hail.,,PDC
199703,28,1959,199703,28,1959,2060413,5595810,TENNESSEE,47,1997,March,Hail,C,43,DICKSON,OHX,28-MAR-97 19:59:00,CST,28-MAR-97 19:59:00,0,0,0,0,,,,1.00,,,,,,,,,,,,,SOUTHERN SECTIONS,,,SOUTHERN SECTIONS,36.05,-87.37,36.05,-87.37,Amateur radio operator reported quarter size hail.,,PDC
199703,28,2006,199703,28,2006,2060414,5595811,TENNESSEE,47,1997,March,Hail,C,189,WILSON,OHX,28-MAR-97 20:06:00,CST,28-MAR-97 20:06:00,0,0,0,0,,,,.75,,,,,,,,,,,,,MT JULIET,,,MT JULIET,36.2,-86.52,36.2,-86.52,Dime size hail at the National Weather Service Office.,,PDC
199703,28,2009,199703,28,2009,2060415,5595812,TENNESSEE,47,1997,March,Hail,C,189,WILSON,OHX,28-MAR-97 20:09:00,CST,28-MAR-97 20:09:00,0,0,0,0,,,,1.75,,,,,,,,,,,,,MT JULIET,,,MT JULIET,36.2,-86.52,36.2,-86.52,Golf ball size hail reported by NWS employee at home.,,PDC
