BEGIN_YEARMONTH,BEGIN_DAY,BEGIN_TIME,END_YEARMONTH,END_DAY,END_TIME,EPISODE_ID,EVENT_ID,STATE,STATE_FIPS,YEAR,MONTH_NAME,EVENT_TYPE,CZ_TYPE,CZ_FIPS,CZ_NAME,WFO,BEGIN_DATE_TIME,CZ_TIMEZONE,END_DATE_TIME,INJURIES_DIRECT,INJURIES_INDIRECT,DEATHS_DIRECT,DEATHS_INDIRECT,DAMAGE_PROPERTY,DAMAGE_CROPS,SOURCE,MAGNITUDE,MAGNITUDE_TYPE,FLOOD_CAUSE,CATEGORY,TOR_F_SCALE,TOR_LENGTH,TOR_WIDTH,TOR_OTHER_WFO,TOR_OTHER_CZ_STATE,TOR_OTHER_CZ_FIPS,TOR_OTHER_CZ_NAME,BEGIN_RANGE,BEGIN_AZIMUTH,BEGIN_LOCATION,END_RANGE,END_AZIMUTH,END_LOCATION,BEGIN_LAT,BEGIN_LON,END_LAT,END_LON,EPISODE_NARRATIVE,EVENT_NARRATIVE,DATA_SOURCE
199712,29,1800,199712,29,2300,2071484,5624618,DELAWARE,10,1997,December,Coastal Flood,Z,4,DELAWARE BEACHES,PHI,29-DEC-97 18:00:00,EST,29-DEC-97 23:00:00,0,0,0,0,,0,,,,,,,,,,,,,,,,,,,,,,,A low pressure system formed to the lee of the Southern Rockies the morning of December 28th and moved east into the Tennessee Valley the morning of the 29th.  A  second low pressure system formed along the South Carolina Coast the morning of the 29th and intensified rapidly as it moved northward and became the main low pressure system.  The low moved inland along the New Jersey shore the night of the 29th.  By 7 a.m. EST on the 30th it was located in southern Vermont.The strong onshore flow preceding the low pressure system caused some minor tidal flooding at the times of the evening high tide on the 29th.  The heaviest rain in most places did not coincide with the incoming tide and thus did not exacerbate the flooding along the coastal communities.  The high tides that evening included 6.1 feet above mean low water in Lewes.  Tidal departures averaged between 2.0 and 2.5 feet above normal.,,PDC
199711,14,600,199711,14,2300,2071254,5626477,DELAWARE,10,1997,November,Coastal Flood,Z,3,INLAND SUSSEX,PHI,14-NOV-97 06:00:00,EST,14-NOV-97 23:00:00,0,0,0,0,,0,,,,,,,,,,,,,,,,,,,,,,,A coastal storm or nor'easter developed along the South Carolina coast the morning of the 13th and moved slowly northeast and was about 75 miles east of Salisbury Maryland at 7 a.m. EST on the 14th.  The low pressure system then accelerated and was well southeast of Nova Scotia on the morning of the 15th.  This nor'easter unfortunately coincided with the full moon and spring tides and caused moderate tidal flooding during the morning high tide and minor tidal flooding during the evening high tide on the 14th as well as more beach erosion.  The high tides Friday (the 14th) morning were only about 2 feet above normal.  But the onshore flow coincided with relatively high astronomical tides (even by spring tide standards) and produced moderate tidal flooding.  Tides reached 7.5 feet above mean low water at Lewes.,,PDC
199708,13,1530,199708,13,1530,2070248,5621506,DELAWARE,10,1997,August,Thunderstorm Wind,C,5,SUSSEX,PHI,13-AUG-97 15:30:00,EST,13-AUG-97 15:30:00,0,0,0,0,,0,,,,,,,,,,,,,,,LEWES,,,LEWES,38.77,-75.15,38.77,-75.15,A severe thunderstorm pulled down wires in the eastern part of Sussex County from 430 p.m. through 5 p.m. EDT.  The hardest hit area was in and around Lewes.,,PDC
199708,16,900,199708,17,1900,2070255,5621597,DELAWARE,10,1997,August,Heat,Z,1,NEW CASTLE,PHI,16-AUG-97 09:00:00,EST,17-AUG-97 19:00:00,3,0,0,0,,,,,,,,,,,,,,,,,,,,,,,,,"The weekend of August 16th and 17th brought some of the hottest and most humid air of the summer into Delaware.  High temperatures in most places reached around 100 degrees, while dew point temperatures (an indication of how humid the air mass is) were well into the 70s.  Three heat related illnesses were reported in New Castle County.  The hot weather continued to stress growing conditions across the state.  The highest temperatures this weekend (on Saturday the 16th for most locations) included 100 degrees in Bridgeville,  Dover, Georgetown and Lewes,  97 degrees at the New Castle County Airport and 95 degrees in Prices Corner.    The high of 100 degrees in Dover set a new record, surpassing the previous record of 98 degrees set in 1954.  The high of 97 degrees at the New Castle County Airport fell one degree short of tying the record for the date.  The hot spell ended abruptly as a strong cold front moved through the region early on the 18th.",,PDC
199708,17,1730,199708,17,1830,2070273,5621723,DELAWARE,10,1997,August,Lightning,C,1,KENT,PHI,17-AUG-97 17:30:00,EST,17-AUG-97 18:30:00,0,0,0,0,,0,,,,,,,,,,,,,,,MILFORD,,,MILFORD,,,,,"A series of thunderstorms caused frequent cloud to ground lightning across the southern half of Kent County.  Fire department personnel responded to about 20 alarms, mainly in the Milford area.  Lightning struck power transformer poles and buildings.  No major damage or injuries were reported.",,PDC
199708,17,1855,199708,17,1855,2070274,5621724,DELAWARE,10,1997,August,Thunderstorm Wind,C,5,SUSSEX,PHI,17-AUG-97 18:55:00,EST,17-AUG-97 18:55:00,0,0,0,0,50K,,,74,,,,,,,,,,,1,N,FENWICK IS,1,N,FENWICK IS,38.48,-75.05,38.48,-75.05,A severe thunderstorm produced wind gusts of 85 mph (before the anemometer blew away) between Bethany Beach and Fenwick Island on the Delaware coast.  Two unoccupied mobile homes were destroyed and four others were badly damaged by the winds.,,PDC
199708,16,900,199708,17,1900,2070255,5621594,DELAWARE,10,1997,August,Heat,Z,4,DELAWARE BEACHES,PHI,16-AUG-97 09:00:00,EST,17-AUG-97 19:00:00,0,0,0,0,,,,,,,,,,,,,,,,,,,,,,,,,"The weekend of August 16th and 17th brought some of the hottest and most humid air of the summer into Delaware.  High temperatures in most places reached around 100 degrees, while dew point temperatures (an indication of how humid the air mass is) were well into the 70s.  Three heat related illnesses were reported in New Castle County.  The hot weather continued to stress growing conditions across the state.  The highest temperatures this weekend (on Saturday the 16th for most locations) included 100 degrees in Bridgeville,  Dover, Georgetown and Lewes,  97 degrees at the New Castle County Airport and 95 degrees in Prices Corner.    The high of 100 degrees in Dover set a new record, surpassing the previous record of 98 degrees set in 1954.  The high of 97 degrees at the New Castle County Airport fell one degree short of tying the record for the date.  The hot spell ended abruptly as a strong cold front moved through the region early on the 18th.",,PDC
199709,10,1645,199709,10,1645,1049528,5620187,DELAWARE,10,1997,September,Thunderstorm Wind,C,5,SUSSEX,PHI,10-SEP-97 16:45:00,EST,10-SEP-97 16:45:00,0,0,0,0,,0,,,,,,,,,,,,,3,N,GEORGETOWN,3,N,GEORGETOWN,38.73,-75.38,38.73,-75.38,"A severe thunderstorm knocked down several billboards just north of Georgetown.  The same thunderstorm also knocked over a large oak tree onto a house.  The tree damaged about 12 feet of the house's roof.  No injuries were reported.  The same thunderstorm also produced a funnel cloud as it approached Ellendale, but it apparently did not touch down.",,PDC
199708,16,900,199708,17,1900,2070255,5621595,DELAWARE,10,1997,August,Heat,Z,3,INLAND SUSSEX,PHI,16-AUG-97 09:00:00,EST,17-AUG-97 19:00:00,0,0,0,0,,,,,,,,,,,,,,,,,,,,,,,,,"The weekend of August 16th and 17th brought some of the hottest and most humid air of the summer into Delaware.  High temperatures in most places reached around 100 degrees, while dew point temperatures (an indication of how humid the air mass is) were well into the 70s.  Three heat related illnesses were reported in New Castle County.  The hot weather continued to stress growing conditions across the state.  The highest temperatures this weekend (on Saturday the 16th for most locations) included 100 degrees in Bridgeville,  Dover, Georgetown and Lewes,  97 degrees at the New Castle County Airport and 95 degrees in Prices Corner.    The high of 100 degrees in Dover set a new record, surpassing the previous record of 98 degrees set in 1954.  The high of 97 degrees at the New Castle County Airport fell one degree short of tying the record for the date.  The hot spell ended abruptly as a strong cold front moved through the region early on the 18th.",,PDC
199710,19,800,199710,19,1300,2070949,5619752,DELAWARE,10,1997,October,Coastal Flood,Z,4,DELAWARE BEACHES / X E SUSSEX,PHI,19-OCT-97 08:00:00,EST,19-OCT-97 13:00:00,0,0,0,0,,0,,,,,,,,,,,,,,,,,,,,,,,"An intense low pressure system that moved east of Cape Hatteras in combination with relatively high astronomical tides coming off the full moon on Wednesday the 15th produced minor tidal flooding around the time of the midday high tide on the 19th.  Two low pressure systems formed off the South Atlantic Coast on the 18th: one near Cape Hatteras, the other just southeast of the South Carolina Coast.  They merged into one during the morning of the 19th east of Cape Hatteras.  During the next 24 hours, this low deepened rapidly (or bombed) from 1000 mb the morning of the 19th to 976 mb the morning of the 20th.  Fortunately for the Delaware shore, this low moved eastnortheast and not northeast.  By the morning of the 20th, it was already about 750 miles east of the Delaware coastline.     The highest tides associated with this low occurred during the midday high tide on Sunday the 19th. This caused some minor tidal flooding.   The persistent northeast flow for a couple of days also caused rough surf and some beach erosion.",,PDC
199708,20,1800,199708,20,2200,2070281,5621733,DELAWARE,10,1997,August,Flash Flood,C,1,KENT,PHI,20-AUG-97 18:00:00,EST,20-AUG-97 22:00:00,0,0,0,0,,,,,,,,,,,,,,,,,DOVER,,,DOVER,,,,,"Heavy rain fell across southern sections of the Maryland Eastern Shore and Central Delaware as thunderstorms continued to reform and move over the same locations.  The rain became heavier as a developing low pressure system intensified over Delaware and Southern New Jersey.  Storm totals averaged between 3 and 9 inches in Kent County with the heaviest amounts toward Delaware Bay.  In Dover, the storm total was 8.94 inches.   In spite of the torrential downpours, the drought conditions that have occurred all summer helped the ground absorb much of the rain.  The only reported flooding was along the Puncheon Run in Dover.  The heavy rain also contributed to a fatal accident.  At 745 p.m. EDT a 23-year-old male died when he lost control of his vehicle driving through a patch of  standing water.  The vehicle ran off the road and overturned.  Rainfall amounts although heavy, were considerably less in the rest of Delaware.  Storm totals included 2.51 inches in Newark and 2.31 inches at the New Castle County Airport and 1.4 inches in  Salisbury Maryland.",,PDC
199710,31,2359,199710,31,2359,2070951,5619754,DELAWARE,10,1997,October,Drought,Z,1,NEW CASTLE,PHI,31-OCT-97 23:59:00,EST,31-OCT-97 23:59:00,0,0,0,0,,,,,,,,,,,,,,,,,,,,,,,,,"Unseasonably dry weather and below normal rainfall, which became worse during the summer months, forced the Delaware River Basin Commission to declare a drought warning on October 27th.  The commission urged the 7 million residents within the basin's 13,539 square mile area to voluntarily conserve water.  While the yearly precipitation total for Kent and Sussex Counties were above average, on a county weighted average, yearly precipitation through October 31st within New Castle County was 5.5 inches, or about 15 percent,  below normal.",,PDC
199711,14,600,199711,14,2300,2071254,5626476,DELAWARE,10,1997,November,Coastal Flood,Z,4,DELAWARE BEACHES / X E SUSSEX,PHI,14-NOV-97 06:00:00,EST,14-NOV-97 23:00:00,0,0,0,0,,0,,,,,,,,,,,,,,,,,,,,,,,A coastal storm or nor'easter developed along the South Carolina coast the morning of the 13th and moved slowly northeast and was about 75 miles east of Salisbury Maryland at 7 a.m. EST on the 14th.  The low pressure system then accelerated and was well southeast of Nova Scotia on the morning of the 15th.  This nor'easter unfortunately coincided with the full moon and spring tides and caused moderate tidal flooding during the morning high tide and minor tidal flooding during the evening high tide on the 14th as well as more beach erosion.  The high tides Friday (the 14th) morning were only about 2 feet above normal.  But the onshore flow coincided with relatively high astronomical tides (even by spring tide standards) and produced moderate tidal flooding.  Tides reached 7.5 feet above mean low water at Lewes.,,PDC
199709,10,1645,199709,10,1645,1049528,5620108,DELAWARE,10,1997,September,Funnel Cloud,C,5,SUSSEX,PHI,10-SEP-97 16:45:00,EST,10-SEP-97 16:45:00,0,0,0,0,0,0,,,,,,,,,,,,,1,S,ELLENDALE,1,S,ELLENDALE,,,,,"A severe thunderstorm knocked down several billboards just north of Georgetown.  The same thunderstorm also knocked over a large oak tree onto a house.  The tree damaged about 12 feet of the house's roof.  No injuries were reported.  The same thunderstorm also produced a funnel cloud as it approached Ellendale, but it apparently did not touch down.",,PDC
199708,16,900,199708,17,1900,2070255,5621596,DELAWARE,10,1997,August,Heat,Z,2,KENT,PHI,16-AUG-97 09:00:00,EST,17-AUG-97 19:00:00,0,0,0,0,,,,,,,,,,,,,,,,,,,,,,,,,"The weekend of August 16th and 17th brought some of the hottest and most humid air of the summer into Delaware.  High temperatures in most places reached around 100 degrees, while dew point temperatures (an indication of how humid the air mass is) were well into the 70s.  Three heat related illnesses were reported in New Castle County.  The hot weather continued to stress growing conditions across the state.  The highest temperatures this weekend (on Saturday the 16th for most locations) included 100 degrees in Bridgeville,  Dover, Georgetown and Lewes,  97 degrees at the New Castle County Airport and 95 degrees in Prices Corner.    The high of 100 degrees in Dover set a new record, surpassing the previous record of 98 degrees set in 1954.  The high of 97 degrees at the New Castle County Airport fell one degree short of tying the record for the date.  The hot spell ended abruptly as a strong cold front moved through the region early on the 18th.",,PDC
199711,7,1100,199711,8,1600,2071250,5626452,DELAWARE,10,1997,November,Coastal Flood,Z,4,DELAWARE BEACHES,PHI,07-NOV-97 11:00:00,EST,08-NOV-97 16:00:00,0,0,0,0,,0,,,,,,,,,,,,,,,,,,,,,,,"A slow moving nor'easter caused strong winds, heavy rain, beach erosion and widespread, but minor, tidal flooding from mid-day on the 7th through the morning of the 9th.  The low pressure system formed near Cape Hatteras on the morning of the 7th and moved slowly north as the surface low was captured by a closed low at higher levels of the atmosphere.  On the morning of the 8th,  it was located about 80 miles east of Wallops Island, Virginia and on the morning of the 9th,  it was near Cape May City.  That morning a second low pressure system was located near Cape Cod, Massachusetts and the two merged into one and was located just south of Nova Scotia by the morning of the 10th.  The low came close enough to the Delaware Coast by the morning of the 9th to cause the onshore winds and consequently the tidal flooding to diminish as well as the heavy rain.The several tide cycle pounding cause beach erosion and raised tidal departures to around 3.5 feet above normal and around 2.5 feet above normal at times of high tide from mid-day on the 7th (Friday) through the afternoon on the 8th (Saturday).  This caused widespread, but minor,  tidal flooding from the mid-day high tide on the 7th through the afternoon on the 8th.   The highest tide reported at Lewes was 7.1 feet above mean low water.  Strong gusty winds buffeted the region from the morning of the 7th through the afternoon of the 8th.  The strongest gusts were reported during the afternoon and evening of the 7th.  Peak gusts were around 50 mph.  Heavy rain came in two bursts, during the early morning on the 8th  and again from the evening of the 8th into the early morning on the 9th.  In spite of impressive storm totals, no serious flooding was reported as the heavy rain was not concentrated within a short period of time.  Rain began during the evening of the 6th and was not completely over until the daylight hours on the 9th.  Three day storm totals included 4.08 inches in Salisbury, MD, 3.74 inches in Dover, 3.71 inches in Bridgeville, 3.52 inches in Georgetown and 2.03 inches in Lewes.",,PDC
199711,7,1100,199711,8,1600,2071250,5626453,DELAWARE,10,1997,November,Coastal Flood,Z,3,INLAND SUSSEX,PHI,07-NOV-97 11:00:00,EST,08-NOV-97 16:00:00,0,0,0,0,,0,,,,,,,,,,,,,,,,,,,,,,,"A slow moving nor'easter caused strong winds, heavy rain, beach erosion and widespread, but minor, tidal flooding from mid-day on the 7th through the morning of the 9th.  The low pressure system formed near Cape Hatteras on the morning of the 7th and moved slowly north as the surface low was captured by a closed low at higher levels of the atmosphere.  On the morning of the 8th,  it was located about 80 miles east of Wallops Island, Virginia and on the morning of the 9th,  it was near Cape May City.  That morning a second low pressure system was located near Cape Cod, Massachusetts and the two merged into one and was located just south of Nova Scotia by the morning of the 10th.  The low came close enough to the Delaware Coast by the morning of the 9th to cause the onshore winds and consequently the tidal flooding to diminish as well as the heavy rain.The several tide cycle pounding cause beach erosion and raised tidal departures to around 3.5 feet above normal and around 2.5 feet above normal at times of high tide from mid-day on the 7th (Friday) through the afternoon on the 8th (Saturday).  This caused widespread, but minor,  tidal flooding from the mid-day high tide on the 7th through the afternoon on the 8th.   The highest tide reported at Lewes was 7.1 feet above mean low water.  Strong gusty winds buffeted the region from the morning of the 7th through the afternoon of the 8th.  The strongest gusts were reported during the afternoon and evening of the 7th.  Peak gusts were around 50 mph.  Heavy rain came in two bursts, during the early morning on the 8th  and again from the evening of the 8th into the early morning on the 9th.  In spite of impressive storm totals, no serious flooding was reported as the heavy rain was not concentrated within a short period of time.  Rain began during the evening of the 6th and was not completely over until the daylight hours on the 9th.  Three day storm totals included 4.08 inches in Salisbury, MD, 3.74 inches in Dover, 3.71 inches in Bridgeville, 3.52 inches in Georgetown and 2.03 inches in Lewes.",,PDC
199711,7,1900,199711,9,700,2071250,5626454,DELAWARE,10,1997,November,Heavy Rain,C,1,KENT,PHI,07-NOV-97 19:00:00,EST,09-NOV-97 07:00:00,0,0,0,0,,0,,,,,,,,,,,,,,,COUNTYWIDE,,,COUNTYWIDE,,,,,"A slow moving nor'easter caused strong winds, heavy rain, beach erosion and widespread, but minor, tidal flooding from mid-day on the 7th through the morning of the 9th.  The low pressure system formed near Cape Hatteras on the morning of the 7th and moved slowly north as the surface low was captured by a closed low at higher levels of the atmosphere.  On the morning of the 8th,  it was located about 80 miles east of Wallops Island, Virginia and on the morning of the 9th,  it was near Cape May City.  That morning a second low pressure system was located near Cape Cod, Massachusetts and the two merged into one and was located just south of Nova Scotia by the morning of the 10th.  The low came close enough to the Delaware Coast by the morning of the 9th to cause the onshore winds and consequently the tidal flooding to diminish as well as the heavy rain.The several tide cycle pounding cause beach erosion and raised tidal departures to around 3.5 feet above normal and around 2.5 feet above normal at times of high tide from mid-day on the 7th (Friday) through the afternoon on the 8th (Saturday).  This caused widespread, but minor,  tidal flooding from the mid-day high tide on the 7th through the afternoon on the 8th.   The highest tide reported at Lewes was 7.1 feet above mean low water.  Strong gusty winds buffeted the region from the morning of the 7th through the afternoon of the 8th.  The strongest gusts were reported during the afternoon and evening of the 7th.  Peak gusts were around 50 mph.  Heavy rain came in two bursts, during the early morning on the 8th  and again from the evening of the 8th into the early morning on the 9th.  In spite of impressive storm totals, no serious flooding was reported as the heavy rain was not concentrated within a short period of time.  Rain began during the evening of the 6th and was not completely over until the daylight hours on the 9th.  Three day storm totals included 4.08 inches in Salisbury, MD, 3.74 inches in Dover, 3.71 inches in Bridgeville, 3.52 inches in Georgetown and 2.03 inches in Lewes.",,PDC
199711,7,1900,199711,9,700,2071250,5626455,DELAWARE,10,1997,November,Heavy Rain,C,5,SUSSEX,PHI,07-NOV-97 19:00:00,EST,09-NOV-97 07:00:00,0,0,0,0,,0,,,,,,,,,,,,,,,COUNTYWIDE,,,COUNTYWIDE,,,,,"A slow moving nor'easter caused strong winds, heavy rain, beach erosion and widespread, but minor, tidal flooding from mid-day on the 7th through the morning of the 9th.  The low pressure system formed near Cape Hatteras on the morning of the 7th and moved slowly north as the surface low was captured by a closed low at higher levels of the atmosphere.  On the morning of the 8th,  it was located about 80 miles east of Wallops Island, Virginia and on the morning of the 9th,  it was near Cape May City.  That morning a second low pressure system was located near Cape Cod, Massachusetts and the two merged into one and was located just south of Nova Scotia by the morning of the 10th.  The low came close enough to the Delaware Coast by the morning of the 9th to cause the onshore winds and consequently the tidal flooding to diminish as well as the heavy rain.The several tide cycle pounding cause beach erosion and raised tidal departures to around 3.5 feet above normal and around 2.5 feet above normal at times of high tide from mid-day on the 7th (Friday) through the afternoon on the 8th (Saturday).  This caused widespread, but minor,  tidal flooding from the mid-day high tide on the 7th through the afternoon on the 8th.   The highest tide reported at Lewes was 7.1 feet above mean low water.  Strong gusty winds buffeted the region from the morning of the 7th through the afternoon of the 8th.  The strongest gusts were reported during the afternoon and evening of the 7th.  Peak gusts were around 50 mph.  Heavy rain came in two bursts, during the early morning on the 8th  and again from the evening of the 8th into the early morning on the 9th.  In spite of impressive storm totals, no serious flooding was reported as the heavy rain was not concentrated within a short period of time.  Rain began during the evening of the 6th and was not completely over until the daylight hours on the 9th.  Three day storm totals included 4.08 inches in Salisbury, MD, 3.74 inches in Dover, 3.71 inches in Bridgeville, 3.52 inches in Georgetown and 2.03 inches in Lewes.",,PDC
199711,7,1000,199711,8,1500,2071250,5626456,DELAWARE,10,1997,November,Strong Wind,Z,4,DELAWARE BEACHES,PHI,07-NOV-97 10:00:00,EST,08-NOV-97 15:00:00,0,0,0,0,,0,,,,,,,,,,,,,,,,,,,,,,,"A slow moving nor'easter caused strong winds, heavy rain, beach erosion and widespread, but minor, tidal flooding from mid-day on the 7th through the morning of the 9th.  The low pressure system formed near Cape Hatteras on the morning of the 7th and moved slowly north as the surface low was captured by a closed low at higher levels of the atmosphere.  On the morning of the 8th,  it was located about 80 miles east of Wallops Island, Virginia and on the morning of the 9th,  it was near Cape May City.  That morning a second low pressure system was located near Cape Cod, Massachusetts and the two merged into one and was located just south of Nova Scotia by the morning of the 10th.  The low came close enough to the Delaware Coast by the morning of the 9th to cause the onshore winds and consequently the tidal flooding to diminish as well as the heavy rain.The several tide cycle pounding cause beach erosion and raised tidal departures to around 3.5 feet above normal and around 2.5 feet above normal at times of high tide from mid-day on the 7th (Friday) through the afternoon on the 8th (Saturday).  This caused widespread, but minor,  tidal flooding from the mid-day high tide on the 7th through the afternoon on the 8th.   The highest tide reported at Lewes was 7.1 feet above mean low water.  Strong gusty winds buffeted the region from the morning of the 7th through the afternoon of the 8th.  The strongest gusts were reported during the afternoon and evening of the 7th.  Peak gusts were around 50 mph.  Heavy rain came in two bursts, during the early morning on the 8th  and again from the evening of the 8th into the early morning on the 9th.  In spite of impressive storm totals, no serious flooding was reported as the heavy rain was not concentrated within a short period of time.  Rain began during the evening of the 6th and was not completely over until the daylight hours on the 9th.  Three day storm totals included 4.08 inches in Salisbury, MD, 3.74 inches in Dover, 3.71 inches in Bridgeville, 3.52 inches in Georgetown and 2.03 inches in Lewes.",,PDC
