BEGIN_YEARMONTH,BEGIN_DAY,BEGIN_TIME,END_YEARMONTH,END_DAY,END_TIME,EPISODE_ID,EVENT_ID,STATE,STATE_FIPS,YEAR,MONTH_NAME,EVENT_TYPE,CZ_TYPE,CZ_FIPS,CZ_NAME,WFO,BEGIN_DATE_TIME,CZ_TIMEZONE,END_DATE_TIME,INJURIES_DIRECT,INJURIES_INDIRECT,DEATHS_DIRECT,DEATHS_INDIRECT,DAMAGE_PROPERTY,DAMAGE_CROPS,SOURCE,MAGNITUDE,MAGNITUDE_TYPE,FLOOD_CAUSE,CATEGORY,TOR_F_SCALE,TOR_LENGTH,TOR_WIDTH,TOR_OTHER_WFO,TOR_OTHER_CZ_STATE,TOR_OTHER_CZ_FIPS,TOR_OTHER_CZ_NAME,BEGIN_RANGE,BEGIN_AZIMUTH,BEGIN_LOCATION,END_RANGE,END_AZIMUTH,END_LOCATION,BEGIN_LAT,BEGIN_LON,END_LAT,END_LON,EPISODE_NARRATIVE,EVENT_NARRATIVE,DATA_SOURCE
199707,16,1520,199707,16,1620,2068872,5614495,DELAWARE,10,1997,July,Heavy Rain,C,5,SUSSEX,PHI,16-JUL-97 15:20:00,EST,16-JUL-97 16:20:00,0,0,0,0,,,,,,,,,,,,,,,,,BETHANY BEACH,,,BETHANY BEACH,,,,,"A severe thunderstorm blew the roof off a house and a catamaran was blown off Delaware State Route 1 in Fenwick Island.  The same thunderstorm dropped quarter size hail in Bethany Beach.  Later that afternoon thunderstorms became prolific heavy rain producers and caused some urban and poor drainage flooding.  In Bethany Beach,  2.9 inches of rain fell within one hour.",,PDC
199706,26,1620,199706,26,1620,1045017,5611950,DELAWARE,10,1997,June,Hail,C,5,SUSSEX,PHI,26-JUN-97 16:20:00,EST,26-JUN-97 16:20:00,0,0,0,0,,,,1.00,,,,,,,,,,,,,GREENWOOD,,,GREENWOOD,38.8,-75.58,38.8,-75.58,A severe thunderstorm produced quarter size hail in Greenwood that covered the ground.  The same storm then proceeded to down numerous trees and cause widespread power outages in the central and southern parts of Sussex County.,,PDC
199707,16,1432,199707,16,1432,2068872,5614493,DELAWARE,10,1997,July,Thunderstorm Wind,C,5,SUSSEX,PHI,16-JUL-97 14:32:00,EST,16-JUL-97 14:32:00,0,0,0,0,,0,,,,,,,,,,,,,,,FENWICK IS,,,FENWICK IS,38.47,-75.05,38.47,-75.05,"A severe thunderstorm blew the roof off a house and a catamaran was blown off Delaware State Route 1 in Fenwick Island.  The same thunderstorm dropped quarter size hail in Bethany Beach.  Later that afternoon thunderstorms became prolific heavy rain producers and caused some urban and poor drainage flooding.  In Bethany Beach,  2.9 inches of rain fell within one hour.",,PDC
199707,16,1432,199707,16,1432,2068872,5614494,DELAWARE,10,1997,July,Hail,C,5,SUSSEX,PHI,16-JUL-97 14:32:00,EST,16-JUL-97 14:32:00,0,0,0,0,,0,,1.00,,,,,,,,,,,,,BETHANY BEACH,,,BETHANY BEACH,38.53,-75.07,38.53,-75.07,"A severe thunderstorm blew the roof off a house and a catamaran was blown off Delaware State Route 1 in Fenwick Island.  The same thunderstorm dropped quarter size hail in Bethany Beach.  Later that afternoon thunderstorms became prolific heavy rain producers and caused some urban and poor drainage flooding.  In Bethany Beach,  2.9 inches of rain fell within one hour.",,PDC
199707,12,1000,199707,19,1800,2068866,5614365,DELAWARE,10,1997,July,Heat,Z,3,INLAND SUSSEX,PHI,12-JUL-97 10:00:00,EST,19-JUL-97 18:00:00,0,0,0,0,,,,,,,,,,,,,,,,,,,,,,,,,"The longest and hottest heat wave of the summer of 1997 brought up to 8 straight days of high temperatures of 90 degrees or higher to Delaware along with oppressive humidity and limited rainfall. The heat wave started to end after a strong cold front moved through the region early on the 19th.  In spite of lowering humidity levels,  high temperatures on the 19th still made it into the 90s across most of central and southern Delaware.  The hottest day for most areas was the 15th as high temperatures were around 100 degrees.  This was also the day the Pennsylvania-Jersey-Maryland Interconnection (PJM) reported a record usage of 49,822 megawatts in their regional serving area.  This surpassed the previous record of 48,524 megawatts set on August 2, 1995.  Highest temperatures during this heat wave included 102 degrees in Lewes, 100 degrees in Camden, 99 degrees at the New Castle County Airport and 98 degrees in Bridgeville, Pennyhill and Prices Corner.  No widespread heat related injuries were reported.  But, the lack of rain continued to stress crops, throughout the state especially in southern parts of New Castle County and northern parts of Kent County.  Rainfall totals for July on a county weighted average were below normal throughout the state.  The largest deficits were in Kent County where only 70 percent of normal rainfall fell.",,PDC
199706,18,2120,199706,18,2120,2066547,5611938,DELAWARE,10,1997,June,Thunderstorm Wind,C,5,SUSSEX,PHI,18-JUN-97 21:20:00,EST,18-JUN-97 21:20:00,0,0,0,0,,0,,,,,,,,,,,,,,,SEAFORD,,,SEAFORD,38.63,-75.57,38.63,-75.57,A funnel cloud was sighted just east of Millsboro in Sussex County.  It apparently never touched down.  A severe thunderstorm did knock down large tree limbs and wires in and around Seaford.  The heavy rain that accompanied the thunderstorm damaged five classrooms on the second floor of Seaford High School.  The high school roof was under repair and the water came through a 50 by 50 foot hole in the roof.  Numerous books were damaged.,,PDC
199706,13,1100,199706,13,1200,2066544,5611932,DELAWARE,10,1997,June,Heavy Rain,Z,1,NEW CASTLE,PHI,13-JUN-97 11:00:00,EST,13-JUN-97 12:00:00,0,0,0,0,,,,,,,,,,,,,,,,,,,,,,,,,"Thunderstorms with heavy rain caused some urban and poor drainage flooding in the northern part of New Castle County. In Newark,  1.2 inches of rain fell within an hour.  In Marshallton, overflowing sewers closed Duncan Road at Grafton Drive. The heavy rain also caused significant, but within bankfull rises in most of the major creeks and rivers in northern New Castle County.",,PDC
199705,31,2359,199705,31,2359,2065507,5609191,DELAWARE,10,1997,May,Cold/Wind Chill,Z,3,INLAND SUSSEX,PHI,31-MAY-97 23:59:00,EST,31-MAY-97 23:59:00,0,0,0,0,,,,,,,,,,,,,,,,,,,,,,,,,"May 1997 was an unseasonably cool month.  For most locations, it was the coolest May since 1967 with monthly departures that averaged 3 to 4 degrees below normal.  At the New Castle County Airport, the monthly mean temperature of 58.6 degrees was 3.9 degrees below normal and the 6th coolest May of this century.",,PDC
199701,11,100,199701,11,800,2060908,5596440,DELAWARE,10,1997,January,Winter Weather,Z,2,KENT,PHI,11-JAN-97 01:00:00,EST,11-JAN-97 08:00:00,0,0,0,0,,,,,,,,,,,,,,,,,,,,,,,,,"A  weak low pressure system developed over Virginia the night of the 10th along a secondary cold front.  As the low moved northeast and reached Block Island Rhode Island during the morning of the 11th, a swath of light snow accompanied it during the pre-dawn hours.  For most places across central and northern Delaware, this was the first measurable snowfall of the season.  Accumulations though were light, mainly between 1 and 2 inches across Kent and New Castle Counties.  Just a trace of snow fell at Lewes.  Since the snow fell very early on a Saturday morning, few accidents occurred.",,PDC
199701,9,1000,199701,9,1700,2060905,5596429,DELAWARE,10,1997,January,Winter Weather,Z,2,KENT,PHI,09-JAN-97 10:00:00,EST,09-JAN-97 17:00:00,0,0,0,0,,,,,,,,,,,,,,,,,,,,,,,,,"Double barrel low pressure systems spread a mixture of sleet and freezing rain across the northern half of Delaware.  Precipitation started briefly as light snow across northern New Castle County.  Precipitation spread across the area by noon on the 9th.  Strong east winds helped change it from sleet and freezing rain to plain rain from southeast to northwest across the state.  Very little freezing precipitation occurred in Sussex County.   The significant precipitation ended by the late evening of the 9th.    The wintry mix of sleet and freezing rain did cause slippery roads and contributed to a fatal accident just west of Dover.  A 49-year-old and 66-year-old woman were both killed when they collided head-on with another vehicle.  Farther north along Interstate 495 traffic was stopped for ""miles"" during rush hour due to the combination of slippery roads and accidents.,   The lows went from the central Ohio Valley and Georgia the morning of the 9th to Lake Huron (the former) and Boston (the latter) the morning of the 10th.  Keeping separate identities prevented these lows from dropping heavier precipitation across the area.",,PDC
199701,9,1000,199701,9,2200,2060905,5596279,DELAWARE,10,1997,January,Sleet,Z,1,NEW CASTLE,PHI,09-JAN-97 10:00:00,EST,09-JAN-97 22:00:00,0,0,0,0,,,,,,,,,,,,,,,,,,,,,,,,,"Double barrel low pressure systems spread a mixture of sleet and freezing rain across the northern half of Delaware.  Precipitation started briefly as light snow across northern New Castle County.  Precipitation spread across the area by noon on the 9th.  Strong east winds helped change it from sleet and freezing rain to plain rain from southeast to northwest across the state.  Very little freezing precipitation occurred in Sussex County.   The significant precipitation ended by the late evening of the 9th.    The wintry mix of sleet and freezing rain did cause slippery roads and contributed to a fatal accident just west of Dover.  A 49-year-old and 66-year-old woman were both killed when they collided head-on with another vehicle.  Farther north along Interstate 495 traffic was stopped for ""miles"" during rush hour due to the combination of slippery roads and accidents.,   The lows went from the central Ohio Valley and Georgia the morning of the 9th to Lake Huron (the former) and Boston (the latter) the morning of the 10th.  Keeping separate identities prevented these lows from dropping heavier precipitation across the area.",,PDC
199705,6,1325,199705,6,1325,2065492,5609048,DELAWARE,10,1997,May,Funnel Cloud,C,5,SUSSEX,PHI,06-MAY-97 13:25:00,EST,06-MAY-97 13:25:00,0,0,0,0,0,0,,,,,,,,,,,,,,,HOLLYVILLE,,,HOLLYVILLE,,,,,A funnel cloud was sighted near Hollyville at the intersection of Delaware State Route 5 and Sussex County Route 47.  It apparently did not touch down as no damage was reported.,,PDC
199705,6,1330,199705,6,1330,2065493,5609049,DELAWARE,10,1997,May,Thunderstorm Wind,C,5,SUSSEX,PHI,06-MAY-97 13:30:00,EST,06-MAY-97 13:30:00,0,0,0,0,,0,,,,,,,,,,,,,,,NASSAU,,,NASSAU,38.75,-75.17,38.75,-75.17,A severe thunderstorm knocked over several billboards in the southern part of Sussex County.,,PDC
199705,1,1655,199705,1,1655,2065459,5608923,DELAWARE,10,1997,May,Hail,C,3,NEW CASTLE,PHI,01-MAY-97 16:55:00,EST,01-MAY-97 16:55:00,0,0,0,0,,,,.75,,,,,,,,,,,,,NEWARK,,,NEWARK,39.68,-75.75,39.68,-75.75,,,PDC
199702,19,1100,199702,22,1700,2061036,5595141,DELAWARE,10,1997,February,Heat,Z,4,DELAWARE BEACHES,PHI,19-FEB-97 11:00:00,EST,22-FEB-97 17:00:00,0,0,0,0,,,,,,,,,,,,,,,,,,,,,,,,,A persistent west to southwest flow at all levels of the atmosphere brought unseasonably warm weather into the Northeast from the afternoon of the 19th through the 22nd.  This warm spell ended rather abruptly with a strong cold frontal passage on the 22nd.  The warmest temperatures reached around 70 degrees in most areas.  The New Castle County Airport tied two high temperature records: 67 degrees on the 19th and 69 degrees on the 22nd.,,PDC
199702,14,0,199702,14,600,2061049,5595334,DELAWARE,10,1997,February,Winter Weather,Z,1,NEW CASTLE,PHI,14-FEB-97 00:00:00,EST,14-FEB-97 06:00:00,0,0,0,0,,,,,,,,,,,,,,,,,,,,,,,,,"A high pressure system brought in a relatively cold and dry air mass into the Northeast on the 12th and 13th.   Then a low pressure system travelled along the Eastern Seaboard and dropped a wintry mix of snow and freezing rain in Northern Delaware prior to dawn on the 14th. Precipitation started as snow across northern areas of Delaware the night of the 13th/morning of the 14th.  South winds above the ground brought in relatively warmer air and changed the snow to freezing rain by 3 a.m. EST.  East winds near the surface then brought in warmer air and helped change the freezing rain to just plain rain by 6 a.m.  As is typically the case, the change to plain rain took the longest in the some of the hillier terrain of northwestern New Castle County.  Little if any freezing or frozen precipitation fell farther south in Delaware.  Driving on untreated roadways overnight was hazardous. Snowfall totals prior to the changeover were generally less than one inch.  At the New Castle County Airport, the snowfall was 0.5 inches.The low pressure system responsible for the wintry mix developed over northern Mexico on the 12th.  It moved along southern parts of the Gulf Coast States on the 13th before moving quickly up the Eastern Seaboard the night of the 13th through the night of the 14th.  The low went from Savannah, Georgia at 7 p.m EST on the 13th to Portland, Maine at 7 p.m. EST on the 14th.  The fast movement kept precipitation totals down.  Conversely since it was a relatively weak low pressure system, the winds were light and this kept cold air trapped in some of the valleys in northwestern New Castle County and prolonged the changeover to plain rain.",,PDC
199702,26,1200,199702,28,2359,1039104,5595720,DELAWARE,10,1997,February,Heat,Z,3,INLAND SUSSEX,PHI,26-FEB-97 12:00:00,EST,28-FEB-97 23:59:00,0,0,0,0,,,,,,,,,,,,,,,,,,,,,,,,,"A persistent west to southwest flow of air throughout the Eastern United States brought unseasonably warm air into Delaware from the afternoon of February 26th through March 2nd. The warmest day through this spring preview was February 27th as many new record high temperatures were set.  A series of cold fronts, one early on February 28th and a stronger second one on March 2nd brought temperatures closer to seasonal levels.  At the New Castle County Airport, the high temperature of 73 degrees set a new record high for February 27th, breaking the old record of  70 degrees set in 1946.  High temperatures across Central and Southern Delaware were as warm as the mid and upper 70s on February 27th.  Just south of the area Salisbury, Maryland warmed to 78 degrees.",,PDC
199702,26,1200,199702,28,2359,1039104,5595721,DELAWARE,10,1997,February,Heat,Z,4,DELAWARE BEACHES,PHI,26-FEB-97 12:00:00,EST,28-FEB-97 23:59:00,0,0,0,0,,,,,,,,,,,,,,,,,,,,,,,,,"A persistent west to southwest flow of air throughout the Eastern United States brought unseasonably warm air into Delaware from the afternoon of February 26th through March 2nd. The warmest day through this spring preview was February 27th as many new record high temperatures were set.  A series of cold fronts, one early on February 28th and a stronger second one on March 2nd brought temperatures closer to seasonal levels.  At the New Castle County Airport, the high temperature of 73 degrees set a new record high for February 27th, breaking the old record of  70 degrees set in 1946.  High temperatures across Central and Southern Delaware were as warm as the mid and upper 70s on February 27th.  Just south of the area Salisbury, Maryland warmed to 78 degrees.",,PDC
199701,3,1000,199701,5,2300,1038951,5596246,DELAWARE,10,1997,January,Heat,Z,1,NEW CASTLE,PHI,03-JAN-97 10:00:00,EST,05-JAN-97 23:00:00,0,0,0,0,,,,,,,,,,,,,,,,,,,,,,,,,"A persistent west to southwest flow throughout the start of 1997 led to unseasonably warm weather from the 3rd through the 6th across Delaware.  The warmest days statewide were the 3rd and the 5th.  A weak backdoor cold front brought mostly cloudy skies and slightly cooler temperatures to the northern part of the state on the 4th.  In spite of a cold frontal passage, during the 6th, some places in Sussex County still managed to reach into the 60s.   A record breaking high of 62 degrees was set at the New Castle County Airport on the 3rd.  The warmest day though was the 5th when the high reached 65 degrees, but was not a record.  Georgetown reached 69 degrees on the 4th.",,PDC
199701,17,100,199701,20,900,2060917,5596677,DELAWARE,10,1997,January,Cold/Wind Chill,Z,4,DELAWARE BEACHES,PHI,17-JAN-97 01:00:00,EST,20-JAN-97 09:00:00,0,0,0,0,,,,,,,,,,,,,,,,,,,,,,,,,"The coldest air mass of the winter season moved into Delaware on Friday the 17th.  The high pressure system came straight from the arctic tundra and moved southeast reaching the Middle and South Atlantic States on the 19th and 20th.  Strong gusty northwest winds brought wind chill factors well below zero on the 17th and 18th.  The coldest morning was the 19th.  For most locations this was the coldest day of the winter season.   Low temperatures that morning included  2F in Georgetown,  4F in Prices Corner  (New Castle County), 5F in Pennyhill (New Castle County), 6F at the New Castle County Airport and Bridgeville (Sussex County) and 7F in Lewes.  No new record lows were set.",,PDC
199704,9,100,199704,11,800,2064006,5604373,DELAWARE,10,1997,April,Cold/Wind Chill,Z,1,NEW CASTLE,PHI,09-APR-97 01:00:00,EST,11-APR-97 08:00:00,0,0,0,0,,,,,,,,,,,,,,,,,,,,,,,,,"An unseasonably cold air mass from Canada moved across the Delmarva Peninsula from April 9th through the 11th.  A cold front moved through the region during the night of the 8th and ushered in this unseasonably cold air mass.  The high pressure system at the center of it reached the Great Lakes the morning of the 10th and the Middle Atlantic Coast the morning of the 11th.  Southwest winds around this high then modified the air mass and returned temperatures closer to seasonal levels.  Low temperatures those three mornings were below the freezing mark in most areas.  Unseasonably warm weather for most of late February and March preceding this cold spell had plants blooming ahead of schedule and some of the vegetation susceptible to the cold was damaged.  The coldest morning was the 10th.  Low temperatures that morning included 22F in Georgetown, 24F in Odessa,  26F at the New Castle County Airport,  28F in Bridgeville, 30F in Camden,  31F in Pennyhill and 32F in Lewes.",,PDC
199703,31,800,199703,31,2359,2062492,5599892,DELAWARE,10,1997,March,Strong Wind,Z,1,NEW CASTLE,PHI,31-MAR-97 08:00:00,EST,31-MAR-97 23:59:00,0,0,0,0,,,,,,,,,,,,,,,,,,,,,,,,,"A late season snowstorm dropped some of the heaviest snow of all winter in northwestern parts of New Castle County from the afternoon on March 31st into the morning of April 1st.  The low pressure system responsible for this looked rather innocuous on March 30th as it moved with its associated cold front through the Midwest.  Temperatures that day (Easter Sunday) warmed into the 70s across most of Delaware.  But as the low intensified off the New Jersey Coast on March 31st,  it pulled down colder air.  The heavy precipitation it created also cooled the atmosphere and changed the rain over to snow at times of heavier precipitation bursts in the northern half of the state from the afternoon of March 31st into the early morning of April 1st.  These bands of heavier snow moved through the Middle Atlantic States and caused wide variations in accumulations that were both location (underneath these bands) and elevation dependent.  One such band affected the northwest part of New Castle County where accumulations exceeded five inches. Less snow (3 to 4 inches on average) accumulated farther southeast including the city of Wilmington.   Strong northwest winds on both March 31st and April 1st caused some blowing and drifting of the snow in northwest New Castle County.  In addition, the weight of the heavy, wet snow tore down tree limbs and produced scattered power outages.  Very little snow accumulated farther south in Delaware, but gusty northwest winds that circulated around the low pressure system buffeted the state for two days.  The peak wind gust at the New Castle County Airport was 43 mph, but stronger gusts occurred farther south.  A wind gust of 58 mph was recorded by the Cape May/Lewes Ferry.  The strong winds also pulled down power lines and caused scattered outages in Sussex County and isolated outages in Kent County.  The very strong winds also forced the Cape May/Lewes Ferry to reduce their number of trips across Delaware Bay.",,PDC
199701,22,500,199701,22,800,2060921,5596699,DELAWARE,10,1997,January,Winter Weather,Z,1,NEW CASTLE,PHI,22-JAN-97 05:00:00,EST,22-JAN-97 08:00:00,0,0,0,0,,,,,,,,,,,,,,,,,,,,,,,,,"A moist south to southeast flow from Delaware Bay passing over road surfaces that were very cold from the recent deep freeze helped black ice to form on roadways, bridges and overpasses the morning of the 22nd.  This thin layer of ice that is virtually impossible to detect helped contribute to three traffic fatalities and over 100 injuries in the Greater Philadelphia Metropolitan Area.  All the fatalities occurred in Pennsylvania and New Jersey.",,PDC
199704,1,0,199704,1,1900,2064796,5603376,DELAWARE,10,1997,April,High Wind,Z,3,INLAND SUSSEX,PHI,01-APR-97 00:00:00,EST,01-APR-97 19:00:00,0,0,0,0,,0,,50,,,,,,,,,,,,,,,,,,,,,"A late season snowstorm dropped some of the heaviest snow of all winter in northwestern parts of New Castle County from the afternoon on March 31st into the morning of April 1st.  The low pressure system responsible for this looked rather innocuous on March 30th as it moved with its associated cold front through the Midwest.  Temperatures that day (Easter Sunday) warmed into the 70s across most of Delaware.  But as the low intensified off the New Jersey Coast on March 31st,  it pulled down colder air.  The heavy precipitation it created also cooled the atmosphere and changed the rain over to snow at times of heavier precipitation bursts in the northern half of the state from the afternoon of March 31st into the early morning of April 1st.  These bands of heavier snow moved through the Middle Atlantic States and caused wide variations in accumulations that were both location (underneath these bands) and elevation dependent.  One such band affected the northwest part of New Castle County where accumulations exceeded five inches. Less snow (3 to 4 inches on average) accumulated farther southeast including the city of Wilmington.   Strong northwest winds on both March 31st and April 1st caused some blowing and drifting of the snow in northwest New Castle County.  In addition, the weight of the heavy, wet snow tore down tree limbs and produced scattered power outages.  Very little snow accumulated farther south in Delaware, but gusty northwest winds that circulated around the low pressure system buffeted the state for two days.  The peak wind gust at the New Castle County Airport was 43 mph, but stronger gusts occurred farther south.  A wind gust of 58 mph was recorded by the Cape May/Lewes Ferry.  The strong winds also pulled down power lines and caused scattered outages in Sussex County and isolated outages in Kent County.  The very strong winds also forced the Cape May/Lewes Ferry to reduce their number of trips across Delaware Bay.",,PDC
199702,28,2359,199702,28,2359,2061043,5595727,DELAWARE,10,1997,February,Heat,Z,4,DELAWARE BEACHES / X E SUSSEX,PHI,28-FEB-97 23:59:00,EST,28-FEB-97 23:59:00,0,0,0,0,,,,,,,,,,,,,,,,,,,,,,,,,February 1997 was an unseasonably warm month for the Middle Atlantic States including Delaware.  The monthly mean temperature of 38.9 degrees at the New Castle County Airport was 5.5 degrees above normal and the 8th warmest February of this century.,,PDC
199702,28,2359,199702,28,2359,2061043,5595730,DELAWARE,10,1997,February,Heat,Z,1,NEW CASTLE,PHI,28-FEB-97 23:59:00,EST,28-FEB-97 23:59:00,0,0,0,0,,,,,,,,,,,,,,,,,,,,,,,,,February 1997 was an unseasonably warm month for the Middle Atlantic States including Delaware.  The monthly mean temperature of 38.9 degrees at the New Castle County Airport was 5.5 degrees above normal and the 8th warmest February of this century.,,PDC
199703,1,0,199703,2,1700,2064793,5603239,DELAWARE,10,1997,March,Heat,Z,1,NEW CASTLE,PHI,01-MAR-97 00:00:00,EST,02-MAR-97 17:00:00,0,0,0,0,,,,,,,,,,,,,,,,,,,,,,,,,"A persistent west to southwest flow of air throughout the Eastern United States brought unseasonably warm air into Delaware from the afternoon of February 26th through March 2nd. The warmest day through this spring preview was February 27th as many new record high temperatures were set.  A series of cold fronts, one early on February 28th and a stronger second one on March 2nd brought temperatures closer to seasonal levels.  At the New Castle County Airport, the high temperature of 73 degrees set a new record high for February 27th, breaking the old record of  70 degrees set in 1946.  High temperatures across Central and Southern Delaware were as warm as the mid and upper 70s on February 27th.  Just south of the area Salisbury, Maryland warmed to 78 degrees.",,PDC
199702,19,1100,199702,22,1700,2061036,5595143,DELAWARE,10,1997,February,Heat,Z,2,KENT,PHI,19-FEB-97 11:00:00,EST,22-FEB-97 17:00:00,0,0,0,0,,,,,,,,,,,,,,,,,,,,,,,,,A persistent west to southwest flow at all levels of the atmosphere brought unseasonably warm weather into the Northeast from the afternoon of the 19th through the 22nd.  This warm spell ended rather abruptly with a strong cold frontal passage on the 22nd.  The warmest temperatures reached around 70 degrees in most areas.  The New Castle County Airport tied two high temperature records: 67 degrees on the 19th and 69 degrees on the 22nd.,,PDC
199702,19,1100,199702,22,1700,2061036,5595142,DELAWARE,10,1997,February,Heat,Z,3,INLAND SUSSEX,PHI,19-FEB-97 11:00:00,EST,22-FEB-97 17:00:00,0,0,0,0,,,,,,,,,,,,,,,,,,,,,,,,,A persistent west to southwest flow at all levels of the atmosphere brought unseasonably warm weather into the Northeast from the afternoon of the 19th through the 22nd.  This warm spell ended rather abruptly with a strong cold frontal passage on the 22nd.  The warmest temperatures reached around 70 degrees in most areas.  The New Castle County Airport tied two high temperature records: 67 degrees on the 19th and 69 degrees on the 22nd.,,PDC
