BEGIN_YEARMONTH,BEGIN_DAY,BEGIN_TIME,END_YEARMONTH,END_DAY,END_TIME,EPISODE_ID,EVENT_ID,STATE,STATE_FIPS,YEAR,MONTH_NAME,EVENT_TYPE,CZ_TYPE,CZ_FIPS,CZ_NAME,WFO,BEGIN_DATE_TIME,CZ_TIMEZONE,END_DATE_TIME,INJURIES_DIRECT,INJURIES_INDIRECT,DEATHS_DIRECT,DEATHS_INDIRECT,DAMAGE_PROPERTY,DAMAGE_CROPS,SOURCE,MAGNITUDE,MAGNITUDE_TYPE,FLOOD_CAUSE,CATEGORY,TOR_F_SCALE,TOR_LENGTH,TOR_WIDTH,TOR_OTHER_WFO,TOR_OTHER_CZ_STATE,TOR_OTHER_CZ_FIPS,TOR_OTHER_CZ_NAME,BEGIN_RANGE,BEGIN_AZIMUTH,BEGIN_LOCATION,END_RANGE,END_AZIMUTH,END_LOCATION,BEGIN_LAT,BEGIN_LON,END_LAT,END_LON,EPISODE_NARRATIVE,EVENT_NARRATIVE,DATA_SOURCE
199707,12,1000,199707,18,1800,2068866,5614367,DELAWARE,10,1997,July,Heat,Z,1,NEW CASTLE,PHI,12-JUL-97 10:00:00,EST,18-JUL-97 18:00:00,0,0,0,0,,,,,,,,,,,,,,,,,,,,,,,,,"The longest and hottest heat wave of the summer of 1997 brought up to 8 straight days of high temperatures of 90 degrees or higher to Delaware along with oppressive humidity and limited rainfall. The heat wave started to end after a strong cold front moved through the region early on the 19th.  In spite of lowering humidity levels,  high temperatures on the 19th still made it into the 90s across most of central and southern Delaware.  The hottest day for most areas was the 15th as high temperatures were around 100 degrees.  This was also the day the Pennsylvania-Jersey-Maryland Interconnection (PJM) reported a record usage of 49,822 megawatts in their regional serving area.  This surpassed the previous record of 48,524 megawatts set on August 2, 1995.  Highest temperatures during this heat wave included 102 degrees in Lewes, 100 degrees in Camden, 99 degrees at the New Castle County Airport and 98 degrees in Bridgeville, Pennyhill and Prices Corner.  No widespread heat related injuries were reported.  But, the lack of rain continued to stress crops, throughout the state especially in southern parts of New Castle County and northern parts of Kent County.  Rainfall totals for July on a county weighted average were below normal throughout the state.  The largest deficits were in Kent County where only 70 percent of normal rainfall fell.",,PDC
199707,23,1400,199707,24,700,2068894,5614581,DELAWARE,10,1997,July,Heavy Rain,C,3,NEW CASTLE,PHI,23-JUL-97 14:00:00,EST,24-JUL-97 07:00:00,0,0,0,0,,,,,,,,,,,,,,,,,COUNTYWIDE,,,COUNTYWIDE,,,,,"Heavy rain, associated with weak low pressure systems riding along a nearly stationary frontal boundary just to the south of the Delaware, fell across New Castle County from the afternoon of the 23rd to the morning of the 24th.  For most places this was the most widespread rain in the county since the beginning of June. Storm totals included  3.3 inches in Pennyhill, 2.05 inches in Odessa, 1.97 inches at the New Castle County Airport, 1.66 inches in Newark and 1.6 inches in Prices Corner.  Because of the extremely dry weather preceding this week, there was no river or creek flooding and roadway flooding was confined to the usual poor drainage and low-lying areas.",,PDC
199706,30,2359,199706,30,2359,2066562,5612062,DELAWARE,10,1997,June,Drought,Z,3,INLAND SUSSEX,PHI,30-JUN-97 23:59:00,EST,30-JUN-97 23:59:00,0,0,0,0,,,,,,,,,,,,,,,,,,,,,,,,,"June 1997 was drier than normal throughout Delaware.  On a county weighted average, deficits averaged between 1 and 2 inches in New Castle and Sussex Counties.   Only Kent County was within an inch of normal.  Coupled with the hot weather from June 21st onward,  the lack of rain started to stress growing areas.  The monthly precipitation total at the New Castle County Airport was 1.75 inches, about 49 percent of normal.",,PDC
199706,22,1630,199706,22,1630,2066551,5611943,DELAWARE,10,1997,June,Thunderstorm Wind,C,1,KENT,PHI,22-JUN-97 16:30:00,EST,22-JUN-97 16:30:00,0,0,0,0,,0,,,,,,,,,,,,,,S,SMYRNA,1,,CHESWOLD,39.28,-75.60,39.22,-75.58,"A severe thunderstorm caused wind damage in northern Kent County from around Smyrna to Cheswold.  The thunderstorm blew a big piece of a house's roof off on Big Oak Road.  Part of a roof was also blown off a Main Street building in Cheswold.  Several trees were also uprooted.  There was also very intense lightning with this thunderstorm.  The Dover fire department responded to fourteen alarms.   In one case, struck power lines fell onto a parked vehicle at a restaurant on U.S. Route 113 near Dover and burned it. There were also six other lightning fires farther north in the county.",,PDC
199706,21,900,199706,26,1800,1045020,5611957,DELAWARE,10,1997,June,Heat,Z,3,INLAND SUSSEX,PHI,21-JUN-97 09:00:00,EST,26-JUN-97 18:00:00,0,0,0,0,,,,,,,,,,,,,,,,,,,,,,,,,"The first heat wave of 1997 brought the warmest weather in two years to the Delmarva Peninsula.  The highest temperatures reached near or around the 100 degree mark in many places on the 25th and 26th.  A strong cold front brought an end to the excessive humidity on the 26th, although some places reached around 90 degrees on the 27th.  The heat wave started for a few spots on the peninsula on the 20th.  All locations reached the 90s on the 21st.  A weak cold front briefly brought drier air into the region on the 23rd.  But that was short-lived as both heat and humidity levels became oppressive again on the 24th.The highest temperatures included 100 degrees at both Lewes (on the 25th and 26th) and Odessa (26th), 98 degrees in Dover (on the 25th and 26th),  95 degrees at the New Castle County Airport (on the 25th) and also Bridgeville and Pennyhill (on both the 25th and 26th).",,PDC
199706,13,1220,199706,13,1220,1044999,5611927,DELAWARE,10,1997,June,Thunderstorm Wind,C,3,NEW CASTLE,PHI,13-JUN-97 12:20:00,EST,13-JUN-97 12:20:00,0,0,0,0,,0,,,,,,,,,,,,,,,WILMINGTON,,,WILMINGTON,39.75,-75.53,39.75,-75.53,"A severe thunderstorm tore down power lines across the northeast part of the county.  Between 8,000 and 10,000 homes and businesses lost power.  All but 100 customers had power restored by 10 p.m. EDT that evening.",,PDC
199706,21,900,199706,26,1800,1045020,5611958,DELAWARE,10,1997,June,Heat,Z,2,KENT,PHI,21-JUN-97 09:00:00,EST,26-JUN-97 18:00:00,0,0,0,0,,,,,,,,,,,,,,,,,,,,,,,,,"The first heat wave of 1997 brought the warmest weather in two years to the Delmarva Peninsula.  The highest temperatures reached near or around the 100 degree mark in many places on the 25th and 26th.  A strong cold front brought an end to the excessive humidity on the 26th, although some places reached around 90 degrees on the 27th.  The heat wave started for a few spots on the peninsula on the 20th.  All locations reached the 90s on the 21st.  A weak cold front briefly brought drier air into the region on the 23rd.  But that was short-lived as both heat and humidity levels became oppressive again on the 24th.The highest temperatures included 100 degrees at both Lewes (on the 25th and 26th) and Odessa (26th), 98 degrees in Dover (on the 25th and 26th),  95 degrees at the New Castle County Airport (on the 25th) and also Bridgeville and Pennyhill (on both the 25th and 26th).",,PDC
199706,18,2100,199706,18,2100,2066547,5611937,DELAWARE,10,1997,June,Funnel Cloud,C,5,SUSSEX,PHI,18-JUN-97 21:00:00,EST,18-JUN-97 21:00:00,0,0,0,0,0,0,,,,,,,,,,,,,1,E,MILLSBORO,1,E,MILLSBORO,,,,,A funnel cloud was sighted just east of Millsboro in Sussex County.  It apparently never touched down.  A severe thunderstorm did knock down large tree limbs and wires in and around Seaford.  The heavy rain that accompanied the thunderstorm damaged five classrooms on the second floor of Seaford High School.  The high school roof was under repair and the water came through a 50 by 50 foot hole in the roof.  Numerous books were damaged.,,PDC
199706,30,2359,199706,30,2359,2066562,5612061,DELAWARE,10,1997,June,Drought,Z,4,DELAWARE BEACHES,PHI,30-JUN-97 23:59:00,EST,30-JUN-97 23:59:00,0,0,0,0,,,,,,,,,,,,,,,,,,,,,,,,,"June 1997 was drier than normal throughout Delaware.  On a county weighted average, deficits averaged between 1 and 2 inches in New Castle and Sussex Counties.   Only Kent County was within an inch of normal.  Coupled with the hot weather from June 21st onward,  the lack of rain started to stress growing areas.  The monthly precipitation total at the New Castle County Airport was 1.75 inches, about 49 percent of normal.",,PDC
199707,18,2040,199707,18,2130,2068892,5614526,DELAWARE,10,1997,July,Thunderstorm Wind,C,5,SUSSEX,PHI,18-JUL-97 20:40:00,EST,18-JUL-97 21:30:00,0,0,0,0,,,,78,,,,,,,,,,,,,RELIANCE,,,MILLSBORO,38.63,-75.70,38.58,-75.30,Severe thunderstorms pulled down trees and wires in the southern half of Sussex County.  Some of the worst damage occurred around Millsboro when a microburst produced estimated wind gusts of around 90 mph.  The thunderstorm winds pushed in the west side of one house.  The porch railing on the southwest corner of the porch was blown down.  All the porch furniture was blown to the east side of the porch.  Elsewhere a vacant chicken was completely blown down.  Another chicken house partially collapsed. Many large trees were damaged with several large trees (3 feet in diameter) snapped off and corn fields were flattened.,,PDC
199706,2,1500,199706,3,2000,2066538,5611820,DELAWARE,10,1997,June,Coastal Flood,Z,4,DELAWARE BEACHES,PHI,02-JUN-97 15:00:00,EST,03-JUN-97 20:00:00,0,0,0,0,,,,,,,,,,,,,,,,,,,,,,,,,"A series of low pressure systems moving east off the North Carolina coast and a relatively strong high pressure system over Eastern Canada brought a strong and persistent northeast flow from the 2nd through the 4th.  The onshore flow peaked during the evening of the 2nd through the morning of the 3rd and produced some minor tidal flooding at times of high tide.  A wind gust of 48 mph was reported by the Cape May-Lewes Ferry the morning of the 3rd.  Tidal departures averaged about 2 feet above normal, peaking the morning of the 3rd. The heavy surf also caused some minor beach erosion, especially in Rehoboth Beach.",,PDC
199701,11,100,199701,11,800,2060908,5596441,DELAWARE,10,1997,January,Winter Weather,Z,1,NEW CASTLE,PHI,11-JAN-97 01:00:00,EST,11-JAN-97 08:00:00,0,0,0,0,,,,,,,,,,,,,,,,,,,,,,,,,"A  weak low pressure system developed over Virginia the night of the 10th along a secondary cold front.  As the low moved northeast and reached Block Island Rhode Island during the morning of the 11th, a swath of light snow accompanied it during the pre-dawn hours.  For most places across central and northern Delaware, this was the first measurable snowfall of the season.  Accumulations though were light, mainly between 1 and 2 inches across Kent and New Castle Counties.  Just a trace of snow fell at Lewes.  Since the snow fell very early on a Saturday morning, few accidents occurred.",,PDC
199706,22,1630,199706,22,1730,2066551,5611944,DELAWARE,10,1997,June,Lightning,C,1,KENT,PHI,22-JUN-97 16:30:00,EST,22-JUN-97 17:30:00,0,0,0,0,,0,,,,,,,,,,,,,,,SMYRNA,,,SMYRNA,,,,,"A severe thunderstorm caused wind damage in northern Kent County from around Smyrna to Cheswold.  The thunderstorm blew a big piece of a house's roof off on Big Oak Road.  Part of a roof was also blown off a Main Street building in Cheswold.  Several trees were also uprooted.  There was also very intense lightning with this thunderstorm.  The Dover fire department responded to fourteen alarms.   In one case, struck power lines fell onto a parked vehicle at a restaurant on U.S. Route 113 near Dover and burned it. There were also six other lightning fires farther north in the county.",,PDC
199702,8,600,199702,8,2200,2061026,5594521,DELAWARE,10,1997,February,Heavy Snow,Z,1,NEW CASTLE,PHI,08-FEB-97 06:00:00,EST,08-FEB-97 22:00:00,0,0,0,0,,,,,,,,,,,,,,,,,,,,,,,,,"The heaviest snow of the winter season for most of Delaware fell throughout the day on the 8th.  Snow started just before sunrise on the 8th and fell at a fairly steady clip throughout the day.  The snow ended during the evening hours.  The snow was mixed with rain at times in Sussex County, especially toward the shore and this held accumulations down in the county.    Accumulations were fairly uniform in Kent and New Castle Counties and averaged 4 to 6 inches.  The highest accumulations (around 6 inches) occurred with a band of heavier snow that passed across Kent County.  Accumulations in Sussex County ranged from 4 inches across northwest sections to less than 2 inches at the shore. Since this snow fell on a Saturday, the number of accidents was reduced.  Nevertheless, the state police in New Castle County responded to over 60 accidents and disabled vehicles.  In Kent County, the state police responded to over a dozen accidents and several disabled vehicles - a couple skidded into ditches.  In Sussex County, a few accidents were reported during the evening of the 8th as temperatures dropped below the freezing mark.The low pressure system responsible for the heavy snow initially formed in the western Gulf of Mexico on the 7th.  By the morning of the 8th, there were three separate centers,  over Georgia, western North Carolina and near Cape Hatteras.  These combined into one by the afternoon of the 8th.  The low though moved fairly quickly out to sea.  By 7 a.m. EST on the 9th, it was already about 500 miles eastnortheast of the Delaware Coast.   While its storm track placed the band of heaviest snow across Delmarva and Southern New Jersey, its fast movement prevented heavier accumulations from occurring.",,PDC
199706,2,1800,199706,3,1100,2066538,5611819,DELAWARE,10,1997,June,Strong Wind,Z,4,DELAWARE BEACHES,PHI,02-JUN-97 18:00:00,EST,03-JUN-97 11:00:00,0,0,0,0,,,,,,,,,,,,,,,,,,,,,,,,,"A series of low pressure systems moving east off the North Carolina coast and a relatively strong high pressure system over Eastern Canada brought a strong and persistent northeast flow from the 2nd through the 4th.  The onshore flow peaked during the evening of the 2nd through the morning of the 3rd and produced some minor tidal flooding at times of high tide.  A wind gust of 48 mph was reported by the Cape May-Lewes Ferry the morning of the 3rd.  Tidal departures averaged about 2 feet above normal, peaking the morning of the 3rd. The heavy surf also caused some minor beach erosion, especially in Rehoboth Beach.",,PDC
199707,12,1000,199707,19,1800,2068866,5614364,DELAWARE,10,1997,July,Heat,Z,4,DELAWARE BEACHES,PHI,12-JUL-97 10:00:00,EST,19-JUL-97 18:00:00,0,0,0,0,,,,,,,,,,,,,,,,,,,,,,,,,"The longest and hottest heat wave of the summer of 1997 brought up to 8 straight days of high temperatures of 90 degrees or higher to Delaware along with oppressive humidity and limited rainfall. The heat wave started to end after a strong cold front moved through the region early on the 19th.  In spite of lowering humidity levels,  high temperatures on the 19th still made it into the 90s across most of central and southern Delaware.  The hottest day for most areas was the 15th as high temperatures were around 100 degrees.  This was also the day the Pennsylvania-Jersey-Maryland Interconnection (PJM) reported a record usage of 49,822 megawatts in their regional serving area.  This surpassed the previous record of 48,524 megawatts set on August 2, 1995.  Highest temperatures during this heat wave included 102 degrees in Lewes, 100 degrees in Camden, 99 degrees at the New Castle County Airport and 98 degrees in Bridgeville, Pennyhill and Prices Corner.  No widespread heat related injuries were reported.  But, the lack of rain continued to stress crops, throughout the state especially in southern parts of New Castle County and northern parts of Kent County.  Rainfall totals for July on a county weighted average were below normal throughout the state.  The largest deficits were in Kent County where only 70 percent of normal rainfall fell.",,PDC
199706,21,900,199706,26,1800,1045020,5611960,DELAWARE,10,1997,June,Heat,Z,4,DELAWARE BEACHES,PHI,21-JUN-97 09:00:00,EST,26-JUN-97 18:00:00,0,0,0,0,,,,,,,,,,,,,,,,,,,,,,,,,"The first heat wave of 1997 brought the warmest weather in two years to the Delmarva Peninsula.  The highest temperatures reached near or around the 100 degree mark in many places on the 25th and 26th.  A strong cold front brought an end to the excessive humidity on the 26th, although some places reached around 90 degrees on the 27th.  The heat wave started for a few spots on the peninsula on the 20th.  All locations reached the 90s on the 21st.  A weak cold front briefly brought drier air into the region on the 23rd.  But that was short-lived as both heat and humidity levels became oppressive again on the 24th.The highest temperatures included 100 degrees at both Lewes (on the 25th and 26th) and Odessa (26th), 98 degrees in Dover (on the 25th and 26th),  95 degrees at the New Castle County Airport (on the 25th) and also Bridgeville and Pennyhill (on both the 25th and 26th).",,PDC
199701,3,1000,199701,6,2300,1038951,5596243,DELAWARE,10,1997,January,Heat,Z,4,DELAWARE BEACHES / X E SUSSEX,PHI,03-JAN-97 10:00:00,EST,06-JAN-97 23:00:00,0,0,0,0,,,,,,,,,,,,,,,,,,,,,,,,,"A persistent west to southwest flow throughout the start of 1997 led to unseasonably warm weather from the 3rd through the 6th across Delaware.  The warmest days statewide were the 3rd and the 5th.  A weak backdoor cold front brought mostly cloudy skies and slightly cooler temperatures to the northern part of the state on the 4th.  In spite of a cold frontal passage, during the 6th, some places in Sussex County still managed to reach into the 60s.   A record breaking high of 62 degrees was set at the New Castle County Airport on the 3rd.  The warmest day though was the 5th when the high reached 65 degrees, but was not a record.  Georgetown reached 69 degrees on the 4th.",,PDC
199701,3,1000,199701,6,2300,1038951,5596244,DELAWARE,10,1997,January,Heat,Z,3,INLAND SUSSEX,PHI,03-JAN-97 10:00:00,EST,06-JAN-97 23:00:00,0,0,0,0,,,,,,,,,,,,,,,,,,,,,,,,,"A persistent west to southwest flow throughout the start of 1997 led to unseasonably warm weather from the 3rd through the 6th across Delaware.  The warmest days statewide were the 3rd and the 5th.  A weak backdoor cold front brought mostly cloudy skies and slightly cooler temperatures to the northern part of the state on the 4th.  In spite of a cold frontal passage, during the 6th, some places in Sussex County still managed to reach into the 60s.   A record breaking high of 62 degrees was set at the New Castle County Airport on the 3rd.  The warmest day though was the 5th when the high reached 65 degrees, but was not a record.  Georgetown reached 69 degrees on the 4th.",,PDC
199706,26,1630,199706,26,1645,1045017,5611949,DELAWARE,10,1997,June,Thunderstorm Wind,C,5,SUSSEX,PHI,26-JUN-97 16:30:00,EST,26-JUN-97 16:45:00,0,0,0,0,,0,,,,,,,,,,,,,,,ATLANTA,,,BAYARD,38.70,-75.68,38.50,-75.13,A severe thunderstorm produced quarter size hail in Greenwood that covered the ground.  The same storm then proceeded to down numerous trees and cause widespread power outages in the central and southern parts of Sussex County.,,PDC
199702,26,1200,199702,28,2359,1039104,5595719,DELAWARE,10,1997,February,Heat,Z,2,KENT,PHI,26-FEB-97 12:00:00,EST,28-FEB-97 23:59:00,0,0,0,0,,,,,,,,,,,,,,,,,,,,,,,,,"A persistent west to southwest flow of air throughout the Eastern United States brought unseasonably warm air into Delaware from the afternoon of February 26th through March 2nd. The warmest day through this spring preview was February 27th as many new record high temperatures were set.  A series of cold fronts, one early on February 28th and a stronger second one on March 2nd brought temperatures closer to seasonal levels.  At the New Castle County Airport, the high temperature of 73 degrees set a new record high for February 27th, breaking the old record of  70 degrees set in 1946.  High temperatures across Central and Southern Delaware were as warm as the mid and upper 70s on February 27th.  Just south of the area Salisbury, Maryland warmed to 78 degrees.",,PDC
199701,1,1900,199701,1,2000,2060895,5596054,DELAWARE,10,1997,January,Winter Weather,Z,1,NEW CASTLE,PHI,01-JAN-97 19:00:00,EST,01-JAN-97 20:00:00,0,0,0,0,,,,,,,,,,,,,,,,,,,,,,,,,,Freezing drizzle caused slippery roads to develop across New Castle County the evening of the 1st.  Three multivehicle accidents including one 8 car pile-up occurred on Delaware State Route 141 in Newport within a ten minute span.  Three accidents also occurred in Newark.,PDC
199707,12,1000,199707,19,1800,2068866,5614366,DELAWARE,10,1997,July,Heat,Z,2,KENT,PHI,12-JUL-97 10:00:00,EST,19-JUL-97 18:00:00,0,0,0,0,,,,,,,,,,,,,,,,,,,,,,,,,"The longest and hottest heat wave of the summer of 1997 brought up to 8 straight days of high temperatures of 90 degrees or higher to Delaware along with oppressive humidity and limited rainfall. The heat wave started to end after a strong cold front moved through the region early on the 19th.  In spite of lowering humidity levels,  high temperatures on the 19th still made it into the 90s across most of central and southern Delaware.  The hottest day for most areas was the 15th as high temperatures were around 100 degrees.  This was also the day the Pennsylvania-Jersey-Maryland Interconnection (PJM) reported a record usage of 49,822 megawatts in their regional serving area.  This surpassed the previous record of 48,524 megawatts set on August 2, 1995.  Highest temperatures during this heat wave included 102 degrees in Lewes, 100 degrees in Camden, 99 degrees at the New Castle County Airport and 98 degrees in Bridgeville, Pennyhill and Prices Corner.  No widespread heat related injuries were reported.  But, the lack of rain continued to stress crops, throughout the state especially in southern parts of New Castle County and northern parts of Kent County.  Rainfall totals for July on a county weighted average were below normal throughout the state.  The largest deficits were in Kent County where only 70 percent of normal rainfall fell.",,PDC
199701,3,1000,199701,5,2300,1038951,5596245,DELAWARE,10,1997,January,Heat,Z,2,KENT,PHI,03-JAN-97 10:00:00,EST,05-JAN-97 23:00:00,0,0,0,0,,,,,,,,,,,,,,,,,,,,,,,,,"A persistent west to southwest flow throughout the start of 1997 led to unseasonably warm weather from the 3rd through the 6th across Delaware.  The warmest days statewide were the 3rd and the 5th.  A weak backdoor cold front brought mostly cloudy skies and slightly cooler temperatures to the northern part of the state on the 4th.  In spite of a cold frontal passage, during the 6th, some places in Sussex County still managed to reach into the 60s.   A record breaking high of 62 degrees was set at the New Castle County Airport on the 3rd.  The warmest day though was the 5th when the high reached 65 degrees, but was not a record.  Georgetown reached 69 degrees on the 4th.",,PDC
199702,26,1200,199702,28,2359,1039104,5595718,DELAWARE,10,1997,February,Heat,Z,1,NEW CASTLE,PHI,26-FEB-97 12:00:00,EST,28-FEB-97 23:59:00,0,0,0,0,,,,,,,,,,,,,,,,,,,,,,,,,"A persistent west to southwest flow of air throughout the Eastern United States brought unseasonably warm air into Delaware from the afternoon of February 26th through March 2nd. The warmest day through this spring preview was February 27th as many new record high temperatures were set.  A series of cold fronts, one early on February 28th and a stronger second one on March 2nd brought temperatures closer to seasonal levels.  At the New Castle County Airport, the high temperature of 73 degrees set a new record high for February 27th, breaking the old record of  70 degrees set in 1946.  High temperatures across Central and Southern Delaware were as warm as the mid and upper 70s on February 27th.  Just south of the area Salisbury, Maryland warmed to 78 degrees.",,PDC
199706,21,900,199706,26,1800,1045020,5611959,DELAWARE,10,1997,June,Heat,Z,1,NEW CASTLE,PHI,21-JUN-97 09:00:00,EST,26-JUN-97 18:00:00,0,0,0,0,,,,,,,,,,,,,,,,,,,,,,,,,"The first heat wave of 1997 brought the warmest weather in two years to the Delmarva Peninsula.  The highest temperatures reached near or around the 100 degree mark in many places on the 25th and 26th.  A strong cold front brought an end to the excessive humidity on the 26th, although some places reached around 90 degrees on the 27th.  The heat wave started for a few spots on the peninsula on the 20th.  All locations reached the 90s on the 21st.  A weak cold front briefly brought drier air into the region on the 23rd.  But that was short-lived as both heat and humidity levels became oppressive again on the 24th.The highest temperatures included 100 degrees at both Lewes (on the 25th and 26th) and Odessa (26th), 98 degrees in Dover (on the 25th and 26th),  95 degrees at the New Castle County Airport (on the 25th) and also Bridgeville and Pennyhill (on both the 25th and 26th).",,PDC
199706,30,2359,199706,30,2359,2066562,5612063,DELAWARE,10,1997,June,Drought,Z,2,KENT,PHI,30-JUN-97 23:59:00,EST,30-JUN-97 23:59:00,0,0,0,0,,,,,,,,,,,,,,,,,,,,,,,,,"June 1997 was drier than normal throughout Delaware.  On a county weighted average, deficits averaged between 1 and 2 inches in New Castle and Sussex Counties.   Only Kent County was within an inch of normal.  Coupled with the hot weather from June 21st onward,  the lack of rain started to stress growing areas.  The monthly precipitation total at the New Castle County Airport was 1.75 inches, about 49 percent of normal.",,PDC
199706,30,2359,199706,30,2359,2066562,5612064,DELAWARE,10,1997,June,Drought,Z,1,NEW CASTLE,PHI,30-JUN-97 23:59:00,EST,30-JUN-97 23:59:00,0,0,0,0,,,,,,,,,,,,,,,,,,,,,,,,,"June 1997 was drier than normal throughout Delaware.  On a county weighted average, deficits averaged between 1 and 2 inches in New Castle and Sussex Counties.   Only Kent County was within an inch of normal.  Coupled with the hot weather from June 21st onward,  the lack of rain started to stress growing areas.  The monthly precipitation total at the New Castle County Airport was 1.75 inches, about 49 percent of normal.",,PDC
